id,Manufacturer,NHTSACampaignNumber,parkIt,parkOutSide,overTheAirUpdate,NHTSAActionNumber,ReportReceivedDate,Component,Summary,Consequence,Remedy,Notes,ModelYear,Make,Model
1801,"GENERAL MOTORS CORP.","85V052000",0,0,0,,"01/05/1985","EQUIPMENT:OTHER:LABELS","RIM INFORMATION MAY HAVE BEEN OMITTED ON CERTIFICATION    LABEL INSTALLED ON THE LEFT FRONT DOOR.                                                                                                                           CONSEQUENCE OF DEFECT: THESE TRUCKS DO NOT CONFORM WITH FMVSS 120, TIRE          SELECTIONS AND RIMS FOR VEHICLES OTHER THAN PASSENGER CARS.",,"INSTALL NEW CORRECTED LABELS.","VEHICLE DESCRIPTION: FOURWHEEL DRIVE PICKUPS AND CHASSIS CABS.                  SYSTEM: TIRE CERTIFICATION LABEL/FMVSS 120.","1985","CHEVROLET","K10"
1802,"HONEYWELL INTERNATIONAL, INC.","07E088000",0,0,0,,"24/10/2007","EQUIPMENT","CERTAIN HONEYWELL FRAM RACING BRAND HP4 AND HP8 OIL FILTERS THAT WERE MANUFACTURED FROM MAY 25, 2006, THROUGH SEPTEMBER 14, 2007, AND SOLD FOR USE AS REPLACEMENT EQUIPMENT FOR VEHICLES LIST ABOVE.  THE AFFECTED FILTERS ARE MARKED WITH A DATE CODE A61451 THROUGH A72571 SEQUENTIALLY.  THE DATE CODE AND PART NUMBER APPEAR ON THE FILTER HOUSING.  FRAM RACING HP4 AND HP8 OIL FILTERS NOT BEARING A DATE CODE IN THIS RANGE ARE NOT AFFECTED BY THIS RECALL.  THE GASKET OF THE OIL FILTER BECOMES MORE PLIABLE UNDER HIGH TEMPERATURES AND PRESSURES.","THIS CONDITION MAY CAUSE INADEQUATE SEALING AND LOSS OF ENGINE OIL, POSSIBLY RESULTING IN A FIRE.","HONEYWELL WILL REPLACE THE AFFECTED OIL FILTERS FREE OF CHARGE.  THE RECALL BEGAN DURING NOVEMBER 2007.  OWNERS CAN CONTACT FRAM CUSTOMER SERVICE TOLL-FREE AT 1-800-890-2075.","CUSTOMERS MAY CONTACT THE NATIONAL HIGHWAY TRAFFIC SAFETY ADMINISTRATION'S VEHICLE SAFETY HOTLINE AT 1-888-327-4236 (TTY: 1-800-424-9153); OR GO TO HTTP://WWW.SAFERCAR.GOV.","1985","CHEVROLET","K20"
1803,"HONEYWELL INTERNATIONAL, INC.","06E043000",0,0,0,,"19/05/2006","FUEL SYSTEM, GASOLINE","CERTAIN REPLACEMENT FUEL FILTERS, FRAM BRAND NAME P/N G3727, WITH DATE CODES X52911 THROUGH X60801 SEQUENTIALLY OR X600141 AND A MEXICO COUNTRY OR ORIGIN MARKING ON THE FUEL FILTER HOUSING MANUFACTURED FROM OCTOBER 18, 2005, THROUGH MARCH 21, 2006, SOLD FOR USE ON THE VEHICLES LISTED ABOVE AND ON CERTAIN SCHOOL BUSES.  (TO SEE THE SCHOOL BUS ENGINE SIZES, CLICK ON ""DOCUMENT SEARCH"" AND THEN ""BUS APPLICATIONS"").  THE CONNECTOR ON THE FUEL FILTER WAS NOT MANUFACTURED TO HONEYWELL'S SPECIFICATION.  AS A RESULT, THE O-RING MAY NOT SEAT CORRECTLY ON THE FUEL LINE.","THIS CONDITION MAY CAUSE AN INADEQUATE SEAL AT THE CONNECTION, POTENTIALLY LEADING TO A FUEL LEAK. IN THE PRESENCE OF AN IGNITION SOURCE, A FIRE COULD OCCUR.","HONEYWELL WILL NOTIFY OWNERS AND REPLACE THE FUEL FILTERS FREE OF CHARGE.  THE RECALL BEGAN ON OCTOBER 18, 2006.  OWNERS MAY CONTACT FRAM CUSTOMER SERVICE AT 1-800-890-2075 (OPTION 1).","THIS RECALL ONLY PERTAINS TO AFTERMARKET FRAM FUEL FILTERS AND HAS NO RELATION TO ANY ORIGINAL EQUIPMENT INSTALLED ON THE VEHICLES LISTED.  CUSTOMERS MAY CONTACT THE NATIONAL HIGHWAY TRAFFIC SAFETY ADMINISTRATION'S VEHICLE SAFETY HOTLINE AT 1-888-327-4236 (TTY: 1-800-424-9153); OR GO TO HTTP://WWW.SAFERCAR.GOV.","1985","CHEVROLET","MONTE CARLO"
1804,"HONEYWELL INTERNATIONAL, INC.","07E088000",0,0,0,,"24/10/2007","EQUIPMENT","CERTAIN HONEYWELL FRAM RACING BRAND HP4 AND HP8 OIL FILTERS THAT WERE MANUFACTURED FROM MAY 25, 2006, THROUGH SEPTEMBER 14, 2007, AND SOLD FOR USE AS REPLACEMENT EQUIPMENT FOR VEHICLES LIST ABOVE.  THE AFFECTED FILTERS ARE MARKED WITH A DATE CODE A61451 THROUGH A72571 SEQUENTIALLY.  THE DATE CODE AND PART NUMBER APPEAR ON THE FILTER HOUSING.  FRAM RACING HP4 AND HP8 OIL FILTERS NOT BEARING A DATE CODE IN THIS RANGE ARE NOT AFFECTED BY THIS RECALL.  THE GASKET OF THE OIL FILTER BECOMES MORE PLIABLE UNDER HIGH TEMPERATURES AND PRESSURES.","THIS CONDITION MAY CAUSE INADEQUATE SEALING AND LOSS OF ENGINE OIL, POSSIBLY RESULTING IN A FIRE.","HONEYWELL WILL REPLACE THE AFFECTED OIL FILTERS FREE OF CHARGE.  THE RECALL BEGAN DURING NOVEMBER 2007.  OWNERS CAN CONTACT FRAM CUSTOMER SERVICE TOLL-FREE AT 1-800-890-2075.","CUSTOMERS MAY CONTACT THE NATIONAL HIGHWAY TRAFFIC SAFETY ADMINISTRATION'S VEHICLE SAFETY HOTLINE AT 1-888-327-4236 (TTY: 1-800-424-9153); OR GO TO HTTP://WWW.SAFERCAR.GOV.","1985","CHEVROLET","MONTE CARLO"
1840,"HONEYWELL INTERNATIONAL, INC.","07E088000",0,0,0,,"24/10/2007","EQUIPMENT","CERTAIN HONEYWELL FRAM RACING BRAND HP4 AND HP8 OIL FILTERS THAT WERE MANUFACTURED FROM MAY 25, 2006, THROUGH SEPTEMBER 14, 2007, AND SOLD FOR USE AS REPLACEMENT EQUIPMENT FOR VEHICLES LIST ABOVE.  THE AFFECTED FILTERS ARE MARKED WITH A DATE CODE A61451 THROUGH A72571 SEQUENTIALLY.  THE DATE CODE AND PART NUMBER APPEAR ON THE FILTER HOUSING.  FRAM RACING HP4 AND HP8 OIL FILTERS NOT BEARING A DATE CODE IN THIS RANGE ARE NOT AFFECTED BY THIS RECALL.  THE GASKET OF THE OIL FILTER BECOMES MORE PLIABLE UNDER HIGH TEMPERATURES AND PRESSURES.","THIS CONDITION MAY CAUSE INADEQUATE SEALING AND LOSS OF ENGINE OIL, POSSIBLY RESULTING IN A FIRE.","HONEYWELL WILL REPLACE THE AFFECTED OIL FILTERS FREE OF CHARGE.  THE RECALL BEGAN DURING NOVEMBER 2007.  OWNERS CAN CONTACT FRAM CUSTOMER SERVICE TOLL-FREE AT 1-800-890-2075.","CUSTOMERS MAY CONTACT THE NATIONAL HIGHWAY TRAFFIC SAFETY ADMINISTRATION'S VEHICLE SAFETY HOTLINE AT 1-888-327-4236 (TTY: 1-800-424-9153); OR GO TO HTTP://WWW.SAFERCAR.GOV.","1985","CHEVROLET","P30"
1841,"GENERAL MOTORS CORP.","85V128000",0,0,0,,"15/10/1985","ENGINE AND ENGINE COOLING:COOLING SYSTEM:FAN","THE FAN BLADE, WHEN SUBJECTED TO HIGH STRESS LEVELS, CAN  FATIGUE AND BREAK APART AT THE HUB WHILE THE ENGINE IS RUNNING.                                                                                                   CONSEQUENCE OF DEFECT: IF BREAKAGE OCCURS WHILE HOOD IS OPEN, A PERSON WORKING   UNDER THE HOOD OR NEAR THE TRUCK COULD BE STRUCK BY A  BLADE PART AND BE         INJURED.",,"REPLACE ENGINE FAN.","SYSTEM:ENGINE FAN BLADE.    VEHICLE DESCRIPTION: MEDUIM TRUCKS WITH A 6.2L DIESEL ENGINE, 4 SPEED MANUAL    TRANSMISSION AND A 4.56 REAR AXLE RATIO.","1985","CHEVROLET","P30"
1842,"GENERAL MOTORS CORP.","85V156000",0,0,0,,"26/11/1985","WHEELS:RIM","THE WHEEL MAY DEVELOP CRACKS BETWEEN THE DISC AND RIM.                                                                                     CONSEQUENCE OF DEFECT: IF THIS OCCURS AND IS NOT NOTICED, THE CRACK COULD        INCREASE AROUND THE RIM, RESULTING IN SEPARATION OF THE RIM FROM THE DISC, LOSS  OF CONTROL AND AN ACCIDENT MAY OCCUR.",,"REPLACE WHEELS HAVING THE SUSPECTED MANUFACTURING CODE        NUMBER.","SYSTEM: DUAL REAR WHEELS, 16X6 FIRESTONE DUAL WHEELS.                                                                                                           VEHICLE DESCRIPTION: C,K AND P 30/35 SERIES LIGHT-DUTY TRUCKS EQUIPPED WITH     DUAL REAR WHEELS.","1985","CHEVROLET","P30"
1843,"GENERAL MOTORS CORP.","86V117000",0,0,0,,"25/08/1986","SEATS","THREE BOLTS WHICH ATTACH THE SILL THAT SUPPORTS THE BASE  OF THE SEAT WERE OMITTED; THEREFORE VEHICLES DO NOT COMPLY WITH FMVSS 210 AND    FMVSS 207.                                                                                                                                                        CONSEQUENCE OF DEFECT: IN THE EVENT OF A CRASH, THE FLOOR PLATE COULD BUCKLE     ALONG THE INBOARD SIDE CAUSING THE SEAT PEDESTAL TO BE IMBALANCED, AND           INCREASING THE LIKELIHOOD OF INJURY TO THE SEAT OCCUPANT.",,"INSTALL MISSING BOLTS.","SYSTEM: SEAT ATTACHING BOLTS/FMVSS 207 AND 210.                                                                                                                 VEHICLE DESCRIPTION: LIGHT DUTY TRUCKS EQUIPPED WITH UNION CITY KING STEEL      BODIES AND DRIVER/PASSENGER BUCKET SEATS WITH A TILT PEDESTAL.","1985","CHEVROLET","P30"
1844,"GENERAL MOTORS CORP.","86V114000",0,0,0,,"18/08/1986","STEERING:LINKAGES:TIE ROD ASSEMBLY","DURING A COMBINED CORNERING AND BRAKING MANEUVER, THE     TIE ROD END COULD CONTACT THE TIRE WALL.                                                                                                                          CONSEQUENCE OF DEFECT: THIS CONTACT CAN CAUSE GROOVING OF THE TIRE, WHICH COULD  EVENTUALLY RESULT IN TIRE FAILURE AND POSSIBLY A VEHICLE CRASH WITHOUT PRIOR     WARNING.",,"REPLACE 16"" WHEELS AND TIRES WITH 19 1/2"" WHEELS AND TIRES;   ALSO, REPLACE SPEEDOMETER GEAR TO COMPENSATE FOR NEW SIZE WHEELS AND TIRES.","SYSTEM: TIE ROD END/WHEELS/TIRES.                                                                                                                               VEHICLE DESCRIPTION: LIGHT DUTY TRUCKS EQUIPPED WITH AN I BEAM FRONT AXLE AND   16"" WHEELS AND TIRES.","1985","CHEVROLET","P30"
1845,"GENERAL MOTORS CORP.","88V110000",0,0,0,"EA88007","06/07/1988","SUSPENSION:FRONT:CONTROL ARM:LOWER ARM","LEFT HAND LOWER CONTROL ARM CAN CRACK AND COULD EVENTUALLY CAUSE THE LOWER BALL JOINT TO SEPARATE FROM THE CONTROL ARM.","LOSS OF STEERING CONTROL CAN OCCUR WHICH COULD RESULT INA CRASH WITHOUT PRIOR WARNING.","REPAIR OR REPLACE LOWER LEFT CONTROL ARM.","SYSTEM: STEERING/LOWER CONTROL ARM.VEHICLE DESCRIPTION: TRUCKS.","1985","CHEVROLET","P30"
1819,"K2 MOTOR CORPORATION","08E050000",0,0,0,,"11/08/2008","EXTERIOR LIGHTING:HEADLIGHTS","K2 MOTOR IS RECALLING 1,921 AFTERMARKET HEADLAMPS OF VARIOUS MODELS SOLD FOR USE ON THE ABOVE LISTED VEHICLES.  THESE HEADLAMPS ARE MISSING THE AMBER SIDE REFLEX REFLECTOR WHICH FAILS TO CONFORM WITH THE REQUIREMENTS OF FEDERAL MOTOR VEHICLE SAFETY STANDARD NO. 108, ""LAMPS, REFLECTIVE DEVICES, AND ASSOCIATED EQUIPMENT.""","WITHOUT THE AMBER SIDE REFLEX REFLECTORS, THE LIGHTING VISIBILITY MAY BE AFFECTED, POSSIBLY RESULTING IN A VEHICLE CRASH.","K2 MOTOR WILL NOTIFY OWNERS AND OFFER A FULL REFUND.  THE RECALL BEGAN ON DECEMEBER 17, 2008.  OWNERS MAY CONTACT K2 MOTOR AT 1-909-839-2992.","THIS RECALL ONLY PERTAINS TO AFTERMARKET REPLACEMENT EQUIPMENT AND HAS NO RELATION TO ANY ORIGINAL EQUIPMENT INSTALLED ON VEHICLES MANUFACTURED BY HONDA, FORD, OR CHRYSLER LLC.   CUSTOMERS MAY CONTACT THE NATIONAL HIGHWAY TRAFFIC SAFETY ADMINISTRATION'S VEHICLE SAFETY HOTLINE AT 1-888-327-4236 (TTY: 1-800-424-9153); OR GO TO HTTP://WWW.SAFERCAR.GOV.","1985","CHEVROLET","S10"
1820,"CK MOTORSPORT, INC.","06E049000",0,0,0,,"24/05/2006","EXTERIOR LIGHTING","CERTAIN CK MOTORSPORTS COMBINATION HEADLIGHTS, CLEAR CORNER, BUMPER, AND SIDE MARKER LIGHTS SOLD AS REPLACEMENT LAMPS FOR USE ON THE PASSENGER VEHICLES LISTED ABOVE.  SOME COMBINATION LAMPS THAT ARE NOT EQUIPPED WITH AMBER SIDE REFLECTORS FAIL TO CONFORM TO FEDERAL MOTOR VEHICLE SAFETY STANDARD NO. 108, LAMPS, REFLECTIVE DEVICES, AND ASSOCIATED EQUIPMENT.","WITHOUT THE AMBER REFLECTORS, THE VEHICLE WILL BE POORLY ILLUMINATED, POSSIBLY RESULTING IN A VEHICLE CRASH WITHOUT WARNING.","CK MOTORSPORT WILL NOTIFY OWNERS AND REPLACE THE NONCOMPLIANT LAMPS FREE OF CHARGE.  THE RECALL BEGAN ON JULY 1, 2006.  OWNERS MAY CONTACT CK MOTORSPORT AT 1-909-610-7211.","THIS RECALL ONLY PERTAINS TO AFTERMARKET REPLACEMENT EQUIPMENT AND HAS NO RELATION TO ANY ORIGINAL EQUIPMENT INSTALLED ON VEHICLES MANUFACTURED BY THE VEHICLE MANUFACTURERS.  FOR MORE INFORMATION ON THE LAMP MODEL NUMBERS, CLICK ON DOCUMENT SEARCH AND VIEW DOCUMENT TITLED ""LAMP MODEL NUMBERS.""  CUSTOMERS MAY CONTACT THE NATIONAL HIGHWAY TRAFFIC SAFETY ADMINISTRATION'S VEHICLE SAFETY HOTLINE AT 1-888-327-4236 (TTY: 1-800-424-9153); OR GO TO HTTP://WWW.SAFERCAR.GOV.","1985","CHEVROLET","S10"
1821,"PRO-A MOTORS, INC.","06E026000",0,0,0,,"23/03/2006","EXTERIOR LIGHTING","CERTAIN PRO-A MOTORS CORNER LAMPS, TURN SIGNALS, AND HEADLIGHTS SOLD AS REPLACEMENT LAMPS FOR USE ON CERTAIN PASSENGER VEHICLES LISTED ABOVE.  SOME COMBINATION LAMPS THAT ARE NOT EQUIPPED WITH AMBER SIDE REFLECTORS FAIL TO CONFORM TO FEDERAL MOTOR VEHICLE SAFETY STANDARD NO. 108, LAMPS, REFLECTIVE DEVICES, AND ASSOCIATED EQUIPMENT.","WITHOUT THE AMBER REFLECTORS, THE VEHICLE WILL BE POORLY ILLUMINATED, POSSIBLY RESULTING IN A VEHICLE CRASH WITHOUT WARNING.","PRO-A MOTORS WILL NOTIFY OWNERS AND OFFER TO REPURCHASE THE LAMPS.  THE RECALL BEGAN ON APRIL 3, 2006.  OWNERS MAY CONTACT PRO-A MOTORS AT 323-838-2988.","THIS RECALL ONLY PERTAINS TO PRO-A MOTORS AFTERMARKET LAMPS AND HAS NO RELATION TO ANY ORIGINAL EQUIPMENT INSTALLED ON THE LISTED PASSENGER VEHICLES.  FOR MORE INFORMATION ON THE LAMP MODEL NUMBERS, CLICK ON DOCUMENT SEARCH AND VIEW DOCUMENT TITLED ""LAMP MODEL NUMBERS.""  CUSTOMERS MAY CONTACT THE NATIONAL HIGHWAY TRAFFIC SAFETY ADMINISTRATION'S VEHICLE SAFETY HOTLINE AT 1-888-327-4236 (TTY: 1-800-424-9153); OR GO TO HTTP://WWW.SAFERCAR.GOV.","1985","CHEVROLET","S10"
1805,"GENERAL MOTORS CORP.","87V078000",0,0,0,,"26/05/1987","FUEL SYSTEM, GASOLINE:DELIVERY:FUEL PUMP","VEHICLES MAY EXPERIENCE PERFORATION OF THE FUEL PUMP DIAPHRAGM.  EXCESSIVE ALCOHOL CONTENT IN THE FUEL PROMOTES DEGRADATION OF THE DIAPHRAGM COATING RESULTING IN RADIAL CRACKING OF THE DIAPHRAGM.","A PERFORATED DIAPHRAGM CAN ALLOW FUEL TO LEAK FROM THEFUEL PUMP INTO THE UNDERHOOD AREA.  THIS COULD ULTIMATELY RESULT IN ANUNDERHOOD FIRE WITHOUT PRIOR WARNING.  SUCH A FIRE COULD SPREAD TO THEPASSENGER COMPARTMENT.","A FUEL VENTILATION HOSE KIT WILL BE INSTALLED TO PREVENT FUEL FROM ESCAPING INTO THE ENGINE COMPARTMENT IF THE FUEL PUMP DIAPHRAGM LEAKS AND THEREBY REDUCE THE POSSIBILITY OF AN UNDERHOOD FIRE.","SYSTEM: FUELVEHICLE DESCRIPTION: PASSENGER CARS.","1985","CHEVROLET","SPECTRUM"
1847,"FEDERAL-MOGUL CHASSIS PRODUCTS","08E033000",0,0,0,,"14/04/2008","SUSPENSION","FEDERAL MOGUL IS RECALLING 6,903 AFTERMARKET BALL JOINT ASSEMBLIES SHIPPED BETWEEN NOVEMBER 9, 2007 AND MARCH 26, 2008, WHICH MAY HAVE BEEN PACKAGED WITH INCORRECT NUTS.  THE PART NUMBERS PACKAGED WITH INCORRECT NUTS ARE: K7147, K7329, K8683, AND 104353.  THESE PARTS WERE MADE FOR USE ON THE VARIOUS VEHICLES LISTED ABOVE.","THE NUTS INCLUDED IN THE PACKAGING FOR THESE BALL JOINT ASSEMBLIES ARE MISSING THE INTENDED PREVAILING TORQUE (SELF-LOCKING) FEATURE.  IF THE INCORRECT NUT WAS TO BECOME LOOSE, THE JOINING MEMBERS MAY LOOSEN LEADING TO A SEPARATION OF THE BALL JOINT.  THIS MAY RESULT IN LOSS OF VEHICLE CONTROL, POSSIBLY RESULTING IN A VEHICLE CRASH.","FEDERAL MOGUL WILL NOTIFY OWNERS AND REPLACE THE PARTS FREE OF CHARGE.   THE RECALL BEGAN ON MAY 22, 2008.  OWNERS CAN CONTACT FEDERAL MOGUL AT 877-489-6659.","THIS RECALL ONLY PERTAINS TO AFTERMARKET BALL JOINT ASSEMBLIES AND HAS NO RELATION TO ANY ORIGINAL EQUIPMENT INSTALLED ON VEHICLES MANUFACTURED BY THE VEHICLE MANUFACTURERS.  CUSTOMERS MAY CONTACT THE NATIONAL HIGHWAY TRAFFIC SAFETY ADMINISTRATION'S VEHICLE SAFETY HOTLINE AT 1-888-327-4236 (TTY: 1-800-424-9153); OR GO TO HTTP://WWW.SAFERCAR.GOV.","1985","CHRYSLER","LASER"
1848,"CHRYSLER CORPORATION","85V010000",0,0,0,,"01/01/1985","FUEL SYSTEM, GASOLINE:DELIVERY:HOSES, LINES/PIPING, AND FITTINGS","AN ENGINE COMPARTMENT FUEL HOSE ROUTED TO THE FUEL        SYSTEM PRESSURE REGULATOR MAY HAVE AN INADEQUATELY TIGHTENED HOSE CLAMP.                                                                                          CONSEQUENCE OF DEFECT: THE FUEL HOSE COULD LEAK AND RESULT IN AN ENGINE          COMPARTMENT FIRE.",,"REPOSITION AND TIGHTEN TO THE PROPER TORQUE LEVEL OF THE      FUEL HOSE CLAMP.","VEHICLE DESCRIPTION: PASSENGER CARS EQUIPPED WITH 2.2 LITER TURBO ENGINE.   SYSTEM: FUEL HOSE.","1985","CHRYSLER","LASER"
1849,"CHRYSLER CORPORATION","88V105000",0,0,0,,"01/07/1988","FUEL SYSTEM, GASOLINE","FUEL LEAKAGE MAY OCCUR IN LOW AMBIENT TEMPERATURE OPERATION AT CONNECTIONS OF AN ENGINE COMPARTMENT FUEL SUPPLY HOSE TO THE PRESSURE REGULATOR AND TO THE FUEL RAIL.","IN THE PRESENCE OF AN IGNITION SOURCE, FUEL LEAKAGE COULDRESULT IN A FIRE.","RELOCATE PRESSURE REGULATOR; REPLACE FUEL SUPPLY WITH FORMED HOSE WITH REVISED ROUTING CONFIGURATION TO ENSURE SEALING INTEGRITY.","SYSTEM: FUEL.VEHICLE DESCRIPTION: VEHICLES EQUIPPED WITH 2.2L TURBO CHARGED ENGINE.","1985","CHRYSLER","LASER"
1850,"CHRYSLER CORPORATION","89V011000",0,0,0,,"31/01/1989","SEATS","DRIVERS SEAT FRAME MAY EXPERIENCE FATIGUE FAILURE AT ONE (FRONT/OUTBOARD) OF ITS FOUR ATTACHMENTS.","THIS COULD RESULT IN SOME FORWARD, BACKWARD OR LATERALMOVEMENT OF SEAT, CREATING A POTENTIAL FOR LOSS OF CONTROL OF THE VEHICLEWHICH COULD RESULT IN AN ACCIDENT","REPLACE DRIVERS SEAT FRAME WITH A STRENGHTENED VERSION; ALSO, REINFORCE POWER ADJUSTER FRONT CROSSMEMBER TO INCREASE RIGIDITY OF SEAT ATTACHMENT SYSTEM.","SYSTEM: SEATSVEHICLE DESCRIPTION: PASSENGER CARS EQUIPPED WITH POWER ADJUSTED BUCKET SEATS.","1985","CHRYSLER","LASER"
1851,"FEDERAL-MOGUL CHASSIS PRODUCTS","08E033000",0,0,0,,"14/04/2008","SUSPENSION","FEDERAL MOGUL IS RECALLING 6,903 AFTERMARKET BALL JOINT ASSEMBLIES SHIPPED BETWEEN NOVEMBER 9, 2007 AND MARCH 26, 2008, WHICH MAY HAVE BEEN PACKAGED WITH INCORRECT NUTS.  THE PART NUMBERS PACKAGED WITH INCORRECT NUTS ARE: K7147, K7329, K8683, AND 104353.  THESE PARTS WERE MADE FOR USE ON THE VARIOUS VEHICLES LISTED ABOVE.","THE NUTS INCLUDED IN THE PACKAGING FOR THESE BALL JOINT ASSEMBLIES ARE MISSING THE INTENDED PREVAILING TORQUE (SELF-LOCKING) FEATURE.  IF THE INCORRECT NUT WAS TO BECOME LOOSE, THE JOINING MEMBERS MAY LOOSEN LEADING TO A SEPARATION OF THE BALL JOINT.  THIS MAY RESULT IN LOSS OF VEHICLE CONTROL, POSSIBLY RESULTING IN A VEHICLE CRASH.","FEDERAL MOGUL WILL NOTIFY OWNERS AND REPLACE THE PARTS FREE OF CHARGE.   THE RECALL BEGAN ON MAY 22, 2008.  OWNERS CAN CONTACT FEDERAL MOGUL AT 877-489-6659.","THIS RECALL ONLY PERTAINS TO AFTERMARKET BALL JOINT ASSEMBLIES AND HAS NO RELATION TO ANY ORIGINAL EQUIPMENT INSTALLED ON VEHICLES MANUFACTURED BY THE VEHICLE MANUFACTURERS.  CUSTOMERS MAY CONTACT THE NATIONAL HIGHWAY TRAFFIC SAFETY ADMINISTRATION'S VEHICLE SAFETY HOTLINE AT 1-888-327-4236 (TTY: 1-800-424-9153); OR GO TO HTTP://WWW.SAFERCAR.GOV.","1985","CHRYSLER","LEBARON"
1852,"CHRYSLER CORPORATION","88V061000",0,0,0,"EA88008","08/04/1988","SEATS:FRONT ASSEMBLY:POWER ADJUST","A SERVICE REPLACEMENT DRIVERS SEAT CUSHION (MANUAL SEAT TYPE) MAY CONTAIN WRONG CUSHION WITH A BRACE THAT COULD INTERFERE WITH POWER SEAT ADJUSTER MECHANISM AND CAUSE STRESS ON THE FRAME.","SEAT FRAME COULD FRACTURE AND RESULT IN SIGNIFICANTREARWARD MOVEMENT OF THE SEAT BACK.","REPLACE FRAME WITH PROPER POWER SEAT FRAME.","SYSTEM: SEAT FRAME.VEHICLE DESCRIPTION: PASSENGER CARS EQUIPPED WITH OPTIONAL POWER ADJUSTER BUCKETOR 50/50 FRONT SEATS.","1985","CHRYSLER","LEBARON"
1853,"CHRYSLER CORPORATION","84V163000",0,0,0,,"23/12/1984","SEAT BELTS:FRONT","REQUIRED FRONT CENTER SEAT BELT ASSEMBLY WAS OMITTED. VEHICLES ARE NOT IN COMPLIANCE WITH THE REQUIREMENTS OF FEDERAL MOTOR VEHICLE SAFETY STANDARD 209, SEAT BELT ASSEMBLIES.",,"INSTALLATION OF MISSING CENTER SEAT BELT WILL BE DONE WITHOUT CHARGE.","VEHICLE DESCRIPTION: PASSENGER VEHICLES EQUIPPED WITH OPTIONAL FRONT SEATCENTER CUSHION AND ARMREST.SYSTEM: INTERIOR SYSTEMS; SEAT BELTS.CONSEQUENCES OF DEFECT: PASSENGERS IN THE FRONT CENTER SEAT COULD BE INJURED INAN ACCIDENT WITHOUT THE PROTECTION OF THE REQUIRED SEAT BELT.","1985","CHRYSLER","LEBARON"
1854,"CHRYSLER CORPORATION","85V010000",0,0,0,,"01/01/1985","FUEL SYSTEM, GASOLINE:DELIVERY:HOSES, LINES/PIPING, AND FITTINGS","AN ENGINE COMPARTMENT FUEL HOSE ROUTED TO THE FUEL        SYSTEM PRESSURE REGULATOR MAY HAVE AN INADEQUATELY TIGHTENED HOSE CLAMP.                                                                                          CONSEQUENCE OF DEFECT: THE FUEL HOSE COULD LEAK AND RESULT IN AN ENGINE          COMPARTMENT FIRE.",,"REPOSITION AND TIGHTEN TO THE PROPER TORQUE LEVEL OF THE      FUEL HOSE CLAMP.","VEHICLE DESCRIPTION: PASSENGER CARS EQUIPPED WITH 2.2 LITER TURBO ENGINE.   SYSTEM: FUEL HOSE.","1985","CHRYSLER","LEBARON"
1855,"CHRYSLER CORPORATION","88V105000",0,0,0,,"01/07/1988","FUEL SYSTEM, GASOLINE","FUEL LEAKAGE MAY OCCUR IN LOW AMBIENT TEMPERATURE OPERATION AT CONNECTIONS OF AN ENGINE COMPARTMENT FUEL SUPPLY HOSE TO THE PRESSURE REGULATOR AND TO THE FUEL RAIL.","IN THE PRESENCE OF AN IGNITION SOURCE, FUEL LEAKAGE COULDRESULT IN A FIRE.","RELOCATE PRESSURE REGULATOR; REPLACE FUEL SUPPLY WITH FORMED HOSE WITH REVISED ROUTING CONFIGURATION TO ENSURE SEALING INTEGRITY.","SYSTEM: FUEL.VEHICLE DESCRIPTION: VEHICLES EQUIPPED WITH 2.2L TURBO CHARGED ENGINE.","1985","CHRYSLER","LEBARON"
1856,"CHRYSLER CORPORATION","89V011000",0,0,0,,"31/01/1989","SEATS","DRIVERS SEAT FRAME MAY EXPERIENCE FATIGUE FAILURE AT ONE (FRONT/OUTBOARD) OF ITS FOUR ATTACHMENTS.","THIS COULD RESULT IN SOME FORWARD, BACKWARD OR LATERALMOVEMENT OF SEAT, CREATING A POTENTIAL FOR LOSS OF CONTROL OF THE VEHICLEWHICH COULD RESULT IN AN ACCIDENT","REPLACE DRIVERS SEAT FRAME WITH A STRENGHTENED VERSION; ALSO, REINFORCE POWER ADJUSTER FRONT CROSSMEMBER TO INCREASE RIGIDITY OF SEAT ATTACHMENT SYSTEM.","SYSTEM: SEATSVEHICLE DESCRIPTION: PASSENGER CARS EQUIPPED WITH POWER ADJUSTED BUCKET SEATS.","1985","CHRYSLER","LEBARON"
1857,"FEDERAL-MOGUL CHASSIS PRODUCTS","08E033000",0,0,0,,"14/04/2008","SUSPENSION","FEDERAL MOGUL IS RECALLING 6,903 AFTERMARKET BALL JOINT ASSEMBLIES SHIPPED BETWEEN NOVEMBER 9, 2007 AND MARCH 26, 2008, WHICH MAY HAVE BEEN PACKAGED WITH INCORRECT NUTS.  THE PART NUMBERS PACKAGED WITH INCORRECT NUTS ARE: K7147, K7329, K8683, AND 104353.  THESE PARTS WERE MADE FOR USE ON THE VARIOUS VEHICLES LISTED ABOVE.","THE NUTS INCLUDED IN THE PACKAGING FOR THESE BALL JOINT ASSEMBLIES ARE MISSING THE INTENDED PREVAILING TORQUE (SELF-LOCKING) FEATURE.  IF THE INCORRECT NUT WAS TO BECOME LOOSE, THE JOINING MEMBERS MAY LOOSEN LEADING TO A SEPARATION OF THE BALL JOINT.  THIS MAY RESULT IN LOSS OF VEHICLE CONTROL, POSSIBLY RESULTING IN A VEHICLE CRASH.","FEDERAL MOGUL WILL NOTIFY OWNERS AND REPLACE THE PARTS FREE OF CHARGE.   THE RECALL BEGAN ON MAY 22, 2008.  OWNERS CAN CONTACT FEDERAL MOGUL AT 877-489-6659.","THIS RECALL ONLY PERTAINS TO AFTERMARKET BALL JOINT ASSEMBLIES AND HAS NO RELATION TO ANY ORIGINAL EQUIPMENT INSTALLED ON VEHICLES MANUFACTURED BY THE VEHICLE MANUFACTURERS.  CUSTOMERS MAY CONTACT THE NATIONAL HIGHWAY TRAFFIC SAFETY ADMINISTRATION'S VEHICLE SAFETY HOTLINE AT 1-888-327-4236 (TTY: 1-800-424-9153); OR GO TO HTTP://WWW.SAFERCAR.GOV.","1985","CHRYSLER","NEW YORKER"
1858,"CHRYSLER CORPORATION","85V010000",0,0,0,,"01/01/1985","FUEL SYSTEM, GASOLINE:DELIVERY:HOSES, LINES/PIPING, AND FITTINGS","AN ENGINE COMPARTMENT FUEL HOSE ROUTED TO THE FUEL        SYSTEM PRESSURE REGULATOR MAY HAVE AN INADEQUATELY TIGHTENED HOSE CLAMP.                                                                                          CONSEQUENCE OF DEFECT: THE FUEL HOSE COULD LEAK AND RESULT IN AN ENGINE          COMPARTMENT FIRE.",,"REPOSITION AND TIGHTEN TO THE PROPER TORQUE LEVEL OF THE      FUEL HOSE CLAMP.","VEHICLE DESCRIPTION: PASSENGER CARS EQUIPPED WITH 2.2 LITER TURBO ENGINE.   SYSTEM: FUEL HOSE.","1985","CHRYSLER","NEW YORKER"
1859,"CHRYSLER CORPORATION","88V105000",0,0,0,,"01/07/1988","FUEL SYSTEM, GASOLINE","FUEL LEAKAGE MAY OCCUR IN LOW AMBIENT TEMPERATURE OPERATION AT CONNECTIONS OF AN ENGINE COMPARTMENT FUEL SUPPLY HOSE TO THE PRESSURE REGULATOR AND TO THE FUEL RAIL.","IN THE PRESENCE OF AN IGNITION SOURCE, FUEL LEAKAGE COULDRESULT IN A FIRE.","RELOCATE PRESSURE REGULATOR; REPLACE FUEL SUPPLY WITH FORMED HOSE WITH REVISED ROUTING CONFIGURATION TO ENSURE SEALING INTEGRITY.","SYSTEM: FUEL.VEHICLE DESCRIPTION: VEHICLES EQUIPPED WITH 2.2L TURBO CHARGED ENGINE.","1985","CHRYSLER","NEW YORKER"
1860,"COACHMEN RV COMPANY","91E021001",0,0,0,"EA90010","05/06/1991","EQUIPMENT:RECREATIONAL VEHICLE/TRAILER:LPG SYSTEMS:FURNACE","CONTAMINANTS COULD BLOCK THE INTERNAL ORIFICES IN THE ITT VALVES, CAUSING THE GAS CONTROL VALVE TO FAIL IN OPEN POSITION: THIS WOULD ALLOW UNBURNED GAS TO REACH VEHICLE'S LIVING QUARTERS.","HAZARDS OF LIQUID PROPANE GAS IN THE LIVING QUARTERS OF ARECREATIONAL VEHICLE INCLUDE RISK OF EXPLOSION AND FIRE WHEN EXPOSED TO A SOURCEOF IGNITION, AND RESPIRATORY DISTRESS FROM THE GAS ITSELF.","REPLACE THE ITT VALVES WITH REDUNDANT GAS CONTROL VALVES.","SYSTEM: GAS CONTROL VALVE.VEHICLE DESCRIPTION: HYDRO FLAME FURNACE WITH RV28SBR59 AND RV28SBR68 ITTVALVES.NOTICE: THIS RECALL WAS INITIATED BY HYDRO FLAME CORPORATION.","1985","COACHMEN","TRAVELMASTER"
1861,"COACHMEN RV COMPANY","91V059000",0,0,0,,"12/04/1991","POWER TRAIN:AXLE ASSEMBLY","REAR AXLE BEARINGS MAY FAIL DUE TO A BENDING MOMENT CREATED BY THE AFTERMARKET DUAL REAR WHEELS FROM A VARIETY OF FACTORS AND ESPECIALLY WHEN OVERLOADED. FAILURE OF THE BEARINGS CREATE STRESSES ON THE  REAR AXLE, RESULTING IN THE BREAKAGE OF THE AXLE.","A BROKEN AXLE WILL CAUSE SEPARATION OF THE DUAL REARWHEEL ASSEMBLY FROM THE MOTORHOME, CAUSING LOSS OF CONTROL WHICH COULD RESULT AN ACCIDENT.","REPLACE REAR AXLE ASSEMBLIES WITH FULL-FLOATING REAR AXLE ASSEMBLIES. ALSO, LITERATURE WILL BE CIRCULATED CAUTIONING VEHICLE OWNERS NOT TO OVERLOAD THE MICRO-MINI MOTORHOMES.","SYSTEM: REAR AXLE; SINGLE AXLE WITH DUAL REAR WHEELS.VEHICLE DESCRIPTION: MICRO-MINI MOTORHOMES BUILT ON TOYOTA CAMPER CAB-CHASSISEQUIPPED WITH AFTERMARKET DUAL REAR WHEELS ON REAR AXLE DESIGNED FOR SINGLEWHEELS.","1985","COACHMEN","TRAVELMASTER"
