id,Manufacturer,NHTSACampaignNumber,parkIt,parkOutSide,overTheAirUpdate,NHTSAActionNumber,ReportReceivedDate,Component,Summary,Consequence,Remedy,Notes,ModelYear,Make,Model
256,"HONEYWELL INTERNATIONAL, INC.","07E088000",0,0,0,,"24/10/2007","EQUIPMENT","CERTAIN HONEYWELL FRAM RACING BRAND HP4 AND HP8 OIL FILTERS THAT WERE MANUFACTURED FROM MAY 25, 2006, THROUGH SEPTEMBER 14, 2007, AND SOLD FOR USE AS REPLACEMENT EQUIPMENT FOR VEHICLES LIST ABOVE.  THE AFFECTED FILTERS ARE MARKED WITH A DATE CODE A61451 THROUGH A72571 SEQUENTIALLY.  THE DATE CODE AND PART NUMBER APPEAR ON THE FILTER HOUSING.  FRAM RACING HP4 AND HP8 OIL FILTERS NOT BEARING A DATE CODE IN THIS RANGE ARE NOT AFFECTED BY THIS RECALL.  THE GASKET OF THE OIL FILTER BECOMES MORE PLIABLE UNDER HIGH TEMPERATURES AND PRESSURES.","THIS CONDITION MAY CAUSE INADEQUATE SEALING AND LOSS OF ENGINE OIL, POSSIBLY RESULTING IN A FIRE.","HONEYWELL WILL REPLACE THE AFFECTED OIL FILTERS FREE OF CHARGE.  THE RECALL BEGAN DURING NOVEMBER 2007.  OWNERS CAN CONTACT FRAM CUSTOMER SERVICE TOLL-FREE AT 1-800-890-2075.","CUSTOMERS MAY CONTACT THE NATIONAL HIGHWAY TRAFFIC SAFETY ADMINISTRATION'S VEHICLE SAFETY HOTLINE AT 1-888-327-4236 (TTY: 1-800-424-9153); OR GO TO HTTP://WWW.SAFERCAR.GOV.","1976","CHEVROLET","BLAZER"
250,"HONEYWELL INTERNATIONAL, INC.","07E088000",0,0,0,,"24/10/2007","EQUIPMENT","CERTAIN HONEYWELL FRAM RACING BRAND HP4 AND HP8 OIL FILTERS THAT WERE MANUFACTURED FROM MAY 25, 2006, THROUGH SEPTEMBER 14, 2007, AND SOLD FOR USE AS REPLACEMENT EQUIPMENT FOR VEHICLES LIST ABOVE.  THE AFFECTED FILTERS ARE MARKED WITH A DATE CODE A61451 THROUGH A72571 SEQUENTIALLY.  THE DATE CODE AND PART NUMBER APPEAR ON THE FILTER HOUSING.  FRAM RACING HP4 AND HP8 OIL FILTERS NOT BEARING A DATE CODE IN THIS RANGE ARE NOT AFFECTED BY THIS RECALL.  THE GASKET OF THE OIL FILTER BECOMES MORE PLIABLE UNDER HIGH TEMPERATURES AND PRESSURES.","THIS CONDITION MAY CAUSE INADEQUATE SEALING AND LOSS OF ENGINE OIL, POSSIBLY RESULTING IN A FIRE.","HONEYWELL WILL REPLACE THE AFFECTED OIL FILTERS FREE OF CHARGE.  THE RECALL BEGAN DURING NOVEMBER 2007.  OWNERS CAN CONTACT FRAM CUSTOMER SERVICE TOLL-FREE AT 1-800-890-2075.","CUSTOMERS MAY CONTACT THE NATIONAL HIGHWAY TRAFFIC SAFETY ADMINISTRATION'S VEHICLE SAFETY HOTLINE AT 1-888-327-4236 (TTY: 1-800-424-9153); OR GO TO HTTP://WWW.SAFERCAR.GOV.","1976","CHEVROLET","C10"
251,"GENERAL MOTORS CORP.","77V178000",0,0,0,,"14/10/1977","VEHICLE SPEED CONTROL:ACCELERATOR PEDAL","THE ACCELERATOR PEDAL ROD IN COMBINATION WITH THE PEDAL INSTALLED ON THE INVOLVED VEHICLES MAY CUT THROUGH THE FLOOR PAN RUBBER MAT OR CARPET INTO THE THICK RESILIENT INSULATION PAD UNDERNEATH DURING HEAVY OR REPEATED FULL THROTTLE APPLICATIONS. AS A RESULT, THE ACCELERATOR PEDAL ROD MAY CATCH IN THE MAT OR CARPET, PREVENTING THE THROTTLE FROM RETURNING TO IDLE WHEN THE DRIVER""S FOOT IS REMOVED FROM THE PEDAL.",,"DEALER WILL INSTALL A NEW ACCELERATOR PEDAL AND RETAINER DESIGNED TO PREVENT THE ACCELERATOR PEDAL ROD FROM CUTTING THE RUBBER MAT OR CARPET. THIS WILL BE PERFORMED WITHOUT CHARGE.","VEHICLE DESCRIPTION: LIGHT TRUCKS.SYSTEM: THROTTLE LINKAGES AND CONTROL; ACCELERATOR PEDAL ROD.CONSEQUENCES OF DEFECT: IN THE EVENT THAT THE THROTTLE DOES NOT RETURN TO IDLE,THE VEHICLE WOULD NOT DECELERATE AS EXPECTED AND LOSS OF VEHICLE CONTROL AND ANACCIDENT COULD RESULT.","1976","CHEVROLET","C10"
252,"HONEYWELL INTERNATIONAL, INC.","07E088000",0,0,0,,"24/10/2007","EQUIPMENT","CERTAIN HONEYWELL FRAM RACING BRAND HP4 AND HP8 OIL FILTERS THAT WERE MANUFACTURED FROM MAY 25, 2006, THROUGH SEPTEMBER 14, 2007, AND SOLD FOR USE AS REPLACEMENT EQUIPMENT FOR VEHICLES LIST ABOVE.  THE AFFECTED FILTERS ARE MARKED WITH A DATE CODE A61451 THROUGH A72571 SEQUENTIALLY.  THE DATE CODE AND PART NUMBER APPEAR ON THE FILTER HOUSING.  FRAM RACING HP4 AND HP8 OIL FILTERS NOT BEARING A DATE CODE IN THIS RANGE ARE NOT AFFECTED BY THIS RECALL.  THE GASKET OF THE OIL FILTER BECOMES MORE PLIABLE UNDER HIGH TEMPERATURES AND PRESSURES.","THIS CONDITION MAY CAUSE INADEQUATE SEALING AND LOSS OF ENGINE OIL, POSSIBLY RESULTING IN A FIRE.","HONEYWELL WILL REPLACE THE AFFECTED OIL FILTERS FREE OF CHARGE.  THE RECALL BEGAN DURING NOVEMBER 2007.  OWNERS CAN CONTACT FRAM CUSTOMER SERVICE TOLL-FREE AT 1-800-890-2075.","CUSTOMERS MAY CONTACT THE NATIONAL HIGHWAY TRAFFIC SAFETY ADMINISTRATION'S VEHICLE SAFETY HOTLINE AT 1-888-327-4236 (TTY: 1-800-424-9153); OR GO TO HTTP://WWW.SAFERCAR.GOV.","1976","CHEVROLET","C30"
253,"GENERAL MOTORS CORP.","77V098000",0,0,0,,"22/06/1977","SUSPENSION:FRONT:CONTROL ARM:LOWER ARM","THE FRONT SUSPENSION CONTROL ARMS WERE ASSEMBLED WITH BALL JOINTS WHICH MAY CONTAIN SOCKETS THAT WERE NOT PROPERLY HEAT-TREATED. THIS MAY CAUSE THE SOCKET TO WEAR RAPIDLY AND ALLOW THE BALL JOINT STUD TO SEPARATE FROM THE SOCKET, CAUSING EITHER THE LEFT OR RIGHT WHEEL SUSPENSION TO COLLAPSE.",,"DEALER WILL INSPECT AND, WHERE NECESSARY, WILL REPLACE THE BALL JOINTS WITHOUT CHARGE TO OWNER.","VEHICLE DESCRIPTION: LIGHT TRUCKS.SYSTEM: SUSPENSION; INDEPENDENT FRONT CONTROL ARM, LOWER.CONSEQUENCES OF DEFECT: IF SUSPENSION COLLAPSES WHILE VEHICLE IS IN MOTION,LOSS OF VEHICLE CONTROL AND AN ACCIDENT COULD OCCUR.","1976","CHEVROLET","C30"
254,"GENERAL MOTORS CORP.","77V178000",0,0,0,,"14/10/1977","VEHICLE SPEED CONTROL:ACCELERATOR PEDAL","THE ACCELERATOR PEDAL ROD IN COMBINATION WITH THE PEDAL INSTALLED ON THE INVOLVED VEHICLES MAY CUT THROUGH THE FLOOR PAN RUBBER MAT OR CARPET INTO THE THICK RESILIENT INSULATION PAD UNDERNEATH DURING HEAVY OR REPEATED FULL THROTTLE APPLICATIONS. AS A RESULT, THE ACCELERATOR PEDAL ROD MAY CATCH IN THE MAT OR CARPET, PREVENTING THE THROTTLE FROM RETURNING TO IDLE WHEN THE DRIVER""S FOOT IS REMOVED FROM THE PEDAL.",,"DEALER WILL INSTALL A NEW ACCELERATOR PEDAL AND RETAINER DESIGNED TO PREVENT THE ACCELERATOR PEDAL ROD FROM CUTTING THE RUBBER MAT OR CARPET. THIS WILL BE PERFORMED WITHOUT CHARGE.","VEHICLE DESCRIPTION: LIGHT TRUCKS.SYSTEM: THROTTLE LINKAGES AND CONTROL; ACCELERATOR PEDAL ROD.CONSEQUENCES OF DEFECT: IN THE EVENT THAT THE THROTTLE DOES NOT RETURN TO IDLE,THE VEHICLE WOULD NOT DECELERATE AS EXPECTED AND LOSS OF VEHICLE CONTROL AND ANACCIDENT COULD RESULT.","1976","CHEVROLET","C30"
255,"GENERAL MOTORS CORP.","75V214000",0,0,0,,"19/12/1975","SERVICE BRAKES, HYDRAULIC:FOUNDATION COMPONENTS:DIFFERENTIAL PROPORTIONAL VALVE",,,,"CHEVROLET CAMPAIGN NO 76C04, PONTIAC CAMPAIGN NO. 76C7, OLDSMOBILE CAMPAIGN NO.76C1, BUICK CAMPAIGN NO. 76C1.  POSSIBILITY THAT THE COMBINATION VALVE, WHICHIS A PART OF THE HYDRAULIC SERVICE BRAKE SYSTEM MAY HAVE BEEN IMPROPERLYMANUFACTURED AND COULD MALFUNCTION.  SHOULD THIS CONDITION OCCUR WHILE VEHICLEIS IN MOTION AT A TIME WHEN MINIMUM STOPPING DISTANCE IS REQUIRED.  A VEHICLECRASH COULD OCCUR WITHOUT PRIOR WARNING.  (CORRECT BY INSPECTING AND REPLACINGVALVE WHERE NECESSARY.  ) PASSENGER CARS AND LIGHT TRUCKS.","1976","CHEVROLET","C30"
257,"HONEYWELL INTERNATIONAL, INC.","07E088000",0,0,0,,"24/10/2007","EQUIPMENT","CERTAIN HONEYWELL FRAM RACING BRAND HP4 AND HP8 OIL FILTERS THAT WERE MANUFACTURED FROM MAY 25, 2006, THROUGH SEPTEMBER 14, 2007, AND SOLD FOR USE AS REPLACEMENT EQUIPMENT FOR VEHICLES LIST ABOVE.  THE AFFECTED FILTERS ARE MARKED WITH A DATE CODE A61451 THROUGH A72571 SEQUENTIALLY.  THE DATE CODE AND PART NUMBER APPEAR ON THE FILTER HOUSING.  FRAM RACING HP4 AND HP8 OIL FILTERS NOT BEARING A DATE CODE IN THIS RANGE ARE NOT AFFECTED BY THIS RECALL.  THE GASKET OF THE OIL FILTER BECOMES MORE PLIABLE UNDER HIGH TEMPERATURES AND PRESSURES.","THIS CONDITION MAY CAUSE INADEQUATE SEALING AND LOSS OF ENGINE OIL, POSSIBLY RESULTING IN A FIRE.","HONEYWELL WILL REPLACE THE AFFECTED OIL FILTERS FREE OF CHARGE.  THE RECALL BEGAN DURING NOVEMBER 2007.  OWNERS CAN CONTACT FRAM CUSTOMER SERVICE TOLL-FREE AT 1-800-890-2075.","CUSTOMERS MAY CONTACT THE NATIONAL HIGHWAY TRAFFIC SAFETY ADMINISTRATION'S VEHICLE SAFETY HOTLINE AT 1-888-327-4236 (TTY: 1-800-424-9153); OR GO TO HTTP://WWW.SAFERCAR.GOV.","1976","CHEVROLET","CORVETTE"
258,"CARDONE INDUSTRIES, INC.","03E032000",0,0,0,,"12/05/2003","SERVICE BRAKES, AIR:DISC:CALIPER","REMANUFACTURERD REAR BRAKE CALIPERS, PART NOS. 18-7019, 18-7020, 16-7019, AND 16-7020, MANUFACTURED FROM FEBRUARY 1, 2002, TO APRIL, 25, 2003., AND FOR USE ON 1965 THRU 1982 CHEVROLET CORVETTES.  THE SUBJECT BRAKE CALIPERS WERE MANUFACTURED USING IMPROPERLY MANUFACTURED PISTON SEALS.  THESE SEALS ARE INTENDED TO PREVENT FLUID LEAKAGE BETWEEN THE CALIPER HOUSING AND THE PISTONS.  THESE BRAKE CALIPERS ARE FOR USE ONLY ON 1965 THRU 1982 CHEVROLET CORVETTE VEHICLES.  THIS RECALL DOES NOT INVOLVE GENERAL MOTORS CORPORATION OR ANY OF ITS PRODUCTS.","UNDER THESE CONDITIONS, THE VEHICLE OPERATOR MAY NOT BE ABLE TO STOP THE CAR, POSSIBLY RESULTING IN A VEHICLE CRASH.","CARDONE WILL NOTIFY ITS CUSTOMERS AND ALL UNSOLD INVENTORY WILL BE REPURCHASED AND WILL PROVIDE A FULL REFUND TO CUSTOMERS.
OWNER NOTIFICATION IS EXPECTED TO BEGIN DURING MAY 2003.  OWNERS WHO TAKE THEIR VEHICLES TO AN AUTHORIZED DEALER ON AN AGREED UPON SERVICE DATE AND DO NOT RECEIVE THE FREE REMEDY WITHIN A REASONABLE TIME SHOULD CONTACT CARDONE AT 215-912-3000.","ALSO, CUSTOMERS CAN CONTACT THE NATIONAL HIGHWAY TRAFFIC SAFETY ADMINISTRATION'S AUTO SAFETY HOTLINE AT 1-888-DASH-2-DOT (1-888-327-4236).","1976","CHEVROLET","CORVETTE"
259,"HONEYWELL INTERNATIONAL, INC.","07E088000",0,0,0,,"24/10/2007","EQUIPMENT","CERTAIN HONEYWELL FRAM RACING BRAND HP4 AND HP8 OIL FILTERS THAT WERE MANUFACTURED FROM MAY 25, 2006, THROUGH SEPTEMBER 14, 2007, AND SOLD FOR USE AS REPLACEMENT EQUIPMENT FOR VEHICLES LIST ABOVE.  THE AFFECTED FILTERS ARE MARKED WITH A DATE CODE A61451 THROUGH A72571 SEQUENTIALLY.  THE DATE CODE AND PART NUMBER APPEAR ON THE FILTER HOUSING.  FRAM RACING HP4 AND HP8 OIL FILTERS NOT BEARING A DATE CODE IN THIS RANGE ARE NOT AFFECTED BY THIS RECALL.  THE GASKET OF THE OIL FILTER BECOMES MORE PLIABLE UNDER HIGH TEMPERATURES AND PRESSURES.","THIS CONDITION MAY CAUSE INADEQUATE SEALING AND LOSS OF ENGINE OIL, POSSIBLY RESULTING IN A FIRE.","HONEYWELL WILL REPLACE THE AFFECTED OIL FILTERS FREE OF CHARGE.  THE RECALL BEGAN DURING NOVEMBER 2007.  OWNERS CAN CONTACT FRAM CUSTOMER SERVICE TOLL-FREE AT 1-800-890-2075.","CUSTOMERS MAY CONTACT THE NATIONAL HIGHWAY TRAFFIC SAFETY ADMINISTRATION'S VEHICLE SAFETY HOTLINE AT 1-888-327-4236 (TTY: 1-800-424-9153); OR GO TO HTTP://WWW.SAFERCAR.GOV.","1976","CHEVROLET","MONZA"
260,"GENERAL MOTORS CORP.","76V142000",0,0,0,,"14/09/1976","SERVICE BRAKES, HYDRAULIC:FOUNDATION COMPONENTS:DIFFERENTIAL PROPORTIONAL VALVE",,,,"GENERAL MOTORS CAMPAIGN NO 76C21.  2 + 2 AND TOWN COUPE ONLY.  POSSIBILITY THATAN INCORRECT COMBINATION BRAKE VALVE WAS INSTALLED, WHICH MAY CAUSE BRAKES TOFAIL TO COMPLY WITH THE FMVSS NO.  105.  THIS CONDITION MAY DECREASE THEBRAKING ABILITY AND INCREASE THE POSSIBILITY OF A VEHICLE CRASH WHEN A BRAKINGSITUATION REQUIRES MINIMUM STOPPING DISTANCE.  (CORRECT BY INSPECTING ANDREPLACING VALVE WITH PROPER TYPE WHERE NECESSARY).  PASSENGER VEHICLE.  (2+2AND TOWN COUPE ONLU).","1976","CHEVROLET","MONZA"
261,"GENERAL MOTORS CORP.","76V023000",0,0,0,,"12/02/1976","SERVICE BRAKES, HYDRAULIC:FOUNDATION COMPONENTS:DISC:PADS",,,,"CHEVROLET CAMPAIGN NO 76C07.  BUICK CAMPAIGN NO 76-C-3.  PONTIAC CAMPAIGN NO76-C-12.  OLDSMOBILE CAMPAIGN NO 76-C-4.  POSSIBILITY THAT A MACHININGOPERATION ON THE FRONT BRAKE CALIPER REMOVED EXCESSIVE MATERIAL FROM A SURFACETHAT SERVES AS A REACTION AREA FOR THE DISC BRAKE SHOE.  AS A RESULT, THE FRONTDISC BRAKE SHOES MAY NOT BE HELD IN PROPER POSITION BY THE BRAKE SHOE REACTIONAREA OF THE FRONT BRAKE CALIPERS WHEN THE BRAKES RECEIVE REPEATED HARDAPPLICATIONS.  THIS ACTION MAY CAUSE BRAKE SHOE SUPPORT EAR TO FATIGUE ANDBRAKE SHOE TO SEPARATE FROM THE CALIPERS, FOLLOWED BY A LOSS OF FRONT BRAKINGACTION.  (CORRECT BY INSPECTING AND INSTALLING ADDITIONAL REACTION TABS TO HOLDSHOE IN PROPER POSITION.","1976","CHEVROLET","MONZA"
262,"GENERAL MOTORS CORP.","76V018000",0,0,0,,"10/02/1976","STEERING:GEAR BOX (OTHER THAN RACK AND PINION)",,,,"CHEVROLET CAMPAIGN NO 76C08.  PONTIAC CAMPAIGN NO 76-C-10.  BUICK CAMPAIGN NON/A.  POSSIBILITY THAT THE WASHERS USED WITH THE BOLTS TO ATTACH THE STEERINGGEAR TO FRAME MAY NOT HAVE BEEN PROPERLY HARDENED, AND THEIR INSIDE DIAMETERMAY BE TOO LARGE.  IF THIS CONDITION EXISTS, THE ATTACHING BOLT BOLT TORQUE MAYNOT BE MAINTAINED, CAUSING THE STEERING GEAR TO BECOME LOOSE AT THE FRAME.  IFDRIVER DOES NOT HEED THIS CONDITION, IT COULD RESULT IN A VEHICLE CRASH.(CORRECT BY INSPECTING AND REPLACING AFFECTED WASHERS WHERE NECESSARY.  )","1976","CHEVROLET","MONZA"
263,"CHRYSLER CORPORATION","78V020000",0,0,0,,"24/01/1978","FUEL SYSTEM, GASOLINE:CARBURETOR SYSTEM","WHEN THE ACCELERATOR PEDAL ON THE INVOLVED VEHICLES IS DEPRESSED AND THE ACCELERATOR PUMP IS ACTIVATED, A DISTORTED ACCELERATOR PUMP SEAL IN THE CARBURETOR MAY PREVENT THE PUMP FROM DELIVERING THE PROPER AMOUNT OF FUEL.",,"DEALER WILL REPLACE THE CARBURETOR ACCELERATOR PUMP SEAL WITH A SEAL OF IMPROVED DISTORTION RESISTANCE. THE CARBURETOR WILL ALSO BE CHECKED FOR THE PROPER FLOAT LEVEL.","VEHICLE DESCRIPTION: PASSENGER VEHICLES EQUIPPED WITH 225 OR 318 CID ENGINES.SYSTEM: FUEL; CARBURETOR ACCELERATOR PUMP SEAL.CONSEQUENCES OF DEFECT: THIS MAY RESULT IN HESITATION OR LACK OF RESPONSE WHENDRIVER ATTEMPTS TO ACCELERATE. ENGINE STALLING MAY OCCUR IN SOME CASES; THISCOULD LEAD TO A VEHICLE ACCIDENT IN CERTAIN TRAFFIC SITUATIONS.","1976","CHRYSLER","CORDOBA"
264,"CHRYSLER CORPORATION","76V125000",0,0,0,,"10/08/1976","SERVICE BRAKES, HYDRAULIC:POWER ASSIST:VACUUM",,,,"CHRYSLER CAMPAIGN NO 217.  EQUIPPED WITH POWER BRAKES.  POSSIBILITY THAT THEPOWER BRAKE BOOSTER MAY CONTAIN SILENCER PAD THAT RESTRICTS INPUT AIR DURINGBRAKE PEDAL APPLICATION DUE TO EXCESSIVE SILENCER MATERIAL DENSITY.  IF THISCONDITION EXISTS, IT COULD CAUSE BRAKING ACTION DELAY ON RAPID PEDALAPPLICATION AND INCREASED STOPPING DISTANCE.  (CORRECT BY INSPECTING ANDREWORKING SUSPECT BOOSTER AND REMOVING SILENCER PAD).  PASSENGER VEHICLE.","1976","CHRYSLER","CORDOBA"
265,"FEDERAL-MOGUL CORPORATION","07E064000",0,0,0,,"27/08/2007","FUEL SYSTEM, GASOLINE:DELIVERY:FUEL PUMP","CERTAIN FEDERAL-MOGUL AFTERMARKET FUEL PUMPS SOLD UNDER THE BRAND NAMES OF CARTER, ACCUFLOW, NAPA, TRUFLOW, PARTS DEPO, AND PARTS MASTER, SHIPPED BETWEEN AUGUST 2006 AND JULY 2007 FOR USE ON THE VEHICLES LISTED ABOVE.  THE FUEL PUMP DIAPHRAGM IN CERTAIN PRODUCTION RUNS MAY HAVE BEEN IMPROPERLY INSTALLED OR INADEQUATELY TESTED WHICH MAY CAUSE THE FUEL PUMP TO LEAK.","A LEAKING FUEL PUMP COULD CREATE A VEHICLE FIRE HAZARD.","FEDERAL-MOGUL WILL NOTIFY OWNERS AND REPLACE THE DEFECTIVE FUEL PUMPS FREE OF CHARGE.  THE RECALL BEGAN ON OCTOBER 15, 2007.  OWNERS CAN CONTACT FEDERAL-MOGUL AT 248-354-7700.","THIS RECALL ONLY PERTAINS TO AFTERMARKET CARTER, NAPA, ACCUFLOW, TRU FLOW, PARTS MASTER, AND PARTS DEPOT BRAND FUEL PUMPS AND HAS NO RELATION TO ANY ORIGINAL EQUIPMENT INSTALLED ON THE LISTED MOTOR VEHICLES.  CUSTOMERS MAY CONTACT THE NATIONAL HIGHWAY TRAFFIC SAFETY ADMINISTRATION'S VEHICLE SAFETY HOTLINE AT 1-888-327-4236 (TTY: 1-800-424-9153); OR GO TO HTTP://WWW.SAFERCAR.GOV.","1976","DATSUN","620"
266,"CHRYSLER CORPORATION","77V242000",0,0,0,,"28/12/1977","FUEL SYSTEM, GASOLINE:CARBURETOR SYSTEM","ON THE INVOLVED VEHICLES, THE CARBURETOR ACCELERATOR PUMP SEAL CAN BECOME DISTORTED DUE TO CONTACT WITH CERTAIN TYPES OF GASOLINE. NORMALLY, WHEN THE ACCELERATOR PEDAL IS DEPRESSED, THE ACCELERATOR PUMP IS ACTIVATED TO PROVIDE ADDITIONAL GASOLINE REQUIRED FOR ACCELERATION. A DISTORTED SEAL HOWEVER, MAY PREVENT THE PUMP FROM DELIVERING THE PROPER AMOUNT OF FUEL.",,"THE DEALER WILL REPLACE THE CARBURETOR ACCELERATOR PUMP SEAL WITH A NEW SEAL HAVING IMPROVED DISTORTION RESISTANCE AND WILL ENSURE PROPER ADJUSTMENT. THIS WILL BE DONE FREE OF CHARGE.","VEHICLE DESCRIPTION: PASSENGER VEHICLES.SYSTEM: FUEL; CARBURETOR ACCELERATOR PUMP.CONSEQUENCES OF DEFECT: SHOULD STALLING OCCUR IN CERTAIN TRAFFIC SITUATIONS, ANACCIDENT MAY RESULT.","1976","DODGE","ASPEN"
267,"CHRYSLER CORPORATION","77V240000",0,0,0,,"28/12/1977","LATCHES/LOCKS/LINKAGES:HOOD:LATCH","ON THE INVOLVED VEHICLES, THE HOOD SECONDARY CATCH SYSTEM MAY BE MISALIGNED WHICH MAY CAUSE THE SECONDARY CATCH TO MALFUNCTION. CONSEQUENTLY, THE HOOD MAY NOT BE SECURELY LATCHED.",,"DEALER WILL ADJUST THE CATCH SYSTEM TO FULLY SECURE THE HOOD, WITHOUT CHARGE.","VEHICLE DESCRIPTION: PASSENGER VEHICLES.SYSTEM: STRUCTURE; HOOD SECONDARY LATCH/STRIKER.CONSEQUENCES OF DEFECT: THE HOOD COULD SPRING OPEN DURING VEHICLE OPERATION,OBSCURING THE DRIVER""S VIEW OF THE ROAD AND, POSSIBLY, CAUSING AN ACCIDENT.NOTE: IF THE VEHICLE WAS PREVIOUSLY RECALLED FOR CORRECTION OF THE SERVICEBRAKE HYDRAULIC SYSTEM, THE SECONDARY HOOD CATCH SERVICE SHOULD ALSO HAVE BEENCOMPLETED.","1976","DODGE","ASPEN"
268,"CHRYSLER CORPORATION","76V055000",0,0,0,,"13/04/1976","SEAT BELTS:FRONT:RETRACTOR",,,,"CHRYSLER CAMPAIGN NO 211.  POSSIBILITY THAT THE AUTOMATIC LOCKING LAP BELTRETRACTOR ON FRONT OUTBOARD SEAT BELT ASSEMBLIES MAY INTERMITTENTLY FAIL TOENGAGE IN THE LOCKED POSITION WHEN THE BELT IS EXTRACTED FOR OCCUPANTS USE.  IFTHE RETRACTOR FAILS TO LOCK, A BELTED OCCUPANT MAY NOT BE ADEQUATELY RESTRAINEDDURING IMPACT.  (CORRECT BY INSPECTING AND INSTALLING SPECIALLY DEVELOPED CLIPTO INCREASE CLUTCH TORQUE OUTPUT TO ENSURE ENGAGEMENT OF THE RETRACTOR LOCKINGPAWL).","1976","DODGE","ASPEN"
269,"CHRYSLER CORPORATION","76V037000",0,0,0,,"09/03/1976","ENGINE AND ENGINE COOLING:EXHAUST SYSTEM:EMISSION CONTROL",,,,"CHRYSLER CAMPAIGN NO 209.  VEHICLE EQUIPPED WITH SIX CYLINDER ENGINE HAVINGCALIFORNIA EMISSION PACKAGE.  POSSIBILITY THAT FUEL VAPOR RETURN LINE MAY HAVEBEEN MISROUTED IN A MANNER WHICH ALLOWS INTERFERENCE BETWEEN THE LINE ANDALTERNATOR DRIVE BELT.  IF THIS CONDITION EXISTS, RETURN LINE ABRASIONRESULTING FROM INTERFERENCE COULD RESULT IN FUEL LEAKAGE, WITH THE POTENTIALFOR AN ENGINE COMPARTMENT FIRE.  (CORRECT BY INSPECTING AND RELOCATINGRETURNLINE TO PRECLUDE INTERFERENCE).","1976","DODGE","ASPEN"
270,"CHRYSLER CORPORATION","78V097000",0,0,0,,"01/05/1978","SUSPENSION:FRONT:CONTROL ARM:UPPER ARM","POSSIBLE FATIGUE FAILURE CAN OCCUR IN THE FRAME SUPPORT PLATES (FRONT SUSPENSION PIVOT BAR SUPPORT PLATE) THAT CONNECTS A PORTION OF THE FRONT SUSPENSION TO THE VEHICLE FRAME ON THE INVOLVED VEHICLES.",,"THE DEALER WILL INSPECT SUPPORT PLATES FOR INDICATIONS OF FAILURE AND, IF NECESSARY, WILL REPLACE THE PLATES. ADDITIONAL SUPPORT BRACKETS WILL ALSO BE INSTALLED TO REINFORCE THE SUPPORT PLATE AT THE PIVOT BAR ATTACHMENTS.","VEHICLE DESCRIPTION: PASSENGER VEHICLES.SYSTEM: SUSPENSION; FRAME SUPPORT PLATE.CONSEQUENCES OF DEFECT: UNDER CERTAIN DRIVING CONDITIONS, THIS FAILURE COULDAFFECT VEHICLE DIRECTIONAL CONTROL, PARTICULARLY DURING HEAVY BRAKEAPPLICATION. THIS WILL RESULT IN LOSS OF VEHICLE CONTROL WITHOUT PRIOR WARNINGAND A VEHICLE ACCIDENT.","1976","DODGE","ASPEN"
271,"CHRYSLER CORPORATION","77V188000",0,0,0,,"25/10/1977","SERVICE BRAKES, HYDRAULIC:FOUNDATION COMPONENTS:HOSES, LINES/PIPING, AND FITTINGS","ON THE INVOLVED VEHICLES, DAMAGE TO THE FRONT WHEEL BRAKE HYDRAULIC SYSTEM COULD OCCUR DUE TO FRONT WHEEL BRAKE LINE TUBE CORROSION. FRONT WHEEL BRAKE HOSES MAY BECOME BRITTLE AND CRACK DUE TO PROLONGED OPERATION IN COLD TEMPERATURES.",,"THE DEALER WILL REPLACE BOTH FRONT HOSES IF FOUND NECESSARY AND IN ADDITION, WILL INSTALL A PLASTIC SHIELD BETWEEN THE BATTERY THERMO-GUARD AND THE TUBES TO PREVENT CORROSION.","VEHICLE DESCRIPTION: PASSENGER VEHICLES.SYSTEM: SERVICE BRAKES; STEEL BRAKE TUBES.CONSEQUENCES OF DEFECT: LOSS OF FRONT WHEEL BRAKING CAPABILITY COULD RESULTWHICH WOULD INCREASE THE VEHICLE STOPPING DISTANCE AND COULD LEAD TO ANACCIDENT.NOTE: ILLUMINATION OF THE RED WARNING SIGNAL ON THE INSTRUMENT PANEL SHOULDALERT DRIVER THAT BRAKE MALFUNCTION HAS OCCURRED.","1976","DODGE","ASPEN"
272,"CHRYSLER CORPORATION","76V125000",0,0,0,,"10/08/1976","SERVICE BRAKES, HYDRAULIC:POWER ASSIST:VACUUM",,,,"CHRYSLER CAMPAIGN NO 217.  EQUIPPED WITH POWER BRAKES.  POSSIBILITY THAT THEPOWER BRAKE BOOSTER MAY CONTAIN SILENCER PAD THAT RESTRICTS INPUT AIR DURINGBRAKE PEDAL APPLICATION DUE TO EXCESSIVE SILENCER MATERIAL DENSITY.  IF THISCONDITION EXISTS, IT COULD CAUSE BRAKING ACTION DELAY ON RAPID PEDALAPPLICATION AND INCREASED STOPPING DISTANCE.  (CORRECT BY INSPECTING ANDREWORKING SUSPECT BOOSTER AND REMOVING SILENCER PAD).  PASSENGER VEHICLE.","1976","DODGE","ASPEN"
273,"CHRYSLER CORPORATION","77V017000",0,0,0,,"09/02/1977","EQUIPMENT:OTHER:LABELS","THE INVOLVED VEHICLES MAY NOT COMPLY WITH FEDERAL MOTOR VEHICLE SAFETY STANDARD NO. 110, ""TIRE SELECTION AND RIMS"". THE TIRE PRESSURE PLACARDS INCORRECTLY SPECIFY THE FRONT TIRE PRESSURE FOR MAXIMUM LOAD CONDITIONS. AS A RESULT, TIRES COULD FAIL DUE TO OVERLOADING.",,"THE OWNER WILL BE SENT THE CORRECT PLACARD AND HAS THE OPTION OF INSTALLING IT HIM/HERSELF OR HAVING THE DEALER INSTALL IT, FREE OF CHARGE.","VEHICLE DESCRIPTION: PASSENGER VEHICLES.SYSTEM: EQUIPMENT; TIRE INFORMATION PLACARDS.CONSEQUENCES OF DEFECT: IF TIRE FAILURE OCCURS, LOSS OF VEHICLE CONTROL AND ANACCIDENT COULD OCCUR.NOTE: TO ELIMINATE ANY POTENTIAL FOR OVERLOADING OF THE FRONT TIRES, THEINFLATION PRESSURE OF THE FRONT TIRES SHOULD BE SET AT 26 PSI AND MAINTAINED ATTHAT LEVEL.","1976","DODGE","ASPEN"
276,"CHRYSLER CORPORATION","80V073000",0,0,0,,"11/06/1980","SERVICE BRAKES, HYDRAULIC:FOUNDATION COMPONENTS:DISC:CALIPER","DUE TO A COMBINATION OF DISC BRAKE PAD WEAR AND TURN STOP WEAR ON CERTAIN VEHICLES, THERE MAY BE AN INCREASE IN BRAKE PEDAL TRAVEL AND A REDUCTION IN FRONT BRAKING EFFECTIVENESS FOLLOWING A FULL TURN. ALSO, A FRAME CRACK COULD DEVELOP AND COULD EXTEND THROUGH ALL OR MOST OF THE RAIL SECTION.",,"UPON INSPECTION DEALER WILL REPLACE EITHER THE LEFT OR RIGHT TURN STOP BRACKET TO CORRECT THE FRONT BRAKES. IF FRAME IS CRACKED IT WILL BE WELDED AND A ROD REINFORCEMENT WILL BE INSTALLED OVER THE CRACKED AREA.","VEHICLE DESCRIPTION: LIGHT TRUCKS.SYSTEM: SERVICE BRAKES; FRONT WHEEL DISC BRAKES, STRUCTURE; FRONT FRAME RAILEXTENSION.CONSEQUENCES OF DEFECT: THE REDUCTION IN FRONT WHEEL BRAKING EFFECTIVENESSCOULD RESULT IN A VEHICLE ACCIDENT IN SITUATIONS WHICH REQUIRE MINIMUM STOPPINGDISTANCE. IF AN EXTENSIVE CRACK DEVELOPS IN THE FRAME RAIL, INCREASED STEERINGSYSTEM PLAY AND DIFFICULTY IN HANDLING OF VEHICLE COULD ALSO LEAD TO ANACCIDENT.NOTE: A CRACK IN THE FRAME MAY BE ACCOMPANIED BY A METALLIC RATTLING NOISE ASTHE TWO EDGES SCRAPE AGAINST EACH OTHER.","1976","DODGE","B300"
277,"CHRYSLER CORPORATION","80V027000",0,0,0,,"14/03/1980","STRUCTURE:FRAME AND MEMBERS","THE FRONT RAIL EXTENSION MAY EXPERIENCE FATIGUE CRACKING NEAR THE AREA WHERE THE POWER STEERING GEAR ATTACHES TO THE FRAME. IF THE CRACK PROGRESSES THROUGH MOST OR ALL OF THE RAIL SECTION, STEERING SYSTEM FREE PLAY ACCOMPANIED BY METALLIC RATTLE NOISE WILL BE EXPERIENCED.",,"AFFECTED VEHICLES WILL BE WELD REPAIRED AND A REINFORCEMENT ROD WILL BE INSTALLED OVER THE CRACKED AREA.","VEHICLE DESCRIPTION: LIGHT TRUCKS.SYSTEM: STRUCTURE; LEFT FRONT FRAME RAIL.CONSEQUENCES OF DEFECT: THE CRACK CONDITION MAY CAUSE A COMPLETE LOSS OFSTEERING AND AN ACCIDENT.","1976","DODGE","B300"
274,"CHRYSLER CORPORATION","78V257000",0,0,0,,"01/12/1978","SEATS","THE INVOLVED VEHICLES FAIL TO CONFORM TO FEDERAL MOTOR VEHICLE SAFETY STANDARD NO. 207, ""SEATING SYSTEMS"". THE REQUIRED UNDERBODY SEAT REINFORCEMENTS MAY HAVE BEEN OMITTED DURING ASSEMBLY. WITHOUT THE REINFORCEMENTS, THE SEAT ASSEMBLIES MAY NOT BE ADEQUATELY SECURED TO THE VEHICLE STRUCTURE TO PREVENT SEAT DETACHMENT IN A VEHICLE CRASH SITUATION.",,"DEALER WILL INSTALL UNDERBODY REINFORCEMENTS WITHOUT CHARGE TO OWNER.","VEHICLE DESCRIPTION: LIGHT TRUCKS.SYSTEM: INTERIOR; BUCKET SEATS.CONSEQUENCES OF DEFECT: IF SEATS FAIL TO REMAIN PROPERLY ANCHORED IN THE EVENTOF A VEHICLE IMPACT, THE CHANCES OF PASSENGER INJURY WOULD BE INCREASED.","1976","DODGE","DODGE TRUCK"
275,"CHRYSLER CORPORATION","76V032000",0,0,0,,"23/02/1976","UNKNOWN OR OTHER",,,,"CHRYSLER CAMPAIGN NO 145T.  LIGHT DUTY TRUCKS EQUIPPED FOR SNOW PLOWINSTALLATION.  POSSIBIBILITY THAT THE SNOW PLOW LIFT FRAMES INSTALLED MAYEXPERIENCE STRUCTURAL FAILURE AT THE AUXILIARY BRACKET ATTACHMENT.  SUCHFAILURE COULD RESULT IN DETACHMENT OF THE LIGHT BRACKET AND LOSS OF THE SUPPORTREQUIRED TO MAINTAIN THE PLOW BLADE IN THE RAISED POSITION.  (CORRECT BYREWORKING AND REINFORCING BY ADDING CLIP WELDED TO BOTH FRAMES AND LIGHTBRACKET).","1976","DODGE","W100"
278,"FORD MOTOR COMPANY","76V165000",0,0,0,,"18/10/1976","STEERING:GEAR BOX (OTHER THAN RACK AND PINION)",,,,"FORD MOTOR CAMPAIGN NO 207.  POSSIBILITY THAT CERTAIN VEHICLES WERE PRODUCEDWITH FLAT WASHERS THAT MAY FRACTURE UNDER THE HEADS OF BOLTS THAT SECURE THESTEERING GEAR TO THE FRAME RAIL.  A FRACTURED WASHER COULD CAUSE THE ATTACHINGBOLT TO LOSE PRELOAD AND LOOSEN, AS A RESULT THE AFFECTED BOLT MAY FATIQUEFRACTURE LEADING TO THE FRACTURING OF THE TWO REMAINING ATTACHING BOLTS.SHOULD THIS OCCUR, THE STEERING GEAR CAN SEPARATE FROM THE FRAME RAIL ANDRESULT IN LOSS OF STEERING CONTROL.  VEHICLE DRIVER MAY BE WARNED OF CONDITIONBY STEERING LOOSENESS AND/OR NOISE.  (CORRECT BY REPLACING ASSEMBLY WASHERSTHAT ARE NOT BROKEN AND REPLACING ALL BOLTS AND WASHERS IF AN ASSEMBLY WASHERIS BROKEN).  LIGHT TRUCK, VAN.","1976","FORD","E150"
