Manufacturer,NHTSACampaignNumber,parkIt,parkOutSide,overTheAirUpdate,NHTSAActionNumber,ReportReceivedDate,Component,Summary,Consequence,Remedy,Notes,ModelYear,Make,Model
"FEDERAL-MOGUL CORPORATION","09E021000",0,0,0,,"30/04/2009","FUEL SYSTEM, OTHER:DELIVERY:FUEL PUMP","FEDERAL-MOGUL CORPORATION IS RECALLING 2,790 MECHANICAL FUEL PUMPS, P/NO. M6737 SOLD UNDER CARTER AND NAPA BRANDS AND P/NO. 2M6737 SOLD UNDER ACCU-FLOW AND TRU-FLOW BRANDS SHIPPED BETWEEN AUGUST 2008 AND MARCH 2009 FOR USE AS REPLACEMENT EQUIPMENT FOR THE VEHICLES LISTED ABOVE.  THE FUEL PUMP DIAPHRAGM ROD IN CERTAIN PRODUCTION RUNS MAY HAVE BEEN IMPROPERLY MANUFACTURED.  IMPROPERLY MANUFACTURED PUMP DIAPHRAGM RODS MAY CAUSE THE PUMP TO PRODUCE EXCESS PRESSURE.","EXCESS FUEL PUMP PRESSURE COULD CAUSE A VEHICLE FIRE.","FEDERAL-MOGUL WILL NOTIFY OWNERS AND REPLACE THE FUEL PUMP FREE OF CHARGE.  THE SAFETY RECALL BEGAN ON MAY 12, 2009.  OWNERS MAY CONTACT FEDERAL-MOGUL AT 1-877-489-6659.","THIS RECALL ONLY PERTAINS TO AFTERMARKET NAPA, CARTER, ACCU-FLO, AND TRU-FLO FUEL PUMPS AND HAS NO RELATION TO ANY ORIGINAL EQUIPMENT INSTALLED ON VEHICLES MANUFACTURED BY CHRYSLER LLC. OWNERS MAY ALSO CONTACT THE NATIONAL HIGHWAY TRAFFIC SAFETY ADMINISTRATION'S VEHICLE SAFETY HOTLINE AT 1-888-327-4236 (TTY 1-800-424-9153), OR GO TO <A HREF=HTTP://WWW.SAFERCAR.GOV>HTTP://WWW.SAFERCAR.GOV</A> .","1983","AMERICAN MOTORS","EAGLE"
"FEDERAL-MOGUL CORPORATION","07E064000",0,0,0,,"27/08/2007","FUEL SYSTEM, GASOLINE:DELIVERY:FUEL PUMP","CERTAIN FEDERAL-MOGUL AFTERMARKET FUEL PUMPS SOLD UNDER THE BRAND NAMES OF CARTER, ACCUFLOW, NAPA, TRUFLOW, PARTS DEPO, AND PARTS MASTER, SHIPPED BETWEEN AUGUST 2006 AND JULY 2007 FOR USE ON THE VEHICLES LISTED ABOVE.  THE FUEL PUMP DIAPHRAGM IN CERTAIN PRODUCTION RUNS MAY HAVE BEEN IMPROPERLY INSTALLED OR INADEQUATELY TESTED WHICH MAY CAUSE THE FUEL PUMP TO LEAK.","A LEAKING FUEL PUMP COULD CREATE A VEHICLE FIRE HAZARD.","FEDERAL-MOGUL WILL NOTIFY OWNERS AND REPLACE THE DEFECTIVE FUEL PUMPS FREE OF CHARGE.  THE RECALL BEGAN ON OCTOBER 15, 2007.  OWNERS CAN CONTACT FEDERAL-MOGUL AT 248-354-7700.","THIS RECALL ONLY PERTAINS TO AFTERMARKET CARTER, NAPA, ACCUFLOW, TRU FLOW, PARTS MASTER, AND PARTS DEPOT BRAND FUEL PUMPS AND HAS NO RELATION TO ANY ORIGINAL EQUIPMENT INSTALLED ON THE LISTED MOTOR VEHICLES.  CUSTOMERS MAY CONTACT THE NATIONAL HIGHWAY TRAFFIC SAFETY ADMINISTRATION'S VEHICLE SAFETY HOTLINE AT 1-888-327-4236 (TTY: 1-800-424-9153); OR GO TO HTTP://WWW.SAFERCAR.GOV.","1983","AMERICAN MOTORS","EAGLE"
"EIS BRAKE PARTS","96E006000",0,0,0,,"04/03/1996","SERVICE BRAKES, HYDRAULIC:FOUNDATION COMPONENTS:HOSES, LINES/PIPING, AND FITTINGS","THESE BRAKE HOSE ASSEMBLIES HAVE INADEQUATE CRIMPS ATTACHING THE HOSE TO THE HOSE FITTINGS AND COULD CAUSE THE HOSE AND FITTING TO SEPARATE.","IF THE BRAKE HOSE ASSEMBLY SEPARATES, LOSS OF BRAKING POWER CAN OCCUR INCREASING THE POTENTIAL FOR A VEHICLE ACCIDENT.","THESE BRAKE HOSE ASSEMBLIES WILL BE REPLACED.","SYSTEM: BRAKES; HYDRAULIC; LINES; HOSES.EQUIPMENT DESCRIPTION: AFTERMARKET BRAKE HOSE ASSEMBLIES, MODEL SP6957, FOR USE ON 1983 THROUGH 1986 AUDI 5000 VEHICLES.  NOTE: THE VEHICLE OWNER SHOULD IMMEDIATELY RETURN THE VEHICLE TO THE SERVICE FACILITY WHICH PERFORMED THE INSTALLATION AND THE INSTALLER SHOLD REMOVE THE BRAKE HOSE ASSEMBLY AND REPLACE IT WITH ASSEMBLY SP9037.  EIS WILL REMEDY THE DEFECT WITHOUT CHARGE TO THE OWNER FOR THE REPLACEMENT OF THE DEFECTIVE PARTS AND WILL PAY THE INSTALLING FACILITY FOR ITS PURCHASE COST OF THERE PLACEMENT PART (A COPY OF THE PURCHASE INVOICE WILL BE NEEDED) PLUS A LABOR CHARGE. OWNERS OR INSTALLERS CAN CONTACT EIS AT 129 WORTHINGTON RIDGE, BERLIN, CONNECTICUT 06037, ATTN. D. J. DUPREY, QUALITY ASSURANCE MANAGER, OR CALL1-203-828-8290. ALSO CONTACT THE NATIONAL HIGHWAY TRAFFIC SAFETY ADMINISTRATION'S AUTO SAFETY HOTLINE AT 1-800-424-9393.","1983","AUDI","5000"
"VOLKSWAGEN OF AMERICA,INC","87V008000",0,0,0,,"03/01/1987","POWER TRAIN:AUTOMATIC TRANSMISSION:LEVER AND LINKAGE:FLOOR SHIFT","SUDDEN ACCELERATION FROM A STATIONARY POSITION MAY OCCUR, WHEN SHIFTING FROM PARK TO REVERSE OR DRIVE.","UNEXPECTED SUDDEN ACCELERATION WITHOUT PRIOR WARNINGCOULD RESULT IN A VEHICLE CRASH, CAUSING INJURIES.","INSTALL AN AUTOMATIC SHIFT LOCK TO PREVENT THE TRANSMISSION SHIFT LEVER FROM BEING MOVED FROM PARK TO REVERSE OR DRIVE UNLESS BRAKE PEDAL IS APPLIED AT THE SAME TIME.","SYSTEM: TRANSMISSION LINKAGE.VEHICLE DESCRIPTION: PASSENGER VEHICLES WITH AUTOMATIC TRANSMISSION.","1983","AUDI","5000"
"VOLKSWAGEN OF AMERICA,INC","82V037000",0,0,0,,"21/04/1982","VEHICLE SPEED CONTROL:ACCELERATOR PEDAL","ON THE INVOLVED VEHICLES, AN IMPROPERLY PLACED MAT INTERFERES WITH THE VIBRATION ABSORBER ATTACHED TO THE UNDERSIDE OF THE ACCELERATOR. THE PEDAL MAY NOT FULLY RETURN TO THE IDLE POSITION.","CONSEQUENCE OF DEFECT:  THIS COULD RESULT IN UNINTENTIONAL ACCLERATION WHICH COULD CAUSE LOSS OF VEHICLE CONTROL AND AN ACCIDENT.","DEALER WILL INSTALL, WHERE NECESSARY, A GUIDE FOR THE ACCELERATOR PEDAL AND INSPECT THE ENTIRE THROTTLE SYSTEM.","VEHICLE DESCRIPTION: PASSENGER VEHICLES EQUIPPED WITH AUTOMATIC TRANSMISSION.SYSTEM: FUEL; ACCELERATOR PEDAL DAMPER.  NOTE: ON ALL AFFECTED VEHICLES THE DRIVER IS ADVISED NOT TO REMOVE THE KEY FROMTHE IGNITION WHILE CAR IS IN MOTION DUE TO THE STEERING LOCK HINDERING VEHICLEMANEUVERABILITY.","1983","AUDI","5000"
"VOLKSWAGEN OF AMERICA,INC","83V095000",0,0,0,,"22/09/1983","SERVICE BRAKES, HYDRAULIC:PEDALS AND LINKAGES","CERTAIN VEHICLES WERE ASSEMBLED WITH AN INSUFFICIENT HEIGHT DIFFERENTIAL BETWEEN THE ACCELERATOR AND BRAKE PEDALS.","CONSEQUENCE OF DEFECT:  THE DRIVER COULD INADVERTENTLY DEPRESS BOTH PEDALS AT ONE TIME, LOSE CONTROL, AND HAVE AN ACCIDENT.","DEALER WILL INSTALL A BRAKE PEDAL PLATE WHICH WILL RAISE THE BRAKE PEDAL TO THE PROPER HEIGHT.","VEHICLE DESCRIPTION: PASSENGER VEHICLES EQUIPPED WITH AUTOMATIC TRANSMISSIONS.  SYSTEM: SERVICE BRAKES; BRAKE PEDAL.  NOTE: IF UNINTENDED ACCELERATION IS EXPERIENCED, THE IGNITION SHOULD BE TURNED OFF AND THE BRAKE PEDAL FIRMLY PRESSED.","1983","AUDI","5000"
"VOLKSWAGEN OF AMERICA,INC","85V099000",0,0,0,,"30/07/1985","SERVICE BRAKES, HYDRAULIC:FOUNDATION COMPONENTS:HOSES, LINES/PIPING, AND FITTINGS","UNDER ADVERSE WEATHER CONDITIONS, OUTER RUBBER LAYER OF   BRAKE HOSES MAY BECOME BRITTLE AND DEVELOP CRACKS.                                                                                                                CONSEQUENCE OF DEFECT: CRACKS COULD LEAD TO LOSS OF BRAKE FLUID RESULTING IN AN  INCREASE IN STOPPING DISTANCE AND POSSIBLY AN ACCIDENT.",,"REPLACE BRAKE HOSES AS NECESSARY.","VEHICLE DESCRIPTION: PASSENGER CARS. SYSTEM: DISC BRAKE HOSE.","1983","AUDI","5000"
"BAYERISCHE MOTOREN WERKE","82V122000",0,0,0,,"09/12/1982","STEERING: STEERING WHEEL/HANDLE BAR","ON THE INVOLVED VEHICLES, THE SELF LOCKING NUTS THAT CONNECT THE LOWER STEERING COLUMN SHAFT TO THE FLEXIBLE COUPLING MAY NOT HAVE BEEN SUFFICIENTLY TIGHTENED. THESE NUTS CAN COME LOOSE.",,"THE DEALER WILL DO A TORQUE CHECK OF THE SELF-LOCKING NUTS AND, IF THE NUTS ARE FOUND TO BE LOOSE, THEY WILL BE TIGHTENED TO THE PROPER TORQUE SPECIFICATIONS, FREE OF CHARGE.","VEHICLE DESCRIPTION: PASSENGER VEHICLES.SYSTEM: STEERING; SELF LOCKING NUTS (STEERING COLUMN).CONSEQUENCES OF DEFECT: IF THE NUTS LOOSEN AND FALL OFF, THIS CAN LEAD TO LOSSOF VEHICLE CONTROL AND AN ACCIDENT.NOTE: PRIOR WARNING TO THE DRIVER SHOULD OCCUR IN THE FORM OF ABNORMAL STEERINGPLAY, CAUSED BY THE LOOSE NUTS.","1983","BMW","633"
"GENERAL MOTORS CORP.","83V105000",0,0,0,,"13/10/1983","SERVICE BRAKES, HYDRAULIC:FOUNDATION COMPONENTS:DIFFERENTIAL PROPORTIONAL VALVE","THE BRAKE PROPORTIONER VALVES MAY BREAK AND SEPARATE FROM THE MASTER CYLINDER. THIS WOULD ALLOW BRAKE FLUID TO LEAK AND WOULD RESULT IN A PARTIAL LOSS OF THE BRAKE SYSTEM.",,"THE DEALER WILL INSPECT AND, IF NECESSARY, REPLACE ALL SUSPECT VALVES.","VEHICLE DESCRIPTION: PASSENGER VEHICLES.SYSTEM: SERVICE BRAKES; BRAKE PROPORTIONER VALVES.CONSEQUENCES OF DEFECT: SINCE THIS IS A DUAL BRAKE SYSTEM, PART OF THE SYSTEMWILL STILL WORK AND ALLOW THE VEHICLE TO BE STOPPED, BUT OVER A GREATERDISTANCE. PARTIAL LOSS OF THE BRAKING SYSTEM AT A TIME WHEN MINIMUM STOPPINGDISTANCE IS REQUIRED COULD RESULT IN A VEHICLE ACCIDENT WITHOUT PRIOR WARNING.","1983","BUICK","CENTURY"
"GENERAL MOTORS CORP.","83V106000",0,0,0,,"13/10/1983","SERVICE BRAKES, HYDRAULIC:FOUNDATION COMPONENTS:HOSES, LINES/PIPING, AND FITTINGS","THE MASTER CYLINDER REAR BRAKE PIPE, WHICH CARRIES BRAKE FLUID TO THE REAR BRAKES, MAY DEVELOP A LEAK DUE TO EXTENDED CHAFING ON THE AIR CLEANER RESONATOR BRACKET.",,"IF UPON INSPECTION THE DEALER FINDS THAT THERE IS INADEQUATE CLEARANCE, THE PIPE WILL BE REFORMED TO OBTAIN THE NECESSARY THREE QUARTER INCH SPACE. ONLY THOSE PIPES SHOWING SIGNS OF WEAR WILL BE REPLACED.","VEHICLE DESCRIPTION: PASSENGER VEHICLES AND LIGHT TRUCKS EQUIPPED WITH 5.7LITER DIESEL ENGINES.SYSTEM: SERVICE BRAKES; MASTER CYLINDER, REAR BRAKE PIPE.CONSEQUENCES OF DEFECT: BRAKE FLUID LEAKAGE WILL RESULT IN LOSS OF BRAKINGACTION AT THE REAR WHEELS. LOSS OF VEHICLE CONTROL AND AN ACCIDENT COULDRESULT, PARTICULARLY IN SITUATIONS WHERE MINIMUM STOPPING DISTANCE IS REQUIRED.","1983","BUICK","REGAL"
"GENERAL MOTORS CORP.","82V110000",0,0,0,,"15/11/1982","VISIBILITY:WINDSHIELD WIPER/WASHER:MOTOR","DURING WINDSHIELD WIPER OPERATION, THE NOISE SUPPRESION CAPACITOR IN THE WIPER MOTOR RELAY MAY OVERHEAT.",,"THE DEALER WILL MODIFY THE WINDSHIELD WIPER MOTOR DELAY RELAY BY REMOVING THE NOISE SUPPRESION CAPACITOR. THIS WILL BE DONE FREE OF CHARGE.","VEHICLE DESCRIPTION: PASSENGER VEHICLES EQUIPPED WITH DELCO/BOSE RADIO PULSEWIPE FEATURES.SYSTEM: VISUAL; WIPER MOTOR DELAY RELAY.CONSEQUENCES OF DEFECT: WIPER MOTOR OVERHEATING CAN CAUSE LOSS OF WINDSHIELDWIPER OPERATION AND AN UNDERHOOD FIRE. THIS FIRE MAY SPREAD THROUGHOUT THEPASSENGER COMPARTMENT AND CAUSE BURN INJURIES TO THE VEHICLE OCCUPANTS.NOTE: OWNER IS ADVISED NOT TO USE THE WINDSHIELD WIPER MOTOR DELAY FEATUREUNTIL THE VEHICLE CAN BE CORRECTED. WHEN IT IS NECESSARY TO USE THE WINDSHIELDWIPER SYSTEM, IT SHOULD ONLY BE USED IN THE MEDIUM OR HIGH POSITIONS.","1983","BUICK","RIVIERA"
"HONEYWELL INTERNATIONAL, INC.","06E043000",0,0,0,,"19/05/2006","FUEL SYSTEM, GASOLINE","CERTAIN REPLACEMENT FUEL FILTERS, FRAM BRAND NAME P/N G3727, WITH DATE CODES X52911 THROUGH X60801 SEQUENTIALLY OR X600141 AND A MEXICO COUNTRY OR ORIGIN MARKING ON THE FUEL FILTER HOUSING MANUFACTURED FROM OCTOBER 18, 2005, THROUGH MARCH 21, 2006, SOLD FOR USE ON THE VEHICLES LISTED ABOVE AND ON CERTAIN SCHOOL BUSES.  (TO SEE THE SCHOOL BUS ENGINE SIZES, CLICK ON ""DOCUMENT SEARCH"" AND THEN ""BUS APPLICATIONS"").  THE CONNECTOR ON THE FUEL FILTER WAS NOT MANUFACTURED TO HONEYWELL'S SPECIFICATION.  AS A RESULT, THE O-RING MAY NOT SEAT CORRECTLY ON THE FUEL LINE.","THIS CONDITION MAY CAUSE AN INADEQUATE SEAL AT THE CONNECTION, POTENTIALLY LEADING TO A FUEL LEAK. IN THE PRESENCE OF AN IGNITION SOURCE, A FIRE COULD OCCUR.","HONEYWELL WILL NOTIFY OWNERS AND REPLACE THE FUEL FILTERS FREE OF CHARGE.  THE RECALL BEGAN ON OCTOBER 18, 2006.  OWNERS MAY CONTACT FRAM CUSTOMER SERVICE AT 1-800-890-2075 (OPTION 1).","THIS RECALL ONLY PERTAINS TO AFTERMARKET FRAM FUEL FILTERS AND HAS NO RELATION TO ANY ORIGINAL EQUIPMENT INSTALLED ON THE VEHICLES LISTED.  CUSTOMERS MAY CONTACT THE NATIONAL HIGHWAY TRAFFIC SAFETY ADMINISTRATION'S VEHICLE SAFETY HOTLINE AT 1-888-327-4236 (TTY: 1-800-424-9153); OR GO TO HTTP://WWW.SAFERCAR.GOV.","1983","BUICK","SKYHAWK"
"GENERAL MOTORS CORP.","87V079000",0,0,0,"EA86023","07/05/1987","SEATS","THE METAL FLOOR PAN ANCHOR BAR COULD FATIGUE AND BREAK AROUND THE LEFT FRONT OUTER SEAT ADJUSTER STUD OF THE DRIVERS SEAT, ALLOWING THE STUD TO SEPARATE FROM THE FLOOR PAN ANCHOR BAR.","DRIVERS SEAT COULD TIP REARWARD UNEXPECTEDLY; THIS COULDRESULT IN LOSS OF CONTROL AND A VEHICLE CRASH WITHOUT PRIOR WARNING.","INSTALL A REINFORCEMENT BRACKET ON THE FLOOR PAN ANCHOR BAR AT THE LEFT FRONT OUTER SEAT ADJUSTER POSITION OF THE DRIVERS SEAT.","SYSTEM: DRIVERS SEAT.VEHICLE DESCRIPTION: PASSENGER CARS EQUIPPED WITH MANUALLY ADJUSTABLE DRIVERSSEAT.","1983","BUICK","SKYHAWK"
"GENERAL MOTORS CORP.","83V105000",0,0,0,,"13/10/1983","SERVICE BRAKES, HYDRAULIC:FOUNDATION COMPONENTS:DIFFERENTIAL PROPORTIONAL VALVE","THE BRAKE PROPORTIONER VALVES MAY BREAK AND SEPARATE FROM THE MASTER CYLINDER. THIS WOULD ALLOW BRAKE FLUID TO LEAK AND WOULD RESULT IN A PARTIAL LOSS OF THE BRAKE SYSTEM.",,"THE DEALER WILL INSPECT AND, IF NECESSARY, REPLACE ALL SUSPECT VALVES.","VEHICLE DESCRIPTION: PASSENGER VEHICLES.SYSTEM: SERVICE BRAKES; BRAKE PROPORTIONER VALVES.CONSEQUENCES OF DEFECT: SINCE THIS IS A DUAL BRAKE SYSTEM, PART OF THE SYSTEMWILL STILL WORK AND ALLOW THE VEHICLE TO BE STOPPED, BUT OVER A GREATERDISTANCE. PARTIAL LOSS OF THE BRAKING SYSTEM AT A TIME WHEN MINIMUM STOPPINGDISTANCE IS REQUIRED COULD RESULT IN A VEHICLE ACCIDENT WITHOUT PRIOR WARNING.","1983","BUICK","SKYHAWK"
"GENERAL MOTORS CORP.","82V096000",0,0,0,,"07/10/1982","FUEL SYSTEM, GASOLINE:FUEL INJECTION SYSTEM:INJECTORS","POSSIBLE FUEL LEAKAGE COULD OCCUR AT THE THROTTLE BODY INJECTION FUEL FEED PIPE CONNECTION ON THE INVOLVED VEHICLES.",,"THE FUEL FEED LINE FITTING BOLT AND TWO WASHERS WILL BE REPLACED BY THE DEALER AT NO COST TO OWNER.","VEHICLE DESCRIPTION: PASSENGER VEHICLES EQUIPPED WITH 2.0 LITER ENGINES.SYSTEM: FUEL; FUEL FEED PIPE CONNECTION.CONSEQUENCES OF DEFECT: IF AN IGNITION SOURCE IS PRESENT WHEN FUEL LEAKAGEOCCURS, A FIRE COULD START AND COULD SPREAD TO THE PASSENGER COMPARTMENT,CAUSING SERIOUS PERSONAL INJURY TO PASSENGERS.","1983","BUICK","SKYHAWK"
"GENERAL MOTORS CORP.","87V165000",0,0,0,,"26/10/1987","ENGINE AND ENGINE COOLING:EXHAUST SYSTEM:EMISSION CONTROL:CRANKCASE (PCV)","INTERNAL CORROSION OF PULSAIR CHECK VALVE ASSEMBLY COULD PERMIT EXHAUST GAS TO MELT THE PLASTIC SHUT OFF VALVE AND DRAW VALVE PIECES INTO THE AIR CLEANER AND THROTTLE BODY.","IF VALVE PIECES LODGE AGAINST THROTTLE PLATE, ENGINE MAYNOT RETURN TO IDLE RESULTING IN LOSS ACCELERATOR CONTROL AND POSSIBLY A CRASH.","REPLACE PULSAIR CHECK VALVE AND SHUT OFF VALVE WITH NEWLY DESIGNED VALVES.","SYSTEM: PULSAIR CHECK VALVEVEHICLE DESCRIPTION: PASSENGER CARS EQUIPPED WITH 2.0L ENGINES.","1983","BUICK","SKYHAWK"
"GENERAL MOTORS CORP.","83V105000",0,0,0,,"13/10/1983","SERVICE BRAKES, HYDRAULIC:FOUNDATION COMPONENTS:DIFFERENTIAL PROPORTIONAL VALVE","THE BRAKE PROPORTIONER VALVES MAY BREAK AND SEPARATE FROM THE MASTER CYLINDER. THIS WOULD ALLOW BRAKE FLUID TO LEAK AND WOULD RESULT IN A PARTIAL LOSS OF THE BRAKE SYSTEM.",,"THE DEALER WILL INSPECT AND, IF NECESSARY, REPLACE ALL SUSPECT VALVES.","VEHICLE DESCRIPTION: PASSENGER VEHICLES.SYSTEM: SERVICE BRAKES; BRAKE PROPORTIONER VALVES.CONSEQUENCES OF DEFECT: SINCE THIS IS A DUAL BRAKE SYSTEM, PART OF THE SYSTEMWILL STILL WORK AND ALLOW THE VEHICLE TO BE STOPPED, BUT OVER A GREATERDISTANCE. PARTIAL LOSS OF THE BRAKING SYSTEM AT A TIME WHEN MINIMUM STOPPINGDISTANCE IS REQUIRED COULD RESULT IN A VEHICLE ACCIDENT WITHOUT PRIOR WARNING.","1983","BUICK","SKYLARK"
"PUROLATOR PRODUCTS, INC.","93E019000",0,0,0,,"04/06/1993","FUEL SYSTEM, GASOLINE:STORAGE","THE FUEL FILTERS WERE PRODUCED WITH AN INCORRECT THREADED FITTING. THE INCORRECT FITTING IS SIMILIAR ENOUGH IN SIZE THAT THE FUEL FILTER MAY APPEAR TO BE CORRECTLY THREADED ONTO THE FUEL LINE.","REPLACE THE FILTERS WITH THE CORRECT FILTERS.","THE IMPROPER THREADING COULD CAUSE A GASOLINE LEAK WHICH MAY RESULT IN AN UNDERHOOD FIRE WHEN EXPOSED TO A SOURCE OF IGNITION.","SYSTEM: FUEL; FILTER.EQUIPMENT DESCRIPTION: FUEL FILTERS, PART NOS. F33141 AND GF3141.NOTE: IF YOU HAVE PROBLEMS EXCHANGING YOUR DEFECTIVE FUEL FILTER, PLEASE CALLPUROLATER CUSTOMER SERVICE AT 1-800-526-3659. ALSO CONTACT THE NATIONAL HIGHWAYTRAFFIC SAFETY ADMINISTRATION'S AUTO SAFETY HOTLINE AT 1-800-424-9393.","1983","CADILLAC","DEVILLE"
"PUROLATOR PRODUCTS, INC.","93E019000",0,0,0,,"04/06/1993","FUEL SYSTEM, GASOLINE:STORAGE","THE FUEL FILTERS WERE PRODUCED WITH AN INCORRECT THREADED FITTING. THE INCORRECT FITTING IS SIMILIAR ENOUGH IN SIZE THAT THE FUEL FILTER MAY APPEAR TO BE CORRECTLY THREADED ONTO THE FUEL LINE.","REPLACE THE FILTERS WITH THE CORRECT FILTERS.","THE IMPROPER THREADING COULD CAUSE A GASOLINE LEAK WHICH MAY RESULT IN AN UNDERHOOD FIRE WHEN EXPOSED TO A SOURCE OF IGNITION.","SYSTEM: FUEL; FILTER.EQUIPMENT DESCRIPTION: FUEL FILTERS, PART NOS. F33141 AND GF3141.NOTE: IF YOU HAVE PROBLEMS EXCHANGING YOUR DEFECTIVE FUEL FILTER, PLEASE CALLPUROLATER CUSTOMER SERVICE AT 1-800-526-3659. ALSO CONTACT THE NATIONAL HIGHWAYTRAFFIC SAFETY ADMINISTRATION'S AUTO SAFETY HOTLINE AT 1-800-424-9393.","1983","CADILLAC","ELDORADO"
"GENERAL MOTORS CORP.","82V110000",0,0,0,,"15/11/1982","VISIBILITY:WINDSHIELD WIPER/WASHER:MOTOR","DURING WINDSHIELD WIPER OPERATION, THE NOISE SUPPRESION CAPACITOR IN THE WIPER MOTOR RELAY MAY OVERHEAT.",,"THE DEALER WILL MODIFY THE WINDSHIELD WIPER MOTOR DELAY RELAY BY REMOVING THE NOISE SUPPRESION CAPACITOR. THIS WILL BE DONE FREE OF CHARGE.","VEHICLE DESCRIPTION: PASSENGER VEHICLES EQUIPPED WITH DELCO/BOSE RADIO PULSEWIPE FEATURES.SYSTEM: VISUAL; WIPER MOTOR DELAY RELAY.CONSEQUENCES OF DEFECT: WIPER MOTOR OVERHEATING CAN CAUSE LOSS OF WINDSHIELDWIPER OPERATION AND AN UNDERHOOD FIRE. THIS FIRE MAY SPREAD THROUGHOUT THEPASSENGER COMPARTMENT AND CAUSE BURN INJURIES TO THE VEHICLE OCCUPANTS.NOTE: OWNER IS ADVISED NOT TO USE THE WINDSHIELD WIPER MOTOR DELAY FEATUREUNTIL THE VEHICLE CAN BE CORRECTED. WHEN IT IS NECESSARY TO USE THE WINDSHIELDWIPER SYSTEM, IT SHOULD ONLY BE USED IN THE MEDIUM OR HIGH POSITIONS.","1983","CADILLAC","ELDORADO"
"EMPIRE COACH COMPANY","90V093000",0,0,0,,"09/05/1990","EQUIPMENT:OTHER:LABELS","VEHICLE DESCRIPTION:  LIMOUSINES BUILT BY EMPIRE COACH.   VEHICLE ALTERERS LABEL MAY BE MISSING OR INCOMPLETE.","VEHICLES DO NOT COMPLY WITH PART 567.","ADD COMPLIANCE LABEL.","SYSTEM: COMPLIANCE LABEL; PART 567.VEHICLE DESCRIPTION:LIMOUSINES MANUFACTURED BY  COACH LIMOUSINES.","1983","CADILLAC","FLEETWOOD"
"PUROLATOR PRODUCTS, INC.","93E019000",0,0,0,,"04/06/1993","FUEL SYSTEM, GASOLINE:STORAGE","THE FUEL FILTERS WERE PRODUCED WITH AN INCORRECT THREADED FITTING. THE INCORRECT FITTING IS SIMILIAR ENOUGH IN SIZE THAT THE FUEL FILTER MAY APPEAR TO BE CORRECTLY THREADED ONTO THE FUEL LINE.","REPLACE THE FILTERS WITH THE CORRECT FILTERS.","THE IMPROPER THREADING COULD CAUSE A GASOLINE LEAK WHICH MAY RESULT IN AN UNDERHOOD FIRE WHEN EXPOSED TO A SOURCE OF IGNITION.","SYSTEM: FUEL; FILTER.EQUIPMENT DESCRIPTION: FUEL FILTERS, PART NOS. F33141 AND GF3141.NOTE: IF YOU HAVE PROBLEMS EXCHANGING YOUR DEFECTIVE FUEL FILTER, PLEASE CALLPUROLATER CUSTOMER SERVICE AT 1-800-526-3659. ALSO CONTACT THE NATIONAL HIGHWAYTRAFFIC SAFETY ADMINISTRATION'S AUTO SAFETY HOTLINE AT 1-800-424-9393.","1983","CADILLAC","FLEETWOOD"
"PUROLATOR PRODUCTS, INC.","93E019000",0,0,0,,"04/06/1993","FUEL SYSTEM, GASOLINE:STORAGE","THE FUEL FILTERS WERE PRODUCED WITH AN INCORRECT THREADED FITTING. THE INCORRECT FITTING IS SIMILIAR ENOUGH IN SIZE THAT THE FUEL FILTER MAY APPEAR TO BE CORRECTLY THREADED ONTO THE FUEL LINE.","REPLACE THE FILTERS WITH THE CORRECT FILTERS.","THE IMPROPER THREADING COULD CAUSE A GASOLINE LEAK WHICH MAY RESULT IN AN UNDERHOOD FIRE WHEN EXPOSED TO A SOURCE OF IGNITION.","SYSTEM: FUEL; FILTER.EQUIPMENT DESCRIPTION: FUEL FILTERS, PART NOS. F33141 AND GF3141.NOTE: IF YOU HAVE PROBLEMS EXCHANGING YOUR DEFECTIVE FUEL FILTER, PLEASE CALLPUROLATER CUSTOMER SERVICE AT 1-800-526-3659. ALSO CONTACT THE NATIONAL HIGHWAYTRAFFIC SAFETY ADMINISTRATION'S AUTO SAFETY HOTLINE AT 1-800-424-9393.","1983","CADILLAC","SEVILLE"
"GENERAL MOTORS CORP.","83V065000",0,0,0,,"07/07/1983","VISIBILITY:DEFROSTER/DEFOGGER/HVAC SYSTEM:REAR WINDOW","THE FUSIBLE LINK, WHICH PROTECTS ELECTRICAL COMPONENTS CONNECTED THROUGH THE IGNITION SWITCH, COULD COME OPEN WHILE REAR WINDOW DEFOGGER IS IN OPERATION. IF TWILIGHT SENTINEL SWITCH IS ON AND HEADLIGHT SWITCH IS OFF, AN OPEN LINK WILL RESULT IN LOSS OF HEADLIGHTS.",,"DEALER WILL REPLACE DEFECTIVE FUSIBLE LINK WITH AN IMPROVED TYPE.","VEHICLE DESCRIPTION: PASSENGER VEHICLES EQUIPPED WITH REAR WINDOW DEFOGGERS ANDTWILIGHT SENTINEL.SYSTEM: ELECTRICAL; FUSIBLE LINK.CONSEQUENCES OF DEFECT: LOSS OF HEADLIGHTS WITHOUT WARNING COULD RESULT IN ANACCIDENT, ESPECIALLY IN POOR WEATHER/NIGHT TIME DRIVING CONDITIONS.","1983","CADILLAC","SEVILLE"
"GENERAL MOTORS CORP.","82V110000",0,0,0,,"15/11/1982","VISIBILITY:WINDSHIELD WIPER/WASHER:MOTOR","DURING WINDSHIELD WIPER OPERATION, THE NOISE SUPPRESION CAPACITOR IN THE WIPER MOTOR RELAY MAY OVERHEAT.",,"THE DEALER WILL MODIFY THE WINDSHIELD WIPER MOTOR DELAY RELAY BY REMOVING THE NOISE SUPPRESION CAPACITOR. THIS WILL BE DONE FREE OF CHARGE.","VEHICLE DESCRIPTION: PASSENGER VEHICLES EQUIPPED WITH DELCO/BOSE RADIO PULSEWIPE FEATURES.SYSTEM: VISUAL; WIPER MOTOR DELAY RELAY.CONSEQUENCES OF DEFECT: WIPER MOTOR OVERHEATING CAN CAUSE LOSS OF WINDSHIELDWIPER OPERATION AND AN UNDERHOOD FIRE. THIS FIRE MAY SPREAD THROUGHOUT THEPASSENGER COMPARTMENT AND CAUSE BURN INJURIES TO THE VEHICLE OCCUPANTS.NOTE: OWNER IS ADVISED NOT TO USE THE WINDSHIELD WIPER MOTOR DELAY FEATUREUNTIL THE VEHICLE CAN BE CORRECTED. WHEN IT IS NECESSARY TO USE THE WINDSHIELDWIPER SYSTEM, IT SHOULD ONLY BE USED IN THE MEDIUM OR HIGH POSITIONS.","1983","CADILLAC","SEVILLE"
"PRO-A MOTORS, INC.","06E026000",0,0,0,,"23/03/2006","EXTERIOR LIGHTING","CERTAIN PRO-A MOTORS CORNER LAMPS, TURN SIGNALS, AND HEADLIGHTS SOLD AS REPLACEMENT LAMPS FOR USE ON CERTAIN PASSENGER VEHICLES LISTED ABOVE.  SOME COMBINATION LAMPS THAT ARE NOT EQUIPPED WITH AMBER SIDE REFLECTORS FAIL TO CONFORM TO FEDERAL MOTOR VEHICLE SAFETY STANDARD NO. 108, LAMPS, REFLECTIVE DEVICES, AND ASSOCIATED EQUIPMENT.","WITHOUT THE AMBER REFLECTORS, THE VEHICLE WILL BE POORLY ILLUMINATED, POSSIBLY RESULTING IN A VEHICLE CRASH WITHOUT WARNING.","PRO-A MOTORS WILL NOTIFY OWNERS AND OFFER TO REPURCHASE THE LAMPS.  THE RECALL BEGAN ON APRIL 3, 2006.  OWNERS MAY CONTACT PRO-A MOTORS AT 323-838-2988.","THIS RECALL ONLY PERTAINS TO PRO-A MOTORS AFTERMARKET LAMPS AND HAS NO RELATION TO ANY ORIGINAL EQUIPMENT INSTALLED ON THE LISTED PASSENGER VEHICLES.  FOR MORE INFORMATION ON THE LAMP MODEL NUMBERS, CLICK ON DOCUMENT SEARCH AND VIEW DOCUMENT TITLED ""LAMP MODEL NUMBERS.""  CUSTOMERS MAY CONTACT THE NATIONAL HIGHWAY TRAFFIC SAFETY ADMINISTRATION'S VEHICLE SAFETY HOTLINE AT 1-888-327-4236 (TTY: 1-800-424-9153); OR GO TO HTTP://WWW.SAFERCAR.GOV.","1983","CHEVROLET","BLAZER"
"HONEYWELL INTERNATIONAL, INC.","07E088000",0,0,0,,"24/10/2007","EQUIPMENT","CERTAIN HONEYWELL FRAM RACING BRAND HP4 AND HP8 OIL FILTERS THAT WERE MANUFACTURED FROM MAY 25, 2006, THROUGH SEPTEMBER 14, 2007, AND SOLD FOR USE AS REPLACEMENT EQUIPMENT FOR VEHICLES LIST ABOVE.  THE AFFECTED FILTERS ARE MARKED WITH A DATE CODE A61451 THROUGH A72571 SEQUENTIALLY.  THE DATE CODE AND PART NUMBER APPEAR ON THE FILTER HOUSING.  FRAM RACING HP4 AND HP8 OIL FILTERS NOT BEARING A DATE CODE IN THIS RANGE ARE NOT AFFECTED BY THIS RECALL.  THE GASKET OF THE OIL FILTER BECOMES MORE PLIABLE UNDER HIGH TEMPERATURES AND PRESSURES.","THIS CONDITION MAY CAUSE INADEQUATE SEALING AND LOSS OF ENGINE OIL, POSSIBLY RESULTING IN A FIRE.","HONEYWELL WILL REPLACE THE AFFECTED OIL FILTERS FREE OF CHARGE.  THE RECALL BEGAN DURING NOVEMBER 2007.  OWNERS CAN CONTACT FRAM CUSTOMER SERVICE TOLL-FREE AT 1-800-890-2075.","CUSTOMERS MAY CONTACT THE NATIONAL HIGHWAY TRAFFIC SAFETY ADMINISTRATION'S VEHICLE SAFETY HOTLINE AT 1-888-327-4236 (TTY: 1-800-424-9153); OR GO TO HTTP://WWW.SAFERCAR.GOV.","1983","CHEVROLET","BLAZER"
"GENERAL MOTORS CORP.","83V107000",0,0,0,,"13/10/1983","SERVICE BRAKES, HYDRAULIC:FOUNDATION COMPONENTS:HOSES, LINES/PIPING, AND FITTINGS","THE RIGHT FRONT CROSSOVER PIPE, WHICH CARRIES BRAKE HYDRAULIC FLUID, MAY BREAK AND LEAK FLUID. THIS OCCURS WHEN THE RIGHT FRONT FENDER SKIRT CONTACTS THE PIPE AND VIBRATION CAUSES THE PIPE TO WEAR THROUGH.",,"IF THE POSITION AND CLEARANCE OF THE BRAKE PIPE ARE INCORRECT, THE FENDER SKIRT WILL BE ADJUSTED AND A REPLACEMENT PIPE WILL BE INSTALLED.","VEHICLE DESCRIPTION: LIGHT TRUCKS, FOUR WHEEL DRIVE.SYSTEM: SERVICE BRAKES; FRONT BRAKE HYDRAULIC CROSSOVER PIPE.CONSEQUENCES OF DEFECT: FLUID LEAKAGE WILL RESULT IN THE LOSS OF FRONT BRAKING,AND AN INCREASE IN STOPPING DISTANCE. AN ACCIDENT MAY RESULT, PARTICULARLY INSITUATIONS REQUIRING MINIMUM STOPPING DISTANCE.NOTE: AN INCREASE IN BRAKE PEDAL TRAVEL AND ILLUMINATION OF THE BRAKE WARNINGLIGHT MAY INDICATE THE PROBLEM EXISTS.","1983","CHEVROLET","BLAZER"
"GENERAL MOTORS CORP.","83V046000",0,0,0,,"27/04/1983","SEATS","THE INERTIA LOCK MECHANISM MAY NOT FUNCTION, ALLOWING THE SEAT BACK TO FOLD FORWARD, AND THE SEAT TO MOVE FORWARD.",,,"VEHICLE DESCRIPTION: LIGHT TRUCKS EQUIPPED WITH FOLDING REAR BENCH SEATS.SYSTEM: INTERIOR SYSTEMS; SEAT BACK INERTIA LOCK.CONSEQUENCES OF DEFECT: IF THE REAR SEAT IS OCCUPIED, THIS COULD CAUSE PERSONALINJURY BY PINNING OCCUPANTS BETWEEN THE REAR SEAT AND THE BACK OF THE FRONTSEAT.NOTE: THIS FAILURE MAY OCCUR UNDER MODERATE BRAKING CONDITIONS.CORRECTIVEACTION: THE DEALER WILL INSTALL A MANUALLY OPERATED LATCH WITH APOSITIVE LOCK AND RELEASE HANDLE AT NO CHARGE.","1983","CHEVROLET","BLAZER"
