Manufacturer,NHTSACampaignNumber,parkIt,parkOutSide,overTheAirUpdate,NHTSAActionNumber,ReportReceivedDate,Component,Summary,Consequence,Remedy,Notes,ModelYear,Make,Model
"HONEYWELL INTERNATIONAL, INC.","07E088000",0,0,0,,"24/10/2007","EQUIPMENT","CERTAIN HONEYWELL FRAM RACING BRAND HP4 AND HP8 OIL FILTERS THAT WERE MANUFACTURED FROM MAY 25, 2006, THROUGH SEPTEMBER 14, 2007, AND SOLD FOR USE AS REPLACEMENT EQUIPMENT FOR VEHICLES LIST ABOVE.  THE AFFECTED FILTERS ARE MARKED WITH A DATE CODE A61451 THROUGH A72571 SEQUENTIALLY.  THE DATE CODE AND PART NUMBER APPEAR ON THE FILTER HOUSING.  FRAM RACING HP4 AND HP8 OIL FILTERS NOT BEARING A DATE CODE IN THIS RANGE ARE NOT AFFECTED BY THIS RECALL.  THE GASKET OF THE OIL FILTER BECOMES MORE PLIABLE UNDER HIGH TEMPERATURES AND PRESSURES.","THIS CONDITION MAY CAUSE INADEQUATE SEALING AND LOSS OF ENGINE OIL, POSSIBLY RESULTING IN A FIRE.","HONEYWELL WILL REPLACE THE AFFECTED OIL FILTERS FREE OF CHARGE.  THE RECALL BEGAN DURING NOVEMBER 2007.  OWNERS CAN CONTACT FRAM CUSTOMER SERVICE TOLL-FREE AT 1-800-890-2075.","CUSTOMERS MAY CONTACT THE NATIONAL HIGHWAY TRAFFIC SAFETY ADMINISTRATION'S VEHICLE SAFETY HOTLINE AT 1-888-327-4236 (TTY: 1-800-424-9153); OR GO TO HTTP://WWW.SAFERCAR.GOV.","1983","CHEVROLET","MONTE CARLO"
"GENERAL MOTORS CORP.","83V106000",0,0,0,,"13/10/1983","SERVICE BRAKES, HYDRAULIC:FOUNDATION COMPONENTS:HOSES, LINES/PIPING, AND FITTINGS","THE MASTER CYLINDER REAR BRAKE PIPE, WHICH CARRIES BRAKE FLUID TO THE REAR BRAKES, MAY DEVELOP A LEAK DUE TO EXTENDED CHAFING ON THE AIR CLEANER RESONATOR BRACKET.",,"IF UPON INSPECTION THE DEALER FINDS THAT THERE IS INADEQUATE CLEARANCE, THE PIPE WILL BE REFORMED TO OBTAIN THE NECESSARY THREE QUARTER INCH SPACE. ONLY THOSE PIPES SHOWING SIGNS OF WEAR WILL BE REPLACED.","VEHICLE DESCRIPTION: PASSENGER VEHICLES AND LIGHT TRUCKS EQUIPPED WITH 5.7LITER DIESEL ENGINES.SYSTEM: SERVICE BRAKES; MASTER CYLINDER, REAR BRAKE PIPE.CONSEQUENCES OF DEFECT: BRAKE FLUID LEAKAGE WILL RESULT IN LOSS OF BRAKINGACTION AT THE REAR WHEELS. LOSS OF VEHICLE CONTROL AND AN ACCIDENT COULDRESULT, PARTICULARLY IN SITUATIONS WHERE MINIMUM STOPPING DISTANCE IS REQUIRED.","1983","CHEVROLET","MONTE CARLO"
"K2 MOTOR CORPORATION","08E050000",0,0,0,,"11/08/2008","EXTERIOR LIGHTING:HEADLIGHTS","K2 MOTOR IS RECALLING 1,921 AFTERMARKET HEADLAMPS OF VARIOUS MODELS SOLD FOR USE ON THE ABOVE LISTED VEHICLES.  THESE HEADLAMPS ARE MISSING THE AMBER SIDE REFLEX REFLECTOR WHICH FAILS TO CONFORM WITH THE REQUIREMENTS OF FEDERAL MOTOR VEHICLE SAFETY STANDARD NO. 108, ""LAMPS, REFLECTIVE DEVICES, AND ASSOCIATED EQUIPMENT.""","WITHOUT THE AMBER SIDE REFLEX REFLECTORS, THE LIGHTING VISIBILITY MAY BE AFFECTED, POSSIBLY RESULTING IN A VEHICLE CRASH.","K2 MOTOR WILL NOTIFY OWNERS AND OFFER A FULL REFUND.  THE RECALL BEGAN ON DECEMEBER 17, 2008.  OWNERS MAY CONTACT K2 MOTOR AT 1-909-839-2992.","THIS RECALL ONLY PERTAINS TO AFTERMARKET REPLACEMENT EQUIPMENT AND HAS NO RELATION TO ANY ORIGINAL EQUIPMENT INSTALLED ON VEHICLES MANUFACTURED BY HONDA, FORD, OR CHRYSLER LLC.   CUSTOMERS MAY CONTACT THE NATIONAL HIGHWAY TRAFFIC SAFETY ADMINISTRATION'S VEHICLE SAFETY HOTLINE AT 1-888-327-4236 (TTY: 1-800-424-9153); OR GO TO HTTP://WWW.SAFERCAR.GOV.","1983","CHEVROLET","S10"
"CK MOTORSPORT, INC.","06E049000",0,0,0,,"24/05/2006","EXTERIOR LIGHTING","CERTAIN CK MOTORSPORTS COMBINATION HEADLIGHTS, CLEAR CORNER, BUMPER, AND SIDE MARKER LIGHTS SOLD AS REPLACEMENT LAMPS FOR USE ON THE PASSENGER VEHICLES LISTED ABOVE.  SOME COMBINATION LAMPS THAT ARE NOT EQUIPPED WITH AMBER SIDE REFLECTORS FAIL TO CONFORM TO FEDERAL MOTOR VEHICLE SAFETY STANDARD NO. 108, LAMPS, REFLECTIVE DEVICES, AND ASSOCIATED EQUIPMENT.","WITHOUT THE AMBER REFLECTORS, THE VEHICLE WILL BE POORLY ILLUMINATED, POSSIBLY RESULTING IN A VEHICLE CRASH WITHOUT WARNING.","CK MOTORSPORT WILL NOTIFY OWNERS AND REPLACE THE NONCOMPLIANT LAMPS FREE OF CHARGE.  THE RECALL BEGAN ON JULY 1, 2006.  OWNERS MAY CONTACT CK MOTORSPORT AT 1-909-610-7211.","THIS RECALL ONLY PERTAINS TO AFTERMARKET REPLACEMENT EQUIPMENT AND HAS NO RELATION TO ANY ORIGINAL EQUIPMENT INSTALLED ON VEHICLES MANUFACTURED BY THE VEHICLE MANUFACTURERS.  FOR MORE INFORMATION ON THE LAMP MODEL NUMBERS, CLICK ON DOCUMENT SEARCH AND VIEW DOCUMENT TITLED ""LAMP MODEL NUMBERS.""  CUSTOMERS MAY CONTACT THE NATIONAL HIGHWAY TRAFFIC SAFETY ADMINISTRATION'S VEHICLE SAFETY HOTLINE AT 1-888-327-4236 (TTY: 1-800-424-9153); OR GO TO HTTP://WWW.SAFERCAR.GOV.","1983","CHEVROLET","S10"
"PRO-A MOTORS, INC.","06E026000",0,0,0,,"23/03/2006","EXTERIOR LIGHTING","CERTAIN PRO-A MOTORS CORNER LAMPS, TURN SIGNALS, AND HEADLIGHTS SOLD AS REPLACEMENT LAMPS FOR USE ON CERTAIN PASSENGER VEHICLES LISTED ABOVE.  SOME COMBINATION LAMPS THAT ARE NOT EQUIPPED WITH AMBER SIDE REFLECTORS FAIL TO CONFORM TO FEDERAL MOTOR VEHICLE SAFETY STANDARD NO. 108, LAMPS, REFLECTIVE DEVICES, AND ASSOCIATED EQUIPMENT.","WITHOUT THE AMBER REFLECTORS, THE VEHICLE WILL BE POORLY ILLUMINATED, POSSIBLY RESULTING IN A VEHICLE CRASH WITHOUT WARNING.","PRO-A MOTORS WILL NOTIFY OWNERS AND OFFER TO REPURCHASE THE LAMPS.  THE RECALL BEGAN ON APRIL 3, 2006.  OWNERS MAY CONTACT PRO-A MOTORS AT 323-838-2988.","THIS RECALL ONLY PERTAINS TO PRO-A MOTORS AFTERMARKET LAMPS AND HAS NO RELATION TO ANY ORIGINAL EQUIPMENT INSTALLED ON THE LISTED PASSENGER VEHICLES.  FOR MORE INFORMATION ON THE LAMP MODEL NUMBERS, CLICK ON DOCUMENT SEARCH AND VIEW DOCUMENT TITLED ""LAMP MODEL NUMBERS.""  CUSTOMERS MAY CONTACT THE NATIONAL HIGHWAY TRAFFIC SAFETY ADMINISTRATION'S VEHICLE SAFETY HOTLINE AT 1-888-327-4236 (TTY: 1-800-424-9153); OR GO TO HTTP://WWW.SAFERCAR.GOV.","1983","CHEVROLET","S10"
"GENERAL MOTORS CORP.","84V073000",0,0,0,,"18/06/1984","POWER TRAIN:MANUAL TRANSMISSION:LUBRICANT","REAR WHEELS MAY LOCK SUDDENLY DUE TO INSUFFICIENT LUBRICATION BETWEEN MAINSHAFT AND FIRST GEAR.",,"DEALER WILL REPLACE TRANSMISSION FLUID WITH A BLENDED FLUID AND IN ADDITION, WILL UPDATE THE MAINTENANCE SCHEDULE.","VEHICLE DESCRIPTION: LIGHT TRUCKS EQUIPPED WITH 5-SPEED MANUAL TRANSMISSIONS.SYSTEM: TRANSMISSION; LUBRICATION.CONSEQUENCES OF DEFECT: WHEN VEHICLE IS IN FIFTH GEAR, THE TRANSMISSION COULDLOCK THE REAR WHEELS, POSSIBLY RESULTING IN SUDDEN LOSS OF CONTROL AND ANACCIDENT.","1983","CHEVROLET","S10"
"CHRYSLER CORPORATION","89V052000",0,0,0,"PE89093","29/03/1989","SUSPENSION:FRONT:CONTROL ARM:LOWER ARM","FRONT SUSPENSION CROSSMEMBER MAY CORRODE AND FAIL AT LOWER CONTROL ARM REAR PIVOT MOUNTS IF OPERATED WHERE SALT IS USED TO AID IN SNOW REMOVAL.","CONTROL ARM COULD DETACH FROM THE CROSSMEMBER, ADVERSELYAFFECTING DIRECTIONAL STABILITY, WHICH COULD RESULT IN AN ACCIDENT.","INSTALL ATTACHMENT REINFORCEMENT BRACKETS TO PREVENT CONTROL ARM DETACHMENT AS A RESULT OF CORROSION WEAKENING.","SYSTEM: FRONT SUSPENSION CROSSMEMBER.VEHICLE DESCRIPTION: PASSENGER CARS.","1983","CHRYSLER","E CLASS"
"CHRYSLER CORPORATION","82V123000",0,0,0,,"09/12/1982","SERVICE BRAKES, HYDRAULIC:FOUNDATION COMPONENTS:HOSES, LINES/PIPING, AND FITTINGS","HYDRAULIC BRAKE TUBING ROUTED TO THE LEFT REAR WHEEL BRAKE SYSTEM MAY HAVE BEEN BENT OUT OF SHAPE DURING ASSEMBLY AND COULD CHAFE AGAINST THE EXHAUST SYSTEM HANGER BOLT.",,"DEALER WILL INSPECT AND RELOCATE TUBE, IF NECESSARY. A RETAINING CLIP WILL BE INSTALLED TO ENSURE ADEQUATE CLEARANCE FOR THE TUBING; ANY DAMAGED TUBES WILL ALSO BE REPLACED.","VEHICLE DESCRIPTION: PASSENGER VEHICLES.SYSTEM: SERVICE BRAKES; HYDRAULIC BRAKE TUBING.CONSEQUENCES OF DEFECT: CONTINUED CHAFING WILL EVENTUALLY WEAR A HOLE IN THETUBING AND RESULT IN LOSS OF BRAKE FLUID AND PARTIAL LOSS OF BRAKINGCAPABILITY, WHICH COULD CAUSE AN ACCIDENT.NOTE: THE BRAKE WARNING LIGHT SHOULD ALERT OPERATOR TO THE PARTIAL SYSTEM LOSS.","1983","CHRYSLER","E CLASS"
"CHRYSLER CORPORATION","82V092000",0,0,0,,"24/09/1982","EQUIPMENT:ELECTRICAL","THE TRAVEL COMPUTER SYSTEM WIRING, ON THE INVOLVED VEHICLES, MAY BE IMPROPERLY CONNECTED. THIS CONDITION CAN CAUSE DAMAGE TO INTERNAL COMPONENTS.",,"THE WIRING WILL BE RECONNECTED TO ENSURE PROPER FUNCTIONING OF IGNITION SYSTEM..","VEHICLE DESCRIPTION: PASSENGER VEHICLES EQUIPPED WITH OPTIONAL TRAVEL COMPUTERSYSTEMS.SYSTEM: ELECTRICAL; TRAVEL COMPUTER SYSTEM, WIRING.CONSEQUENCES OF DEFECT: DAMAGE TO INTERNAL COMPONENTS OF THE SYSTEMS INTERFACEMODULE COULD AFFECT THE ENGINE IGNITION SYSTEM CAUSING LOSS OF IGNITION ALONGWITH THE INABILITY TO RESTART THE ENGINE. THIS PRESENTS A TRAFFIC HAZARD FROMWHICH AN ACCIDENT COULD RESULT.","1983","CHRYSLER","E CLASS"
"CHRYSLER CORPORATION","82V091000",0,0,0,,"22/09/1982","FUEL SYSTEM, GASOLINE:STORAGE:TANK ASSEMBLY:FILLER PIPE AND CAP","THE INVOLVED VEHICLES MAY BE EQUIPPED WITH AN ELECTRICAL FUEL FILLER DOOR RELEASE WHICH IS ACTIVATED THROUGH A COILED CURRENT CARRYING WIRE (A SOLENOID). A SHORT IN THE SOLENOID COULD CAUSE SPARKING AT THE ATTACHING SCREWS OF THE SOLENOID.",,"A SOLENOID GROUND WIRE WILL BE INSTALLED, BY THE DEALER, TO PREVENT SPARKING OF SOLENOID.","VEHICLE DESCRIPTION: PASSENGER VEHICLES.SYSTEM: FUEL; FUEL FILLER PIPE CAP.CONSEQUENCES OF DEFECT: ELECTRICAL SPARKING AT THE SOLENOID ATTACHING SCREWSCOULD IGNITE ANY FUEL VAPORS THAT MAY BE PRESENT AT THE FUEL FILLER PIPE CAP.PERSONAL INJURY AND FIRE DAMAGE COULD RESULT.","1983","CHRYSLER","E CLASS"
"CHRYSLER CORPORATION","89V052000",0,0,0,"PE89093","29/03/1989","SUSPENSION:FRONT:CONTROL ARM:LOWER ARM","FRONT SUSPENSION CROSSMEMBER MAY CORRODE AND FAIL AT LOWER CONTROL ARM REAR PIVOT MOUNTS IF OPERATED WHERE SALT IS USED TO AID IN SNOW REMOVAL.","CONTROL ARM COULD DETACH FROM THE CROSSMEMBER, ADVERSELYAFFECTING DIRECTIONAL STABILITY, WHICH COULD RESULT IN AN ACCIDENT.","INSTALL ATTACHMENT REINFORCEMENT BRACKETS TO PREVENT CONTROL ARM DETACHMENT AS A RESULT OF CORROSION WEAKENING.","SYSTEM: FRONT SUSPENSION CROSSMEMBER.VEHICLE DESCRIPTION: PASSENGER CARS.","1983","CHRYSLER","LEBARON"
"CHRYSLER CORPORATION","82V123000",0,0,0,,"09/12/1982","SERVICE BRAKES, HYDRAULIC:FOUNDATION COMPONENTS:HOSES, LINES/PIPING, AND FITTINGS","HYDRAULIC BRAKE TUBING ROUTED TO THE LEFT REAR WHEEL BRAKE SYSTEM MAY HAVE BEEN BENT OUT OF SHAPE DURING ASSEMBLY AND COULD CHAFE AGAINST THE EXHAUST SYSTEM HANGER BOLT.",,"DEALER WILL INSPECT AND RELOCATE TUBE, IF NECESSARY. A RETAINING CLIP WILL BE INSTALLED TO ENSURE ADEQUATE CLEARANCE FOR THE TUBING; ANY DAMAGED TUBES WILL ALSO BE REPLACED.","VEHICLE DESCRIPTION: PASSENGER VEHICLES.SYSTEM: SERVICE BRAKES; HYDRAULIC BRAKE TUBING.CONSEQUENCES OF DEFECT: CONTINUED CHAFING WILL EVENTUALLY WEAR A HOLE IN THETUBING AND RESULT IN LOSS OF BRAKE FLUID AND PARTIAL LOSS OF BRAKINGCAPABILITY, WHICH COULD CAUSE AN ACCIDENT.NOTE: THE BRAKE WARNING LIGHT SHOULD ALERT OPERATOR TO THE PARTIAL SYSTEM LOSS.","1983","CHRYSLER","LEBARON"
"CHRYSLER CORPORATION","82V092000",0,0,0,,"24/09/1982","EQUIPMENT:ELECTRICAL","THE TRAVEL COMPUTER SYSTEM WIRING, ON THE INVOLVED VEHICLES, MAY BE IMPROPERLY CONNECTED. THIS CONDITION CAN CAUSE DAMAGE TO INTERNAL COMPONENTS.",,"THE WIRING WILL BE RECONNECTED TO ENSURE PROPER FUNCTIONING OF IGNITION SYSTEM..","VEHICLE DESCRIPTION: PASSENGER VEHICLES EQUIPPED WITH OPTIONAL TRAVEL COMPUTERSYSTEMS.SYSTEM: ELECTRICAL; TRAVEL COMPUTER SYSTEM, WIRING.CONSEQUENCES OF DEFECT: DAMAGE TO INTERNAL COMPONENTS OF THE SYSTEMS INTERFACEMODULE COULD AFFECT THE ENGINE IGNITION SYSTEM CAUSING LOSS OF IGNITION ALONGWITH THE INABILITY TO RESTART THE ENGINE. THIS PRESENTS A TRAFFIC HAZARD FROMWHICH AN ACCIDENT COULD RESULT.","1983","CHRYSLER","LEBARON"
"CHRYSLER CORPORATION","82V085000",0,0,0,,"09/09/1982","SERVICE BRAKES, HYDRAULIC:FOUNDATION COMPONENTS:HOSES, LINES/PIPING, AND FITTINGS","ON THE INVOLVED VEHICLES, IMPROPER ROUTING OF THE HYDRAULIC BRAKE TUBE COULD CAUSE IT TO CHAFE AGAINST THE PARK BRAKE CABLES. EVENTUALLY, THE BRAKE TUBE MAY FAIL AND BRAKE FLUID LEAKAGE MAY OCCUR.",,"DEALER WILL REROUTE THE HYDRAULIC BRAKE TUBE, IF NECESSARY, WITHOUT CHARGE TO OWNER.","VEHICLE DESCRIPTION; PASSENGER VEHICLES.SYSTEM: PARKING BRAKES; HYDRAULIC BRAKE TUBE, ROUTING.CONSEQUENCES OF DEFECT: PARTIAL LOSS OF BRAKING CAPABILITY, LOSS OF VEHICLECONTROL, AND AN ACCIDENT COULD OCCUR.NOTE: THE INSTRUMENT PANEL BRAKE WARNING LIGHT SHOULD ALERT DRIVER TO THEPROBLEM.","1983","CHRYSLER","LEBARON"
"CHRYSLER CORPORATION","89V052000",0,0,0,"PE89093","29/03/1989","SUSPENSION:FRONT:CONTROL ARM:LOWER ARM","FRONT SUSPENSION CROSSMEMBER MAY CORRODE AND FAIL AT LOWER CONTROL ARM REAR PIVOT MOUNTS IF OPERATED WHERE SALT IS USED TO AID IN SNOW REMOVAL.","CONTROL ARM COULD DETACH FROM THE CROSSMEMBER, ADVERSELYAFFECTING DIRECTIONAL STABILITY, WHICH COULD RESULT IN AN ACCIDENT.","INSTALL ATTACHMENT REINFORCEMENT BRACKETS TO PREVENT CONTROL ARM DETACHMENT AS A RESULT OF CORROSION WEAKENING.","SYSTEM: FRONT SUSPENSION CROSSMEMBER.VEHICLE DESCRIPTION: PASSENGER CARS.","1983","CHRYSLER","NEW YORKER"
"CHRYSLER CORPORATION","83V060000",0,0,0,,"06/06/1983","SERVICE BRAKES, HYDRAULIC:FOUNDATION COMPONENTS:HOSES, LINES/PIPING, AND FITTINGS","LOCATION OF HYDRAULIC BRAKE TUBE TO BOTH REAR WHEELS CAUSES INTERFERENCE AND CHAFING BETWEEN THE TUBES AND REAR SUSPENSION TRAILING ARM PIVOT BRACKETS.",,"DEALER WILL INSPECT REAR WHEEL BRAKE TUBES AND REROUTE TO ENSURE PROPER TUBE TO PIVOT BRACKET CLEARANCE. ANY DAMAGED TUBES WILL ALSO BE REPLACED.","VEHICLE DESCRIPTION: PASSENGER VEHICLES.SYSTEM: SERVICE BRAKES; REAR HYDRAULIC BRAKE TUBES.CONSEQUENCES OF DEFECT: TUBE FAILURE AND A PARTIAL LOSS OF BRAKING CAPABILITYCOULD RESULT. THIS COULD CAUSE AN ACCIDENT AND PERSONAL INJURY.NOTE: ILLUMINATION OF AN INSTRUMENT PANEL WARNING LIGHT SHOULD ALERT DRIVER TOA BRAKE TUBE FAILURE.","1983","CHRYSLER","NEW YORKER"
"CHRYSLER CORPORATION","89V052000",0,0,0,"PE89093","29/03/1989","SUSPENSION:FRONT:CONTROL ARM:LOWER ARM","FRONT SUSPENSION CROSSMEMBER MAY CORRODE AND FAIL AT LOWER CONTROL ARM REAR PIVOT MOUNTS IF OPERATED WHERE SALT IS USED TO AID IN SNOW REMOVAL.","CONTROL ARM COULD DETACH FROM THE CROSSMEMBER, ADVERSELYAFFECTING DIRECTIONAL STABILITY, WHICH COULD RESULT IN AN ACCIDENT.","INSTALL ATTACHMENT REINFORCEMENT BRACKETS TO PREVENT CONTROL ARM DETACHMENT AS A RESULT OF CORROSION WEAKENING.","SYSTEM: FRONT SUSPENSION CROSSMEMBER.VEHICLE DESCRIPTION: PASSENGER CARS.","1983","DODGE","ARIES"
"CHRYSLER CORPORATION","83V060000",0,0,0,,"06/06/1983","SERVICE BRAKES, HYDRAULIC:FOUNDATION COMPONENTS:HOSES, LINES/PIPING, AND FITTINGS","LOCATION OF HYDRAULIC BRAKE TUBE TO BOTH REAR WHEELS CAUSES INTERFERENCE AND CHAFING BETWEEN THE TUBES AND REAR SUSPENSION TRAILING ARM PIVOT BRACKETS.",,"DEALER WILL INSPECT REAR WHEEL BRAKE TUBES AND REROUTE TO ENSURE PROPER TUBE TO PIVOT BRACKET CLEARANCE. ANY DAMAGED TUBES WILL ALSO BE REPLACED.","VEHICLE DESCRIPTION: PASSENGER VEHICLES.SYSTEM: SERVICE BRAKES; REAR HYDRAULIC BRAKE TUBES.CONSEQUENCES OF DEFECT: TUBE FAILURE AND A PARTIAL LOSS OF BRAKING CAPABILITYCOULD RESULT. THIS COULD CAUSE AN ACCIDENT AND PERSONAL INJURY.NOTE: ILLUMINATION OF AN INSTRUMENT PANEL WARNING LIGHT SHOULD ALERT DRIVER TOA BRAKE TUBE FAILURE.","1983","DODGE","ARIES"
"CHRYSLER CORPORATION","82V123000",0,0,0,,"09/12/1982","SERVICE BRAKES, HYDRAULIC:FOUNDATION COMPONENTS:HOSES, LINES/PIPING, AND FITTINGS","HYDRAULIC BRAKE TUBING ROUTED TO THE LEFT REAR WHEEL BRAKE SYSTEM MAY HAVE BEEN BENT OUT OF SHAPE DURING ASSEMBLY AND COULD CHAFE AGAINST THE EXHAUST SYSTEM HANGER BOLT.",,"DEALER WILL INSPECT AND RELOCATE TUBE, IF NECESSARY. A RETAINING CLIP WILL BE INSTALLED TO ENSURE ADEQUATE CLEARANCE FOR THE TUBING; ANY DAMAGED TUBES WILL ALSO BE REPLACED.","VEHICLE DESCRIPTION: PASSENGER VEHICLES.SYSTEM: SERVICE BRAKES; HYDRAULIC BRAKE TUBING.CONSEQUENCES OF DEFECT: CONTINUED CHAFING WILL EVENTUALLY WEAR A HOLE IN THETUBING AND RESULT IN LOSS OF BRAKE FLUID AND PARTIAL LOSS OF BRAKINGCAPABILITY, WHICH COULD CAUSE AN ACCIDENT.NOTE: THE BRAKE WARNING LIGHT SHOULD ALERT OPERATOR TO THE PARTIAL SYSTEM LOSS.","1983","DODGE","ARIES"
"CHRYSLER CORPORATION","82V085000",0,0,0,,"09/09/1982","SERVICE BRAKES, HYDRAULIC:FOUNDATION COMPONENTS:HOSES, LINES/PIPING, AND FITTINGS","ON THE INVOLVED VEHICLES, IMPROPER ROUTING OF THE HYDRAULIC BRAKE TUBE COULD CAUSE IT TO CHAFE AGAINST THE PARK BRAKE CABLES. EVENTUALLY, THE BRAKE TUBE MAY FAIL AND BRAKE FLUID LEAKAGE MAY OCCUR.",,"DEALER WILL REROUTE THE HYDRAULIC BRAKE TUBE, IF NECESSARY, WITHOUT CHARGE TO OWNER.","VEHICLE DESCRIPTION; PASSENGER VEHICLES.SYSTEM: PARKING BRAKES; HYDRAULIC BRAKE TUBE, ROUTING.CONSEQUENCES OF DEFECT: PARTIAL LOSS OF BRAKING CAPABILITY, LOSS OF VEHICLECONTROL, AND AN ACCIDENT COULD OCCUR.NOTE: THE INSTRUMENT PANEL BRAKE WARNING LIGHT SHOULD ALERT DRIVER TO THEPROBLEM.","1983","DODGE","ARIES"
"ELDORADO MOTOR CORP.","85V055000",0,0,0,,"01/05/1985","PARKING BRAKE:CONVENTIONAL:MECHANICAL:LINKAGE AND CABLE","THE EMERGENCY BRAKE CABLE MAY BECOME FRAYED OR BOUND UP   ON THE HEAT SHIELD OF THE PROPANE TANK MOUNTING BRACKETS.                                                                                                         CONSEQUENCE OF DEFECT: EMERGENCY BRAKES COULD BECOME INOPERATIVE.",,"REROUTE EMERGENCY BRAKE CABLE TO PREVENT CONTACT WITH HEAT    SHIELD OF THE PROPANE TANK MOUNTING BRACKET.","VEHICLE DESCRIPTION: MOTORHOMES.SYSTEM: EMERGENCY BRAKE CABLE.","1983","ELDORADO","MONARCH"
"FLEETWOOD ENT., INC.","85V106000",0,0,0,,"27/08/1985","FUEL SYSTEM, GASOLINE:STORAGE:TANK ASSEMBLY:FILLER PIPE AND CAP","MAIN FUEL TANK FILLER CAP MAY DISENGAGE SUDDENLY WHEN     REMOVING THE CAP FOR REFUELING. THE SUDDEN CAP DISENGAGEMENT PERMITS EXPULSION   OF VAPOR AND UNDER SOME CIRCUMSTANCES, SPRAYS GASOLINE AROUND THE SURROUNDING    AREA OR PERSONS.                                                                                                                                                  CONSEQUENCE OF DEFECT: THE GASOLINE SPILLAGE MAY CAUSE A FIRE AND/OR AN          EXPLOSION IF AN IGNITION SOURCE IS PRESENT.",,"REQUIRES THE REPLACEMENT OF THE SINGLE STAGE BAYONET CAP      WITH A TWO STAGE CAP WHICH REQUIRES AN ADDITIONAL ROTATION PRIOR TO REMOVAL.     ALSO A WARNING LABEL STICKER WILL BE ISSUED TO BE INSTALLED JUST ABOVE THE       GASOLINE FILL OPENING.","VEHICLE DESCRIPTION: MOTORHOMES.   SYSTEM: FUEL TANK CAP.","1983","FLEETWOOD","SOUTHWIND"
"FLEETWOOD ENT., INC.","83V059000",0,0,0,,"02/06/1983","WHEELS:HUB","THE DECORATIVE WHEEL COVERS MAY CONTACT THE TIRE SIDEWALLS RESULTING IN DAMAGE TO THE TIRES.",,"INSPECTION AND REPLACEMENT OF TIRES, IF NECESSARY, AND REPLACEMENT OF WHEEL COVERS.","VEHICLE DESCRIPTION: MOTORHOMES.SYSTEM: SUSPENSION; WHEEL COVER.CONSEQUENCES OF DEFECT: DAMAGE COULD RESULT IN COMPLETE FAILURE OF TIRESIDEWALL, SUDDEN LOSS OF AIR PRESSURE, POSSIBLE LOSS OF VEHICLE CONTROL, AND ANACCIDENT.NOTE: OWNER IS INSTRUCTED TO REMOVE WHEEL COVERS AND RETAINING CLIPS UNTILDEALER CAN INSPECT THE VEHICLE.","1983","FLEETWOOD","SOUTHWIND"
"FEDERAL-MOGUL CORPORATION","07E064000",0,0,0,,"27/08/2007","FUEL SYSTEM, GASOLINE:DELIVERY:FUEL PUMP","CERTAIN FEDERAL-MOGUL AFTERMARKET FUEL PUMPS SOLD UNDER THE BRAND NAMES OF CARTER, ACCUFLOW, NAPA, TRUFLOW, PARTS DEPO, AND PARTS MASTER, SHIPPED BETWEEN AUGUST 2006 AND JULY 2007 FOR USE ON THE VEHICLES LISTED ABOVE.  THE FUEL PUMP DIAPHRAGM IN CERTAIN PRODUCTION RUNS MAY HAVE BEEN IMPROPERLY INSTALLED OR INADEQUATELY TESTED WHICH MAY CAUSE THE FUEL PUMP TO LEAK.","A LEAKING FUEL PUMP COULD CREATE A VEHICLE FIRE HAZARD.","FEDERAL-MOGUL WILL NOTIFY OWNERS AND REPLACE THE DEFECTIVE FUEL PUMPS FREE OF CHARGE.  THE RECALL BEGAN ON OCTOBER 15, 2007.  OWNERS CAN CONTACT FEDERAL-MOGUL AT 248-354-7700.","THIS RECALL ONLY PERTAINS TO AFTERMARKET CARTER, NAPA, ACCUFLOW, TRU FLOW, PARTS MASTER, AND PARTS DEPOT BRAND FUEL PUMPS AND HAS NO RELATION TO ANY ORIGINAL EQUIPMENT INSTALLED ON THE LISTED MOTOR VEHICLES.  CUSTOMERS MAY CONTACT THE NATIONAL HIGHWAY TRAFFIC SAFETY ADMINISTRATION'S VEHICLE SAFETY HOTLINE AT 1-888-327-4236 (TTY: 1-800-424-9153); OR GO TO HTTP://WWW.SAFERCAR.GOV.","1983","FORD","BRONCO"
"FORD MOTOR COMPANY","83V020000",0,0,0,,"24/02/1983","SEATS","THE MANUFACTURER SUSPECTS THAT THE HARDWARE THAT ATTACHES THE SEAT TRACKS (THE STRIPS THAT THE SEAT SLIDES ON) TO THE FLOOR MAY BECOME LOOSE OR MAY FAIL TO HOLD THE SEAT IN PLACE DURING A COLLISION. THIS CONDITION IS DUE TO THE SUBSTITUTION OF AN INCORRECT WASHER DURING MANUFACTURE. THE VEHICLES MAY NOT COMPLY WITH THE STRENGTH REQUIREMENTS OF FEDERAL MOTOR VEHICLE SAFETY STANDARD 207, ""SEATING SYSTEMS"".",,"THE DEALER WILL INSPECT AND INSTALL ADDITIONAL LARGER DIAMETER WASHERS ON THE BOLT ASSEMBLY.","VEHICLE DESCRIPTION: LIGHT TRUCKS EQUIPPED WITH BENCH SEATS.SYSTEM: INTERIOR SYSTEMS; SEAT TRACK ATTACHMENT BOLTS.CONSEQUENCES OF DEFECT: THIS DEFECT COULD CAUSE THE SEAT ASSEMBLY TO BECOMEDETACHED DURING AN ACCIDENT, INCREASING THE CHANCES OF PASSENGER INJURY.NOTE: A RATTLING NOISE MAY INDICATE A LOOSENING OF THE SEAT BELT TRACK BOLT.","1983","FORD","BRONCO"
"FORD MOTOR COMPANY","83V028000",0,0,0,,"07/03/1983","POWER TRAIN:AUTOMATIC TRANSMISSION","THE PARKING GEAR MAY NOT ENGAGE, EVEN THOUGH THE GEAR SHIFT LEVER IS PLACED IN THE ""PARK"" POSITION. THIS OCCURS IF THE LINKAGE INSIDE THE TRANSMISSION THAT ACTUATES THE PARK GEAR WAS IMPROPERLY MANUFACTURED. A PIN THAT RETAINS COMPONENTS ON A LINKAGE (ACTUATING) ROD COULD BREAK AND THE LINKAGE MAY NOT ENGAGE THE PARKING GEAR.",,"DEALER WILL INSPECT AND, IF NECESSARY, REPLACE THE PARKING PAWL ACTUATING ROD ASSEMBLY.","VEHICLE DESCRIPTION: PASSENGER VEHICLES EQUIPPED WITH AUTOMATIC OVERDRIVETRANSMISSIONS.SYSTEM: POWER TRAIN; TRANSMISSION, PARKING PAWL ACTUATING ASSEMBLY.CONSEQUENCES OF DEFECT: IF THE PARKING BRAKE IS NOT APPLIED AND THE PARKINGGEAR DOES NOT ENGAGE, UNEXPECTED VEHICLE MOVEMENT COULD CAUSE AN ACCIDENT ANDPERSONAL INJURY.NOTE: DRIVERS SHOULD ALWAYS APPLY THE PARKING BRAKE WHENEVER LEAVING THEVEHICLE.","1983","FORD","CROWN VICTORIA"
"FORD MOTOR COMPANY","83V017000",0,0,0,,"24/02/1983","POWER TRAIN:AUTOMATIC TRANSMISSION:LEVER AND LINKAGE:COLUMN SHIFT","THE SHIFT INDICATOR MAY NOT ACCURATELY REFLECT THE SHIFT SELECTOR POSITION. SOME VEHICLES WERE PRODUCED WITH TRANSMISSION CONTROL SELECTOR TUBE RETAINING CLIPS THAT MAY NOT BE HARD ENOUGH. THE CLIP MAY LOOSEN OR FALL OFF, AND THE SELECTOR TUBE MAY BECOME DISPLACED.",,"THE DEALER WILL REPLACE THE TRANSMISSION CONTROL SELECTOR TUBE RETAINING CLIP AT NO CHARGE TO OWNER.","VEHICLE DESCRIPTION: PASSENGER VEHICLES EQUIPPED WITH COLUMN SHIFT ANDAUTOMATIC TRANSMISSION.SYSTEM: POWER TRAIN; TRANSMISSION CONTROL SELECTOR TUBE RETAINING CLIPS.CONSEQUENCES OF DEFECT: THE SELECTOR TUBE, WHICH IS ROUTED INSIDE THE STEERINGCOLUMN, CONTROLS THE POSITION OF THE TRANSMISSION GEAR INDICATOR IN THE DASH.IF THE CLIP LOOSENS AND THE TUBE IS NOT POSITIONED CORRECTLY, THE INDICATOR MAYNOT BE ACCURATE. FOR EXAMPLE, THE INDICATOR MAY SHOW THAT THE TRANSMISSION ISIN ""PARK"", WHEN IT IS ACTUALLY IN ""REVERSE"", OR IT MAY INDICATE ""NEUTRAL"" WHENTHE TRANSMISSION IS IN GEAR. IF THIS SHOULD OCCUR, AND THE PARKING BRAKE IS NOTSET, THE VEHICLE MAY MOVE UNEXPECTEDLY AND CAUSE AN ACCIDENT OR PERSONALINJURY.","1983","FORD","CROWN VICTORIA"
"MARK III INDUSTRIES, INC.","90V137000",0,0,0,,"18/07/1990","SEAT BELTS:FRONT:ANCHORAGE",,"OCCUPANTS WOULD NOT BE ADEQUATELY PROTECTED IN EVENT OFAN ACCIDENT OR SUDDEN STOP.","INSTALL PROPER MOUNTING HARDWARE AND SEAT BELTS.","NOTE: THIS RECALL WAS INITIALIZED BY MARK III INDUSTRIES.SYSTEM: SEAT BELTS, SEAT BELT ANCHORS, AND SEAT MOUNTING. DOM: SEPT. 1978 TOSEPT. 1984.DESCRIPTION ON DEFECT: IMPROPER MOUNTING HARDWARE AND IMPROPER SAFETY RESTRAINTSYSTEMS MAY HAVE BEEN INSTALLED IN THESE VEHICLES.","1983","FORD","E150"
"WHEELED COACH INDUSTRIES","89V140000",0,0,0,"PE89038","15/08/1989","VISIBILITY:DEFROSTER/DEFOGGER/HVAC SYSTEM:HEATER CORE","HEATER HOSE MAY BE INCORRECTLY ROUTED.","HOSE COULD WEAR THROUGH AND LEAK WHICH COULD RESULT INAN UNDERHOOD FIRE.","REROUTE AND REPAIR HOSE AS NECESSARY.","SYSTEM:  HEATER HOSE.VEHICLE DESCRIPTION:  TYPES II AND III GASOLINE AMBULANCES BUILT ON FORD E350CHASSIS.","1983","FORD","E350"
"FORD MOTOR COMPANY","88V133000",0,0,0,,"09/08/1988","ENGINE AND ENGINE COOLING:COOLING SYSTEM:HOSES/LINES/PIPING/FITTINGS","EXTREME OPERATING CONDITIONS COULD CAUSE PREMATURE DETERIORATION OF THE ENGINE COMPARTMENT HEATER HOSES OR ENGINE BYPASS HOSES.","ENGINE COOLANT COULD DISCHARGE ONTO THE ENGINE AND ITSEXHAUST MANIFOLD CREATING THE POTENTIAL FOR A FIRE DUE TO THE HIGH ENGINEEXHAUST MANIFOLD TEMPERATURES.","REPLACE HOSES AND RADIATOR CAPS; INSTALL HIGH HEAT RESISTANCE ALUMINIZED STAINLESS STEEL MUFFLERS.","SYSTEM: ENGINE HOSES.VEHICLE DESCRIPTION: AMBULANCE VEHICLES MANUFACTURED FROM FORD CUTAWAY CHASSISAND VANS.","1983","FORD","E350"
"FORD MOTOR COMPANY","85V061000",0,0,0,,"14/05/1985","FUEL SYSTEM, DIESEL","WHEN FRONTALLY IMPACTED INTO A FIXED BARRIER AT 30 MPH,   AS SPECIFIED IN FEDERAL MOTOR VEHICLE SAFETY STANDARD (FMVSS) NO. 301, THE LEFT  FRAME RAILS OF SUCH VEHICLES MAY DISPLACE INBOARD, PINCHING THE FUEL/WATER       SEPARATOR CANISTER BETWEEN THE FRAME RAIL AND ENGINE SUFFICIENTLY TO DISPLACE    THE FUEL/WATER SEPARATOR DRAIN ROD, ALLOWING THE CONTENTS OF THE CANISTER TO     DRAIN.                                                                                                                                                            CONSEQUENCE OF DEFECT: FUEL LEAK DURING OR AFTER A CRASH INCREASES THE           POSSIBILITY OF A FIRE.",,"INSTALL A CANISTER SHIELD, A REVISED DESIGN DRAIN ROD         SHIELD, AND MODIFY FUEL/WATER SEPARATOR MOUNTING BRACKET.","VEHICLE DESCRIPTION: VANS, SUPER VANS, SUPER WAGONS AND CLUB WAGONS EQUIPPED    WITH 6.9 LITER DIESEL ENGINES. SYSTEM: FUEL/FMVSS 301.","1983","FORD","E350"
