id,Manufacturer,NHTSACampaignNumber,parkIt,parkOutSide,overTheAirUpdate,NHTSAActionNumber,ReportReceivedDate,Component,Summary,Consequence,Remedy,Notes,ModelYear,Make,Model
1927,"FORD MOTOR COMPANY","87V144000",0,0,0,,"09/09/1987","ENGINE AND ENGINE COOLING:EXHAUST SYSTEM:EMISSION CONTROL","VEHICLES ARE SUBJECT TO EXCESSIVE UNDERHOOD TEMPERATURES AND FUEL SYSTEM PRESSURES IN SEVERE DUTY APPLICATIONS.","THIS CREATES POTENTIAL FOR FUEL EXPULSION FROM THE FUELFILLER PIPE WHICH IN THE PRESENCE OF AN IGNITION SOURCE, COULD RESULT IN AFIRE.","INSTALL MODIFICATION KITS TO MINIMIZE POSSIBILITY OF FUEL EXPULSION AND TO SHIELD UNDERBODY COMPONENTS FROM EXHAUST SYSTEM HEAT.","SYSTEM: FUELVEHICLE DESCRIPTION: 1983 THROUGH 1987 E250, E350, CLUB WAGONS AND ECONOLINEVANS AND CHASSIS EQUIPPED WITH 7.5 AND 1985 THROUGH 1987 E250, E350, CLUB WAGONSAND ECONOLINE VANS EQUIPPED WITH 5.8 LITER ENGINES.","1985","FORD","E350"
1928,"SENTINEL VEHICLES LIMITED","89V062000",0,0,0,"PE89040","17/04/1989","ELECTRICAL SYSTEM:WIRING","NYLON TIES THAT SUPPORT THE MAIN WIRING HARNESS TO THE CHASSIS COULD WEAR AND BREAK DUE TO EXCESSIVE VIBRATION. THUS, WIRING HARNESS COULD FALL ON ENGINE COMPONENTS AND SHORT CIRCUIT.","THIS COULD CAUSE LOSS OF ELECTRICAL SYSTEM WHICH COULDRESULT IN AN UNDERHOOD FIRE.","INSTALL RETROFIT RIT OF PLASTIC-COATED METAL CLAMPS, LOOM FOR POSITIVE BATTERY CABLES AND RE-ROUTE WIRING.","SYSTEM: ELECTRICAL WIRING/HARNESS.VEHICLE DESCRIPTION: TYPE II AND III AMBULANCES BUILT ON FORD CHASSIS.","1985","FORD","E350"
1929,"FORD MOTOR COMPANY","87V113000",0,0,0,,"21/07/1987","ENGINE AND ENGINE COOLING:EXHAUST SYSTEM:EMISSION CONTROL","EXPULSION OF FUEL DUE TO OVERPRESSURIZATION.","FUEL OR FUEL VAPORS IN THE PRESENCE OF AN IGNITIONSOURCE CAN CAUSE A FIRE.","MODIFICATION OF THE BASE FUEL VENTING AND EMISSION CONTROL SYSTEM TO REDUCE OPERATING TEMPERATURES AND FUEL SYSTEM PRESSURES.","SYSTEM: FUEL.VEHICLE DESCRIPTION: AMBULANCE, FORD ECONOLINE E350 CUTAWAY CHASSIS AND VANS,EQUIPPED WITH 7.5 LITER ENGINES.","1985","FORD","E350"
1930,"FORD MOTOR COMPANY","86V092000",0,0,0,,"14/07/1986","POWER TRAIN:DRIVELINE:DRIVESHAFT","COMPOSITE GRAPHITE DRIVESHAFTS ARE SUBJECT TO             OVERHEATING WHILE IDLING, WHICH MAY RESULT IN THE DRIVESHAFT TWISTING AND        SHORTENING CAUSING THE SLIP YOKE TO DISCONNECT FROM THE TRANSMISSION.                                                                                             CONSEQUENCE OF DEFECT: IF THE DRIVESHAFT DISCONNECTS FROM THE TRANSMISSION THE   VEHICLE WOULD BECOME IMMOBILE WITHOUT WARNING.",,"INSTALL METAL DRIVESHAFT.","SYSTEM: DRIVESHAFT.                                                                                                                                             VEHICLE DESCRIPTION: RV AND COMMERCIAL CUTAWAY ECONOLINE INCOMPLETE VEHICLES    EQUIPPED WITH 7.5 LITER ENGINES, C6 TRANSMISSIONS, AND DUAL REAR WHEELS.","1985","FORD","E350"
1931,"FEDERAL-MOGUL CORPORATION","07E064000",0,0,0,,"27/08/2007","FUEL SYSTEM, GASOLINE:DELIVERY:FUEL PUMP","CERTAIN FEDERAL-MOGUL AFTERMARKET FUEL PUMPS SOLD UNDER THE BRAND NAMES OF CARTER, ACCUFLOW, NAPA, TRUFLOW, PARTS DEPO, AND PARTS MASTER, SHIPPED BETWEEN AUGUST 2006 AND JULY 2007 FOR USE ON THE VEHICLES LISTED ABOVE.  THE FUEL PUMP DIAPHRAGM IN CERTAIN PRODUCTION RUNS MAY HAVE BEEN IMPROPERLY INSTALLED OR INADEQUATELY TESTED WHICH MAY CAUSE THE FUEL PUMP TO LEAK.","A LEAKING FUEL PUMP COULD CREATE A VEHICLE FIRE HAZARD.","FEDERAL-MOGUL WILL NOTIFY OWNERS AND REPLACE THE DEFECTIVE FUEL PUMPS FREE OF CHARGE.  THE RECALL BEGAN ON OCTOBER 15, 2007.  OWNERS CAN CONTACT FEDERAL-MOGUL AT 248-354-7700.","THIS RECALL ONLY PERTAINS TO AFTERMARKET CARTER, NAPA, ACCUFLOW, TRU FLOW, PARTS MASTER, AND PARTS DEPOT BRAND FUEL PUMPS AND HAS NO RELATION TO ANY ORIGINAL EQUIPMENT INSTALLED ON THE LISTED MOTOR VEHICLES.  CUSTOMERS MAY CONTACT THE NATIONAL HIGHWAY TRAFFIC SAFETY ADMINISTRATION'S VEHICLE SAFETY HOTLINE AT 1-888-327-4236 (TTY: 1-800-424-9153); OR GO TO HTTP://WWW.SAFERCAR.GOV.","1985","FORD","ECONOLINE"
1932,"FORD MOTOR COMPANY","85V061000",0,0,0,,"14/05/1985","FUEL SYSTEM, DIESEL","WHEN FRONTALLY IMPACTED INTO A FIXED BARRIER AT 30 MPH,   AS SPECIFIED IN FEDERAL MOTOR VEHICLE SAFETY STANDARD (FMVSS) NO. 301, THE LEFT  FRAME RAILS OF SUCH VEHICLES MAY DISPLACE INBOARD, PINCHING THE FUEL/WATER       SEPARATOR CANISTER BETWEEN THE FRAME RAIL AND ENGINE SUFFICIENTLY TO DISPLACE    THE FUEL/WATER SEPARATOR DRAIN ROD, ALLOWING THE CONTENTS OF THE CANISTER TO     DRAIN.                                                                                                                                                            CONSEQUENCE OF DEFECT: FUEL LEAK DURING OR AFTER A CRASH INCREASES THE           POSSIBILITY OF A FIRE.",,"INSTALL A CANISTER SHIELD, A REVISED DESIGN DRAIN ROD         SHIELD, AND MODIFY FUEL/WATER SEPARATOR MOUNTING BRACKET.","VEHICLE DESCRIPTION: VANS, SUPER VANS, SUPER WAGONS AND CLUB WAGONS EQUIPPED    WITH 6.9 LITER DIESEL ENGINES. SYSTEM: FUEL/FMVSS 301.","1985","FORD","ECONOLINE"
1933,"FORD MOTOR COMPANY","87V144000",0,0,0,,"09/09/1987","ENGINE AND ENGINE COOLING:EXHAUST SYSTEM:EMISSION CONTROL","VEHICLES ARE SUBJECT TO EXCESSIVE UNDERHOOD TEMPERATURES AND FUEL SYSTEM PRESSURES IN SEVERE DUTY APPLICATIONS.","THIS CREATES POTENTIAL FOR FUEL EXPULSION FROM THE FUELFILLER PIPE WHICH IN THE PRESENCE OF AN IGNITION SOURCE, COULD RESULT IN AFIRE.","INSTALL MODIFICATION KITS TO MINIMIZE POSSIBILITY OF FUEL EXPULSION AND TO SHIELD UNDERBODY COMPONENTS FROM EXHAUST SYSTEM HEAT.","SYSTEM: FUELVEHICLE DESCRIPTION: 1983 THROUGH 1987 E250, E350, CLUB WAGONS AND ECONOLINEVANS AND CHASSIS EQUIPPED WITH 7.5 AND 1985 THROUGH 1987 E250, E350, CLUB WAGONSAND ECONOLINE VANS EQUIPPED WITH 5.8 LITER ENGINES.","1985","FORD","ECONOLINE"
1934,"FORD MOTOR COMPANY","87V113000",0,0,0,,"21/07/1987","ENGINE AND ENGINE COOLING:EXHAUST SYSTEM:EMISSION CONTROL","EXPULSION OF FUEL DUE TO OVERPRESSURIZATION.","FUEL OR FUEL VAPORS IN THE PRESENCE OF AN IGNITIONSOURCE CAN CAUSE A FIRE.","MODIFICATION OF THE BASE FUEL VENTING AND EMISSION CONTROL SYSTEM TO REDUCE OPERATING TEMPERATURES AND FUEL SYSTEM PRESSURES.","SYSTEM: FUEL.VEHICLE DESCRIPTION: AMBULANCE, FORD ECONOLINE E350 CUTAWAY CHASSIS AND VANS,EQUIPPED WITH 7.5 LITER ENGINES.","1985","FORD","ECONOLINE"
1935,"FORD MOTOR COMPANY","87V111000",0,0,0,,"16/07/1987","FUEL SYSTEM, GASOLINE:STORAGE:TANK ASSEMBLY:MOUNTING","FUEL LEAK AT THE TOP OF THE FRONT FUEL TANK IN THE AREA OF THE VAPOR VALVE GROMMET.  GROMMET MAY SPLIT DUE TO COMPRESSIVE LOAD WHEN INSTALLED IN THE FUEL TANK.","FUEL MAY LEAK FROM VAPOR VALVE AND BECOME THE SOURCE OFFUEL FOR A FIRE.","INSTALLATION OF A NEWLY DESIGNED VAPOR VALVE GROMMET.","SYSTEM: FUEL/TANK VAPOR VALVE.VEHICLE DESCRIPTION: AMBULANCE, ECONOLINE E350 VANS AND CUTAWAY CHASSIS WITH7.5 LITER ENGINES.","1985","FORD","ECONOLINE"
1936,"FORD MOTOR COMPANY","86V094000",0,0,0,,"15/07/1986","STEERING:LINKAGES:DRAG:LINK:CONNECTION","THE RUBBER THAT ENCASES BALL STUD AND SOCKET JOINT        (CONNECTS STEERING DRAG LINK AND PITMAN ARM) MAY DETERIORATE, CAUSING METAL TO   METAL CONTACT, AND MAY EVENTUALLY RESULT IN COMPLETE SEPARATION.                                                                                                  CONSEQUENCE OF DEFECT: COMPLETE SEPARATION OF THE DRAG LINK TO PITMAN ARM        CONNECTION RESULTS IN LOSS OF STEERING CONTROL WHICH MAY LEAD TO AN ACCIDENT.",,"INSTALL NEW DRAG LINK ASSEMBLIES WITH STEEL BALL AND SOCKET   JOINTS AT THE PITMAN ARM CONNECTIONS.","SYSTEM: STEERING.                                                                                                                                               VEHICLE DESCRIPTION: E350 ECONOLINE AND CLUB WAGONS.","1985","FORD","ECONOLINE"
1937,"FORD MOTOR COMPANY","89V095000",0,0,0,"EA87005","12/06/1989","ENGINE AND ENGINE COOLING:ENGINE","EXTERNAL CRACKS ABOVE THE NUMBER 3 CYLINDER (1984 MODELS) OR ROCKER ARM COVER GASKETS SPLITTING (1985 MODELS) COULD ALLOW OIL TO LEAK ONTO THE EXHAUST MANIFOLD.","ENGINE OIL LEAKING ONTO A HOT EXHAUST MANIFOLD COULDRESULT IN AN ENGINE COMPARTMENT FIRE.","REPLACE CRACKED CYLINDER HEADS (1984 MODELS); REPLACE ROCKER ARM COVER GASKETS (1985 MODELS).","SYSTEM:  ENGINE/CYLINDER HEADS, ROCKER ARM COVER GASKETS.VEHICLE DESCRIPTION:  PASSENGER CARS WITH 1.6L AND 1.9L ENGINES.","1985","FORD","ESCORT"
1938,"FORD MOTOR COMPANY","89V170000",0,0,0,"EA87023","13/10/1989","SEATS","THE FORWARD OUTBOARD PEDESTAL OF THE SEAT TRACK OF DRIVER'S SEAT MAY BE SUSCEPTIBLE TO FATIGUE FRACTURE.","THIS COULD RESULT IN A LIMITED DEGREE OF ROCKING MOTIONOF THE DRIVERS SEAT ASSEMBLY UPON ACCELERATION OR DECELERATION, WHICH COULDCAUSE AN ACCIDENT.","INSTALL A REINFORCEMENT ON ALL MODELS AND A NEW SEAT TRACK AS NECESSARY","SYSTEM: SEAT TRACK PEDESTAL.VEHICLE DESCRIPTION: PASSENGER CARS.","1985","FORD","ESCORT"
1939,"FORD MOTOR COMPANY","85V054000",0,0,0,,"01/05/1985","VEHICLE SPEED CONTROL","THE THROTTLE LEVER MAY NOT RETURN TO IDLE POSITION DUE    TO MISALIGNMENT OF THE AIR CONDITIONER SHUT OFF SWITCH TO THE THROTTLE LEVER     PIN.                                                                                                                                                              CONSEQUENCE OF DEFECT: A JAMMED THROTTLE COULD RESULT IN A LOSS OF ACCELERATOR   CONTROL, WITHOUT PRIOR WARNING, AND AN ACCIDENT.",,"ADJUST SHUTOFF SWITCH AND ASSURE PROPER ALIGNMENT TO          THROTTLE LEVER PIN.","VEHICLE DESCRIPTION: PASSENGER CARS EQUIPPED WITH 1.9 2V LITER ENGINES AND AIR  CONDITIONING.  SYSTEM: THROTTLE LEVER.","1985","FORD","ESCORT"
1910,"FORD MOTOR COMPANY","84V162000",0,0,0,,"26/12/1984","FUEL SYSTEM, GASOLINE:FUEL INJECTION SYSTEM:FUEL RAIL","METAL BURRS AND SHARP EDGES ON FUEL RAILS MAY HAVE DAMAGED ADJACENT O-RING SEALS DURING ASSEMBLY. THE DEFECT COULD CAUSE FUEL LEAKAGE WHEN ENGINE IS OPERATING.",,"FUEL RAILS WILL BE INSPECTED FOR LEAKS, WETNESS OR SEEPAGE OF FUEL AND, IF NECESSARY, FUEL RAILS AND RELATED COMPONENTS WILL BE REPLACED WITHOUT COST TO THE OWNER.","VEHICLE DESCRIPTION: LIGHT TRUCKS EQUIPPED WITH 5.0 LITER ELECTRONIC FUELINJECTION ENGINES.SYSTEM: FUEL SYSTEMS; FUEL INJECTION RAILS.CONSEQUENCES OF DEFECT: FUEL LEAKAGE MAY RESULT IN A VEHICLE FIRE AND PERSONALINJURY.","1985","FORD","F150"
1908,"FORD MOTOR COMPANY","84V162000",0,0,0,,"26/12/1984","FUEL SYSTEM, GASOLINE:FUEL INJECTION SYSTEM:FUEL RAIL","METAL BURRS AND SHARP EDGES ON FUEL RAILS MAY HAVE DAMAGED ADJACENT O-RING SEALS DURING ASSEMBLY. THE DEFECT COULD CAUSE FUEL LEAKAGE WHEN ENGINE IS OPERATING.",,"FUEL RAILS WILL BE INSPECTED FOR LEAKS, WETNESS OR SEEPAGE OF FUEL AND, IF NECESSARY, FUEL RAILS AND RELATED COMPONENTS WILL BE REPLACED WITHOUT COST TO THE OWNER.","VEHICLE DESCRIPTION: LIGHT TRUCKS EQUIPPED WITH 5.0 LITER ELECTRONIC FUELINJECTION ENGINES.SYSTEM: FUEL SYSTEMS; FUEL INJECTION RAILS.CONSEQUENCES OF DEFECT: FUEL LEAKAGE MAY RESULT IN A VEHICLE FIRE AND PERSONALINJURY.","1985","FORD","F250"
1909,"FORD MOTOR COMPANY","86V111000",0,0,0,,"14/08/1986","FUEL SYSTEM, GASOLINE:STORAGE:TANK ASSEMBLY:MOUNTING","TRUCKS FAIL TO MEET REQUIREMENT OF FMVSS NO. 301, FUEL    SYSTEM INTEGRITY, IN A 30 MPH FRONT ANGULAR BARRIER TEST IMPACT BECAUSE OF THE   OMISSION OF THE NOSE SHIELD ON MIDSHIP FUEL TANK.                                                                                                                 CONSEQUENCE OF DEFECT: IN CASE OF AN ACCIDENT, FUEL SPILLAGE IN THE TRUCKS       WHICH DO NOT MEET THE FMVSS INCREASES THE RISK OF A FIRE.",,"INSTALL NOSE SHIELD ON THE MIDSHIP FUEL TANK. FUEL TANK.","SYSTEM: FUEL TANK/SHIELD FMVSS NO. 301.                                                                                                                         VEHICLE DESCRIPTION: F-250 4X4 LIGHT DUTY TRUCKS 133 INCH WHEEL BASE.","1985","FORD","F250"
1915,"FORD MOTOR COMPANY","85V127000",0,0,0,,"15/10/1985","FUEL SYSTEM, GASOLINE:STORAGE:AUXILLARY TANK","THE POLYETHYLENE NUTS WHICH HOLD THE FUEL SENDER UNIT     MAY FRACTURE CAUSING THE UNIT TO LOOSEN AND LEAK GASOLINE.                                                                                                        CONSEQUENCE OF DEFECT: FUEL LEAKAGE AROUND THE SENDER-TO-TANK SEAL OR SPILLAGE   DURING FUEL FILL COULD OCCUR AND CREATE A POTENTIAL FIRE HAZARD.",,"REPLACE THE FUEL SENDER RETAINERS.","SYSTEM: FUEL TANK, FUEL SENDER RETAINING NUTS.VEHICLE DESCRIPTION: CHASSIS CABS WITH 137"" AND 161"" WHEELBASES EQUIPPED WITH   OPTIONAL PLASTIC FUEL TANKS LOCATED BEHIND THE REAR AXLE.","1985","FORD","F350"
1911,"FORD MOTOR COMPANY","86V110000",0,0,0,,"12/08/1986","VEHICLE SPEED CONTROL","HAND THROTTLE CONTROLS WERE NOT IDENTIFIED EITHER ON THE  CONTROL KNOB OR ON THE INSTRUMENT PANEL AS REQUIRED BY FMVSS 101.                                                                                                 CONSEQUENCE OF DEFECT: TRUCKS ARE NOT IN COMPLIANCE WITH FMVSS 101, CONTROLS     AND DISPLAYS.",,"WORD THROTTLE WILL BE AFFIXED ON OR ADJACENT TO THE THROTTLE  CONTROL.","SYSTEM: HAND THROTTLE CONTROL IDENTIFICATION/FMVSS 101.                                                                                                         VEHICLE DESCRIPTION: HEAVY DUTY TRUCK TYPE VEHICLES EQUIPPED WITH FLEET         INSTRUCTIONS PANELS AND OPTIONAL VERNIER HAND THROTTLE CONTROLS.","1985","FORD","LT9000"
1943,"FEDERAL-MOGUL CORPORATION","07E064000",0,0,0,,"27/08/2007","FUEL SYSTEM, GASOLINE:DELIVERY:FUEL PUMP","CERTAIN FEDERAL-MOGUL AFTERMARKET FUEL PUMPS SOLD UNDER THE BRAND NAMES OF CARTER, ACCUFLOW, NAPA, TRUFLOW, PARTS DEPO, AND PARTS MASTER, SHIPPED BETWEEN AUGUST 2006 AND JULY 2007 FOR USE ON THE VEHICLES LISTED ABOVE.  THE FUEL PUMP DIAPHRAGM IN CERTAIN PRODUCTION RUNS MAY HAVE BEEN IMPROPERLY INSTALLED OR INADEQUATELY TESTED WHICH MAY CAUSE THE FUEL PUMP TO LEAK.","A LEAKING FUEL PUMP COULD CREATE A VEHICLE FIRE HAZARD.","FEDERAL-MOGUL WILL NOTIFY OWNERS AND REPLACE THE DEFECTIVE FUEL PUMPS FREE OF CHARGE.  THE RECALL BEGAN ON OCTOBER 15, 2007.  OWNERS CAN CONTACT FEDERAL-MOGUL AT 248-354-7700.","THIS RECALL ONLY PERTAINS TO AFTERMARKET CARTER, NAPA, ACCUFLOW, TRU FLOW, PARTS MASTER, AND PARTS DEPOT BRAND FUEL PUMPS AND HAS NO RELATION TO ANY ORIGINAL EQUIPMENT INSTALLED ON THE LISTED MOTOR VEHICLES.  CUSTOMERS MAY CONTACT THE NATIONAL HIGHWAY TRAFFIC SAFETY ADMINISTRATION'S VEHICLE SAFETY HOTLINE AT 1-888-327-4236 (TTY: 1-800-424-9153); OR GO TO HTTP://WWW.SAFERCAR.GOV.","1985","FORD","LTD"
1944,"FORD MOTOR COMPANY","85V077000",0,0,0,,"11/06/1985","STRUCTURE:FRAME AND MEMBERS:UNDERBODY SHIELDS","HEAT SHIELDS FOR THE CATALYTIC CONVERTER OUTLET PIPES     WERE OMITTED DURING PRODUCTION.                                                                                                                                   CONSEQUENCE OF DEFECT: AFTER SEVERE DUTY USE, SUCH AS HIGH SPEED PURSUIT, THE    OUTLET PIPES BECOME VERY HOT AND COULD IGNITE CERTAIN TYPES OF GROUND COVER      RESULTING IN A VEHICLE FIRE.",,"INSTALL CATALYTIC CONVERTER OUTLET PIPE SHIELDS.","VEHICLE DESCRIPTION: PASSENGER CARS WITH OPTIONAL POLICE PACKAGES EQUIPPED WITH 5.0 LITER FUEL INJECTED HIGH OUTPUT ENGINES.  SYSTEM: CATALYTIC CONVERTER HEAT SHIELDS.","1985","FORD","LTD"
1945,"FORD MOTOR COMPANY","85V068000",0,0,0,,"21/05/1985","SERVICE BRAKES, HYDRAULIC:POWER ASSIST:VACUUM","BRAKE BOOSTER REAR SHELLS MAY HAVE REDUCED WALL           THICKNESSES WHICH COULD CAUSE THE SHELL TO BREAK.                                                                                                                 CONSEQUENCE OF DEFECT: REPEATED BRAKE USE COULD CAUSE THE SHELL TO CRACK AND     THE BOOSTER ASSEMBLY TO COME APART. SERVICE BRAKES CAPABILITY WOULD BE TOTALLY   LOST WITHOUT WARNING AND COULD RESULT IN AN ACCIDENT.",,"INSPECT AND IF NECESSARY REPLACE THE POWER BRAKE BOOSTER      ASSEMBLY.","VEHICLE DESCRIPTION: PASSENGER CARS EQUIPPED WITH 3.8 OR 5.0 LITER ENGINES AND  TANDEM POWER BRAKE BOOSTERS.  VEHICLES EQUIPPED WITH POLICE OR TAXI PACKAGE     OPTION ARE NOT AFFECTED.                                                                                                                                        SYSTEM: POWER BRAKE BOOSTERS.","1985","FORD","LTD"
1948,"FEDERAL-MOGUL CORPORATION","07E064000",0,0,0,,"27/08/2007","FUEL SYSTEM, GASOLINE:DELIVERY:FUEL PUMP","CERTAIN FEDERAL-MOGUL AFTERMARKET FUEL PUMPS SOLD UNDER THE BRAND NAMES OF CARTER, ACCUFLOW, NAPA, TRUFLOW, PARTS DEPO, AND PARTS MASTER, SHIPPED BETWEEN AUGUST 2006 AND JULY 2007 FOR USE ON THE VEHICLES LISTED ABOVE.  THE FUEL PUMP DIAPHRAGM IN CERTAIN PRODUCTION RUNS MAY HAVE BEEN IMPROPERLY INSTALLED OR INADEQUATELY TESTED WHICH MAY CAUSE THE FUEL PUMP TO LEAK.","A LEAKING FUEL PUMP COULD CREATE A VEHICLE FIRE HAZARD.","FEDERAL-MOGUL WILL NOTIFY OWNERS AND REPLACE THE DEFECTIVE FUEL PUMPS FREE OF CHARGE.  THE RECALL BEGAN ON OCTOBER 15, 2007.  OWNERS CAN CONTACT FEDERAL-MOGUL AT 248-354-7700.","THIS RECALL ONLY PERTAINS TO AFTERMARKET CARTER, NAPA, ACCUFLOW, TRU FLOW, PARTS MASTER, AND PARTS DEPOT BRAND FUEL PUMPS AND HAS NO RELATION TO ANY ORIGINAL EQUIPMENT INSTALLED ON THE LISTED MOTOR VEHICLES.  CUSTOMERS MAY CONTACT THE NATIONAL HIGHWAY TRAFFIC SAFETY ADMINISTRATION'S VEHICLE SAFETY HOTLINE AT 1-888-327-4236 (TTY: 1-800-424-9153); OR GO TO HTTP://WWW.SAFERCAR.GOV.","1985","FORD","MUSTANG"
1949,"FORD MOTOR COMPANY","92V063000",0,0,0,"EA91003","29/04/1992","SEAT BELTS:FRONT:ANCHORAGE","THE PLASTIC SLEEVE IN THE FRONT SAFETY BELT TONGUE ASSEMBLY WHICH RETAINS THE LOCK BAR CAN DETERIORATE FROM PROLONGED EXPOSURE TO SUNLIGHT AND BECOME DISPLACED, CAUSING THE TONGUE TO DETACH FROM THE SAFETY BELT WEBBING.","IF THE TONGUE DETACHES FROM THE SAFETY BELT WEBBING, THESAFETY BELT WOULD NOT ATTACH TO ITSELF, RESULTING IN INCREASED RISK OF INJURYTO THE SEAT OCCUPANT IN THE EVENT OF A SUDDEN STOP OR VEHICLE CRASH.","FORD WILL REPAIR THE SAFETY BELTS EXPERIENCING THIS CONDITION REGARDLESS OF VEHICLE AGE OR CONDITION.","SYSTEM: SAFETY BELTS.VEHICLE DESCRIPTION: PASSENGER CARS.","1985","FORD","MUSTANG"
1950,"FORD MOTOR COMPANY","85V068000",0,0,0,,"21/05/1985","SERVICE BRAKES, HYDRAULIC:POWER ASSIST:VACUUM","BRAKE BOOSTER REAR SHELLS MAY HAVE REDUCED WALL           THICKNESSES WHICH COULD CAUSE THE SHELL TO BREAK.                                                                                                                 CONSEQUENCE OF DEFECT: REPEATED BRAKE USE COULD CAUSE THE SHELL TO CRACK AND     THE BOOSTER ASSEMBLY TO COME APART. SERVICE BRAKES CAPABILITY WOULD BE TOTALLY   LOST WITHOUT WARNING AND COULD RESULT IN AN ACCIDENT.",,"INSPECT AND IF NECESSARY REPLACE THE POWER BRAKE BOOSTER      ASSEMBLY.","VEHICLE DESCRIPTION: PASSENGER CARS EQUIPPED WITH 3.8 OR 5.0 LITER ENGINES AND  TANDEM POWER BRAKE BOOSTERS.  VEHICLES EQUIPPED WITH POLICE OR TAXI PACKAGE     OPTION ARE NOT AFFECTED.                                                                                                                                        SYSTEM: POWER BRAKE BOOSTERS.","1985","FORD","MUSTANG"
1912,"FEDERAL-MOGUL CORPORATION","07E064000",0,0,0,,"27/08/2007","FUEL SYSTEM, GASOLINE:DELIVERY:FUEL PUMP","CERTAIN FEDERAL-MOGUL AFTERMARKET FUEL PUMPS SOLD UNDER THE BRAND NAMES OF CARTER, ACCUFLOW, NAPA, TRUFLOW, PARTS DEPO, AND PARTS MASTER, SHIPPED BETWEEN AUGUST 2006 AND JULY 2007 FOR USE ON THE VEHICLES LISTED ABOVE.  THE FUEL PUMP DIAPHRAGM IN CERTAIN PRODUCTION RUNS MAY HAVE BEEN IMPROPERLY INSTALLED OR INADEQUATELY TESTED WHICH MAY CAUSE THE FUEL PUMP TO LEAK.","A LEAKING FUEL PUMP COULD CREATE A VEHICLE FIRE HAZARD.","FEDERAL-MOGUL WILL NOTIFY OWNERS AND REPLACE THE DEFECTIVE FUEL PUMPS FREE OF CHARGE.  THE RECALL BEGAN ON OCTOBER 15, 2007.  OWNERS CAN CONTACT FEDERAL-MOGUL AT 248-354-7700.","THIS RECALL ONLY PERTAINS TO AFTERMARKET CARTER, NAPA, ACCUFLOW, TRU FLOW, PARTS MASTER, AND PARTS DEPOT BRAND FUEL PUMPS AND HAS NO RELATION TO ANY ORIGINAL EQUIPMENT INSTALLED ON THE LISTED MOTOR VEHICLES.  CUSTOMERS MAY CONTACT THE NATIONAL HIGHWAY TRAFFIC SAFETY ADMINISTRATION'S VEHICLE SAFETY HOTLINE AT 1-888-327-4236 (TTY: 1-800-424-9153); OR GO TO HTTP://WWW.SAFERCAR.GOV.","1985","FORD","RANGER"
1913,"AIMCO PRODUCTS INC.","98E010000",0,0,0,,"08/04/1998","SERVICE BRAKES, AIR:DISC:ROTOR","EQUIPMENT DESCRIPTION:  AFTERMARKET BRAKE ROTORS FOR USE ON CERTAIN FORD AND MAZDA TRUCKS.  CRACKED CASTINGS CAUSED CRACKS TO APPEAR ON THE OUTER DIAMETER OF THE ROTOR HAT OR AROUND THE STUD HOLE.","LOSS OF BRAKING CAN RESULT.","AIMCO WILL REIMBURSE CONSUMERS/INSTALLERS FOR THE COST OF REPLACEMENT ROTORS AND INSTALLATION.  CONSUMERS ARE REQUESTED TO RETURN TO THE LOCATION WHERE THE ROTORS WERE ORIGINALLY PURCHASED/INSTALLED FOR REPLACEMENT.","OWNER NOTIFICATION IS EXPECTED TO BEGIN DURING APRIL 1998.  OWNERS WHO DO NOT RECEIVE THE FREE ROTORS WITHIN A REASONABLE TIME SHOULD CONTACT AIMCO AT 815-759-7935.  ALSO CONTACT THE NATIONAL HIGHWAY TRAFFIC SAFETY ADMINISTRATION'S AUTO SAFETY HOTLINE AT 1-888-DASH-2-DOT (1-888-327-4236).","1985","FORD","RANGER"
1914,"FORD MOTOR COMPANY","85V045000",0,0,0,,"17/04/1985","FUEL SYSTEM, GASOLINE:DELIVERY:HOSES, LINES/PIPING, AND FITTINGS","THE NYLON FUEL SUPPLY AND RETURN LINES ARE IMPROPERLY     ROUTED ALONG THE FRAME SIDE RAIL AND COULD CONTACT THE UNIVERSAL JOINT ON THE    FRONT DRIVESHAFT.                                                                                                                                                 CONSEQUENCE OF DEFECT: SUCH CONTACT COULD CAUSE ABRASION OF THE LINES AND LOW    PRESSURE FUEL LEAKAGE CREATING THE POTENTIAL FOR A FIRE.",,"REROUTE OR REPLACE AFFECTED FUEL LINES.","VEHICLE DESCRIPTION: LIGHT TRUCKS EQUIPPED WITH 2.3 LITER ENGINES AND           ELECTRONIC FUEL INJECTION SYSTEMS. SYSTEM: FUEL LINES.","1985","FORD","RANGER"
1951,"FEDERAL-MOGUL CORPORATION","07E064000",0,0,0,,"27/08/2007","FUEL SYSTEM, GASOLINE:DELIVERY:FUEL PUMP","CERTAIN FEDERAL-MOGUL AFTERMARKET FUEL PUMPS SOLD UNDER THE BRAND NAMES OF CARTER, ACCUFLOW, NAPA, TRUFLOW, PARTS DEPO, AND PARTS MASTER, SHIPPED BETWEEN AUGUST 2006 AND JULY 2007 FOR USE ON THE VEHICLES LISTED ABOVE.  THE FUEL PUMP DIAPHRAGM IN CERTAIN PRODUCTION RUNS MAY HAVE BEEN IMPROPERLY INSTALLED OR INADEQUATELY TESTED WHICH MAY CAUSE THE FUEL PUMP TO LEAK.","A LEAKING FUEL PUMP COULD CREATE A VEHICLE FIRE HAZARD.","FEDERAL-MOGUL WILL NOTIFY OWNERS AND REPLACE THE DEFECTIVE FUEL PUMPS FREE OF CHARGE.  THE RECALL BEGAN ON OCTOBER 15, 2007.  OWNERS CAN CONTACT FEDERAL-MOGUL AT 248-354-7700.","THIS RECALL ONLY PERTAINS TO AFTERMARKET CARTER, NAPA, ACCUFLOW, TRU FLOW, PARTS MASTER, AND PARTS DEPOT BRAND FUEL PUMPS AND HAS NO RELATION TO ANY ORIGINAL EQUIPMENT INSTALLED ON THE LISTED MOTOR VEHICLES.  CUSTOMERS MAY CONTACT THE NATIONAL HIGHWAY TRAFFIC SAFETY ADMINISTRATION'S VEHICLE SAFETY HOTLINE AT 1-888-327-4236 (TTY: 1-800-424-9153); OR GO TO HTTP://WWW.SAFERCAR.GOV.","1985","FORD","TEMPO"
1952,"FORD MOTOR COMPANY","85V145000",0,0,0,,"05/11/1985","SUSPENSION:REAR","REAR SUPENSION CONTROL ARM-TO-SPINDLE ATTACHMENT BOLTS    MAY BE SUBJECT TO FRACTURE CAUSING THE REAR SPINDLE TO SEPARATE DURING USE OF    CAR.                                                                                                                                                              CONSEQUENCE OF DEFECT: IF BOLTS FRACTURE AND REAR SPINDLE DISENGAGES FROM        CONTROL ARM, LOSS OF CONTROL WILL BE EXPERIENCE WHICH MAY RESULT IN AN           ACCIDENT.",,"REPLACE REAR SUSPENSION BOLTS AS NECESSARY.","SYSTEM: REAR SUSPENSION BOLTS.     VEHICLE DESCRIPTION: PASSENGER CARS. THIS IS AN ADDENDUM THE NHTSA RECALL       NUMBER 85V086000.","1985","FORD","TEMPO"
1953,"FORD MOTOR COMPANY","85V134000",0,0,0,,"22/10/1985","ELECTRICAL SYSTEM:IGNITION:MODULE","THE UNEXPECTED OPEN THROTTLE CAUSES AN INCREASE IN        ENGINE SPEED WHICH COULD RESULT IN LOSS OF CONTROL OF THE CAR AND A POTENTIAL    CRASH.                                                                                                                                                            CONSEQUENCE OF DEFECT: THE ELECTRONIC ENGINE CONTROL PROCESSOR MAY EXPERIENCE    AN INTERMITTENT TIMING PROBLEM. THIS PROBLEM CAUSES IMPROPER EXECUTION ENGINE    PERFORMANCE WHICH MAY MAINTAIN OR CAUSE A PARTIALLY OPEN THROTTLE.",,"REPLACE ELECTRONIC ENGINE CONTROL PROCESSOR, IF NECESSARY.","SYSTEM: ELECTRONIC ENGINE CONTROL PROCESSOR.  VEHICLE DESCRIPTION: PASSENGER CARS WITH 2.3 LITER ENGINES WITH 49-STATES       CALIBRATIONS AND AUTOMATIC TRANSMISSIONS.","1985","FORD","TEMPO"
1954,"FORD MOTOR COMPANY","85V086000",0,0,0,,"03/07/1985","SUSPENSION:REAR","REAR SUSPENSION CONTROL ARM-TO-SPINDLE ATTACHMENT BOLTS   MAY BE SUBJECT TO FRACTURE DURING USE OF CAR.                                                                                                                     CONSEQUENCE OF DEFECT: IF BOLTS FRACTURE, REAR SPINDLE COULD DISENGAGE FROM      CONTROL ARM AND POSSIBLY RESULT IN LOSS OF CONTROL.",,"REPLACE REAR SUSPENSION BOLTS AS NECESSARY.","VEHICLE DESCRIPTION: PASSENGER CARS. SYSTEM: REAR SUSPENSION BOLTS.","1985","FORD","TEMPO"
1940,"FORD MOTOR COMPANY","85V025000",0,0,0,,"11/03/1985","SERVICE BRAKES, HYDRAULIC:FOUNDATION COMPONENTS:MASTER CYLINDER","BRAKE MASTER CYLINDERS MAY HAVE IMPROPERLY ANODIZED       INTERNAL SURFACES CAUSING ACCELERATED WEAR OF A PISTON SEAL.                                                                                                      CONSEQUENCE OF DEFECT: ONE PORTION OF THE SPLIT BRAKE SYSTEM WOULD BECOME        INEFFECTIVE RESULTING IN INCREASED STOPPING DISTANCE WHICH MAY CAUSE AN          ACCIDENT. DRIVER WOULD BE WARNED BY INCREASED PEDAL TRAVEL AND THE BRAKE         WARNING LIGHT.",,"MASTER CYLINDERS BUILT ON JANUARY 9, 1985 WILL BE REPLACED.","VEHICLE DESCRIPTION: PASSENGER CARS. SYSTEM: BRAKE MASTER CYLINDER.","1985","FORD","THUNDERBIRD"
