id,Manufacturer,NHTSACampaignNumber,parkIt,parkOutSide,overTheAirUpdate,NHTSAActionNumber,ReportReceivedDate,Component,Summary,Consequence,Remedy,Notes,ModelYear,Make,Model
279,"FORD MOTOR COMPANY","76V170000",0,0,0,,"29/10/1976","FUEL SYSTEM, GASOLINE:DELIVERY:HOSES, LINES/PIPING, AND FITTINGS",,,,"FORD MOTOR CAMPAIGN NO 209.  POSSIBILITY THAT VEHICLES EQUIPPED WITH 2.  3LITRE ENGINES MAY EXPERIENCE FUEL LEAKAGE AT THE RUBBER HOSE CONNECTING THEFUEL TUBE TO THE CARBURETOR FUEL FILTER.  FUEL LEAKAGE MAY BE CAUSED BY ACOMBINATION OF FACTORS, INCLUDING FUEL TUBE MISALIGNMENT, IMPROPER HOSECLAMPING AND A CHANGE TO A LESS FLEXIBLE, DOUBLE BRAIDED HOSE.  FUEL ODORS MAYPROVIDE WARNING TO DRIVERS.  SHOULD LEAKAGE OCCUR, A POTENTIAL EXISTS FOR THEOCCURANCE OF AN UNDERHOOD FIRE.  (CORRECT BY INSPECTING AND REPLACING FUELHOSE, CLAMP AND ALIGNMENT OF FUEL TUBE WHEN NECESSARY).  PASSENGER VEHICLE.","1976","FORD","MUSTANG"
280,"FORD MOTOR COMPANY","76V112000",0,0,0,,"20/07/1976","SEATS:FRONT ASSEMBLY:RECLINER",,,,"FORD MOTOR CAMPAIGN NO 199.  POSSIBILITY THAT THE FRONT SEAT BACK RESTRAININGDEVICES THAT MAY FAIL TO MEET THE REQUIREMENTS OF FEDERAL MOTOR VEHICLE SAFETYSTANDARD NO.  207.  THIS CONDITION RESULTED BECAUSE SCREWS SECURING THE LATCHSTRIKER TO THE SEAT CUSHION FRAME WERE NOT PROPERLY PROCESSED BY THEIRMANUFATURER.  (CORRECT BY INSPECTING AND REPLACING SCREW AS NECESSARY).PASSENGER VEHICLE.","1976","FORD","MUSTANG"
281,"FORD MOTOR COMPANY","81V003000",0,0,0,,"02/12/1981","ENGINE AND ENGINE COOLING:COOLING SYSTEM:FAN","THE SEVEN-BLADE ENGINE COOLING FAN IS SUBJECT TO FATIGUE CRACKING DURING NORMAL OPERATION. PORTIONS OF THE BLADES MAY SEPARATE WITHOUT PRIOR WARNING.",,"DEFECTIVE FANS WILL BE REPLACED WITH FANS OF AN IMPROVED DESIGN WITHOUT CHARGE.","VEHICLE DESCRIPTION: PASSENGER VEHICLES EQUIPPED WITH 302 CID ENGINES.SYSTEM: ENGINE AND ENGINE COOLING; FLEXIBLE BLADE FANS.CONSEQUENCES OF DEFECT: FLYING PIECES FROM A ROTATING FAN CREATE A RISK OFDAMAGE TO UNDERHOOD COMPONENTS AND MAY CAUSE PERSONAL INJURY TO NEARBYINDIVIDUALS.NOTE: ENGINE SHOULD NOT BE LEFT RUNNING WITH THE HOOD OPEN UNTIL THE FAN HASBEEN REPLACED.","1976","FORD","MUSTANG"
282,"FEDERAL-MOGUL CORPORATION","07E064000",0,0,0,,"27/08/2007","FUEL SYSTEM, GASOLINE:DELIVERY:FUEL PUMP","CERTAIN FEDERAL-MOGUL AFTERMARKET FUEL PUMPS SOLD UNDER THE BRAND NAMES OF CARTER, ACCUFLOW, NAPA, TRUFLOW, PARTS DEPO, AND PARTS MASTER, SHIPPED BETWEEN AUGUST 2006 AND JULY 2007 FOR USE ON THE VEHICLES LISTED ABOVE.  THE FUEL PUMP DIAPHRAGM IN CERTAIN PRODUCTION RUNS MAY HAVE BEEN IMPROPERLY INSTALLED OR INADEQUATELY TESTED WHICH MAY CAUSE THE FUEL PUMP TO LEAK.","A LEAKING FUEL PUMP COULD CREATE A VEHICLE FIRE HAZARD.","FEDERAL-MOGUL WILL NOTIFY OWNERS AND REPLACE THE DEFECTIVE FUEL PUMPS FREE OF CHARGE.  THE RECALL BEGAN ON OCTOBER 15, 2007.  OWNERS CAN CONTACT FEDERAL-MOGUL AT 248-354-7700.","THIS RECALL ONLY PERTAINS TO AFTERMARKET CARTER, NAPA, ACCUFLOW, TRU FLOW, PARTS MASTER, AND PARTS DEPOT BRAND FUEL PUMPS AND HAS NO RELATION TO ANY ORIGINAL EQUIPMENT INSTALLED ON THE LISTED MOTOR VEHICLES.  CUSTOMERS MAY CONTACT THE NATIONAL HIGHWAY TRAFFIC SAFETY ADMINISTRATION'S VEHICLE SAFETY HOTLINE AT 1-888-327-4236 (TTY: 1-800-424-9153); OR GO TO HTTP://WWW.SAFERCAR.GOV.","1976","FORD","PINTO"
283,"FORD MOTOR COMPANY","76V067000",0,0,0,,"29/04/1976","VEHICLE SPEED CONTROL:CABLES",,,,"FORD CAMPAIGN NO 192. POSSIBILITY THAT THE NYLON BUSHING IN THE ACCELERATORNCABLE MAY BECOME LOOSE DUE TO AN OVERSIZE RETAINING CLIP. A LOOSE BUSHING MAYLRESTRICT THE ACCELERATOR CABLE FROM RETURNING TO IDLE OR TO A LOWER SPEEDOR TO A SLOWER SPEED CONDITION, HOLDING CARBURETOR AT CONSTANT SPEED. SHOULDTHIS OCCUR, THE DRIVER CAN STOP THE VEHICLE BY APPLYING THE BRAKES, SHIFTINGTO NEUTRAL AND TURNING OFF THE IGNITION. (CORRECT BY INSPECTING THE BUSHINGBUSHING RETAINING CLIP WHERE NECESSARY.)","1976","FORD","PINTO"
284,"FORD MOTOR COMPANY","78V143000",0,0,0,,"19/06/1978","FUEL SYSTEM, GASOLINE:STORAGE:TANK ASSEMBLY","IN THE EVENT THE VEHICLE IS STRUCK FROM THE REAR, THE FUEL FILLER PIPE COULD DISCONNECT FROM THE TANK OR THE TANK COULD BE PUNCTURED IN THE FORWARD FACE. THIS WOULD RESULT IN FUEL LEAKAGE.",,"THE DEALER WILL INSTALL A LONGER FUEL FILLER PIPE HAVING AN IMPROVED SEAL. ALSO, A POLYETHYLENE SHIELD WILL BE INSTALLED ON THE FRONT OF THE FUEL TANK.","VEHICLE DESCRIPTON: PASSENGER VEHICLES.SYSTEM: FUEL; FUEL TANK.CONSEQUENCES OF DEFECT: FUEL LEAKAGE, IN THE PRESENCE OF A SOURCE OF IGNITION,COULD RESULT IN A VEHICLE FIRE AND SERIOUS INJURY TO PASSENGERS.","1976","FORD","PINTO"
285,"FORD MOTOR COMPANY","76V170000",0,0,0,,"29/10/1976","FUEL SYSTEM, GASOLINE:DELIVERY:HOSES, LINES/PIPING, AND FITTINGS",,,,"FORD MOTOR CAMPAIGN NO 209.  POSSIBILITY THAT VEHICLES EQUIPPED WITH 2.  3LITRE ENGINES MAY EXPERIENCE FUEL LEAKAGE AT THE RUBBER HOSE CONNECTING THEFUEL TUBE TO THE CARBURETOR FUEL FILTER.  FUEL LEAKAGE MAY BE CAUSED BY ACOMBINATION OF FACTORS, INCLUDING FUEL TUBE MISALIGNMENT, IMPROPER HOSECLAMPING AND A CHANGE TO A LESS FLEXIBLE, DOUBLE BRAIDED HOSE.  FUEL ODORS MAYPROVIDE WARNING TO DRIVERS.  SHOULD LEAKAGE OCCUR, A POTENTIAL EXISTS FOR THEOCCURANCE OF AN UNDERHOOD FIRE.  (CORRECT BY INSPECTING AND REPLACING FUELHOSE, CLAMP AND ALIGNMENT OF FUEL TUBE WHEN NECESSARY).  PASSENGER VEHICLE.","1976","FORD","PINTO"
286,"FORD MOTOR COMPANY","76V134000",0,0,0,,"07/09/1976","SEATS:FRONT ASSEMBLY:RECLINER",,,,"FORD CAMPAIGN NO 202.  POSSIBILITY THAT THE REAR SEAT CUSHIONS FAIL TO MEETREQUIREMENT OF FMVSS NO.  207.  THE CUSHION FRAME WAS FOUND TO CONTAINCUSHION-TO-UNDERBODY ATTACHING BRACKETS THAT MAY SEPARATE FROM THE SEAT FRAMEAS A RESULT OF INADEQUATE SPOT WELDS.  (CORRECT BY INSPECTING AND REWORKINGSEAT CUSHION FRAME TO MEET REQUIREMENTS OF FMVSS NO.  207).  PASSENGER VEHICLE.","1976","FORD","PINTO"
287,"FORD MOTOR COMPANY","78V069000",0,0,0,,"04/04/1978","STRUCTURE:BODY:BUMPERS","IN THE EVENT OF A FRONTAL IMPACT, FUEL LEAKAGE MAY OCCUR AT THE FUEL LINE TO FUEL PUMP CONNECTION IN THE ENGINE COMPARTMENT. THESE VEHICLES FAIL TO CONFORM TO FEDERAL MOTOR VEHICLE SAFETY STANDARD NO. 301, ""FUEL SYSTEM INTEGRITY"".",,"DEALER WILL INSTALL A PAIR OF FRONT BUMPER BRACKET EXTENSION PLATES TO SUPPLY ADDED PROTECTION FOR THIS FUEL LINE CONNECTION.","VEHICLE DESCRIPTION: PASSENGER VEHICLES.SYSTEM: FUEL; FUEL LINE TO FUEL PUMP CONNECTION.CONSEQUENCES OF DEFECT: FUEL LEAKAGE RESULTING FROM A VEHICLE COLLISION COULDLEAD TO A VEHICLE FIRE AND INJURY TO PASSENGERS.","1976","FORD","PINTO"
288,"FORD MOTOR COMPANY","76V112000",0,0,0,,"20/07/1976","SEATS:FRONT ASSEMBLY:RECLINER",,,,"FORD MOTOR CAMPAIGN NO 199.  POSSIBILITY THAT THE FRONT SEAT BACK RESTRAININGDEVICES THAT MAY FAIL TO MEET THE REQUIREMENTS OF FEDERAL MOTOR VEHICLE SAFETYSTANDARD NO.  207.  THIS CONDITION RESULTED BECAUSE SCREWS SECURING THE LATCHSTRIKER TO THE SEAT CUSHION FRAME WERE NOT PROPERLY PROCESSED BY THEIRMANUFATURER.  (CORRECT BY INSPECTING AND REPLACING SCREW AS NECESSARY).PASSENGER VEHICLE.","1976","FORD","PINTO"
289,"CHRYSLER CORPORATION","78V039000",0,0,0,,"17/02/1978","POWER TRAIN:MANUAL TRANSMISSION","THE INVOLVED VEHICLES MAY HAVE BEEN BUILT WITH THE TRANSMISSION ADAPTER PLATE SEAL IMPROPERLY SEATED. THIS CONDITION COULD ALLOW A GRADUAL TRANSFER OF LUBRICANT FROM THE TRANSMISSION TO THE TRANSFER CASE.",,"THE DEALER WILL INSPECT THE LUBRICANT LEVELS ON THE INVOLVED VEHICLES AND, WHERE NECESSARY, REPLACE THE REAR OIL SEALS.","VEHICLE DESCRIPTION: JEEPS WITH 3-SPEED MANUAL TRANSMISSIONS.SYSTEM: POWER TRAIN; TRANSMISSION ADAPTER PLATE SEAL.CONSEQUENCES OF DEFECT: IF LUBRICANT TRANSFER TAKES PLACE, THE TRANSMISSIONCOULD EVENTUALLY BECOME DAMAGED AND INOPERATIVE. THIS COULD LEAD TO LOSS OFVEHICLE CONTROL WITHOUT PRIOR WARNING AND AN ACCIDENT.NOTE: IF TRANSMISSION BECOMES DIFFICULT TO SHIFT, THIS MAY INDICATE THATLUBRICANT LEVEL IS LOW AND SHOULD BE CHECKED AND FILLED. DRIVER SHOULD AVOIDDRIVING AT PROLONGED HIGHWAY SPEEDS UNTIL VEHICLE HAS BEEN INSPECTED ANDREPAIRED.","1976","JEEP","CJ7"
290,"CHRYSLER CORPORATION","76V034000",0,0,0,,"01/03/1976","STEERING:GEAR BOX (OTHER THAN RACK AND PINION)",,,,"JEEP CAMPAIGN NO CJSTEER.  POSSIBILITY THE STEERING GEAR ATTACHING BOLTS MAYLOSE TORQUE THROUGH USAGE.  IF THIS OCCURS, SOME LOSS OF STEERING CAN DEVELOP.(CORRECT BY INSPECTING AND COATING BOLT THREADS WITH LOCKING MATERIAL ANDRETORQUING TO PROPER TORQUE).","1976","JEEP","CJ7"
291,"CHRYSLER CORPORATION","76V025000",0,0,0,,"13/02/1976","UNKNOWN OR OTHER",,,,"JEEP CAMPAIGN NO N/A.  POSSIBILITY THAT THE BRACKET WHICH SUPPORTS THEAUXILIARY SNOW-PLOW LIGHTS AND LIFT ARM BRACKET MAY NOT BE SUFFICIENTLY WELDEDAND MAY FAIL RESULTING IN LOSS OF SUPPORT FOR THE SNOW-PLOW BLADE.  (CORRECT BYINSPECTING AND REINFORCING THE WELD BY INSTALLING A SMALL ""L"" SHAPED CLIP).","1976","JEEP","CJ7"
292,"CHRYSLER CORPORATION","78V065000",0,0,0,,"31/03/1978","ELECTRICAL SYSTEM:IGNITION:MODULE","VEHICLES WERE BUILT WITH WIRE CONNECTORS THAT FAIL TO ALLOW THE CURRENT FLOW NEEDED TO SUPPORT THE ELECTRONIC CONTROL OF THE ENGINE IGNITION.",,"DEALER WILL INSTALL IMPROVED WIRE CONNECTORS WITHOUT CHARGE TO OWNERS.","VEHICLE DESCRIPTION: PASSENGER VEHICLES.SYSTEM: ELECTRICAL; ELECTRONIC IGNITION.CONSEQUENCES OF DEFECT: THIS CONDITION OF IGNITION INTERRUPTION WILL CAUSEHESITATION AND ENGINE STALLING. A VEHICLE STALLED IN TRAFFIC PRESENTS A SAFETYHAZARD WICH COULD LEAD TO A VEHICLE ACCIDENT.","1976","JEEP","CJ7"
295,"FORD MOTOR COMPANY","81V008000",0,0,0,,"12/01/1981","POWER TRAIN:AUTOMATIC TRANSMISSION:GEAR POSITION INDICATION (PRNDL)","THIS IS A MANUFACTURER""S NOTICE TO ADVISE OWNERS OF PROPER VEHICLE OPERATION. THE PARKING GEAR MAY NOT BE SECURELY ENGAGED AFTER THE OPERATOR HAS ATTEMPTED TO SHIFT TO PARK. THE VEHICLE MAY APPEAR TO BE IN PARK THOUGH ACTUALLY IN REVERSE. THIS COULD ALLOW THE VEHICLE TO MOVE UNEXPECTEDLY.",,"OWNERS WILL BE PROVIDED WITH A SELF-STICKING LABEL CONTAINING IMPORTANT SAFETY PRECAUTIONS AS A DAILY REMINDER OF THE SERIOUS HAZARDS OF UNEXPECTED VEHICLE MOTION. IT SHOULD BE PLACED INSIDE THE VEHICLE IN AN EASILY SEEN LOCATION.","VEHICLE DESCRIPTION: PASSENGER VEHICLES AND LIGHT TRUCKS EQUIPPED WITH FMX,C-3, C-4, C-6, OR JATCO AUTOMATIC TRANSMISSIONS.SYSTEM: POWER TRAIN; AUTOMATIC TRANSMISSION.CONSEQUENCES OF DEFECT: UNEXPECTED VEHICLE MOVEMENT MAY RESULT IN ACCIDENT,INJURY OR DEATH, ESPECIALLY TO PERSONS IN THE PATH OF THE VEHICLE.NOTE: DRIVERS SHOULD OBSERVE THESE STEPS: 1) MAKE CERTAIN GEAR LEVER IS ENGAGEDIN PARK, 2) SET PARKING BRAKE FULLY, AND 3) SHUT OFF IGNITION.","1976","LINCOLN","LINCOLN"
293,"FEDERAL-MOGUL CORPORATION","07E064000",0,0,0,,"27/08/2007","FUEL SYSTEM, GASOLINE:DELIVERY:FUEL PUMP","CERTAIN FEDERAL-MOGUL AFTERMARKET FUEL PUMPS SOLD UNDER THE BRAND NAMES OF CARTER, ACCUFLOW, NAPA, TRUFLOW, PARTS DEPO, AND PARTS MASTER, SHIPPED BETWEEN AUGUST 2006 AND JULY 2007 FOR USE ON THE VEHICLES LISTED ABOVE.  THE FUEL PUMP DIAPHRAGM IN CERTAIN PRODUCTION RUNS MAY HAVE BEEN IMPROPERLY INSTALLED OR INADEQUATELY TESTED WHICH MAY CAUSE THE FUEL PUMP TO LEAK.","A LEAKING FUEL PUMP COULD CREATE A VEHICLE FIRE HAZARD.","FEDERAL-MOGUL WILL NOTIFY OWNERS AND REPLACE THE DEFECTIVE FUEL PUMPS FREE OF CHARGE.  THE RECALL BEGAN ON OCTOBER 15, 2007.  OWNERS CAN CONTACT FEDERAL-MOGUL AT 248-354-7700.","THIS RECALL ONLY PERTAINS TO AFTERMARKET CARTER, NAPA, ACCUFLOW, TRU FLOW, PARTS MASTER, AND PARTS DEPOT BRAND FUEL PUMPS AND HAS NO RELATION TO ANY ORIGINAL EQUIPMENT INSTALLED ON THE LISTED MOTOR VEHICLES.  CUSTOMERS MAY CONTACT THE NATIONAL HIGHWAY TRAFFIC SAFETY ADMINISTRATION'S VEHICLE SAFETY HOTLINE AT 1-888-327-4236 (TTY: 1-800-424-9153); OR GO TO HTTP://WWW.SAFERCAR.GOV.","1976","LINCOLN","MARK IV"
294,"FORD MOTOR COMPANY","76V067000",0,0,0,,"29/04/1976","VEHICLE SPEED CONTROL:CABLES",,,,"FORD CAMPAIGN NO 192. POSSIBILITY THAT THE NYLON BUSHING IN THE ACCELERATORNCABLE MAY BECOME LOOSE DUE TO AN OVERSIZE RETAINING CLIP. A LOOSE BUSHING MAYLRESTRICT THE ACCELERATOR CABLE FROM RETURNING TO IDLE OR TO A LOWER SPEEDOR TO A SLOWER SPEED CONDITION, HOLDING CARBURETOR AT CONSTANT SPEED. SHOULDTHIS OCCUR, THE DRIVER CAN STOP THE VEHICLE BY APPLYING THE BRAKES, SHIFTINGTO NEUTRAL AND TURNING OFF THE IGNITION. (CORRECT BY INSPECTING THE BUSHINGBUSHING RETAINING CLIP WHERE NECESSARY.)","1976","LINCOLN","MARK IV"
296,"MERCEDES-BENZ USA, INC.","80V160000",0,0,0,,"10/12/1980","POWER TRAIN:AUTOMATIC TRANSMISSION","THE PLASTIC BELL CRANK BUSHING FOR THE PRESSURE CONTROL ROD OF THE AUTOMATIC TRANSMISSION COULD DEFORM DUE TO HIGH TEMPERATURES IN THE ENGINE COMPARTMENT PRODUCED BY THE CATALYTIC CONVERTER. THIS CAN CAUSE THE CONTROL ROD TO DISLODGE. A DISLODGED ROD MAY PREVENT THE NEARBY ENGINE THROTTLE LINKAGE FROM RETURNING TO THE IDLE POSITION.",,"THE DEALER WILL REPLACE THE PLASTIC BUSHING WITH A METAL ONE AT NO CHARGE.","VEHICLE DESCRIPTION: PASSENGER VEHICLES.SYSTEM: POWER TRAIN; PLASTIC BELL CRANK BUSHING.CONSEQUENCES OF DEFECT: IF THE VEHICLE IS DRIVEN WITHOUT BEING REPAIRED, THEDISLODGED ROD CAN RESULT IN A JAMMED THROTTLE, WITHOUT PRIOR WARNING, POSSIBLYCAUSING LOSS OF VEHICLE CONTROL AND AN ACCIDENT.","1976","MERCEDES BENZ","450"
297,"GENERAL MOTORS CORP.","75V214000",0,0,0,,"19/12/1975","SERVICE BRAKES, HYDRAULIC:FOUNDATION COMPONENTS:DIFFERENTIAL PROPORTIONAL VALVE",,,,"CHEVROLET CAMPAIGN NO 76C04, PONTIAC CAMPAIGN NO. 76C7, OLDSMOBILE CAMPAIGN NO.76C1, BUICK CAMPAIGN NO. 76C1.  POSSIBILITY THAT THE COMBINATION VALVE, WHICHIS A PART OF THE HYDRAULIC SERVICE BRAKE SYSTEM MAY HAVE BEEN IMPROPERLYMANUFACTURED AND COULD MALFUNCTION.  SHOULD THIS CONDITION OCCUR WHILE VEHICLEIS IN MOTION AT A TIME WHEN MINIMUM STOPPING DISTANCE IS REQUIRED.  A VEHICLECRASH COULD OCCUR WITHOUT PRIOR WARNING.  (CORRECT BY INSPECTING AND REPLACINGVALVE WHERE NECESSARY.  ) PASSENGER CARS AND LIGHT TRUCKS.","1976","OLDSMOBILE","88"
298,"HONEYWELL INTERNATIONAL, INC.","07E088000",0,0,0,,"24/10/2007","EQUIPMENT","CERTAIN HONEYWELL FRAM RACING BRAND HP4 AND HP8 OIL FILTERS THAT WERE MANUFACTURED FROM MAY 25, 2006, THROUGH SEPTEMBER 14, 2007, AND SOLD FOR USE AS REPLACEMENT EQUIPMENT FOR VEHICLES LIST ABOVE.  THE AFFECTED FILTERS ARE MARKED WITH A DATE CODE A61451 THROUGH A72571 SEQUENTIALLY.  THE DATE CODE AND PART NUMBER APPEAR ON THE FILTER HOUSING.  FRAM RACING HP4 AND HP8 OIL FILTERS NOT BEARING A DATE CODE IN THIS RANGE ARE NOT AFFECTED BY THIS RECALL.  THE GASKET OF THE OIL FILTER BECOMES MORE PLIABLE UNDER HIGH TEMPERATURES AND PRESSURES.","THIS CONDITION MAY CAUSE INADEQUATE SEALING AND LOSS OF ENGINE OIL, POSSIBLY RESULTING IN A FIRE.","HONEYWELL WILL REPLACE THE AFFECTED OIL FILTERS FREE OF CHARGE.  THE RECALL BEGAN DURING NOVEMBER 2007.  OWNERS CAN CONTACT FRAM CUSTOMER SERVICE TOLL-FREE AT 1-800-890-2075.","CUSTOMERS MAY CONTACT THE NATIONAL HIGHWAY TRAFFIC SAFETY ADMINISTRATION'S VEHICLE SAFETY HOTLINE AT 1-888-327-4236 (TTY: 1-800-424-9153); OR GO TO HTTP://WWW.SAFERCAR.GOV.","1976","OLDSMOBILE","CUTLASS"
299,"GENERAL MOTORS CORP.","76V016000",0,0,0,,"10/02/1976","POWER TRAIN:AUTOMATIC TRANSMISSION:GEAR POSITION INDICATION (PRNDL)",,,,"BUICK CAMPAIGN NO 76-C-2.  OLDSMOBILE CAMPAIGN NO 76-C-3.  EQUIPPED WITH 350AND 375B AUTOMATIC TRANSMISSION.  POSSIBILITY THAT THE STOP TANG FOR INNER GEARSELECTOR LINK LOCATED IN THE TRANSMISSION MAY BE IMPROPERLY LOCATED.  AS ARESULT, THE GEAR POSITIONS INDICATED BY THE TRANSMISSION SELECTOR MAY DIFFERFROM THE ACTUAL GEAR POSITION OF THE TRANSMISSION.  IF THIS CONDITION EXISTS,THE TRANSMISSION MAY BE IN A FORWARD OR REVERSE GEAR WHEN THE INDICATOR SHOWSNEUTRAL POSITION AND A VEHICLE CRASH WITHOUT WARNING COULD OCCUR.  (CORRECT BYINSPECTING AND REPLACING SELECTOR CODE RANGE AND INNER SELECTOR LEVERS ASREQUIRED.  )","1976","OLDSMOBILE","CUTLASS"
300,"GENERAL MOTORS CORP.","75V214000",0,0,0,,"19/12/1975","SERVICE BRAKES, HYDRAULIC:FOUNDATION COMPONENTS:DIFFERENTIAL PROPORTIONAL VALVE",,,,"CHEVROLET CAMPAIGN NO 76C04, PONTIAC CAMPAIGN NO. 76C7, OLDSMOBILE CAMPAIGN NO.76C1, BUICK CAMPAIGN NO. 76C1.  POSSIBILITY THAT THE COMBINATION VALVE, WHICHIS A PART OF THE HYDRAULIC SERVICE BRAKE SYSTEM MAY HAVE BEEN IMPROPERLYMANUFACTURED AND COULD MALFUNCTION.  SHOULD THIS CONDITION OCCUR WHILE VEHICLEIS IN MOTION AT A TIME WHEN MINIMUM STOPPING DISTANCE IS REQUIRED.  A VEHICLECRASH COULD OCCUR WITHOUT PRIOR WARNING.  (CORRECT BY INSPECTING AND REPLACINGVALVE WHERE NECESSARY.  ) PASSENGER CARS AND LIGHT TRUCKS.","1976","OLDSMOBILE","DELTA 88"
301,"CHRYSLER CORPORATION","77V242000",0,0,0,,"28/12/1977","FUEL SYSTEM, GASOLINE:CARBURETOR SYSTEM","ON THE INVOLVED VEHICLES, THE CARBURETOR ACCELERATOR PUMP SEAL CAN BECOME DISTORTED DUE TO CONTACT WITH CERTAIN TYPES OF GASOLINE. NORMALLY, WHEN THE ACCELERATOR PEDAL IS DEPRESSED, THE ACCELERATOR PUMP IS ACTIVATED TO PROVIDE ADDITIONAL GASOLINE REQUIRED FOR ACCELERATION. A DISTORTED SEAL HOWEVER, MAY PREVENT THE PUMP FROM DELIVERING THE PROPER AMOUNT OF FUEL.",,"THE DEALER WILL REPLACE THE CARBURETOR ACCELERATOR PUMP SEAL WITH A NEW SEAL HAVING IMPROVED DISTORTION RESISTANCE AND WILL ENSURE PROPER ADJUSTMENT. THIS WILL BE DONE FREE OF CHARGE.","VEHICLE DESCRIPTION: PASSENGER VEHICLES.SYSTEM: FUEL; CARBURETOR ACCELERATOR PUMP.CONSEQUENCES OF DEFECT: SHOULD STALLING OCCUR IN CERTAIN TRAFFIC SITUATIONS, ANACCIDENT MAY RESULT.","1976","PLYMOUTH","VOLARE"
302,"CHRYSLER CORPORATION","77V240000",0,0,0,,"28/12/1977","LATCHES/LOCKS/LINKAGES:HOOD:LATCH","ON THE INVOLVED VEHICLES, THE HOOD SECONDARY CATCH SYSTEM MAY BE MISALIGNED WHICH MAY CAUSE THE SECONDARY CATCH TO MALFUNCTION. CONSEQUENTLY, THE HOOD MAY NOT BE SECURELY LATCHED.",,"DEALER WILL ADJUST THE CATCH SYSTEM TO FULLY SECURE THE HOOD, WITHOUT CHARGE.","VEHICLE DESCRIPTION: PASSENGER VEHICLES.SYSTEM: STRUCTURE; HOOD SECONDARY LATCH/STRIKER.CONSEQUENCES OF DEFECT: THE HOOD COULD SPRING OPEN DURING VEHICLE OPERATION,OBSCURING THE DRIVER""S VIEW OF THE ROAD AND, POSSIBLY, CAUSING AN ACCIDENT.NOTE: IF THE VEHICLE WAS PREVIOUSLY RECALLED FOR CORRECTION OF THE SERVICEBRAKE HYDRAULIC SYSTEM, THE SECONDARY HOOD CATCH SERVICE SHOULD ALSO HAVE BEENCOMPLETED.","1976","PLYMOUTH","VOLARE"
303,"CHRYSLER CORPORATION","76V055000",0,0,0,,"13/04/1976","SEAT BELTS:FRONT:RETRACTOR",,,,"CHRYSLER CAMPAIGN NO 211.  POSSIBILITY THAT THE AUTOMATIC LOCKING LAP BELTRETRACTOR ON FRONT OUTBOARD SEAT BELT ASSEMBLIES MAY INTERMITTENTLY FAIL TOENGAGE IN THE LOCKED POSITION WHEN THE BELT IS EXTRACTED FOR OCCUPANTS USE.  IFTHE RETRACTOR FAILS TO LOCK, A BELTED OCCUPANT MAY NOT BE ADEQUATELY RESTRAINEDDURING IMPACT.  (CORRECT BY INSPECTING AND INSTALLING SPECIALLY DEVELOPED CLIPTO INCREASE CLUTCH TORQUE OUTPUT TO ENSURE ENGAGEMENT OF THE RETRACTOR LOCKINGPAWL).","1976","PLYMOUTH","VOLARE"
304,"CHRYSLER CORPORATION","76V037000",0,0,0,,"09/03/1976","ENGINE AND ENGINE COOLING:EXHAUST SYSTEM:EMISSION CONTROL",,,,"CHRYSLER CAMPAIGN NO 209.  VEHICLE EQUIPPED WITH SIX CYLINDER ENGINE HAVINGCALIFORNIA EMISSION PACKAGE.  POSSIBILITY THAT FUEL VAPOR RETURN LINE MAY HAVEBEEN MISROUTED IN A MANNER WHICH ALLOWS INTERFERENCE BETWEEN THE LINE ANDALTERNATOR DRIVE BELT.  IF THIS CONDITION EXISTS, RETURN LINE ABRASIONRESULTING FROM INTERFERENCE COULD RESULT IN FUEL LEAKAGE, WITH THE POTENTIALFOR AN ENGINE COMPARTMENT FIRE.  (CORRECT BY INSPECTING AND RELOCATINGRETURNLINE TO PRECLUDE INTERFERENCE).","1976","PLYMOUTH","VOLARE"
305,"CHRYSLER CORPORATION","78V097000",0,0,0,,"01/05/1978","SUSPENSION:FRONT:CONTROL ARM:UPPER ARM","POSSIBLE FATIGUE FAILURE CAN OCCUR IN THE FRAME SUPPORT PLATES (FRONT SUSPENSION PIVOT BAR SUPPORT PLATE) THAT CONNECTS A PORTION OF THE FRONT SUSPENSION TO THE VEHICLE FRAME ON THE INVOLVED VEHICLES.",,"THE DEALER WILL INSPECT SUPPORT PLATES FOR INDICATIONS OF FAILURE AND, IF NECESSARY, WILL REPLACE THE PLATES. ADDITIONAL SUPPORT BRACKETS WILL ALSO BE INSTALLED TO REINFORCE THE SUPPORT PLATE AT THE PIVOT BAR ATTACHMENTS.","VEHICLE DESCRIPTION: PASSENGER VEHICLES.SYSTEM: SUSPENSION; FRAME SUPPORT PLATE.CONSEQUENCES OF DEFECT: UNDER CERTAIN DRIVING CONDITIONS, THIS FAILURE COULDAFFECT VEHICLE DIRECTIONAL CONTROL, PARTICULARLY DURING HEAVY BRAKEAPPLICATION. THIS WILL RESULT IN LOSS OF VEHICLE CONTROL WITHOUT PRIOR WARNINGAND A VEHICLE ACCIDENT.","1976","PLYMOUTH","VOLARE"
306,"CHRYSLER CORPORATION","77V188000",0,0,0,,"25/10/1977","SERVICE BRAKES, HYDRAULIC:FOUNDATION COMPONENTS:HOSES, LINES/PIPING, AND FITTINGS","ON THE INVOLVED VEHICLES, DAMAGE TO THE FRONT WHEEL BRAKE HYDRAULIC SYSTEM COULD OCCUR DUE TO FRONT WHEEL BRAKE LINE TUBE CORROSION. FRONT WHEEL BRAKE HOSES MAY BECOME BRITTLE AND CRACK DUE TO PROLONGED OPERATION IN COLD TEMPERATURES.",,"THE DEALER WILL REPLACE BOTH FRONT HOSES IF FOUND NECESSARY AND IN ADDITION, WILL INSTALL A PLASTIC SHIELD BETWEEN THE BATTERY THERMO-GUARD AND THE TUBES TO PREVENT CORROSION.","VEHICLE DESCRIPTION: PASSENGER VEHICLES.SYSTEM: SERVICE BRAKES; STEEL BRAKE TUBES.CONSEQUENCES OF DEFECT: LOSS OF FRONT WHEEL BRAKING CAPABILITY COULD RESULTWHICH WOULD INCREASE THE VEHICLE STOPPING DISTANCE AND COULD LEAD TO ANACCIDENT.NOTE: ILLUMINATION OF THE RED WARNING SIGNAL ON THE INSTRUMENT PANEL SHOULDALERT DRIVER THAT BRAKE MALFUNCTION HAS OCCURRED.","1976","PLYMOUTH","VOLARE"
307,"CHRYSLER CORPORATION","76V125000",0,0,0,,"10/08/1976","SERVICE BRAKES, HYDRAULIC:POWER ASSIST:VACUUM",,,,"CHRYSLER CAMPAIGN NO 217.  EQUIPPED WITH POWER BRAKES.  POSSIBILITY THAT THEPOWER BRAKE BOOSTER MAY CONTAIN SILENCER PAD THAT RESTRICTS INPUT AIR DURINGBRAKE PEDAL APPLICATION DUE TO EXCESSIVE SILENCER MATERIAL DENSITY.  IF THISCONDITION EXISTS, IT COULD CAUSE BRAKING ACTION DELAY ON RAPID PEDALAPPLICATION AND INCREASED STOPPING DISTANCE.  (CORRECT BY INSPECTING ANDREWORKING SUSPECT BOOSTER AND REMOVING SILENCER PAD).  PASSENGER VEHICLE.","1976","PLYMOUTH","VOLARE"
308,"CHRYSLER CORPORATION","77V017000",0,0,0,,"09/02/1977","EQUIPMENT:OTHER:LABELS","THE INVOLVED VEHICLES MAY NOT COMPLY WITH FEDERAL MOTOR VEHICLE SAFETY STANDARD NO. 110, ""TIRE SELECTION AND RIMS"". THE TIRE PRESSURE PLACARDS INCORRECTLY SPECIFY THE FRONT TIRE PRESSURE FOR MAXIMUM LOAD CONDITIONS. AS A RESULT, TIRES COULD FAIL DUE TO OVERLOADING.",,"THE OWNER WILL BE SENT THE CORRECT PLACARD AND HAS THE OPTION OF INSTALLING IT HIM/HERSELF OR HAVING THE DEALER INSTALL IT, FREE OF CHARGE.","VEHICLE DESCRIPTION: PASSENGER VEHICLES.SYSTEM: EQUIPMENT; TIRE INFORMATION PLACARDS.CONSEQUENCES OF DEFECT: IF TIRE FAILURE OCCURS, LOSS OF VEHICLE CONTROL AND ANACCIDENT COULD OCCUR.NOTE: TO ELIMINATE ANY POTENTIAL FOR OVERLOADING OF THE FRONT TIRES, THEINFLATION PRESSURE OF THE FRONT TIRES SHOULD BE SET AT 26 PSI AND MAINTAINED ATTHAT LEVEL.","1976","PLYMOUTH","VOLARE"
309,"HONEYWELL INTERNATIONAL, INC.","07E088000",0,0,0,,"24/10/2007","EQUIPMENT","CERTAIN HONEYWELL FRAM RACING BRAND HP4 AND HP8 OIL FILTERS THAT WERE MANUFACTURED FROM MAY 25, 2006, THROUGH SEPTEMBER 14, 2007, AND SOLD FOR USE AS REPLACEMENT EQUIPMENT FOR VEHICLES LIST ABOVE.  THE AFFECTED FILTERS ARE MARKED WITH A DATE CODE A61451 THROUGH A72571 SEQUENTIALLY.  THE DATE CODE AND PART NUMBER APPEAR ON THE FILTER HOUSING.  FRAM RACING HP4 AND HP8 OIL FILTERS NOT BEARING A DATE CODE IN THIS RANGE ARE NOT AFFECTED BY THIS RECALL.  THE GASKET OF THE OIL FILTER BECOMES MORE PLIABLE UNDER HIGH TEMPERATURES AND PRESSURES.","THIS CONDITION MAY CAUSE INADEQUATE SEALING AND LOSS OF ENGINE OIL, POSSIBLY RESULTING IN A FIRE.","HONEYWELL WILL REPLACE THE AFFECTED OIL FILTERS FREE OF CHARGE.  THE RECALL BEGAN DURING NOVEMBER 2007.  OWNERS CAN CONTACT FRAM CUSTOMER SERVICE TOLL-FREE AT 1-800-890-2075.","CUSTOMERS MAY CONTACT THE NATIONAL HIGHWAY TRAFFIC SAFETY ADMINISTRATION'S VEHICLE SAFETY HOTLINE AT 1-888-327-4236 (TTY: 1-800-424-9153); OR GO TO HTTP://WWW.SAFERCAR.GOV.","1976","PONTIAC","FIREBIRD"
310,"GENERAL MOTORS CORP.","76V070000",0,0,0,,"11/05/1976","FUEL SYSTEM, GASOLINE:DELIVERY:HOSES, LINES/PIPING, AND FITTINGS",,,,"PONTIAC CAMPAIGN NO 76C-16.  EQUIPPED WITH 400 AND 455 C.  I.  D.  ENGINES.POSSIBILITY THAT THE FUEL VAPOR RETURN PIPE IS POSITIONED SO THAT THE HOSE ISTOO SHORT AND WILL BREAK OR PULL LOOSE DURING THE 30 MPH BARRIER PORTION OF THEFEDERAL MOTOR VEHICLE SAFETY STANDARD NO.  301 TEST PROCEDURE, WITH RESULTANTFUEL SPILLAGE.  THIS COULD INCREASE THE POSSIBILITY OF A FIRE RESULTING FROMFUEL SPILLAGE AFTER A VEHICLE CRASH.  (CORRECT BY REPLACING HOSE WITH LONGERHOSE WHERE NECESSARY).","1976","PONTIAC","FIREBIRD"
311,"GENERAL MOTORS CORP.","76V132000",0,0,0,,"07/09/1976","STEERING: STEERING WHEEL/HANDLE BAR",,,,"GENERAL MOTOR CAMPAIGN NO 77-C-1.  POSSIBILITY THAT THE STEERING INTERMEDIATESHAFT MAY HAVE BEEN ASSEMBLED WITH COUPLING RETAINER LOCKING TABS NOT BENT OVERPROPERLY OR ONE OR MORE OF THE LOWER FLEXIBLE COUPLING RIVETS IMPROPERLYPEENED.  IF EITHER OF THESE CONDITIONS EXISTS, THE INTERMEDIATE SHAFT ASSEMBLYCOULD SEPARATE CAUSING LOSS OF STEERING CONTROL, AND VEHICLE CRASH MAY OCCURWITHOUT PRIOR WARNING.  (CORRECT BY INSPECTING, AND REPLACING SHAFT WHERENECESSARY).  PASSENGER VEHICLE.","1976","PONTIAC","FIREBIRD"
312,"TRAVEL EQUIPMENT CORP.","78V192000",0,0,0,,"06/09/1978","FUEL SYSTEM, GASOLINE:STORAGE:TANK ASSEMBLY:MOUNTING","THE BOLTS SECURING THE MAIN FUEL TANK SUPPORT TO THE CHASSIS MAY BREAK UNDER LOAD ALLOWING THE TANK TO DROP TO THE GROUND.",,"DEALER WILL INSTALL A STEEL STRAP ALONG THE BOTTOM OF THE GASOLINE TANK SUPPORT AND REPLACE THE BOLTS THAT SECURE THE SUPPORT FRAME TO THE CHASSIS, WITHOUT CHARGE TO OWNER.","VEHICLE DESCRIPTION: MOTORHOMES.SYSTEM: FUEL; FUEL TANK SUPPORT BRACKET.CONSEQUENCES OF DEFECT: SHOULD THE TANK DROP TO THE GROUND, LEAKING GAS, IN THEPRESENCE OF A SOURCE OF IGNITION, COULD RESULT IN A FIRE, PROPERTY DAMAGE, ANDINJURY TO NEARBY PERSONS.","1976","TRAVEL","166"
