id,Manufacturer,NHTSACampaignNumber,parkIt,parkOutSide,overTheAirUpdate,NHTSAActionNumber,ReportReceivedDate,Component,Summary,Consequence,Remedy,Notes,ModelYear,Make,Model
1748,"FEDERAL-MOGUL CORPORATION","09E021000",0,0,0,,"30/04/2009","FUEL SYSTEM, OTHER:DELIVERY:FUEL PUMP","FEDERAL-MOGUL CORPORATION IS RECALLING 2,790 MECHANICAL FUEL PUMPS, P/NO. M6737 SOLD UNDER CARTER AND NAPA BRANDS AND P/NO. 2M6737 SOLD UNDER ACCU-FLOW AND TRU-FLOW BRANDS SHIPPED BETWEEN AUGUST 2008 AND MARCH 2009 FOR USE AS REPLACEMENT EQUIPMENT FOR THE VEHICLES LISTED ABOVE.  THE FUEL PUMP DIAPHRAGM ROD IN CERTAIN PRODUCTION RUNS MAY HAVE BEEN IMPROPERLY MANUFACTURED.  IMPROPERLY MANUFACTURED PUMP DIAPHRAGM RODS MAY CAUSE THE PUMP TO PRODUCE EXCESS PRESSURE.","EXCESS FUEL PUMP PRESSURE COULD CAUSE A VEHICLE FIRE.","FEDERAL-MOGUL WILL NOTIFY OWNERS AND REPLACE THE FUEL PUMP FREE OF CHARGE.  THE SAFETY RECALL BEGAN ON MAY 12, 2009.  OWNERS MAY CONTACT FEDERAL-MOGUL AT 1-877-489-6659.","THIS RECALL ONLY PERTAINS TO AFTERMARKET NAPA, CARTER, ACCU-FLO, AND TRU-FLO FUEL PUMPS AND HAS NO RELATION TO ANY ORIGINAL EQUIPMENT INSTALLED ON VEHICLES MANUFACTURED BY CHRYSLER LLC. OWNERS MAY ALSO CONTACT THE NATIONAL HIGHWAY TRAFFIC SAFETY ADMINISTRATION'S VEHICLE SAFETY HOTLINE AT 1-888-327-4236 (TTY 1-800-424-9153), OR GO TO <A HREF=HTTP://WWW.SAFERCAR.GOV>HTTP://WWW.SAFERCAR.GOV</A> .","1985","AMERICAN MOTORS","EAGLE"
1749,"VOLKSWAGEN OF AMERICA,INC","93V006000",0,0,0,"EA92028","11/01/1993","POWER TRAIN:AXLE ASSEMBLY","THE DIFFERENTIAL OIL OF THE TRANSAXLE IS LOST OVER TIME DUE TO EVAPORATION. LOW OIL LEVELS CAUSE PREMATURE BEARING AND GEAR WEAR AND EVENTUAL FAILURE OF THE DIFFERENTIAL.","IN THE EVENT OF FAILURE, THE VEHICLE'S DRIVE WHEELS COULDLOSE POWER. IN EXTREME CIRCUMSTANCES, THE FRONT WHEELS LOCK, CAUSING RAPIDDECELERATION RESULTING IN POSSIBLE LOSS OF VEHICLE CONTROL AND AN ACCIDENT.","DRAIN AND REPLACE THE DIFFERENTIAL GEAR OIL WITH OIL HAVING HIGHER PERFORMANCE CHARACTERISTICS.","SYSTEM: POWER TRAIN.VEHICLE DESCRIPTION: PASSENGER CARS WITH AUTOMATIC 3-SPEED TRANSMISSIONS.","1985","AUDI","4000"
1750,"VOLKSWAGEN OF AMERICA,INC","87V069000",0,0,0,,"18/05/1987","VEHICLE SPEED CONTROL","EXCESSIVE WEAR OF IDLE STABILIZER COULD CAUSE IDLE FLUCTUATIONS.","IDLE FLUCTUATIONS COULD RESULT IN UNSATISFACTORYDRIVEABILITY.","REPLACE IDLE STABILIZER.","SYSTEM: IDLE STABILIZER.VEHICLE DESCRIPTION: PASSENGER CARS (5-CYLINDER) EQUIPPED WITH AUTOMATICTRANSMISSION.","1985","AUDI","4000"
1751,"VOLKSWAGEN OF AMERICA,INC","93V006000",0,0,0,"EA92028","11/01/1993","POWER TRAIN:AXLE ASSEMBLY","THE DIFFERENTIAL OIL OF THE TRANSAXLE IS LOST OVER TIME DUE TO EVAPORATION. LOW OIL LEVELS CAUSE PREMATURE BEARING AND GEAR WEAR AND EVENTUAL FAILURE OF THE DIFFERENTIAL.","IN THE EVENT OF FAILURE, THE VEHICLE'S DRIVE WHEELS COULDLOSE POWER. IN EXTREME CIRCUMSTANCES, THE FRONT WHEELS LOCK, CAUSING RAPIDDECELERATION RESULTING IN POSSIBLE LOSS OF VEHICLE CONTROL AND AN ACCIDENT.","DRAIN AND REPLACE THE DIFFERENTIAL GEAR OIL WITH OIL HAVING HIGHER PERFORMANCE CHARACTERISTICS.","SYSTEM: POWER TRAIN.VEHICLE DESCRIPTION: PASSENGER CARS WITH AUTOMATIC 3-SPEED TRANSMISSIONS.","1985","AUDI","5000"
1752,"EIS BRAKE PARTS","96E006000",0,0,0,,"04/03/1996","SERVICE BRAKES, HYDRAULIC:FOUNDATION COMPONENTS:HOSES, LINES/PIPING, AND FITTINGS","THESE BRAKE HOSE ASSEMBLIES HAVE INADEQUATE CRIMPS ATTACHING THE HOSE TO THE HOSE FITTINGS AND COULD CAUSE THE HOSE AND FITTING TO SEPARATE.","IF THE BRAKE HOSE ASSEMBLY SEPARATES, LOSS OF BRAKING POWER CAN OCCUR INCREASING THE POTENTIAL FOR A VEHICLE ACCIDENT.","THESE BRAKE HOSE ASSEMBLIES WILL BE REPLACED.","SYSTEM: BRAKES; HYDRAULIC; LINES; HOSES.EQUIPMENT DESCRIPTION: AFTERMARKET BRAKE HOSE ASSEMBLIES, MODEL SP6957, FOR USE ON 1983 THROUGH 1986 AUDI 5000 VEHICLES.  NOTE: THE VEHICLE OWNER SHOULD IMMEDIATELY RETURN THE VEHICLE TO THE SERVICE FACILITY WHICH PERFORMED THE INSTALLATION AND THE INSTALLER SHOLD REMOVE THE BRAKE HOSE ASSEMBLY AND REPLACE IT WITH ASSEMBLY SP9037.  EIS WILL REMEDY THE DEFECT WITHOUT CHARGE TO THE OWNER FOR THE REPLACEMENT OF THE DEFECTIVE PARTS AND WILL PAY THE INSTALLING FACILITY FOR ITS PURCHASE COST OF THERE PLACEMENT PART (A COPY OF THE PURCHASE INVOICE WILL BE NEEDED) PLUS A LABOR CHARGE. OWNERS OR INSTALLERS CAN CONTACT EIS AT 129 WORTHINGTON RIDGE, BERLIN, CONNECTICUT 06037, ATTN. D. J. DUPREY, QUALITY ASSURANCE MANAGER, OR CALL1-203-828-8290. ALSO CONTACT THE NATIONAL HIGHWAY TRAFFIC SAFETY ADMINISTRATION'S AUTO SAFETY HOTLINE AT 1-800-424-9393.","1985","AUDI","5000"
1753,"VOLKSWAGEN OF AMERICA,INC","87V009000",0,0,0,,"03/01/1987","VEHICLE SPEED CONTROL:CRUISE CONTROL","THE IDLE STABILIZER MAY EXPERIENCE EXCESSIVE WEAR, CAUSING ENGINE IDLE FLUCTUATIONS, USUALLY DESCRIBED AS ENGINE SURGE, WHICH INCREASE WITH USAGE OF THE CAR.","ENGINE SURGE COULD ULTIMATELY SEE-SAW TO THE EXTEND THATLOSS OF VEHICLE CONTROL COULD BE EXPERIENCED IF THE BRAKES WERE NOT APPLIED INTIME.  THERE IS A RISK OF A COLLISION AND INJURY IN A CONFINED SPACE.","REPLACE IDLE STABILIZATION VALVE.","SYSTEM: THROTTLE/IDLE STABILIZER.VEHICLE DESCRIPTION: PASSENGER VEHICLES WITH AUTOMATIC TRANSMISSION.","1985","AUDI","5000"
1754,"VOLKSWAGEN OF AMERICA,INC","87V008000",0,0,0,,"03/01/1987","POWER TRAIN:AUTOMATIC TRANSMISSION:LEVER AND LINKAGE:FLOOR SHIFT","SUDDEN ACCELERATION FROM A STATIONARY POSITION MAY OCCUR, WHEN SHIFTING FROM PARK TO REVERSE OR DRIVE.","UNEXPECTED SUDDEN ACCELERATION WITHOUT PRIOR WARNINGCOULD RESULT IN A VEHICLE CRASH, CAUSING INJURIES.","INSTALL AN AUTOMATIC SHIFT LOCK TO PREVENT THE TRANSMISSION SHIFT LEVER FROM BEING MOVED FROM PARK TO REVERSE OR DRIVE UNLESS BRAKE PEDAL IS APPLIED AT THE SAME TIME.","SYSTEM: TRANSMISSION LINKAGE.VEHICLE DESCRIPTION: PASSENGER VEHICLES WITH AUTOMATIC TRANSMISSION.","1985","AUDI","5000"
1755,"VOLKSWAGEN OF AMERICA,INC","86V103000",0,0,0,"EA85037","04/08/1986","FUEL SYSTEM, GASOLINE:FUEL INJECTION SYSTEM","MISADJUSTMENT OF FUEL DISTRIBUTOR ALLOWS FUEL TO ESCAPE   AND BE ABSORBED BY THE AIR FILTER.                                                                                                                                CONSEQUENCE OF DEFECT: WITH THE FUEL ABSORBED BY THE AIR FILTER AND AN ENGINE    BACKFIRE ON RESTART, THIS FUEL COULD IGNITE AND RESULT IN AN ENGINE COMPARTMENT  FIRE.",,"INSTALLATION OF AN AIR FILTER MODIFICATION KIT TO PRECLUDE    FUEL LEAKS.","SYSTEM: FUEL/ENGINE COMPARTMENT.                                                                                                                                VEHICLE DESCRIPTION: PASSENGER CARS.","1985","AUDI","5000"
1756,"VOLKSWAGEN OF AMERICA,INC","87V170000",0,0,0,,"28/10/1987","VEHICLE SPEED CONTROL:CRUISE CONTROL","MALFUNCTIONS OF INTERNAL COMPONENTS OF IDLE CONTROL UNIT COULD CAUSE IDLE STABILIZER VALVE TO BECOME ACTIVATED OUTSIDE ITS NORMAL OPERATING RANGE.","IDLE RPM MAY BECOME ERRATIC AND, IN SOMEINSTANCES,INCREASE.","INSTALL LATEST SPECIFICATION IDLE CONTROL UNIT.","SYSTEM: IDLE CONTROL UNITVEHICLE DESCRIPTION: 1984 5000S, 1984 AND 1985 TURBO PASSENGER CARS EQUIPPEDWITH AUTOMATIC TRANSMISSION.","1985","AUDI","5000"
1757,"VOLKSWAGEN OF AMERICA,INC","87V157000",0,0,0,"EA85037","06/10/1987","FUEL SYSTEM, GASOLINE:STORAGE:TANK ASSEMBLY","REPEATED TOPPING OFF OF FUEL TANK DURING REFUELING REDUCES THE EXPANSION SPACE WITHIN THE TANK ALLOWING VAPORS TO ESCAPE FROM THE CHARCOAL FILTER TO OUTSIDE RATHER THAN BEING INDUCTED INTO THE ENGINE.","ESCAPING VAPORS COULD IGNITE BY HEAT EMITTED BY THEEXHAUST SYSTEM.","INSTALL REDESIGNED FILLER NECK AND A NEW VENT VALVE AND HOSE FOR CHARCOAL FILTER.  ALSO, STOP REFUELING WHEN PUMP NOZZLE SHUTS OFF.","SYSTEM: FUEL TANKVEHICLE DESCRIPTION: TURBO AND TURBO QUATTRO PASSENGER CARS.","1985","AUDI","5000"
1758,"VOLKSWAGEN OF AMERICA,INC","89V006000",0,0,0,,"17/01/1989","FUEL SYSTEM, GASOLINE","FUEL INJECTION SEALS MAY HARDEN, DUE TO HIGH TEMPERATURE AND ALCOHOL IN SOME FUELS, AND ALLOW FUEL TO ESCAPE INTO THE ENGINE COMPARTMENT.","FUEL DRIPPING ONTO HOT ENGINE COMPONENTS COULD CAUSE ANENGINE COMPARTMENT FIRE.","REPLACE ENGINES FUEL INJECTOR SEALS WITH IMPROVED SEALS PLUS IMPROVEMENTS DESIGNED TO BETTER INSULATE THE ENGINE AGAINST FIRE RISK.","SYSTEM: FUELVEHICLE DESCRIPTION: PASSENGER CARS WITH TURBO.","1985","AUDI","5000"
1763,"BAYERISCHE MOTOREN WERKE","93V015000",0,0,0,"EA92017","01/02/1993","VISIBILITY:DEFROSTER/DEFOGGER/HVAC SYSTEM:HEATER CORE","THE MALFUNCTION OR FAILURE OF A COOLANT SYSTEM COMPONENT RESULTS IN SIGNIFICANTLY INCREASED COOLANT TEMPERATURE AND A RESULTING INCREASE IN SYSTEM PRESSURE.","VEHICLES OPERATED UNDER THIS INCREASED COOLING SYSTEMPRESSURE CONDITION CAN SUFFER DAMAGE OR FAILURE OF PARTS OF THE COOLING SYSTEMSUCH AS (1) LEAKAGE FROM A COOLANT HOSE, (2) LEAKAGE OF THE RADIATOR OREXPANSION TANK, (3) DISCONNECTION OF A HOSE FROM A PIPE OR A FITTING, AND (4)CRACKS IN THE HEATER CORE END PIECE RESULTING IN COOLANT LEAKAGE. IN SOME CASES,BOILING COOLANT CAN CONTACT THE LOWER RIGHT LEG OF THE DRIVER RESULTING INBURNS. ALSO, ESCAPING COOLANT IN THE PASSENGER COMPARTMENT CAN CAUSE VAPORFOGGING OF THE INTERIOR SURFACE OF THE WINDOWS, REDUCING DRIVER VISIBILITY.","DEALERS WILL INSTALL A THERMOSTATIC BYPASS VALVE IN THE ENGINE COMPARTMENT TO CONTROL COOLANT TEMPERATURE IN THE HEATER CORE.  ALSO, A NEW DESIGN RADIATOR CAP WILL BE INSTALLED, TO CONTROL PRESSURE AND PROVIDE GREATER COOLANT OVERFLOW IN THE EVENT OF OVERHEATING.","SYSTEM: COOLANT SYSTEM.VEHICLE DESCRIPTION: PASSENGER CARS.","1985","BMW","318"
1764,"BAYERISCHE MOTOREN WERKE","86V138000",0,0,0,,"20/10/1986","STEERING: STEERING WHEEL/HANDLE BAR","THE TWO PARTS OF THE STEERING COLUMN DISENGAGEMENT        ELEMENT COULD COMPLETELY DISCONNECT IF THE CAR CONTACTS AN OBJECT IN THE         ROADWAY OR ELSEWHERE OF SUFFICIENT MASS TO APPLY A SIGNIFICANT FORCE DIRECTLY    TO THE STEERING GEARBOX.                                                                                                                                          CONSEQUENCE OF DEFECT: STEERING CONTROL WOULD BE LOST.",,"BOLT TWO SPECIALLY FORMED PLATES TO THE DISENGAGEMENT         ELEMENT SO THAT STEERING CAPABILITY WILL BE RETAINED.","SYSTEM: STEERING COLUMN.                                                                                                                                        VEHICLE DESCRIPTION: PASSENGER CARS.","1985","BMW","318"
1765,"BAYERISCHE MOTOREN WERKE","93V015000",0,0,0,"EA92017","01/02/1993","VISIBILITY:DEFROSTER/DEFOGGER/HVAC SYSTEM:HEATER CORE","THE MALFUNCTION OR FAILURE OF A COOLANT SYSTEM COMPONENT RESULTS IN SIGNIFICANTLY INCREASED COOLANT TEMPERATURE AND A RESULTING INCREASE IN SYSTEM PRESSURE.","VEHICLES OPERATED UNDER THIS INCREASED COOLING SYSTEMPRESSURE CONDITION CAN SUFFER DAMAGE OR FAILURE OF PARTS OF THE COOLING SYSTEMSUCH AS (1) LEAKAGE FROM A COOLANT HOSE, (2) LEAKAGE OF THE RADIATOR OREXPANSION TANK, (3) DISCONNECTION OF A HOSE FROM A PIPE OR A FITTING, AND (4)CRACKS IN THE HEATER CORE END PIECE RESULTING IN COOLANT LEAKAGE. IN SOME CASES,BOILING COOLANT CAN CONTACT THE LOWER RIGHT LEG OF THE DRIVER RESULTING INBURNS. ALSO, ESCAPING COOLANT IN THE PASSENGER COMPARTMENT CAN CAUSE VAPORFOGGING OF THE INTERIOR SURFACE OF THE WINDOWS, REDUCING DRIVER VISIBILITY.","DEALERS WILL INSTALL A THERMOSTATIC BYPASS VALVE IN THE ENGINE COMPARTMENT TO CONTROL COOLANT TEMPERATURE IN THE HEATER CORE.  ALSO, A NEW DESIGN RADIATOR CAP WILL BE INSTALLED, TO CONTROL PRESSURE AND PROVIDE GREATER COOLANT OVERFLOW IN THE EVENT OF OVERHEATING.","SYSTEM: COOLANT SYSTEM.VEHICLE DESCRIPTION: PASSENGER CARS.","1985","BMW","325"
1766,"BAYERISCHE MOTOREN WERKE","86V138000",0,0,0,,"20/10/1986","STEERING: STEERING WHEEL/HANDLE BAR","THE TWO PARTS OF THE STEERING COLUMN DISENGAGEMENT        ELEMENT COULD COMPLETELY DISCONNECT IF THE CAR CONTACTS AN OBJECT IN THE         ROADWAY OR ELSEWHERE OF SUFFICIENT MASS TO APPLY A SIGNIFICANT FORCE DIRECTLY    TO THE STEERING GEARBOX.                                                                                                                                          CONSEQUENCE OF DEFECT: STEERING CONTROL WOULD BE LOST.",,"BOLT TWO SPECIALLY FORMED PLATES TO THE DISENGAGEMENT         ELEMENT SO THAT STEERING CAPABILITY WILL BE RETAINED.","SYSTEM: STEERING COLUMN.                                                                                                                                        VEHICLE DESCRIPTION: PASSENGER CARS.","1985","BMW","325"
1759,"BAYERISCHE MOTOREN WERKE","85V065000",0,0,0,,"22/05/1985","WHEELS:HUBCAP/COVER","INCORRECT MACHINING OF THE SEATING SURFACE OF THE WHEELS  WHERE IT CONTACTS THE HUB OF THE CAR MAY PREVENT THE WHEELS FROM MOUNTING        SECURELY TO THE HUB. THIS MAY CAUSE THE WHEEL TO BREAK AND COULD FALL OFF.                                                                                        CONSEQUENCE OF DEFECT: THE WHEELS COULD LOOSEN AND A CRASH COULD OCCUR.  OWNERS  SHOULD NOT DRIVE THEIR CARS UNTIL REPAIR WORK HAS BEEN DONE.",,"SCRAPE THE CENTER BORE OF THE RIM SO IT CAN CLEAR THE CENTER  OF THE HUB.","VEHICLE DESCRIPTION: PASSENGER CARS EQUIPPED WITH TRX 220/55 VR 390 ALLOY       WHEELS MANUFACTURED BY FUCHS. THESE WHEELS CAN BE IDENTIFIED BY A STYLIZED FOX  HEAD LOGO.                                                                                                                                                      SYSTEM: WHEELS.","1985","BMW","635"
1760,"BAYERISCHE MOTOREN WERKE","85V065000",0,0,0,,"22/05/1985","WHEELS:HUBCAP/COVER","INCORRECT MACHINING OF THE SEATING SURFACE OF THE WHEELS  WHERE IT CONTACTS THE HUB OF THE CAR MAY PREVENT THE WHEELS FROM MOUNTING        SECURELY TO THE HUB. THIS MAY CAUSE THE WHEEL TO BREAK AND COULD FALL OFF.                                                                                        CONSEQUENCE OF DEFECT: THE WHEELS COULD LOOSEN AND A CRASH COULD OCCUR.  OWNERS  SHOULD NOT DRIVE THEIR CARS UNTIL REPAIR WORK HAS BEEN DONE.",,"SCRAPE THE CENTER BORE OF THE RIM SO IT CAN CLEAR THE CENTER  OF THE HUB.","VEHICLE DESCRIPTION: PASSENGER CARS EQUIPPED WITH TRX 220/55 VR 390 ALLOY       WHEELS MANUFACTURED BY FUCHS. THESE WHEELS CAN BE IDENTIFIED BY A STYLIZED FOX  HEAD LOGO.                                                                                                                                                      SYSTEM: WHEELS.","1985","BMW","735"
1761,"BAYERISCHE MOTOREN WERKE","86V080000",0,0,0,,"20/06/1986","VEHICLE SPEED CONTROL","THROTTLE CABLE MAY HAVE BEEN DAMAGED DURING INSTALLATION  RESULTING IN A BEND OR A KINK OR CHAFING AND FRAYING OF THE BRAIDED WIRE CABLE.                                                                                   CONSEQUENCE OF DEFECT: THROTTLE OPERATION COULD BE IMPAIRED REQUIRING INCREASED  EFFORT TO OPEN AND CLOSE THE THROTTLE, RESULTING IN LOSS OF THROTTLE CONTROL     WHICH MAY LEAD TO AN ACCIDENT.",,"REPLACE THROTTLE CABLES, AS REQUIRED, MODIFYING TO ASSURE     CABLES CANNOT BEND.","SYSTEM: THROTTLE CABLE.                                                                                                                                         VEHICLE DESCRIPTION: MOTORCYCLES.","1985","BMW","K100"
1762,"BAYERISCHE MOTOREN WERKE","85V011000",0,0,0,,"05/02/1985","EXTERIOR LIGHTING:BRAKE LIGHTS:SWITCH","A GROUND FAULT MAY OCCUR IN THE STOPLIGHT SWITCH WHICH    IS LOCATED ON THE RIGHT HANDLEBAR IN THE THROTTLE TWIST GRIP HOUSING.                                                                                             CONSEQUENCES OF DEFECT: THE CABLE'S INNER PLASTIC TUBE WOULD OVERHEAT AND        SOFTEN OR MELT, IMPAIRING THROTTLE OPERATION. AN ACCIDENT COULD OCCUR IF THE     MOTORCYCLE IS OPERATED AFTER OBSERVING THAT MORE EFFORT IS REQUIRED IN THE       THROTTLE TWIST GRIP.",,"INSTALL A GROUND CABLE BETWEEN THE THROTTLE TWIST GRIP        HOUSING AND THE COMMON GROUND ON THE FRAME TO PREVENT OVERHEATING.","VEHICLE DESCRIPTION: MOTORCYCLE.    SYSTEM: STOPLIGHT SWITCH GROUND CABLE.","1985","BMW","K100"
1768,"HONEYWELL INTERNATIONAL, INC.","06E043000",0,0,0,,"19/05/2006","FUEL SYSTEM, GASOLINE","CERTAIN REPLACEMENT FUEL FILTERS, FRAM BRAND NAME P/N G3727, WITH DATE CODES X52911 THROUGH X60801 SEQUENTIALLY OR X600141 AND A MEXICO COUNTRY OR ORIGIN MARKING ON THE FUEL FILTER HOUSING MANUFACTURED FROM OCTOBER 18, 2005, THROUGH MARCH 21, 2006, SOLD FOR USE ON THE VEHICLES LISTED ABOVE AND ON CERTAIN SCHOOL BUSES.  (TO SEE THE SCHOOL BUS ENGINE SIZES, CLICK ON ""DOCUMENT SEARCH"" AND THEN ""BUS APPLICATIONS"").  THE CONNECTOR ON THE FUEL FILTER WAS NOT MANUFACTURED TO HONEYWELL'S SPECIFICATION.  AS A RESULT, THE O-RING MAY NOT SEAT CORRECTLY ON THE FUEL LINE.","THIS CONDITION MAY CAUSE AN INADEQUATE SEAL AT THE CONNECTION, POTENTIALLY LEADING TO A FUEL LEAK. IN THE PRESENCE OF AN IGNITION SOURCE, A FIRE COULD OCCUR.","HONEYWELL WILL NOTIFY OWNERS AND REPLACE THE FUEL FILTERS FREE OF CHARGE.  THE RECALL BEGAN ON OCTOBER 18, 2006.  OWNERS MAY CONTACT FRAM CUSTOMER SERVICE AT 1-800-890-2075 (OPTION 1).","THIS RECALL ONLY PERTAINS TO AFTERMARKET FRAM FUEL FILTERS AND HAS NO RELATION TO ANY ORIGINAL EQUIPMENT INSTALLED ON THE VEHICLES LISTED.  CUSTOMERS MAY CONTACT THE NATIONAL HIGHWAY TRAFFIC SAFETY ADMINISTRATION'S VEHICLE SAFETY HOTLINE AT 1-888-327-4236 (TTY: 1-800-424-9153); OR GO TO HTTP://WWW.SAFERCAR.GOV.","1985","BUICK","CENTURY"
1769,"GENERAL MOTORS CORP.","89V102000",0,0,0,,"16/06/1989","VEHICLE SPEED CONTROL","A SMALL NYLON BUSHING IN THE CRUISE CONTROL SERVO BAIL MAY SLIP OUT OF PLACE, CAUSING INTERMITTENT AND UNEXPECTED INCREASES IN ENGINE SPEED OR DIESELING (ENGINE RUN ON WITH IGNITION OFF).","SERVO ROD ASSEMBLY COULD CATCH ON ENGINE COMPONENTS ANDRESULT IN A STUCK THROTTLE WITH POTENTIAL FOR A VEHICLE CRASH.","INSTALL A NEW BUSHING IN CRUISE CONTROL SERVO BAIL.","SYSTEM:  CRUISE CONTROL.VEHICLE DESCRIPTION:  PASSENGER VEHICLES EQUIPPED WITH CRUISE CONTROL ANDCERTAIN GASOLINE AND DIESEL ENGINES.","1985","BUICK","LESABRE"
1770,"HONEYWELL INTERNATIONAL, INC.","06E043000",0,0,0,,"19/05/2006","FUEL SYSTEM, GASOLINE","CERTAIN REPLACEMENT FUEL FILTERS, FRAM BRAND NAME P/N G3727, WITH DATE CODES X52911 THROUGH X60801 SEQUENTIALLY OR X600141 AND A MEXICO COUNTRY OR ORIGIN MARKING ON THE FUEL FILTER HOUSING MANUFACTURED FROM OCTOBER 18, 2005, THROUGH MARCH 21, 2006, SOLD FOR USE ON THE VEHICLES LISTED ABOVE AND ON CERTAIN SCHOOL BUSES.  (TO SEE THE SCHOOL BUS ENGINE SIZES, CLICK ON ""DOCUMENT SEARCH"" AND THEN ""BUS APPLICATIONS"").  THE CONNECTOR ON THE FUEL FILTER WAS NOT MANUFACTURED TO HONEYWELL'S SPECIFICATION.  AS A RESULT, THE O-RING MAY NOT SEAT CORRECTLY ON THE FUEL LINE.","THIS CONDITION MAY CAUSE AN INADEQUATE SEAL AT THE CONNECTION, POTENTIALLY LEADING TO A FUEL LEAK. IN THE PRESENCE OF AN IGNITION SOURCE, A FIRE COULD OCCUR.","HONEYWELL WILL NOTIFY OWNERS AND REPLACE THE FUEL FILTERS FREE OF CHARGE.  THE RECALL BEGAN ON OCTOBER 18, 2006.  OWNERS MAY CONTACT FRAM CUSTOMER SERVICE AT 1-800-890-2075 (OPTION 1).","THIS RECALL ONLY PERTAINS TO AFTERMARKET FRAM FUEL FILTERS AND HAS NO RELATION TO ANY ORIGINAL EQUIPMENT INSTALLED ON THE VEHICLES LISTED.  CUSTOMERS MAY CONTACT THE NATIONAL HIGHWAY TRAFFIC SAFETY ADMINISTRATION'S VEHICLE SAFETY HOTLINE AT 1-888-327-4236 (TTY: 1-800-424-9153); OR GO TO HTTP://WWW.SAFERCAR.GOV.","1985","BUICK","REGAL"
1771,"GENERAL MOTORS CORP.","84V124000",0,0,0,,"10/10/1984","STEERING:LINKAGES:TIE ROD ASSEMBLY","THE TIE RODS ARE PART OF THE STEERING LINKAGE AND TRANSMIT TURNING MOVEMENTS TO THE WHEELS. THE BOLTS THAT FASTEN THE TIE RODS TO THEIR ADJUSTERS MAY NOT BE TIGHT ENOUGH. THIS COULD ALLOW THE TIE ROD TO LOOSEN AND DETACH ITSELF FROM THE ADJUSTER.",,"THE TIE ROD END BOLTS WILL BE TIGHTENED WITHOUT COST TO THE OWNER.","VEHICLE DESCRIPTION: PASSENGER VEHICLES.SYSTEM: STEERING LINKAGES; TIE RODS.CONSEQUENCES OF DEFECT: A LOSS OF STEERING CONTROL AND A POSSIBLE VEHICLE CRASHCOULD RESULT.","1985","BUICK","REGAL"
1772,"GENERAL MOTORS CORP.","85V114000",0,0,0,,"19/09/1985","EQUIPMENT:OTHER:LABELS","THE CERTIFICATION LABEL LOCATED ON THE LEFT FRONT DOOR    DID NOT INCLUDE A REQUIRED FEDERAL CERTIFICATION STATEMENT.                                                                                                       CONSEQUENCE OF DEFECT: VEHICLES DO NOT COMPLY WITH FEDERAL REGULATION 567.",,"LABELS CONTAINING CORRECT INFORMATION ARE BEING MAILED AND    SHOULD BE INSTALLED ON THE LEFT FRONT DOOR.","VEHICLE DESCRIPTION: PASSENGER CARS. SYSTEM: CERTIFICATION LABEL (FEDERAL REGULATION 567).","1985","BUICK","REGAL"
1773,"GENERAL MOTORS CORP.","86V030000",0,0,0,,"21/02/1986","VEHICLE SPEED CONTROL:SPRINGS","THE THROTTLE RETURN SPRING ASSEMBLY MAY FAIL PREVENTING   THE THROTTLE FROM RETURNING TO THE CLOSED (IDLE) POSITION WHEN THE ACCELERATOR   PEDAL IS RELEASED.                                                                                                                                                CONSEQUENCE OF DEFECT: ENGINE SPEED MAY NOT DECREASE AND LOSS OF ACCELERATOR     CONTROL COULD RESULT IN AN ACCIDENT WITHOUT PRIOR WARNING.",,"REPLACE THROTTLE RETURN SPRING.","SYSTEM: THROTTLE RETURN SPRING.                                                                                                                                 VEHICLE DESCRIPTION: PASSENGER CARS EQUIPPED WITH 2.5 LITER 4 CYLINDER ENGINES.","1985","BUICK","REGAL"
1774,"GENERAL MOTORS CORP.","85V049000",0,0,0,,"29/04/1985","STRUCTURE:BODY:BUMPERS","THE REAR BUMPER MAY FRACTURE DURING A REAR END            COLLISION, PUNCTURE THE FUEL TANK, AND CAUSE A FUEL LEAK.                                                                                                         CONSEQUENCE OF DEFECT: A FUEL LEAK CREATES THE POTENTIAL FOR A FIRE WHICH COULD  RESULT IN BURN INJURIES TO PERSONS IN OR NEAR THE CAR.",,"REPLACE THE REAR BUMPER BRACKETS AND THE ""L"" SHAPED           REINFORCEMENT WITH A ""U"" SHAPED FULL REINFORCEMENT.","VEHICLE DESCRIPTION: PASSENGER CARS, EXCEPT THOSE EQUIPPED WITH FULL ALUMINUM   REAR BUMPER REINFORCEMENT.     SYSTEM: REAR BUMPER/FUEL TANK.","1985","BUICK","REGAL"
1775,"GENERAL MOTORS CORP.","84V154000",0,0,0,,"27/11/1984","SEAT BELTS:FRONT:RETRACTOR","THE VEHICLES WERE ASSEMBLED WITH FRONT SEAT BELT RETRACTORS WHICH MAY NOT PERFORM ADEQUATELY DURING A COLLISION.",,"THE DEALER WILL REPLACE THE LEFT AND RIGHT FRONT SEAT BELT RETRACTORS FREE OF CHARGE.","VEHICLE DESCRIPTION: PASSENGER VEHICLES.SYSTEM: INTERIOR SYSTEMS; FRONT SEAT BELT RETRACTOR.CONSEQUENCES OF DEFECT: IN THE EVENT OF A VEHICLE CRASH, FAILURE OF A FRONTSEAT BELT RETRACTOR WOULD INCREASE CHANCES OF OCCUPANT INJURY.","1985","BUICK","REGAL"
1776,"GENERAL MOTORS CORP.","88V014000",0,0,0,,"08/01/1988","EXTERIOR LIGHTING:HEADLIGHTS:SWITCH","UNDER EXTENDED HEADLAMP USAGE, CIRCUITRY IN THE HEADLAMP SWITCH PANEL MIGHT EXPERIENCE INCREASED RESISTANCE AND EXCESSIVE HEAT BUILDUP.","HEADLIGHTS WOULD CYCLE ON AND OFF.  SUDDEN LOSS OFHEADLIGHTS UNDER SEVERE WEATHER OR NIGHTIMER DRIVING CONDITIONS COULD RESULTIN A VEHICLE CRASH.","REPLACE HEADLIGHT SWITCH WITH MODIFIED SWITCH.","SYSTEM: HEADLAMP SWITCH CIRCUITRY.VEHICLE DESCRIPTION: PASSENGER CARS.","1985","BUICK","REGAL"
1777,"GENERAL MOTORS CORP.","87V124000",0,0,0,,"10/08/1987","STRUCTURE","SMALL CRACKS MAY DEVELOP IN THE BODY PILLAR AROUND THE DOOR STRIKER BOLT HOLE.","CRACKS WOULD INCREASE LEADING TO DIFFICULTY IN CLOSINGTHE DOOR AND MIGHT ALLOW DOOR TO COME OPEN DURING A CRASH, INCREASINGLIKELIHOOD OF INJURY TO OCCUPANTS.","INSTALL INNER AND OUTER REINFORCEMENT PLATE ON BOTH LEFT AND RIGHT BODY PILLARS.","SYSTEM: BODY PILLARVEHICLE DESCRIPTION: TWO DOOR PASSENGER CARS.","1985","BUICK","REGAL"
1778,"GENERAL MOTORS CORP.","85V047000",0,0,0,,"26/04/1985","VISIBILITY:WINDSHIELD","A LOSS OF BONDING ADHESION BETWEEN THE PAINT AND THE      WINDSHIELD OPENING AREA COULD ALLOW THE WINDSHIELD TO SEPARATE DURING A 30 MILE  PER HOUR FRONTAL BARRIER TEST REQUIRED BY FMVSS 212, WINDSHIELD RETENTION.                                                                                        CONSEQUENCE OF DEFECT: WINDSHIELD SEPARATION DURING AN ACCIDENT COULD RESULT IN  AN UNBELTED OCCUPANT BEING EJECTED FROM THE CAR AND SEVERLY INJURED.",,"REMOVE AND REINSTALL WINDSHIELD IF A LACK OF PAINT BONDING    IS EVIDENT.","VEHICLE DESCRIPTION: PASSENGER CARS. SYSTEM: WINDSHIELD/FMVSS 212.","1985","BUICK","REGAL"
1779,"HONEYWELL INTERNATIONAL, INC.","06E043000",0,0,0,,"19/05/2006","FUEL SYSTEM, GASOLINE","CERTAIN REPLACEMENT FUEL FILTERS, FRAM BRAND NAME P/N G3727, WITH DATE CODES X52911 THROUGH X60801 SEQUENTIALLY OR X600141 AND A MEXICO COUNTRY OR ORIGIN MARKING ON THE FUEL FILTER HOUSING MANUFACTURED FROM OCTOBER 18, 2005, THROUGH MARCH 21, 2006, SOLD FOR USE ON THE VEHICLES LISTED ABOVE AND ON CERTAIN SCHOOL BUSES.  (TO SEE THE SCHOOL BUS ENGINE SIZES, CLICK ON ""DOCUMENT SEARCH"" AND THEN ""BUS APPLICATIONS"").  THE CONNECTOR ON THE FUEL FILTER WAS NOT MANUFACTURED TO HONEYWELL'S SPECIFICATION.  AS A RESULT, THE O-RING MAY NOT SEAT CORRECTLY ON THE FUEL LINE.","THIS CONDITION MAY CAUSE AN INADEQUATE SEAL AT THE CONNECTION, POTENTIALLY LEADING TO A FUEL LEAK. IN THE PRESENCE OF AN IGNITION SOURCE, A FIRE COULD OCCUR.","HONEYWELL WILL NOTIFY OWNERS AND REPLACE THE FUEL FILTERS FREE OF CHARGE.  THE RECALL BEGAN ON OCTOBER 18, 2006.  OWNERS MAY CONTACT FRAM CUSTOMER SERVICE AT 1-800-890-2075 (OPTION 1).","THIS RECALL ONLY PERTAINS TO AFTERMARKET FRAM FUEL FILTERS AND HAS NO RELATION TO ANY ORIGINAL EQUIPMENT INSTALLED ON THE VEHICLES LISTED.  CUSTOMERS MAY CONTACT THE NATIONAL HIGHWAY TRAFFIC SAFETY ADMINISTRATION'S VEHICLE SAFETY HOTLINE AT 1-888-327-4236 (TTY: 1-800-424-9153); OR GO TO HTTP://WWW.SAFERCAR.GOV.","1985","BUICK","RIVIERA"
