Manufacturer,NHTSACampaignNumber,parkIt,parkOutSide,overTheAirUpdate,NHTSAActionNumber,ReportReceivedDate,Component,Summary,Consequence,Remedy,Notes,ModelYear,Make,Model
"PACCAR, INCORPORATED","77V026000",0,0,0,,"18/02/1977","SERVICE BRAKES, AIR:DRUM:SHOES/LININGS","THE INVOLVED VEHICLES DO NOT CONFORM TO FEDERAL MOTOR VEHICLE SAFETY STANDARD NO. 121, ""AIR BRAKE SYSTEMS"". THE INCORRECT BRAKE LININGS WERE INSTALLED ON THESE VEHICLES. THIS COULD LEAD TO INCREASED STOPPING DISTANCES.",,"THE DEALER WILL INSPECT AND REPLACE SUSPECT BRAKE LININGS WITHOUT CHARGE.","VEHICLE DESCRIPTION: TRUCKS.SYSTEM: AIR BRAKES; BRAKE LINING.CONSEQUENCES OF DEFECT: INCREASED STOPPING DISTANCES COULD RESULT IN ANACCIDENT.","1977","PETERBILT","PETERBILT"
"GENERAL MOTORS CORP.","76V176000",0,0,0,,"05/11/1976","EXTERIOR LIGHTING",,,,"GENERAL MOTOR CAMPAIGN NO 77-C-5.  DURING EARLY PRODUCTION AN AMBER COLOREDBULB WAS USED IN THE SIDE MARKER LAMP ASSEMBLIES, INSTEAD OF A CLEAR GLASSBULB.  THIS APPLICATION FAILS TO CONFORM WITH FMVSS NO.  108.  (CORRECT BYINSPECTING AND REPLACING WITH CLEAR BULBS).  PASSENGER VEHICLE.","1977","PONTIAC","BONNEVILLE"
"GENERAL MOTORS CORP.","76V175000",0,0,0,,"03/11/1976","EXTERIOR LIGHTING:TURN SIGNAL:SWITCH",,,,"GENERAL MOTOR CAMPAIGN NO (CHEVROLET) 77C02 (PONTIAC) 77-C-4 (BUICK) 77-C-5.POSSIBILITY THAT THE TURN SIGNAL OPERATING UNIT OR VEHICLES WITH TILT STEERINGCOLUMNS MAY NOT COMPLY WITH FEDERAL MOTOR VEHICLE SAFETY STANDARD NO.  108.THE TURN SIGNAL LEVER ACTUATOR PIVOT PIN WHICH MAY WORK OUT OF THE PIVOT,RESULTING IN NOT BEING ABLE TO USE TURN SIGNAL TO ALERT OTHER DRIVERS OF YOURINTENTIONS TO CHANGE LANES OR TURN, CAUSING POSSIBLE VEHICLE CRASH.  (CORRECTBY INSPECTING AND INSTALLING A RETAINER TO PRECLUDE PIVOT PIN DISENGAGEMENT).PASSENGER VEHICLE.","1977","PONTIAC","BONNEVILLE"
"GENERAL MOTORS CORP.","76V132000",0,0,0,,"07/09/1976","STEERING: STEERING WHEEL/HANDLE BAR",,,,"GENERAL MOTOR CAMPAIGN NO 77-C-1.  POSSIBILITY THAT THE STEERING INTERMEDIATESHAFT MAY HAVE BEEN ASSEMBLED WITH COUPLING RETAINER LOCKING TABS NOT BENT OVERPROPERLY OR ONE OR MORE OF THE LOWER FLEXIBLE COUPLING RIVETS IMPROPERLYPEENED.  IF EITHER OF THESE CONDITIONS EXISTS, THE INTERMEDIATE SHAFT ASSEMBLYCOULD SEPARATE CAUSING LOSS OF STEERING CONTROL, AND VEHICLE CRASH MAY OCCURWITHOUT PRIOR WARNING.  (CORRECT BY INSPECTING, AND REPLACING SHAFT WHERENECESSARY).  PASSENGER VEHICLE.","1977","PONTIAC","BONNEVILLE"
"GENERAL MOTORS CORP.","77V025000",0,0,0,,"16/02/1977","STEERING:LINKAGES:ARM:IDLER AND ATTACHMENT","ON THE INVOLVED VEHICLES, THE INCORRECT STEERING LINKAGE ASSEMBLY MAY HAVE BEEN INSTALLED. AS A RESULT, THE RIGHT-HAND STEERING TIE ROD MIGHT INTERFERE WITH THE INTERMEDIATE ROD. THIS COULD CAUSE THE CONNECTION TO FAIL DUE TO EXCESSIVE STRESS AT THAT POINT.",,"DEALER WILL INSPECT AND, IF NECESSARY, REPLACE THE STEERING LINKAGE ASSEMBLY WITHOUT CHARGE.","VEHICLE DESCRIPTION: PASSENGER VEHICLES.SYSTEM: STEERING; STEERING LINKAGE ASSEMBLY.CONSEQUENCES OF DEFECT: THIS CONDITION COULD CAUSE LOSS OF STEERING CONTROL,AND AN ACCIDENT.","1977","PONTIAC","BONNEVILLE"
"HONEYWELL INTERNATIONAL, INC.","07E088000",0,0,0,,"24/10/2007","EQUIPMENT","CERTAIN HONEYWELL FRAM RACING BRAND HP4 AND HP8 OIL FILTERS THAT WERE MANUFACTURED FROM MAY 25, 2006, THROUGH SEPTEMBER 14, 2007, AND SOLD FOR USE AS REPLACEMENT EQUIPMENT FOR VEHICLES LIST ABOVE.  THE AFFECTED FILTERS ARE MARKED WITH A DATE CODE A61451 THROUGH A72571 SEQUENTIALLY.  THE DATE CODE AND PART NUMBER APPEAR ON THE FILTER HOUSING.  FRAM RACING HP4 AND HP8 OIL FILTERS NOT BEARING A DATE CODE IN THIS RANGE ARE NOT AFFECTED BY THIS RECALL.  THE GASKET OF THE OIL FILTER BECOMES MORE PLIABLE UNDER HIGH TEMPERATURES AND PRESSURES.","THIS CONDITION MAY CAUSE INADEQUATE SEALING AND LOSS OF ENGINE OIL, POSSIBLY RESULTING IN A FIRE.","HONEYWELL WILL REPLACE THE AFFECTED OIL FILTERS FREE OF CHARGE.  THE RECALL BEGAN DURING NOVEMBER 2007.  OWNERS CAN CONTACT FRAM CUSTOMER SERVICE TOLL-FREE AT 1-800-890-2075.","CUSTOMERS MAY CONTACT THE NATIONAL HIGHWAY TRAFFIC SAFETY ADMINISTRATION'S VEHICLE SAFETY HOTLINE AT 1-888-327-4236 (TTY: 1-800-424-9153); OR GO TO HTTP://WWW.SAFERCAR.GOV.","1977","PONTIAC","FIREBIRD"
"GENERAL MOTORS CORP.","79V056000",0,0,0,,"26/02/1979","EQUIPMENT:OTHER:LABELS","LABELS FAIL TO COMPLY WITH FEDERAL MOTOR VEHICLE SAFETY STANDARD NO. 110, ""TIRE SELECTION AND RIMS"". INCORRECT INFORMATION WAS PROVIDED ON TIRE LABELS.",,"CORRECT PLACARDS WILL BE AVAILABLE FOR INSTALLATION BY OWNERS OR BY DEALERS WITHOUT CHARGE.","VEHICLE DESCRIPTION: PASSENGER VEHICLES.SYSTEM: EQUIPMENT; TIRE INFORMATION LABELS.CONSEQUENCES OF DEFECT: REFERENCE TO INCORRECT INFORMATION CAN LEAD TO UNDER OROVER INFLATION FOLLOWED BY LOSS OF VEHICLE CONTROL AND AN ACCIDENT.","1977","PONTIAC","FIREBIRD"
"GENERAL MOTORS CORP.","78V138000",0,0,0,,"13/06/1978","POWER TRAIN:AXLE ASSEMBLY:AXLE SHAFT","THE REAR AXLE SHAFTS MAY CONTAIN A FLAW IN THE METAL. THIS FLAW COULD ALLOW THE SHAFT TO BREAK AND THE TIRE AND WHEEL ASSEMBLY TO SEPARATE.",,"THE DEALER WILL REPLACE ONE OR BOTH REAR AXLE SHAFTS, IF NECESSARY, FREE OF CHARGE.","VEHICLE DESCRIPTION: PASSENGER VEHICLES.SYSTEM: SUSPENSION; AXLE/SHAFT.CONSEQUENCES OF DEFECT: SHOULD SEPARATION OCCUR WHILE VEHICLE IS IN MOTION,LOSS OF VEHICLE CONTROL WITHOUT PRIOR WARNING AND AN ACCIDENT COULD RESULT.NOTE: DRIVER SHOULD AVOID FAST CORNERING, RAPID ACCELERATION, OR ANY TYPE OFDRIVING WHICH MAY PRODUCE ABNORMALLY HEAVY LOADS ON THE REAR AXLE SHAFTS UNTILTHE VEHICLE CAN BE INSPECTED.","1977","PONTIAC","GRAND PRIX"
"GENERAL MOTORS CORP.","76V132000",0,0,0,,"07/09/1976","STEERING: STEERING WHEEL/HANDLE BAR",,,,"GENERAL MOTOR CAMPAIGN NO 77-C-1.  POSSIBILITY THAT THE STEERING INTERMEDIATESHAFT MAY HAVE BEEN ASSEMBLED WITH COUPLING RETAINER LOCKING TABS NOT BENT OVERPROPERLY OR ONE OR MORE OF THE LOWER FLEXIBLE COUPLING RIVETS IMPROPERLYPEENED.  IF EITHER OF THESE CONDITIONS EXISTS, THE INTERMEDIATE SHAFT ASSEMBLYCOULD SEPARATE CAUSING LOSS OF STEERING CONTROL, AND VEHICLE CRASH MAY OCCURWITHOUT PRIOR WARNING.  (CORRECT BY INSPECTING, AND REPLACING SHAFT WHERENECESSARY).  PASSENGER VEHICLE.","1977","PONTIAC","GRAND PRIX"
"GENERAL MOTORS CORP.","77V025000",0,0,0,,"16/02/1977","STEERING:LINKAGES:ARM:IDLER AND ATTACHMENT","ON THE INVOLVED VEHICLES, THE INCORRECT STEERING LINKAGE ASSEMBLY MAY HAVE BEEN INSTALLED. AS A RESULT, THE RIGHT-HAND STEERING TIE ROD MIGHT INTERFERE WITH THE INTERMEDIATE ROD. THIS COULD CAUSE THE CONNECTION TO FAIL DUE TO EXCESSIVE STRESS AT THAT POINT.",,"DEALER WILL INSPECT AND, IF NECESSARY, REPLACE THE STEERING LINKAGE ASSEMBLY WITHOUT CHARGE.","VEHICLE DESCRIPTION: PASSENGER VEHICLES.SYSTEM: STEERING; STEERING LINKAGE ASSEMBLY.CONSEQUENCES OF DEFECT: THIS CONDITION COULD CAUSE LOSS OF STEERING CONTROL,AND AN ACCIDENT.","1977","PONTIAC","GRAND PRIX"
"GENERAL MOTORS CORP.","78V138000",0,0,0,,"13/06/1978","POWER TRAIN:AXLE ASSEMBLY:AXLE SHAFT","THE REAR AXLE SHAFTS MAY CONTAIN A FLAW IN THE METAL. THIS FLAW COULD ALLOW THE SHAFT TO BREAK AND THE TIRE AND WHEEL ASSEMBLY TO SEPARATE.",,"THE DEALER WILL REPLACE ONE OR BOTH REAR AXLE SHAFTS, IF NECESSARY, FREE OF CHARGE.","VEHICLE DESCRIPTION: PASSENGER VEHICLES.SYSTEM: SUSPENSION; AXLE/SHAFT.CONSEQUENCES OF DEFECT: SHOULD SEPARATION OCCUR WHILE VEHICLE IS IN MOTION,LOSS OF VEHICLE CONTROL WITHOUT PRIOR WARNING AND AN ACCIDENT COULD RESULT.NOTE: DRIVER SHOULD AVOID FAST CORNERING, RAPID ACCELERATION, OR ANY TYPE OFDRIVING WHICH MAY PRODUCE ABNORMALLY HEAVY LOADS ON THE REAR AXLE SHAFTS UNTILTHE VEHICLE CAN BE INSPECTED.","1977","PONTIAC","LEMANS"
"GENERAL MOTORS CORP.","76V132000",0,0,0,,"07/09/1976","STEERING: STEERING WHEEL/HANDLE BAR",,,,"GENERAL MOTOR CAMPAIGN NO 77-C-1.  POSSIBILITY THAT THE STEERING INTERMEDIATESHAFT MAY HAVE BEEN ASSEMBLED WITH COUPLING RETAINER LOCKING TABS NOT BENT OVERPROPERLY OR ONE OR MORE OF THE LOWER FLEXIBLE COUPLING RIVETS IMPROPERLYPEENED.  IF EITHER OF THESE CONDITIONS EXISTS, THE INTERMEDIATE SHAFT ASSEMBLYCOULD SEPARATE CAUSING LOSS OF STEERING CONTROL, AND VEHICLE CRASH MAY OCCURWITHOUT PRIOR WARNING.  (CORRECT BY INSPECTING, AND REPLACING SHAFT WHERENECESSARY).  PASSENGER VEHICLE.","1977","PONTIAC","LEMANS"
"GENERAL MOTORS CORP.","77V025000",0,0,0,,"16/02/1977","STEERING:LINKAGES:ARM:IDLER AND ATTACHMENT","ON THE INVOLVED VEHICLES, THE INCORRECT STEERING LINKAGE ASSEMBLY MAY HAVE BEEN INSTALLED. AS A RESULT, THE RIGHT-HAND STEERING TIE ROD MIGHT INTERFERE WITH THE INTERMEDIATE ROD. THIS COULD CAUSE THE CONNECTION TO FAIL DUE TO EXCESSIVE STRESS AT THAT POINT.",,"DEALER WILL INSPECT AND, IF NECESSARY, REPLACE THE STEERING LINKAGE ASSEMBLY WITHOUT CHARGE.","VEHICLE DESCRIPTION: PASSENGER VEHICLES.SYSTEM: STEERING; STEERING LINKAGE ASSEMBLY.CONSEQUENCES OF DEFECT: THIS CONDITION COULD CAUSE LOSS OF STEERING CONTROL,AND AN ACCIDENT.","1977","PONTIAC","LEMANS"
"TOYOTA MOTOR CO., LTD.","80V028000",0,0,0,,"18/03/1980","STEERING:GEAR BOX (OTHER THAN RACK AND PINION)","THE LOCK NUT MAY NOT HAVE BEEN TIGHTENED ENOUGH ON THE STEERING GEAR BOX WORM GEAR BEARING AND ADJUSTER. CONSEQUENTLY, THE WORM GEAR ADJUSTER MAY BECOME LOOSE DUE TO EXCESSIVE PRESSURE FROM HARD REPEATED STEERING.",,"DEALER WILL INSPECT THE STEERING GEAR BOX ON THE INVOLVED VEHICLES AND, IF NECESSARY, SECURE THE STEERING GEAR BOX WORM GEAR BEARING AND ADJUSTER TO PREVENT STEERING INSTABILITY.","VEHICLE DESCRIPTION: PASSENGER VEHICLES.SYSTEM: STEERING; STEERING GEAR BOX LOCK NUT.CONSEQUENCES OF DEFECT: THIS CONDITION COULD RESULT IN FREE PLAY OF THESTEERING GEAR, POSSIBLE LOSS OF STEERING CONTROL AND AN ACCIDENT.","1977","TOYOTA","COROLLA"
"VOLVO OF AMERICA CORP.","79V048000",0,0,0,,"13/02/1979","FUEL SYSTEM, GASOLINE:STORAGE:TANK ASSEMBLY","THE INVOLVED VEHICLES CONTAIN A POTENTIALLY DEFECTIVE PRESSURE CONTROL VALVE IN THE EVAPORATIVE EMISSION CONTROL SYSTEM WHICH, THROUGH EXCESS PRESSURE OVER EXTENDED PERIODS, COULD CAUSE METAL FATIGUE AND EVENTUALLY FUEL VAPORS TO BE EMITTED INTO THE ATMOSPHERE THROUGH HAIRLINE CRACKS IN THE FUEL TANK.",,"DEALER WILL INSPECT THE TANK AND MAKE REPLACEMENTS, IF NECESSARY. THE VALVE WILL BE REPLACED TO CORRECT THE EMISSION AND SAFETY-RELATED PROBLEMS. CERTAIN VEHICLES WILL REQUIRE INSTALLATION OF A FILLER INLET FUEL TRAP AND A FEEDER PUMP TO ELIMINATE THE POSSIBILITY OF FUEL SURGE AND VAPOR LOCK.","VEHICLE DESCRIPTION: PASSENGER VEHICLES.SYSTEM: FUEL; FUEL TANK.CONSEQUENCES OF DEFECT: THIS CONDITION CAN LEAD TO A FIRE HAZARD RESULTING IN AVEHICLE ACCIDENT AND SERIOUS PERSONAL INJURY.","1977","VOLVO","244"
"VOLVO OF AMERICA CORP.","78V062000",0,0,0,,"24/03/1978","POWER TRAIN:AXLE ASSEMBLY:AXLE SHAFT","THE REAR WHEEL BEARINGS ON THE INVOLVED VEHICLES, MAY HAVE RECEIVED AN INADEQUATE AMOUNT OF LUBRICATION. THIS CONDITION WOULD INITIALLY CAUSE THE ROLLER BEARINGS TO DEVELOP A RUMBLING NOISE.",,"THE DEALER WILL EITHER LUBRICATE THE BEARINGS OR REPLACE THEM WITH NEW BEARINGS AND SEALS WITH LUBRICATION AT NO CHARGE TO OWNER.","VEHICLE DESCRIPTION: PASSENGER VEHICLES.SYSTEM: SUSPENSION; AXLE, WHEEL BEARINGS.CONSEQUENCES OF DEFECT: IF ALLOWED TO CONTINUE IN THIS CONDITION, THE BEARINGSWILL HEAT UP AND EVENTUALLY SEIZE. THIS MAY LEAD TO THE REAR AXLE SEPARATINGINTO PIECES, THE WHEEL SEPARATING FROM THE VEHICLE, LOSS OF BRAKING CAPABILITY,AND A VEHICLE ACCIDENT.","1977","VOLVO","244"