Manufacturer,NHTSACampaignNumber,parkIt,parkOutSide,overTheAirUpdate,NHTSAActionNumber,ReportReceivedDate,Component,Summary,Consequence,Remedy,Notes,ModelYear,Make,Model
"BEATRICE FOODS COMPANY","84V058000",0,0,0,,"04/05/1984","SERVICE BRAKES, HYDRAULIC:POWER ASSIST:VACUUM","THE BRAKES ARE OPERATED WITH VACUUM ASSISTANCE. THE VACUUM RESERVOIR TANK MAY DEVELOP AIR LEAKS FROM RUST DETERIORATION. THE RUST OCCURS BECAUSE THE POSITION OF THE TANK DOES NOT ALLOW PROPER DRAINAGE.",,"REPLACE RESERVOIR WITH A NEW TANK IF NECESSARY. IN ADDITION, A PROTECTIVE COVER WILL BE PLACED OVER THE BOTTOM OF TANK TO PREVENT RUST FROM OCCURING.","VEHICLE DESCRIPTION: TRAVEL TRAILERS EQUIPPED WITH VACUUM DISC BRAKES.SYSTEM: BRAKES; VACUUM RESERVOIR TANK.CONSEQUENCES OF DEFECT: RUST EVENTUALLY RESULTS IN PIN HOLES IN THE TANK. THERESULTING AIR LEAKS WILL CAUSE THE BREAK-AWAY FEATURE AND RESERVOIR BRAKING TOFAIL. IF THE TOWING VEHICLE""S ENGINE SHOULD STOP WORKING, THE TRAILER COULD NOTBE STOPPED. AN ACCIDENT COULD RESULT WITHOUT PRIOR WARNING.","1977","AIRSTREAM","AIRSTREAM"
"BEATRICE FOODS COMPANY","77V192000",0,0,0,,"25/10/1977","EQUIPMENT:RECREATIONAL VEHICLE/TRAILER:LPG SYSTEMS:TANK ASSEMBLY","THE L.P. GAS BOTTLE HOLD-DOWN ASSEMBLY MAY HAVE BEEN INCORRECTLY INSTALLED ON THE INVOLVED VEHICLES. AS A RESULT, THE L.P. GAS BOTTLES MAY SHAKE LOOSE FROM THE ASSEMBLY AND FALL FROM THE TRAILER FRAME.",,"DEALER WILL INSTALL A NEW STOP PIN TO PROPERLY SECURE THE HOLD-DOWN ASSEMBLY, WITHOUT CHARGE TO OWNER.","VEHICLE DESCRIPTION: TRAVEL TRAILERS.SYSTEM: FUEL; L.P. GAS BOTTLE ASSEMBLY.CONSEQUENCES OF DEFECT: GAS MAY LEAK FROM THE BOTTLE AND, IF AN IGNITION SOURCEIS PRESENT A FIRE COULD START, RESULTING IN FIRE DAMAGE AND, POSSIBLY, AVEHICLE ACCIDENT.","1977","AIRSTREAM","AIRSTREAM"
"VOLKSWAGEN OF AMERICA,INC","83V117000",0,0,0,,"09/11/1983","FUEL SYSTEM, GASOLINE:FUEL INJECTION SYSTEM","THE FUEL PUMP MAY STOP FUNCTIONING WITHOUT WARNING. THIS CAN OCCUR BECAUSE AN ELECTRICAL CONNECTOR IN THE FUSE PANEL MAY OVERHEAT AND INTERRUPT THE ELECTRICAL CIRCUIT.",,"DEALER WILL INSPECT THE FUSE BOX AND ITS CONNECTORS FOR CORROSION, AND CORRECT WHERE NECESSARY. A BYPASS ADAPTER TO THE FUEL PUMP ELECTRICAL CIRCUIT WILL BE INSTALLED.","VEHICLE DESCRIPTION: PASSENGER VEHICLES EQUIPPED WITH FUEL INJECTION.SYSTEM: FUEL SYSTEM; ELECTRIC FUEL PUMP.CONSEQUENCES OF DEFECT: IF THE FUEL PUMP STOPS FUNCTIONING, THE ENGINE WILLSTALL OR FAIL TO START. A STALLED VEHICLE COULD CAUSE AN ACCIDENT ON THEHIGHWAY.","1977","AUDI","FOX"
"GENERAL MOTORS CORP.","76V175000",0,0,0,,"03/11/1976","EXTERIOR LIGHTING:TURN SIGNAL:SWITCH",,,,"GENERAL MOTOR CAMPAIGN NO (CHEVROLET) 77C02 (PONTIAC) 77-C-4 (BUICK) 77-C-5.POSSIBILITY THAT THE TURN SIGNAL OPERATING UNIT OR VEHICLES WITH TILT STEERINGCOLUMNS MAY NOT COMPLY WITH FEDERAL MOTOR VEHICLE SAFETY STANDARD NO.  108.THE TURN SIGNAL LEVER ACTUATOR PIVOT PIN WHICH MAY WORK OUT OF THE PIVOT,RESULTING IN NOT BEING ABLE TO USE TURN SIGNAL TO ALERT OTHER DRIVERS OF YOURINTENTIONS TO CHANGE LANES OR TURN, CAUSING POSSIBLE VEHICLE CRASH.  (CORRECTBY INSPECTING AND INSTALLING A RETAINER TO PRECLUDE PIVOT PIN DISENGAGEMENT).PASSENGER VEHICLE.","1977","BUICK","LESABRE"
"GENERAL MOTORS CORP.","76V132000",0,0,0,,"07/09/1976","STEERING: STEERING WHEEL/HANDLE BAR",,,,"GENERAL MOTOR CAMPAIGN NO 77-C-1.  POSSIBILITY THAT THE STEERING INTERMEDIATESHAFT MAY HAVE BEEN ASSEMBLED WITH COUPLING RETAINER LOCKING TABS NOT BENT OVERPROPERLY OR ONE OR MORE OF THE LOWER FLEXIBLE COUPLING RIVETS IMPROPERLYPEENED.  IF EITHER OF THESE CONDITIONS EXISTS, THE INTERMEDIATE SHAFT ASSEMBLYCOULD SEPARATE CAUSING LOSS OF STEERING CONTROL, AND VEHICLE CRASH MAY OCCURWITHOUT PRIOR WARNING.  (CORRECT BY INSPECTING, AND REPLACING SHAFT WHERENECESSARY).  PASSENGER VEHICLE.","1977","BUICK","LESABRE"
"GENERAL MOTORS CORP.","77V012000",0,0,0,,"01/01/1977","STEERING:LINKAGES","ON THE INVOLVED VEHICLES, THE COTTER PIN MAY HAVE BEEN OMITTED AND THE RETAINING NUT IMPROPERLY SECURED. CONSEQUENTLY, THE STEERING LINKAGE COULD DETACH FROM THE PITMAN ARM.",,"THE DEALER WILL TIGHTEN THE ATTACHING NUT TO SPECIFICATIONS AND INSTALL A COTTER PIN, WITHOUT CHARGE TO OWNER.","VEHICLE DESCRIPTION: PASSENGER VEHICLES.SYSTEM: STEERING; STEERING ASSEMBLY.CONSEQUENCES OF DEFECT: LOSS OF STEERING CONTROL COULD OCCUR AND RESULT IN LOSSOF VEHICLE CONTROL AND AN ACCIDENT.","1977","BUICK","LESABRE"
"GENERAL MOTORS CORP.","78V189000",0,0,0,,"30/08/1978","UNKNOWN OR OTHER","IF PAPER OR OTHER COMBUSTIBLE MATERIALS ARE PLACED IN THE INSTRUMENT PANEL ASHTRAY RECEPTACLE, THEY COULD BECOME IGNITED AND FLAMES FROM THE FIRE MAY REACH THE INTERIOR OF THE INSTRUMENT PANEL.",,"OWNER WILL BE SENT A METAL HEAT SHIELD TO BE INSTALLED ABOVE THE INSTRUMENT PANEL, EITHER BY THE OWNER OR BY THE DEALER.","VEHICLE DESCRIPTION: PASSENGER VEHICLES.SYSTEM: INTERIOR; INSTRUMENT PANEL.CONSEQUENCES OF DEFECT: THIS COULD CAUSE A VEHICLE FIRE AND PASSENGER INJURIESDUE TO FIRE AND SMOKE INHALATION.","1977","CADILLAC","DEVILLE"
"GENERAL MOTORS CORP.","79V111000",0,0,0,,"04/05/1979","VEHICLE SPEED CONTROL:ACCELERATOR PEDAL","THE INVOLVED VEHICLES WERE BUILT WITH AN ACCELERATOR PEDAL HAVING AN EXTENSION, OR RUBBER FLAP, AT THE BOTTOM OF THE PEDAL. THIS PEDAL FLAP COULD BE INADVERTENTLY DISPLACED BY A FLOOR COVERING AND WEDGED UNDER THE ACCELERATOR PEDAL IN A MANNER THAT CAN INFLUENCE THE THROTTLE SETTING AND INCREASE THE ENGINE IDLE RPM.",,"THE DEALER WILL REMOVE THE RUBBER FLAP FROM THE ACCELERATOR.","VEHICLE DESCRIPTION: PASSENGER VEHICLES EQUIPPED WITH CARBURETED ENGINES.SYSTEM: THROTTLE LINKAGES AND CONTROL; PEDAL.CONSEQUENCES OF DEFECT: IF THIS CONDITION WERE TO OCCUR, THE INCREASED ENGINESPEED COULD PRODUCE AN ACCELERATION RATE UNANTICIPATED BY THE OPERATOR. AVEHICLE ACCIDENT COULD RESULT.","1977","CADILLAC","DEVILLE"
"HONEYWELL INTERNATIONAL, INC.","07E088000",0,0,0,,"24/10/2007","EQUIPMENT","CERTAIN HONEYWELL FRAM RACING BRAND HP4 AND HP8 OIL FILTERS THAT WERE MANUFACTURED FROM MAY 25, 2006, THROUGH SEPTEMBER 14, 2007, AND SOLD FOR USE AS REPLACEMENT EQUIPMENT FOR VEHICLES LIST ABOVE.  THE AFFECTED FILTERS ARE MARKED WITH A DATE CODE A61451 THROUGH A72571 SEQUENTIALLY.  THE DATE CODE AND PART NUMBER APPEAR ON THE FILTER HOUSING.  FRAM RACING HP4 AND HP8 OIL FILTERS NOT BEARING A DATE CODE IN THIS RANGE ARE NOT AFFECTED BY THIS RECALL.  THE GASKET OF THE OIL FILTER BECOMES MORE PLIABLE UNDER HIGH TEMPERATURES AND PRESSURES.","THIS CONDITION MAY CAUSE INADEQUATE SEALING AND LOSS OF ENGINE OIL, POSSIBLY RESULTING IN A FIRE.","HONEYWELL WILL REPLACE THE AFFECTED OIL FILTERS FREE OF CHARGE.  THE RECALL BEGAN DURING NOVEMBER 2007.  OWNERS CAN CONTACT FRAM CUSTOMER SERVICE TOLL-FREE AT 1-800-890-2075.","CUSTOMERS MAY CONTACT THE NATIONAL HIGHWAY TRAFFIC SAFETY ADMINISTRATION'S VEHICLE SAFETY HOTLINE AT 1-888-327-4236 (TTY: 1-800-424-9153); OR GO TO HTTP://WWW.SAFERCAR.GOV.","1977","CHEVROLET","BLAZER"
"HONEYWELL INTERNATIONAL, INC.","07E088000",0,0,0,,"24/10/2007","EQUIPMENT","CERTAIN HONEYWELL FRAM RACING BRAND HP4 AND HP8 OIL FILTERS THAT WERE MANUFACTURED FROM MAY 25, 2006, THROUGH SEPTEMBER 14, 2007, AND SOLD FOR USE AS REPLACEMENT EQUIPMENT FOR VEHICLES LIST ABOVE.  THE AFFECTED FILTERS ARE MARKED WITH A DATE CODE A61451 THROUGH A72571 SEQUENTIALLY.  THE DATE CODE AND PART NUMBER APPEAR ON THE FILTER HOUSING.  FRAM RACING HP4 AND HP8 OIL FILTERS NOT BEARING A DATE CODE IN THIS RANGE ARE NOT AFFECTED BY THIS RECALL.  THE GASKET OF THE OIL FILTER BECOMES MORE PLIABLE UNDER HIGH TEMPERATURES AND PRESSURES.","THIS CONDITION MAY CAUSE INADEQUATE SEALING AND LOSS OF ENGINE OIL, POSSIBLY RESULTING IN A FIRE.","HONEYWELL WILL REPLACE THE AFFECTED OIL FILTERS FREE OF CHARGE.  THE RECALL BEGAN DURING NOVEMBER 2007.  OWNERS CAN CONTACT FRAM CUSTOMER SERVICE TOLL-FREE AT 1-800-890-2075.","CUSTOMERS MAY CONTACT THE NATIONAL HIGHWAY TRAFFIC SAFETY ADMINISTRATION'S VEHICLE SAFETY HOTLINE AT 1-888-327-4236 (TTY: 1-800-424-9153); OR GO TO HTTP://WWW.SAFERCAR.GOV.","1977","CHEVROLET","C10"
"GENERAL MOTORS CORP.","77V171000",0,0,0,,"12/10/1977","SUSPENSION:FRONT","THE INVOLVED VEHICLES WERE ASSEMBLED WITH A STANDARD FRONT SUSPENSION ASSEMBLY, INSTEAD OF THE SPECIFIED HEAVY-DUTY FRONT SUSPENSION. OPERATION OF VEHICLE WHILE CARRYING THE MAXIMUM RATED LOAD MAY LEAD TO DETERIORATION AND EVENTUAL FAILURE OF FRONT SUSPENSION COMPONENTS.",,"DEALER WILL INSTALL THE PROPER FRONT SUSPENSION COMPONENTS WITHOUT CHARGE TO OWNER.","VEHICLE DESCRIPTION: LIGHT TRUCKS EQUIPPED WITH RPO F44 AND F60 HEAVY CHASSISEQUIPMENT AND SPRINGS.SYSTEM: SUSPENSION; FRONT SUSPENSION.CONSEQUENCES OF DEFECT: FAILURE OF THE FRONT SUSPENSION COULD CAUSE LOSS OFSTEERING CONTROL WITHOUT PRIOR WARNING, AND AN ACCIDENT.","1977","CHEVROLET","C10"
"GENERAL MOTORS CORP.","77V178000",0,0,0,,"14/10/1977","VEHICLE SPEED CONTROL:ACCELERATOR PEDAL","THE ACCELERATOR PEDAL ROD IN COMBINATION WITH THE PEDAL INSTALLED ON THE INVOLVED VEHICLES MAY CUT THROUGH THE FLOOR PAN RUBBER MAT OR CARPET INTO THE THICK RESILIENT INSULATION PAD UNDERNEATH DURING HEAVY OR REPEATED FULL THROTTLE APPLICATIONS. AS A RESULT, THE ACCELERATOR PEDAL ROD MAY CATCH IN THE MAT OR CARPET, PREVENTING THE THROTTLE FROM RETURNING TO IDLE WHEN THE DRIVER""S FOOT IS REMOVED FROM THE PEDAL.",,"DEALER WILL INSTALL A NEW ACCELERATOR PEDAL AND RETAINER DESIGNED TO PREVENT THE ACCELERATOR PEDAL ROD FROM CUTTING THE RUBBER MAT OR CARPET. THIS WILL BE PERFORMED WITHOUT CHARGE.","VEHICLE DESCRIPTION: LIGHT TRUCKS.SYSTEM: THROTTLE LINKAGES AND CONTROL; ACCELERATOR PEDAL ROD.CONSEQUENCES OF DEFECT: IN THE EVENT THAT THE THROTTLE DOES NOT RETURN TO IDLE,THE VEHICLE WOULD NOT DECELERATE AS EXPECTED AND LOSS OF VEHICLE CONTROL AND ANACCIDENT COULD RESULT.","1977","CHEVROLET","C10"
"HONEYWELL INTERNATIONAL, INC.","07E088000",0,0,0,,"24/10/2007","EQUIPMENT","CERTAIN HONEYWELL FRAM RACING BRAND HP4 AND HP8 OIL FILTERS THAT WERE MANUFACTURED FROM MAY 25, 2006, THROUGH SEPTEMBER 14, 2007, AND SOLD FOR USE AS REPLACEMENT EQUIPMENT FOR VEHICLES LIST ABOVE.  THE AFFECTED FILTERS ARE MARKED WITH A DATE CODE A61451 THROUGH A72571 SEQUENTIALLY.  THE DATE CODE AND PART NUMBER APPEAR ON THE FILTER HOUSING.  FRAM RACING HP4 AND HP8 OIL FILTERS NOT BEARING A DATE CODE IN THIS RANGE ARE NOT AFFECTED BY THIS RECALL.  THE GASKET OF THE OIL FILTER BECOMES MORE PLIABLE UNDER HIGH TEMPERATURES AND PRESSURES.","THIS CONDITION MAY CAUSE INADEQUATE SEALING AND LOSS OF ENGINE OIL, POSSIBLY RESULTING IN A FIRE.","HONEYWELL WILL REPLACE THE AFFECTED OIL FILTERS FREE OF CHARGE.  THE RECALL BEGAN DURING NOVEMBER 2007.  OWNERS CAN CONTACT FRAM CUSTOMER SERVICE TOLL-FREE AT 1-800-890-2075.","CUSTOMERS MAY CONTACT THE NATIONAL HIGHWAY TRAFFIC SAFETY ADMINISTRATION'S VEHICLE SAFETY HOTLINE AT 1-888-327-4236 (TTY: 1-800-424-9153); OR GO TO HTTP://WWW.SAFERCAR.GOV.","1977","CHEVROLET","C30"
"GENERAL MOTORS CORP.","77V119000",0,0,0,,"10/08/1977","SERVICE BRAKES, HYDRAULIC:POWER ASSIST:VACUUM","ON THE INVOLVED VEHICLES, THE NUTS WHICH ATTACH THE BRAKE MASTER CYLINDER TO THE HYDRO-BOOST UNIT MAY HAVE BEEN OVER-TIGHTENED. THIS COULD HAVE CAUSED STRIPPED THREADS AND CRACKED ATTACHING FLANGES. SHOULD THESE NUTS FAIL, THE PARTS MAY SEPARATE AND LOSS OF SERVICE BRAKES WOULD RESULT.",,"DEALER WILL INSPECT FOR CRACKS IN THE ATTACHING FLANGES; UNITS WITH CRACKS PRESENT WILL BE REPLACED. IF NO CRACKS ARE FOUND, THE STUDS WILL BE REMOVED AND THE HOLES DRILLED OUT. THE UNIT WILL BE REASSEMBLED USING BOLTS AND NUTS IN PLACE OF THE EXISTING STUDS.","VEHICLE DESCRIPTION: LIGHT TRUCKS.SYSTEM: SERVICE BRAKES; MASTER CYLINDER TO HYDRO-BOOST UNIT ATTACHING NUTS.CONSEQUENCES OF DEFECT: LOSS OF BRAKING CAPABILITY COULD OCCUR WITHOUT PRIORWARNING AND COULD CAUSE LOSS OF VEHICLE CONTROL AND AN ACCIDENT.","1977","CHEVROLET","C30"
"GENERAL MOTORS CORP.","77V178000",0,0,0,,"14/10/1977","VEHICLE SPEED CONTROL:ACCELERATOR PEDAL","THE ACCELERATOR PEDAL ROD IN COMBINATION WITH THE PEDAL INSTALLED ON THE INVOLVED VEHICLES MAY CUT THROUGH THE FLOOR PAN RUBBER MAT OR CARPET INTO THE THICK RESILIENT INSULATION PAD UNDERNEATH DURING HEAVY OR REPEATED FULL THROTTLE APPLICATIONS. AS A RESULT, THE ACCELERATOR PEDAL ROD MAY CATCH IN THE MAT OR CARPET, PREVENTING THE THROTTLE FROM RETURNING TO IDLE WHEN THE DRIVER""S FOOT IS REMOVED FROM THE PEDAL.",,"DEALER WILL INSTALL A NEW ACCELERATOR PEDAL AND RETAINER DESIGNED TO PREVENT THE ACCELERATOR PEDAL ROD FROM CUTTING THE RUBBER MAT OR CARPET. THIS WILL BE PERFORMED WITHOUT CHARGE.","VEHICLE DESCRIPTION: LIGHT TRUCKS.SYSTEM: THROTTLE LINKAGES AND CONTROL; ACCELERATOR PEDAL ROD.CONSEQUENCES OF DEFECT: IN THE EVENT THAT THE THROTTLE DOES NOT RETURN TO IDLE,THE VEHICLE WOULD NOT DECELERATE AS EXPECTED AND LOSS OF VEHICLE CONTROL AND ANACCIDENT COULD RESULT.","1977","CHEVROLET","C30"
"HONEYWELL INTERNATIONAL, INC.","07E088000",0,0,0,,"24/10/2007","EQUIPMENT","CERTAIN HONEYWELL FRAM RACING BRAND HP4 AND HP8 OIL FILTERS THAT WERE MANUFACTURED FROM MAY 25, 2006, THROUGH SEPTEMBER 14, 2007, AND SOLD FOR USE AS REPLACEMENT EQUIPMENT FOR VEHICLES LIST ABOVE.  THE AFFECTED FILTERS ARE MARKED WITH A DATE CODE A61451 THROUGH A72571 SEQUENTIALLY.  THE DATE CODE AND PART NUMBER APPEAR ON THE FILTER HOUSING.  FRAM RACING HP4 AND HP8 OIL FILTERS NOT BEARING A DATE CODE IN THIS RANGE ARE NOT AFFECTED BY THIS RECALL.  THE GASKET OF THE OIL FILTER BECOMES MORE PLIABLE UNDER HIGH TEMPERATURES AND PRESSURES.","THIS CONDITION MAY CAUSE INADEQUATE SEALING AND LOSS OF ENGINE OIL, POSSIBLY RESULTING IN A FIRE.","HONEYWELL WILL REPLACE THE AFFECTED OIL FILTERS FREE OF CHARGE.  THE RECALL BEGAN DURING NOVEMBER 2007.  OWNERS CAN CONTACT FRAM CUSTOMER SERVICE TOLL-FREE AT 1-800-890-2075.","CUSTOMERS MAY CONTACT THE NATIONAL HIGHWAY TRAFFIC SAFETY ADMINISTRATION'S VEHICLE SAFETY HOTLINE AT 1-888-327-4236 (TTY: 1-800-424-9153); OR GO TO HTTP://WWW.SAFERCAR.GOV.","1977","CHEVROLET","CAPRICE"
"GENERAL MOTORS CORP.","79V161000",0,0,0,,"02/07/1979","LATCHES/LOCKS/LINKAGES:DOORS:LATCH","A CHILD COULD OPEN THE REAR SIDE COMPARTMENT DOOR AND ENTER THIS COMPARTMENT. THE CHILD COULD BECOME ENTRAPPED IF THE DOOR WERE TO CLOSE, AS IT CANNOT BE UNLATCHED FROM THE INSIDE.",,"DEALER WILL REPLACE THE ORIGINAL COMPARTMENT DOOR LATCH, WHICH CAN BE LATCHED WITHOUT A KEY, WITH A NEW ASSEMBLY THAT REQUIRES A KEY TO LATCH AS WELL AS LOCK THE DOOR.","VEHICLE DESCRIPTION: PASSENGER VEHICLES.SYSTEM: STRUCTURE; STORAGE COMPARTMENT.CONSEQUENCES OF DEFECT: IN THE ABSENCE OF OUTSIDE HELP, THE CHILD WOULDSUFFOCATE.NOTE: THE OWNER IS ADVISED TO KEEP THIS COMPARTMENT LOCKED EXCEPT WHILE EITHERLOADING OR UNLOADING IT.","1977","CHEVROLET","CAPRICE"
"GENERAL MOTORS CORP.","76V175000",0,0,0,,"03/11/1976","EXTERIOR LIGHTING:TURN SIGNAL:SWITCH",,,,"GENERAL MOTOR CAMPAIGN NO (CHEVROLET) 77C02 (PONTIAC) 77-C-4 (BUICK) 77-C-5.POSSIBILITY THAT THE TURN SIGNAL OPERATING UNIT OR VEHICLES WITH TILT STEERINGCOLUMNS MAY NOT COMPLY WITH FEDERAL MOTOR VEHICLE SAFETY STANDARD NO.  108.THE TURN SIGNAL LEVER ACTUATOR PIVOT PIN WHICH MAY WORK OUT OF THE PIVOT,RESULTING IN NOT BEING ABLE TO USE TURN SIGNAL TO ALERT OTHER DRIVERS OF YOURINTENTIONS TO CHANGE LANES OR TURN, CAUSING POSSIBLE VEHICLE CRASH.  (CORRECTBY INSPECTING AND INSTALLING A RETAINER TO PRECLUDE PIVOT PIN DISENGAGEMENT).PASSENGER VEHICLE.","1977","CHEVROLET","CAPRICE"
"GENERAL MOTORS CORP.","76V132000",0,0,0,,"07/09/1976","STEERING: STEERING WHEEL/HANDLE BAR",,,,"GENERAL MOTOR CAMPAIGN NO 77-C-1.  POSSIBILITY THAT THE STEERING INTERMEDIATESHAFT MAY HAVE BEEN ASSEMBLED WITH COUPLING RETAINER LOCKING TABS NOT BENT OVERPROPERLY OR ONE OR MORE OF THE LOWER FLEXIBLE COUPLING RIVETS IMPROPERLYPEENED.  IF EITHER OF THESE CONDITIONS EXISTS, THE INTERMEDIATE SHAFT ASSEMBLYCOULD SEPARATE CAUSING LOSS OF STEERING CONTROL, AND VEHICLE CRASH MAY OCCURWITHOUT PRIOR WARNING.  (CORRECT BY INSPECTING, AND REPLACING SHAFT WHERENECESSARY).  PASSENGER VEHICLE.","1977","CHEVROLET","CAPRICE"
"GENERAL MOTORS CORP.","79V198000",0,0,0,,"07/09/1979","WHEELS","THE INVOLVED VEHICLES FAIL TO CONFORM TO FEDERAL MOTOR VEHICLE SAFETY STANDARD NO. 120, ""TIRE SELECTION AND RIMS FOR VEHICLES OTHER THAN PASSENGER CARS"". SOME OF THE TIRES (ALCOA TUBE TYPE) WERE IMPROPERLY MARKED 22.5 X 7.5/5 WHEN THEY WERE MEANT TO BE 22 X 7.5/5.",,"THE DEALER WILL INSPECT AND REPLACE IMPROPERLY MARKED FRONT ALUMINUM WHEELS WITH CORRECTLY MARKED WHEELS, WITHOUT CHARGE.","VEHICLE DESCRIPTION: TRUCKS, HEAVY.SYSTEM: WHEELS; TIRE AND RIM MARKINGS.CONSEQUENCES OF DEFECT: INCORRECT INFORMATION MAY LEAD TO MISMATCHING ANDMISAPPLICATION DURING TIRE INSTALLATION. THIS WOULD CREATE AN UNSAFE CONDITIONTHAT COULD LEAD TO A VEHICLE ACCIDENT.","1977","CHEVROLET","CHEVROLET TRUCK"
"HONEYWELL INTERNATIONAL, INC.","07E088000",0,0,0,,"24/10/2007","EQUIPMENT","CERTAIN HONEYWELL FRAM RACING BRAND HP4 AND HP8 OIL FILTERS THAT WERE MANUFACTURED FROM MAY 25, 2006, THROUGH SEPTEMBER 14, 2007, AND SOLD FOR USE AS REPLACEMENT EQUIPMENT FOR VEHICLES LIST ABOVE.  THE AFFECTED FILTERS ARE MARKED WITH A DATE CODE A61451 THROUGH A72571 SEQUENTIALLY.  THE DATE CODE AND PART NUMBER APPEAR ON THE FILTER HOUSING.  FRAM RACING HP4 AND HP8 OIL FILTERS NOT BEARING A DATE CODE IN THIS RANGE ARE NOT AFFECTED BY THIS RECALL.  THE GASKET OF THE OIL FILTER BECOMES MORE PLIABLE UNDER HIGH TEMPERATURES AND PRESSURES.","THIS CONDITION MAY CAUSE INADEQUATE SEALING AND LOSS OF ENGINE OIL, POSSIBLY RESULTING IN A FIRE.","HONEYWELL WILL REPLACE THE AFFECTED OIL FILTERS FREE OF CHARGE.  THE RECALL BEGAN DURING NOVEMBER 2007.  OWNERS CAN CONTACT FRAM CUSTOMER SERVICE TOLL-FREE AT 1-800-890-2075.","CUSTOMERS MAY CONTACT THE NATIONAL HIGHWAY TRAFFIC SAFETY ADMINISTRATION'S VEHICLE SAFETY HOTLINE AT 1-888-327-4236 (TTY: 1-800-424-9153); OR GO TO HTTP://WWW.SAFERCAR.GOV.","1977","CHEVROLET","CORVETTE"
"CARDONE INDUSTRIES, INC.","03E032000",0,0,0,,"12/05/2003","SERVICE BRAKES, AIR:DISC:CALIPER","REMANUFACTURERD REAR BRAKE CALIPERS, PART NOS. 18-7019, 18-7020, 16-7019, AND 16-7020, MANUFACTURED FROM FEBRUARY 1, 2002, TO APRIL, 25, 2003., AND FOR USE ON 1965 THRU 1982 CHEVROLET CORVETTES.  THE SUBJECT BRAKE CALIPERS WERE MANUFACTURED USING IMPROPERLY MANUFACTURED PISTON SEALS.  THESE SEALS ARE INTENDED TO PREVENT FLUID LEAKAGE BETWEEN THE CALIPER HOUSING AND THE PISTONS.  THESE BRAKE CALIPERS ARE FOR USE ONLY ON 1965 THRU 1982 CHEVROLET CORVETTE VEHICLES.  THIS RECALL DOES NOT INVOLVE GENERAL MOTORS CORPORATION OR ANY OF ITS PRODUCTS.","UNDER THESE CONDITIONS, THE VEHICLE OPERATOR MAY NOT BE ABLE TO STOP THE CAR, POSSIBLY RESULTING IN A VEHICLE CRASH.","CARDONE WILL NOTIFY ITS CUSTOMERS AND ALL UNSOLD INVENTORY WILL BE REPURCHASED AND WILL PROVIDE A FULL REFUND TO CUSTOMERS.
OWNER NOTIFICATION IS EXPECTED TO BEGIN DURING MAY 2003.  OWNERS WHO TAKE THEIR VEHICLES TO AN AUTHORIZED DEALER ON AN AGREED UPON SERVICE DATE AND DO NOT RECEIVE THE FREE REMEDY WITHIN A REASONABLE TIME SHOULD CONTACT CARDONE AT 215-912-3000.","ALSO, CUSTOMERS CAN CONTACT THE NATIONAL HIGHWAY TRAFFIC SAFETY ADMINISTRATION'S AUTO SAFETY HOTLINE AT 1-888-DASH-2-DOT (1-888-327-4236).","1977","CHEVROLET","CORVETTE"
"GENERAL MOTORS CORP.","77V115000",0,0,0,,"28/07/1977","ELECTRICAL SYSTEM:HORN","THE INVOLVED VEHICLES HAVE STEERING WHEEL CENTER HUBS WHICH FAIL TO CONFORM TO FEDERAL MOTOR VEHICLE SAFETY STANDARD NO. 107, ""REFLECTING SURFACES"". THE HORN BUTTON CAP AND THE LOCK LEVER HAVE A BRUSHED CHROME FINISH. THE SURFACE REFLECTIVITY OF THIS FINISH ON SOME OF THESE HORN BUTTON CAPS AND LOCK LEVERS IS APPROXIMATELY TWICE THE MAXIMUM REFLECTIVITY ALLOWED BY THE STANDARD.",,"DEALER WILL REPLACE THE CAP AND LEVER WITH PARTS PAINTED TO MATCH THE INTERIOR TRIM COLOR AT NO COST TO OWNER.","VEHICLE DESCRIPTION: PASSENGER VEHICLES EQUIPPED WITH TILT TELESCOPING STEERINGASSEMBLY.SYSTEM: STEERING; STEERING WHEEL CENTER HUB.CONSEQUENCES OF DEFECT: IF THE DRIVER DOES NOT TAKE STEPS TO ALLEVIATE THEDISTRACTION OF LIGHT REFLECTING OFF THE STEERING WHEEL HUB, THIS COULD LEAD TOAN ACCIDENT.","1977","CHEVROLET","CORVETTE"
"GENERAL MOTORS CORP.","79V161000",0,0,0,,"02/07/1979","LATCHES/LOCKS/LINKAGES:DOORS:LATCH","A CHILD COULD OPEN THE REAR SIDE COMPARTMENT DOOR AND ENTER THIS COMPARTMENT. THE CHILD COULD BECOME ENTRAPPED IF THE DOOR WERE TO CLOSE, AS IT CANNOT BE UNLATCHED FROM THE INSIDE.",,"DEALER WILL REPLACE THE ORIGINAL COMPARTMENT DOOR LATCH, WHICH CAN BE LATCHED WITHOUT A KEY, WITH A NEW ASSEMBLY THAT REQUIRES A KEY TO LATCH AS WELL AS LOCK THE DOOR.","VEHICLE DESCRIPTION: PASSENGER VEHICLES.SYSTEM: STRUCTURE; STORAGE COMPARTMENT.CONSEQUENCES OF DEFECT: IN THE ABSENCE OF OUTSIDE HELP, THE CHILD WOULDSUFFOCATE.NOTE: THE OWNER IS ADVISED TO KEEP THIS COMPARTMENT LOCKED EXCEPT WHILE EITHERLOADING OR UNLOADING IT.","1977","CHEVROLET","IMPALA"
"GENERAL MOTORS CORP.","76V175000",0,0,0,,"03/11/1976","EXTERIOR LIGHTING:TURN SIGNAL:SWITCH",,,,"GENERAL MOTOR CAMPAIGN NO (CHEVROLET) 77C02 (PONTIAC) 77-C-4 (BUICK) 77-C-5.POSSIBILITY THAT THE TURN SIGNAL OPERATING UNIT OR VEHICLES WITH TILT STEERINGCOLUMNS MAY NOT COMPLY WITH FEDERAL MOTOR VEHICLE SAFETY STANDARD NO.  108.THE TURN SIGNAL LEVER ACTUATOR PIVOT PIN WHICH MAY WORK OUT OF THE PIVOT,RESULTING IN NOT BEING ABLE TO USE TURN SIGNAL TO ALERT OTHER DRIVERS OF YOURINTENTIONS TO CHANGE LANES OR TURN, CAUSING POSSIBLE VEHICLE CRASH.  (CORRECTBY INSPECTING AND INSTALLING A RETAINER TO PRECLUDE PIVOT PIN DISENGAGEMENT).PASSENGER VEHICLE.","1977","CHEVROLET","IMPALA"
"GENERAL MOTORS CORP.","76V132000",0,0,0,,"07/09/1976","STEERING: STEERING WHEEL/HANDLE BAR",,,,"GENERAL MOTOR CAMPAIGN NO 77-C-1.  POSSIBILITY THAT THE STEERING INTERMEDIATESHAFT MAY HAVE BEEN ASSEMBLED WITH COUPLING RETAINER LOCKING TABS NOT BENT OVERPROPERLY OR ONE OR MORE OF THE LOWER FLEXIBLE COUPLING RIVETS IMPROPERLYPEENED.  IF EITHER OF THESE CONDITIONS EXISTS, THE INTERMEDIATE SHAFT ASSEMBLYCOULD SEPARATE CAUSING LOSS OF STEERING CONTROL, AND VEHICLE CRASH MAY OCCURWITHOUT PRIOR WARNING.  (CORRECT BY INSPECTING, AND REPLACING SHAFT WHERENECESSARY).  PASSENGER VEHICLE.","1977","CHEVROLET","IMPALA"
"GENERAL MOTORS CORP.","77V178000",0,0,0,,"14/10/1977","VEHICLE SPEED CONTROL:ACCELERATOR PEDAL","THE ACCELERATOR PEDAL ROD IN COMBINATION WITH THE PEDAL INSTALLED ON THE INVOLVED VEHICLES MAY CUT THROUGH THE FLOOR PAN RUBBER MAT OR CARPET INTO THE THICK RESILIENT INSULATION PAD UNDERNEATH DURING HEAVY OR REPEATED FULL THROTTLE APPLICATIONS. AS A RESULT, THE ACCELERATOR PEDAL ROD MAY CATCH IN THE MAT OR CARPET, PREVENTING THE THROTTLE FROM RETURNING TO IDLE WHEN THE DRIVER""S FOOT IS REMOVED FROM THE PEDAL.",,"DEALER WILL INSTALL A NEW ACCELERATOR PEDAL AND RETAINER DESIGNED TO PREVENT THE ACCELERATOR PEDAL ROD FROM CUTTING THE RUBBER MAT OR CARPET. THIS WILL BE PERFORMED WITHOUT CHARGE.","VEHICLE DESCRIPTION: LIGHT TRUCKS.SYSTEM: THROTTLE LINKAGES AND CONTROL; ACCELERATOR PEDAL ROD.CONSEQUENCES OF DEFECT: IN THE EVENT THAT THE THROTTLE DOES NOT RETURN TO IDLE,THE VEHICLE WOULD NOT DECELERATE AS EXPECTED AND LOSS OF VEHICLE CONTROL AND ANACCIDENT COULD RESULT.","1977","CHEVROLET","K10"
"GENERAL MOTORS CORP.","77V040000",0,0,0,,"22/03/1977","WHEELS:HUBCAP/COVER","THE WHEELS ON THE INVOLVED VEHICLES MAY BE EQUIPPED WITH AN IMPROPERLY FORMED SPIDER IN THE AREA WHERE THE SPIDER ATTACHES TO THE RIM. CONSEQUENTLY, THE CENTER SECTION OF THE WHEEL MAY DEVELOP CRACKS AND SEPARATE FROM THE WHEEL RIM.",,"THE DEALER WILL REPLACE ALL DEFECTIVE WHEELS, FREE OF CHARGE.","VEHICLE DESCRIPTION: LIGHT TRUCKS.SYSTEM: SUSPENSION; WHEELS, DISC SPIDER.CONSEQUENCES OF DEFECT: SHOULD SEPARATION OCCUR DURING VEHICLE OPERATION, LOSSOF VEHICLE CONTROL AND AN ACCIDENT COULD RESULT.","1977","CHEVROLET","K10"
"CHRYSLER CORPORATION","80V027000",0,0,0,,"14/03/1980","STRUCTURE:FRAME AND MEMBERS","THE FRONT RAIL EXTENSION MAY EXPERIENCE FATIGUE CRACKING NEAR THE AREA WHERE THE POWER STEERING GEAR ATTACHES TO THE FRAME. IF THE CRACK PROGRESSES THROUGH MOST OR ALL OF THE RAIL SECTION, STEERING SYSTEM FREE PLAY ACCOMPANIED BY METALLIC RATTLE NOISE WILL BE EXPERIENCED.",,"AFFECTED VEHICLES WILL BE WELD REPAIRED AND A REINFORCEMENT ROD WILL BE INSTALLED OVER THE CRACKED AREA.","VEHICLE DESCRIPTION: LIGHT TRUCKS.SYSTEM: STRUCTURE; LEFT FRONT FRAME RAIL.CONSEQUENCES OF DEFECT: THE CRACK CONDITION MAY CAUSE A COMPLETE LOSS OFSTEERING AND AN ACCIDENT.","1977","DODGE","B100"
"CHRYSLER CORPORATION","80V027000",0,0,0,,"14/03/1980","STRUCTURE:FRAME AND MEMBERS","THE FRONT RAIL EXTENSION MAY EXPERIENCE FATIGUE CRACKING NEAR THE AREA WHERE THE POWER STEERING GEAR ATTACHES TO THE FRAME. IF THE CRACK PROGRESSES THROUGH MOST OR ALL OF THE RAIL SECTION, STEERING SYSTEM FREE PLAY ACCOMPANIED BY METALLIC RATTLE NOISE WILL BE EXPERIENCED.",,"AFFECTED VEHICLES WILL BE WELD REPAIRED AND A REINFORCEMENT ROD WILL BE INSTALLED OVER THE CRACKED AREA.","VEHICLE DESCRIPTION: LIGHT TRUCKS.SYSTEM: STRUCTURE; LEFT FRONT FRAME RAIL.CONSEQUENCES OF DEFECT: THE CRACK CONDITION MAY CAUSE A COMPLETE LOSS OFSTEERING AND AN ACCIDENT.","1977","DODGE","B200"
"CHRYSLER CORPORATION","78V271000",0,0,0,,"29/12/1978","EQUIPMENT:OTHER:LABELS","THE INVOLVED VEHICLES FAIL TO COMPLY WITH THE REQUIREMENTS OF FEDERAL MOTOR VEHICLE SAFETY STANDARD NO. 105, ""HYDRAULIC BRAKE SYSTEMS"". THIS REQUIRES THAT SCHOOL BUSES HAVE A BRAKE FLUID WARNING STATEMENT LOCATED ON OR WITHIN FOUR INCHES OF THE BRAKE FLUID RESERVOIR FILLER CAP.",,"CORRECTIVE ACTION: THE OWNER WILL BE PROVIDED WITH THE PROPER LABEL AND MAY INSTALL IT HIMSELF OR HAVE IT DONE BY THE DEALER.","VEHICLE DESCRIPTION: COMPACT TRUCKS EQUIPPED WITH SCHOOL BUS PACKAGE.SYSTEM: EQUIPMENT; BRAKE FLUID LABELS.CONSEQUENCES OF DEFECT: THIS LABEL PROVIDES IMPORTANT INFORMATION CONCERNINGRESERVOIR MAINTENANCE. LACK OF SUCH INFORMATION COULD LEAD TO UNSAFE VEHICLEOPERATION.","1977","DODGE","B300 MAXIVAN"
