Manufacturer,NHTSACampaignNumber,parkIt,parkOutSide,overTheAirUpdate,NHTSAActionNumber,ReportReceivedDate,Component,Summary,Consequence,Remedy,Notes,ModelYear,Make,Model
"FORD MOTOR COMPANY","83V028000",0,0,0,,"07/03/1983","POWER TRAIN:AUTOMATIC TRANSMISSION","THE PARKING GEAR MAY NOT ENGAGE, EVEN THOUGH THE GEAR SHIFT LEVER IS PLACED IN THE ""PARK"" POSITION. THIS OCCURS IF THE LINKAGE INSIDE THE TRANSMISSION THAT ACTUATES THE PARK GEAR WAS IMPROPERLY MANUFACTURED. A PIN THAT RETAINS COMPONENTS ON A LINKAGE (ACTUATING) ROD COULD BREAK AND THE LINKAGE MAY NOT ENGAGE THE PARKING GEAR.",,"DEALER WILL INSPECT AND, IF NECESSARY, REPLACE THE PARKING PAWL ACTUATING ROD ASSEMBLY.","VEHICLE DESCRIPTION: PASSENGER VEHICLES EQUIPPED WITH AUTOMATIC OVERDRIVETRANSMISSIONS.SYSTEM: POWER TRAIN; TRANSMISSION, PARKING PAWL ACTUATING ASSEMBLY.CONSEQUENCES OF DEFECT: IF THE PARKING BRAKE IS NOT APPLIED AND THE PARKINGGEAR DOES NOT ENGAGE, UNEXPECTED VEHICLE MOVEMENT COULD CAUSE AN ACCIDENT ANDPERSONAL INJURY.NOTE: DRIVERS SHOULD ALWAYS APPLY THE PARKING BRAKE WHENEVER LEAVING THEVEHICLE.","1983","FORD","F350"
"FEDERAL-MOGUL CORPORATION","07E064000",0,0,0,,"27/08/2007","FUEL SYSTEM, GASOLINE:DELIVERY:FUEL PUMP","CERTAIN FEDERAL-MOGUL AFTERMARKET FUEL PUMPS SOLD UNDER THE BRAND NAMES OF CARTER, ACCUFLOW, NAPA, TRUFLOW, PARTS DEPO, AND PARTS MASTER, SHIPPED BETWEEN AUGUST 2006 AND JULY 2007 FOR USE ON THE VEHICLES LISTED ABOVE.  THE FUEL PUMP DIAPHRAGM IN CERTAIN PRODUCTION RUNS MAY HAVE BEEN IMPROPERLY INSTALLED OR INADEQUATELY TESTED WHICH MAY CAUSE THE FUEL PUMP TO LEAK.","A LEAKING FUEL PUMP COULD CREATE A VEHICLE FIRE HAZARD.","FEDERAL-MOGUL WILL NOTIFY OWNERS AND REPLACE THE DEFECTIVE FUEL PUMPS FREE OF CHARGE.  THE RECALL BEGAN ON OCTOBER 15, 2007.  OWNERS CAN CONTACT FEDERAL-MOGUL AT 248-354-7700.","THIS RECALL ONLY PERTAINS TO AFTERMARKET CARTER, NAPA, ACCUFLOW, TRU FLOW, PARTS MASTER, AND PARTS DEPOT BRAND FUEL PUMPS AND HAS NO RELATION TO ANY ORIGINAL EQUIPMENT INSTALLED ON THE LISTED MOTOR VEHICLES.  CUSTOMERS MAY CONTACT THE NATIONAL HIGHWAY TRAFFIC SAFETY ADMINISTRATION'S VEHICLE SAFETY HOTLINE AT 1-888-327-4236 (TTY: 1-800-424-9153); OR GO TO HTTP://WWW.SAFERCAR.GOV.","1983","FORD","FAIRMONT"
"FORD MOTOR COMPANY","82V100000",0,0,0,,"13/10/1982","POWER TRAIN:AUTOMATIC TRANSMISSION","THE PARK LEVER ON THE INVOLVED VEHICLES CONTAINS A DEFECTIVE SPRING WHICH COULD PREVENT AUTOMATIC ENGAGEMENT OF THE PARKING GEAR.",,"THE PARK ACTUATING LEVER ROD SPRING WILL BE REPLACED WITH AN UPGRADED SPRING WITHOUT CHARGE TO OWNER.","VEHICLE DESCRIPTION: PASSENGER VEHICLES EQUIPPED WITH C-3 AUTOMATICTRANSMISSIONS.SYSTEM: POWER TRAIN; TRANSMISSION, PARKING GEAR ACTUATING LEVER ROD, SPRINGS.CONSEQUENCES OF DEFECT: IF THE DRIVER LEAVES THE CAR UNATTENDED WITHOUTENGAGING THE PARKING BRAKE, THE VEHICLE COULD ROLL FREE AND CAUSE ACCIDENT,PERSONAL INJURY AND PROPERTY DAMAGE.","1983","FORD","FAIRMONT"
"FORD MOTOR COMPANY","83V017000",0,0,0,,"24/02/1983","POWER TRAIN:AUTOMATIC TRANSMISSION:LEVER AND LINKAGE:COLUMN SHIFT","THE SHIFT INDICATOR MAY NOT ACCURATELY REFLECT THE SHIFT SELECTOR POSITION. SOME VEHICLES WERE PRODUCED WITH TRANSMISSION CONTROL SELECTOR TUBE RETAINING CLIPS THAT MAY NOT BE HARD ENOUGH. THE CLIP MAY LOOSEN OR FALL OFF, AND THE SELECTOR TUBE MAY BECOME DISPLACED.",,"THE DEALER WILL REPLACE THE TRANSMISSION CONTROL SELECTOR TUBE RETAINING CLIP AT NO CHARGE TO OWNER.","VEHICLE DESCRIPTION: PASSENGER VEHICLES EQUIPPED WITH COLUMN SHIFT ANDAUTOMATIC TRANSMISSION.SYSTEM: POWER TRAIN; TRANSMISSION CONTROL SELECTOR TUBE RETAINING CLIPS.CONSEQUENCES OF DEFECT: THE SELECTOR TUBE, WHICH IS ROUTED INSIDE THE STEERINGCOLUMN, CONTROLS THE POSITION OF THE TRANSMISSION GEAR INDICATOR IN THE DASH.IF THE CLIP LOOSENS AND THE TUBE IS NOT POSITIONED CORRECTLY, THE INDICATOR MAYNOT BE ACCURATE. FOR EXAMPLE, THE INDICATOR MAY SHOW THAT THE TRANSMISSION ISIN ""PARK"", WHEN IT IS ACTUALLY IN ""REVERSE"", OR IT MAY INDICATE ""NEUTRAL"" WHENTHE TRANSMISSION IS IN GEAR. IF THIS SHOULD OCCUR, AND THE PARKING BRAKE IS NOTSET, THE VEHICLE MAY MOVE UNEXPECTEDLY AND CAUSE AN ACCIDENT OR PERSONALINJURY.","1983","FORD","FAIRMONT"
"FEDERAL-MOGUL CORPORATION","07E064000",0,0,0,,"27/08/2007","FUEL SYSTEM, GASOLINE:DELIVERY:FUEL PUMP","CERTAIN FEDERAL-MOGUL AFTERMARKET FUEL PUMPS SOLD UNDER THE BRAND NAMES OF CARTER, ACCUFLOW, NAPA, TRUFLOW, PARTS DEPO, AND PARTS MASTER, SHIPPED BETWEEN AUGUST 2006 AND JULY 2007 FOR USE ON THE VEHICLES LISTED ABOVE.  THE FUEL PUMP DIAPHRAGM IN CERTAIN PRODUCTION RUNS MAY HAVE BEEN IMPROPERLY INSTALLED OR INADEQUATELY TESTED WHICH MAY CAUSE THE FUEL PUMP TO LEAK.","A LEAKING FUEL PUMP COULD CREATE A VEHICLE FIRE HAZARD.","FEDERAL-MOGUL WILL NOTIFY OWNERS AND REPLACE THE DEFECTIVE FUEL PUMPS FREE OF CHARGE.  THE RECALL BEGAN ON OCTOBER 15, 2007.  OWNERS CAN CONTACT FEDERAL-MOGUL AT 248-354-7700.","THIS RECALL ONLY PERTAINS TO AFTERMARKET CARTER, NAPA, ACCUFLOW, TRU FLOW, PARTS MASTER, AND PARTS DEPOT BRAND FUEL PUMPS AND HAS NO RELATION TO ANY ORIGINAL EQUIPMENT INSTALLED ON THE LISTED MOTOR VEHICLES.  CUSTOMERS MAY CONTACT THE NATIONAL HIGHWAY TRAFFIC SAFETY ADMINISTRATION'S VEHICLE SAFETY HOTLINE AT 1-888-327-4236 (TTY: 1-800-424-9153); OR GO TO HTTP://WWW.SAFERCAR.GOV.","1983","FORD","LTD"
"FORD MOTOR COMPANY","83V028000",0,0,0,,"07/03/1983","POWER TRAIN:AUTOMATIC TRANSMISSION","THE PARKING GEAR MAY NOT ENGAGE, EVEN THOUGH THE GEAR SHIFT LEVER IS PLACED IN THE ""PARK"" POSITION. THIS OCCURS IF THE LINKAGE INSIDE THE TRANSMISSION THAT ACTUATES THE PARK GEAR WAS IMPROPERLY MANUFACTURED. A PIN THAT RETAINS COMPONENTS ON A LINKAGE (ACTUATING) ROD COULD BREAK AND THE LINKAGE MAY NOT ENGAGE THE PARKING GEAR.",,"DEALER WILL INSPECT AND, IF NECESSARY, REPLACE THE PARKING PAWL ACTUATING ROD ASSEMBLY.","VEHICLE DESCRIPTION: PASSENGER VEHICLES EQUIPPED WITH AUTOMATIC OVERDRIVETRANSMISSIONS.SYSTEM: POWER TRAIN; TRANSMISSION, PARKING PAWL ACTUATING ASSEMBLY.CONSEQUENCES OF DEFECT: IF THE PARKING BRAKE IS NOT APPLIED AND THE PARKINGGEAR DOES NOT ENGAGE, UNEXPECTED VEHICLE MOVEMENT COULD CAUSE AN ACCIDENT ANDPERSONAL INJURY.NOTE: DRIVERS SHOULD ALWAYS APPLY THE PARKING BRAKE WHENEVER LEAVING THEVEHICLE.","1983","FORD","LTD"
"FEDERAL-MOGUL CORPORATION","07E064000",0,0,0,,"27/08/2007","FUEL SYSTEM, GASOLINE:DELIVERY:FUEL PUMP","CERTAIN FEDERAL-MOGUL AFTERMARKET FUEL PUMPS SOLD UNDER THE BRAND NAMES OF CARTER, ACCUFLOW, NAPA, TRUFLOW, PARTS DEPO, AND PARTS MASTER, SHIPPED BETWEEN AUGUST 2006 AND JULY 2007 FOR USE ON THE VEHICLES LISTED ABOVE.  THE FUEL PUMP DIAPHRAGM IN CERTAIN PRODUCTION RUNS MAY HAVE BEEN IMPROPERLY INSTALLED OR INADEQUATELY TESTED WHICH MAY CAUSE THE FUEL PUMP TO LEAK.","A LEAKING FUEL PUMP COULD CREATE A VEHICLE FIRE HAZARD.","FEDERAL-MOGUL WILL NOTIFY OWNERS AND REPLACE THE DEFECTIVE FUEL PUMPS FREE OF CHARGE.  THE RECALL BEGAN ON OCTOBER 15, 2007.  OWNERS CAN CONTACT FEDERAL-MOGUL AT 248-354-7700.","THIS RECALL ONLY PERTAINS TO AFTERMARKET CARTER, NAPA, ACCUFLOW, TRU FLOW, PARTS MASTER, AND PARTS DEPOT BRAND FUEL PUMPS AND HAS NO RELATION TO ANY ORIGINAL EQUIPMENT INSTALLED ON THE LISTED MOTOR VEHICLES.  CUSTOMERS MAY CONTACT THE NATIONAL HIGHWAY TRAFFIC SAFETY ADMINISTRATION'S VEHICLE SAFETY HOTLINE AT 1-888-327-4236 (TTY: 1-800-424-9153); OR GO TO HTTP://WWW.SAFERCAR.GOV.","1983","FORD","MUSTANG"
"FEDERAL-MOGUL CORPORATION","07E064000",0,0,0,,"27/08/2007","FUEL SYSTEM, GASOLINE:DELIVERY:FUEL PUMP","CERTAIN FEDERAL-MOGUL AFTERMARKET FUEL PUMPS SOLD UNDER THE BRAND NAMES OF CARTER, ACCUFLOW, NAPA, TRUFLOW, PARTS DEPO, AND PARTS MASTER, SHIPPED BETWEEN AUGUST 2006 AND JULY 2007 FOR USE ON THE VEHICLES LISTED ABOVE.  THE FUEL PUMP DIAPHRAGM IN CERTAIN PRODUCTION RUNS MAY HAVE BEEN IMPROPERLY INSTALLED OR INADEQUATELY TESTED WHICH MAY CAUSE THE FUEL PUMP TO LEAK.","A LEAKING FUEL PUMP COULD CREATE A VEHICLE FIRE HAZARD.","FEDERAL-MOGUL WILL NOTIFY OWNERS AND REPLACE THE DEFECTIVE FUEL PUMPS FREE OF CHARGE.  THE RECALL BEGAN ON OCTOBER 15, 2007.  OWNERS CAN CONTACT FEDERAL-MOGUL AT 248-354-7700.","THIS RECALL ONLY PERTAINS TO AFTERMARKET CARTER, NAPA, ACCUFLOW, TRU FLOW, PARTS MASTER, AND PARTS DEPOT BRAND FUEL PUMPS AND HAS NO RELATION TO ANY ORIGINAL EQUIPMENT INSTALLED ON THE LISTED MOTOR VEHICLES.  CUSTOMERS MAY CONTACT THE NATIONAL HIGHWAY TRAFFIC SAFETY ADMINISTRATION'S VEHICLE SAFETY HOTLINE AT 1-888-327-4236 (TTY: 1-800-424-9153); OR GO TO HTTP://WWW.SAFERCAR.GOV.","1983","FORD","RANGER"
"AIMCO PRODUCTS INC.","98E010000",0,0,0,,"08/04/1998","SERVICE BRAKES, AIR:DISC:ROTOR","EQUIPMENT DESCRIPTION:  AFTERMARKET BRAKE ROTORS FOR USE ON CERTAIN FORD AND MAZDA TRUCKS.  CRACKED CASTINGS CAUSED CRACKS TO APPEAR ON THE OUTER DIAMETER OF THE ROTOR HAT OR AROUND THE STUD HOLE.","LOSS OF BRAKING CAN RESULT.","AIMCO WILL REIMBURSE CONSUMERS/INSTALLERS FOR THE COST OF REPLACEMENT ROTORS AND INSTALLATION.  CONSUMERS ARE REQUESTED TO RETURN TO THE LOCATION WHERE THE ROTORS WERE ORIGINALLY PURCHASED/INSTALLED FOR REPLACEMENT.","OWNER NOTIFICATION IS EXPECTED TO BEGIN DURING APRIL 1998.  OWNERS WHO DO NOT RECEIVE THE FREE ROTORS WITHIN A REASONABLE TIME SHOULD CONTACT AIMCO AT 815-759-7935.  ALSO CONTACT THE NATIONAL HIGHWAY TRAFFIC SAFETY ADMINISTRATION'S AUTO SAFETY HOTLINE AT 1-888-DASH-2-DOT (1-888-327-4236).","1983","FORD","RANGER"
"FORD MOTOR COMPANY","84V112000",0,0,0,,"25/09/1984","FUEL SYSTEM, GASOLINE:DELIVERY:HOSES, LINES/PIPING, AND FITTINGS","THE FLEXIBLE HOSE CONNECTING THE FUEL PUMP TO THE CARBURETOR FUEL LINE MAY SEPARATE FROM THE FUEL PUMP.",,"THE EXISTING FUEL HOSE WILL BE REPLACED AND TWO NEW HOSE CLAMPS WILL BE INSTALLED.","VEHICLE DESCRIPTION: LIGHT TRUCKS EQUIPPED WITH 2.0 AND 2.3 LITER ENGINES.SYSTEM: FUEL; FLEXIBLE HOSE.CONSEQUENCES OF DEFECT: IN THE EVENT OF A SEPARATION, FUEL LEAKAGE MAY OCCUR,POSSIBLY CAUSING AN UNDERHOOD FIRE AND INJURY TO VEHICLE OCCUPANTS.NOTE: VEHICLES LEAKING FUEL SHOULD NOT BE DRIVEN.","1983","FORD","RANGER"
"FORD MOTOR COMPANY","84V111000",0,0,0,,"25/09/1984","LATCHES/LOCKS/LINKAGES:HOOD:LATCH","SECONDARY HOOD LATCH COMPONENTS MAY HAVE BEEN IMPROPERLY POSITIONED DURING ASSEMBLY. IF THE HOOD IS NOT CLOSED TIGHTLY, OR IS INADVERTENTLY RELEASED, THE SECONDARY LATCH MAY NOT WORK AND THE HOOD MAY FLY UP WITHOUT PRIOR WARNING.",,"THE HOOD ASSEMBLY WILL BE INSPECTED AND THE HOOD AND LATCH COMPONENTS WILL BE ADJUSTED, IF NECESSARY, WITHOUT CHARGE TO THE OWNER.","VEHICLE DESCRIPTION: LIGHT TRUCKS.SYSTEM: STRUCTURE; HOOD ASSEMBLY LATCH SYSTEMS.CONSEQUENCES OF DEFECT: THE DRIVER""S VIEW WILL BE OBSTRUCTED AND AN ACCIDENTMAY RESULT.NOTE: MAKE CERTAIN THE PRIMARY HOOD LATCH IS ENGAGED PROPERLY BEFORE DRIVING.","1983","FORD","RANGER"
"FORD MOTOR COMPANY","82V033000",0,0,0,,"12/04/1982","ENGINE AND ENGINE COOLING:EXHAUST SYSTEM:MANIFOLD/HEADER/MUFFLER/TAIL PIPE","ON THE INVOLVED VEHICLES, THE MUFFLER GRASS SHIELDS WERE INADVERTENTLY OMITTED DURING MANUFACTURE. WITHOUT THE GRASS SHIELD, AND DURING CERTAIN OPERATING CONDITIONS, THE MUFFLER SURFACE TEMPERATURES COULD BECOME HOT ENOUGH TO EXCEED SPECIFIED STANDARDS AND CREATE THE POTENTIAL FOR IGNITING TALL GRASSES IF THEY WERE PRESENT BENEATH A STANDING VEHICLE.",,"DEALER WILL INSTALL GRASS SHIELDS ON ALL AFFECTED VEHICLES AT NO COST TO OWNER.","VEHICLE DESCRIPTION: PASSENGER VEHICLES EQUIPPED WITH HIGH ALTITUDE ENGINEEMISSION SYSTEMS.SYSTEM: FUEL; MUFFLER GRASS SHIELDS.CONSEQUENCES OF DEFECT: A FIRE COULD START RESULTING IN VEHICLE DAMAGE ANDSERIOUS PERSONAL INJURY.","1983","FORD","RANGER"
"FORD MOTOR COMPANY","84V082000",0,0,0,,"09/07/1984","FUEL SYSTEM, GASOLINE:STORAGE:TANK ASSEMBLY:FILLER PIPE AND CAP","IF TRUCK IS STRUCK FROM THE SIDE, THE CAP ON THE FUEL TANK COULD BECOME UNSEALED, ALLOWING UNSAFE LEAKAGE OF FUEL. THIS IS A FAILURE TO COMPLY WITH THE REQUIREMENTS OF FEDERAL MOTOR VEHICLE SAFETY STANDARD 301, ""FUEL SYSTEM INTEGRITY"". LEAKAGE CAN BE CAUSED BY AN ORANGE-COLORED PLASTIC DIESEL FUEL INFORMATION RING WHICH IS FOUND AROUND THE FUEL TANK NECK, OR BY THE TETHER.",,"UPON INSPECTION, FUEL CAP TETHERS WILL BE REPLACED OR DIESEL FUEL INFORMATION RINGS WILL BE REMOVED.","VEHICLE DESCRIPTION: TRUCKS EQUIPPED WITH MIDSHIP FUEL TANK, TETHERED FUELFILLER PIPE CAPS OR DIESEL ENGINES.SYSTEM: FUEL; FUEL CAPS (LOCKING AND NON-LOCKING).CONSEQUENCES OF DEFECT: LEAKING FUEL COULD CAUSE A FIRE IN THE PRESENCE OF ANIGNITION SOURCE AND COULD RESULT IN PERSONAL INJURY TO VEHICLE OCCUPANTS ORBYSTANDERS.","1983","FORD","RANGER"
"FORD MOTOR COMPANY","83V032000",0,0,0,,"22/03/1983","SUSPENSION:FRONT:SPRINGS:COIL SPRINGS","SOME OF THE INVOLVED VEHICLES MAY HAVE BEEN BUILT WITH IMPROPERLY HEAT TREATED FRONT SUSPENSION LOWER SPRING SEAT ATTACHING STUDS. THESE STUDS COULD FRACTURE DURING VEHICLE OPERATION, ALLOWING THE LOWER SPRING SEAT TO MOVE AND POSSIBLY SLIDE OFF THE AXLE.",,"THE DEALER WILL REPLACE THE LOWER SPRING SEAT STUDS ON BOTH THE LEFT AND RIGHT SIDES OF THE VEHICLE AT NO CHARGE TO OWNERS.","VEHICLE DESCRIPTION: LIGHT TRUCKS.SYSTEM: SUSPENSION; FRONT SUSPENSION ASSEMBLY STUDS.CONSEQUENCES OF DEFECT: THIS COULD CAUSE ERRATIC STEERING. A RUPTURE OF THEFRONT BRAKE HOSE COULD OCCUR, RESULTING IN LOSS OF FRONT WHEEL BRAKING. CHANGESIN STEERING AND A LOSS OF FRONT BRAKES COULD CAUSE A LOSS OF VEHICLE CONTROLPOSSIBLY RESULTING IN AN ACCIDENT.NOTE: THE OPERATOR MAY BE FOREWARNED OF THE CONDITION BY A CHANGE IN VEHICLEATTITUDE, ABNORMAL POSITION OF THE AFFECTED FRONT WHEEL, FRONT END NOISE, ACHANGE IN STEERING EFFORTS OR STEERING PULL, OR ILLUMINATION OF THE BRAKEWARNING LIGHT.","1983","FORD","RANGER"
"FEDERAL-MOGUL CORPORATION","07E064000",0,0,0,,"27/08/2007","FUEL SYSTEM, GASOLINE:DELIVERY:FUEL PUMP","CERTAIN FEDERAL-MOGUL AFTERMARKET FUEL PUMPS SOLD UNDER THE BRAND NAMES OF CARTER, ACCUFLOW, NAPA, TRUFLOW, PARTS DEPO, AND PARTS MASTER, SHIPPED BETWEEN AUGUST 2006 AND JULY 2007 FOR USE ON THE VEHICLES LISTED ABOVE.  THE FUEL PUMP DIAPHRAGM IN CERTAIN PRODUCTION RUNS MAY HAVE BEEN IMPROPERLY INSTALLED OR INADEQUATELY TESTED WHICH MAY CAUSE THE FUEL PUMP TO LEAK.","A LEAKING FUEL PUMP COULD CREATE A VEHICLE FIRE HAZARD.","FEDERAL-MOGUL WILL NOTIFY OWNERS AND REPLACE THE DEFECTIVE FUEL PUMPS FREE OF CHARGE.  THE RECALL BEGAN ON OCTOBER 15, 2007.  OWNERS CAN CONTACT FEDERAL-MOGUL AT 248-354-7700.","THIS RECALL ONLY PERTAINS TO AFTERMARKET CARTER, NAPA, ACCUFLOW, TRU FLOW, PARTS MASTER, AND PARTS DEPOT BRAND FUEL PUMPS AND HAS NO RELATION TO ANY ORIGINAL EQUIPMENT INSTALLED ON THE LISTED MOTOR VEHICLES.  CUSTOMERS MAY CONTACT THE NATIONAL HIGHWAY TRAFFIC SAFETY ADMINISTRATION'S VEHICLE SAFETY HOTLINE AT 1-888-327-4236 (TTY: 1-800-424-9153); OR GO TO HTTP://WWW.SAFERCAR.GOV.","1983","FORD","THUNDERBIRD"
"FORD MOTOR COMPANY","83V039000",0,0,0,,"11/04/1983","FUEL SYSTEM, GASOLINE:DELIVERY:HOSES, LINES/PIPING, AND FITTINGS","FUEL LEAKS COULD DEVELOP IN EITHER OF TWO CONNECTIONS IN A FUEL SUPPLY LINE. ONE CONNECTION UNDER THE VEHICLE MAY HAVE BEEN DAMAGED OR IMPROPERLY INSTALLED. THE OTHER SUSPECT PART IS IN THE ENGINE COMPARTMENT AND CONTAINS A PRESSURE RELIEF VALVE.",,"THE DEALER WILL INSTALL A REVISED DESIGN FUEL LINE VALVE ASSEMBLY WITH NEW HOSE CLAMPS AND REPLACE THE FUEL SUPPLY HOSE CLAMP, IF IT IS DAMAGED OR INCORRECT. NOTIFICATION WAS MADE TO DEALERS PRIOR TO ANY RECORDED VEHICLE SALES, AND VEHICLES SHOULD HAVE BEEN CORRECTED BEFORE FINAL DELIVERY.","VEHICLE DESCRIPTION: PASSENGER VEHICLES EQUIPPED WITH 2.3 LITER TURBO ENGINES.SYSTEM: FUEL; FUEL INLET LINE.CONSEQUENCES OF DEFECT: IF EITHER OF THESE CONNECTIONS SEPARATE OR LEAK, FUELSPILLAGE COULD RESULT, AND IN THE PRESENCE OF AN IGNITION SOURCE, COULD RESULTIN FIRE.NOTE: OWNERS ARE CAUTIONED NOT TO OPERATE THEIR VEHICLES UNTIL CORRECTIVEACTION HAS BEEN COMPLETED.","1983","FORD","THUNDERBIRD"
"FORD MOTOR COMPANY","83V028000",0,0,0,,"07/03/1983","POWER TRAIN:AUTOMATIC TRANSMISSION","THE PARKING GEAR MAY NOT ENGAGE, EVEN THOUGH THE GEAR SHIFT LEVER IS PLACED IN THE ""PARK"" POSITION. THIS OCCURS IF THE LINKAGE INSIDE THE TRANSMISSION THAT ACTUATES THE PARK GEAR WAS IMPROPERLY MANUFACTURED. A PIN THAT RETAINS COMPONENTS ON A LINKAGE (ACTUATING) ROD COULD BREAK AND THE LINKAGE MAY NOT ENGAGE THE PARKING GEAR.",,"DEALER WILL INSPECT AND, IF NECESSARY, REPLACE THE PARKING PAWL ACTUATING ROD ASSEMBLY.","VEHICLE DESCRIPTION: PASSENGER VEHICLES EQUIPPED WITH AUTOMATIC OVERDRIVETRANSMISSIONS.SYSTEM: POWER TRAIN; TRANSMISSION, PARKING PAWL ACTUATING ASSEMBLY.CONSEQUENCES OF DEFECT: IF THE PARKING BRAKE IS NOT APPLIED AND THE PARKINGGEAR DOES NOT ENGAGE, UNEXPECTED VEHICLE MOVEMENT COULD CAUSE AN ACCIDENT ANDPERSONAL INJURY.NOTE: DRIVERS SHOULD ALWAYS APPLY THE PARKING BRAKE WHENEVER LEAVING THEVEHICLE.","1983","FORD","THUNDERBIRD"
"FORD MOTOR COMPANY","83V012000",0,0,0,,"08/02/1983","FUEL SYSTEM, GASOLINE:STORAGE:TANK ASSEMBLY","SOME OF THESE VEHICLES MAY HAVE BEEN BUILT WITH FUEL TANKS THAT HAVE INADEQUATELY WELDED FRONT SEAMS THAT CAN LEAK.",,"THE DEALER WILL DETERMINE IF THE VEHICLE WAS CORRECTED AT THE FACTORY; IF NOT, THE FUEL TANK WILL BE REPLACED AT NO CHARGE TO THE OWNER.","VEHICLE DESCRIPTION: PASSENGER VEHICLES EQUIPPED WITH 3.8 LITER ENGINES.SYSTEM: FUEL SYSTEMS; FUEL TANK.CONSEQUENCES OF DEFECT: LEAKING FUEL, IN COMBINATION WITH A SOURCE OF IGNITION,COULD RESULT IN A FIRE AND PERSONAL INJURY.NOTE: THE OWNER SHOULD NOT OPERATE HIS VEHICLE UNTIL THE NECESSARY CORRECTIONIS MADE.","1983","FORD","THUNDERBIRD"
"PRO-A MOTORS, INC.","06E026000",0,0,0,,"23/03/2006","EXTERIOR LIGHTING","CERTAIN PRO-A MOTORS CORNER LAMPS, TURN SIGNALS, AND HEADLIGHTS SOLD AS REPLACEMENT LAMPS FOR USE ON CERTAIN PASSENGER VEHICLES LISTED ABOVE.  SOME COMBINATION LAMPS THAT ARE NOT EQUIPPED WITH AMBER SIDE REFLECTORS FAIL TO CONFORM TO FEDERAL MOTOR VEHICLE SAFETY STANDARD NO. 108, LAMPS, REFLECTIVE DEVICES, AND ASSOCIATED EQUIPMENT.","WITHOUT THE AMBER REFLECTORS, THE VEHICLE WILL BE POORLY ILLUMINATED, POSSIBLY RESULTING IN A VEHICLE CRASH WITHOUT WARNING.","PRO-A MOTORS WILL NOTIFY OWNERS AND OFFER TO REPURCHASE THE LAMPS.  THE RECALL BEGAN ON APRIL 3, 2006.  OWNERS MAY CONTACT PRO-A MOTORS AT 323-838-2988.","THIS RECALL ONLY PERTAINS TO PRO-A MOTORS AFTERMARKET LAMPS AND HAS NO RELATION TO ANY ORIGINAL EQUIPMENT INSTALLED ON THE LISTED PASSENGER VEHICLES.  FOR MORE INFORMATION ON THE LAMP MODEL NUMBERS, CLICK ON DOCUMENT SEARCH AND VIEW DOCUMENT TITLED ""LAMP MODEL NUMBERS.""  CUSTOMERS MAY CONTACT THE NATIONAL HIGHWAY TRAFFIC SAFETY ADMINISTRATION'S VEHICLE SAFETY HOTLINE AT 1-888-327-4236 (TTY: 1-800-424-9153); OR GO TO HTTP://WWW.SAFERCAR.GOV.","1983","GMC","JIMMY"
"GENERAL MOTORS CORP.","83V046000",0,0,0,,"27/04/1983","SEATS","THE INERTIA LOCK MECHANISM MAY NOT FUNCTION, ALLOWING THE SEAT BACK TO FOLD FORWARD, AND THE SEAT TO MOVE FORWARD.",,,"VEHICLE DESCRIPTION: LIGHT TRUCKS EQUIPPED WITH FOLDING REAR BENCH SEATS.SYSTEM: INTERIOR SYSTEMS; SEAT BACK INERTIA LOCK.CONSEQUENCES OF DEFECT: IF THE REAR SEAT IS OCCUPIED, THIS COULD CAUSE PERSONALINJURY BY PINNING OCCUPANTS BETWEEN THE REAR SEAT AND THE BACK OF THE FRONTSEAT.NOTE: THIS FAILURE MAY OCCUR UNDER MODERATE BRAKING CONDITIONS.CORRECTIVEACTION: THE DEALER WILL INSTALL A MANUALLY OPERATED LATCH WITH APOSITIVE LOCK AND RELEASE HANDLE AT NO CHARGE.","1983","GMC","JIMMY"
"AMERICAN HONDA MOTOR CO.","92V028000",0,0,0,,"03/03/1992","FUEL SYSTEM, GASOLINE:STORAGE:TANK ASSEMBLY:FILLER PIPE AND CAP","IF THE PLASTIC COATING OF THE FUEL FILLER AND/OR BREATHER PIPE IS DAMAGED, SALT WATER MAY ACCUMULATE BETWEEN THE PLASTIC COATING AND THE STEEL PIPES, AND THE ACCUMULATION COULD CAUSE CORROSSION WHICH WOULD EVENTUALLY RUST THROUGH THE AFFECTED PIPES, ALLOWING GASOLINE FUMES AND FUEL TO LEAK.","GASOLINE FUMES AND/OR FUEL LEAKAGE THROUGH THE FILLER ORBREATHER PIPES COULD RESULT IN A FIRE WHEN EXPOSED TO A SOURCE OF IGNITION.","CORRODED FILLER OR BREATHER PIPES WILL BE CLEANED AND RECOATED OR REPLACED AS NEEDED.","SYSTEM: FUEL SYSTEM.VEHICLE DESCRIPTION: PASSENGER CARS IN AREAS WHERE SALT AND CALCIUM CHLORIDE AREUSED IN SNOW AND ICE CONTROL.","1983","HONDA","ACCORD"
"AMERICAN HONDA MOTOR CO.","92V028001",0,0,0,,"15/04/1993","FUEL SYSTEM, GASOLINE","IF THE PLASTIC COATING OF THE FUEL FILLER AND/OR BREATHER PIPE IS DAMAGED, SALT WATER MAY ACCUMULATE BETWEEN THE PLASTIC COATING AND THE STEEL PIPES, AND THE ACCUMULATION COULD CAUSE CORROSION WHICH WOULD EVENTUALLY RUST THROUGH THE AFFECTED PIPES, ALLOWING GASOLINE FUMES AND FUEL TO LEAK.","GASOLINE FUMES AND/OR FUEL LEAKAGE THROUGH THE FILLER ORBREATHER PIPES COULD RESULT IN A FIRE WHEN EXPOSED TO A SOURCE OF IGNITION.","REPAIRS WILL BE MADE TO VEHICLES WITH CORRODED FILLER OR BREATHER PIPES.","SYSTEM: FUEL SYSTEM.VEHICLE DESCRIPTION: PASSENGER CARS IN AREAS WHERE SALT AND CALCIUM CHLORIDE AREUSED IN SNOW AND ICE CONTROL.NOTE: THIS IS AN EXTENSION OF NHTSA RECALL 92V028000. HONDA HAS INCLUDED 1986AND 1987 ACCORDS BUILT BETWEEN JUNE 13, 1985 AND SEPTEMBER 15, 1987, AS WELLAS 1983, 1984, 1985, 1986 AND 1987 PRELUDES BUILT BETWEEN SEPTEMBER 9, 1982 ANDMAY 7, 1987.","1983","HONDA","PRELUDE"
"AMERICAN HONDA MOTOR CO.","83V090000",0,0,0,,"12/09/1983","STEERING: STEERING WHEEL/HANDLE BAR","HANDLEBAR TUBE AND HANDLEBAR ARM DO NOT FIT SECURELY BECAUSE THE INSIDE DIAMETER OF THE HANDLEBAR TUBE IS INCORRECT. THIS CAUSES STRESS TO BEAR DIRECTLY ON A PIN.",,"DEALER WILL REPLACE HANDLEBAR ASSEMBLY WITH A CORRECTED TYPE FREE OF CHARGE.","VEHICLE DESCRIPTION: MOTORCYCLES.SYSTEM: STRUCTURE; HANDLEBARS.CONSEQUENCES OF DEFECT: IF THE PIN BREAKS DUE TO STRESS, THE HANDLEBAR TUBECOULD BECOME LOOSE, FOLLOWED BY POSSIBLE LOSS OF VEHICLE CONTROL AND ANACCIDENT.NOTE: IF LOOSENESS IS DETECTED IN HANDLEBARS, THE MOTORCYCLE SHOULD NOT BERIDDEN UNTIL THE VEHICLE CAN BE INSPECTED AND REPAIRED.","1983","HONDA","VF750F"
"ISUZU MOTORS LIMITED","83V044000",0,0,0,,"29/04/1983","STEERING:COLUMN","THE TILT STEERING WHEEL LOCK MECHANISM THAT HOLDS THE STEERING WHEEL IN PLACE MAY BREAK. FAILURE OF THE LOCKING MECHANISM WOULD ALLOW THE STEERING WHEEL TO TILT, UNRESTRAINED. THE WHEEL MAY TRAVEL TO THE HIGH OR LOW POSITION.",,"THE DEALER WILL REPLACE THE STEERING TILT LOCKING PIN WITH A NEW PIN AT NO CHARGE.","VEHICLE DESCRIPTION: PASSENGER VEHICLES EQUIPPED WITH A TILT STEERING WHEEL.SYSTEM: STEERING; TILT STEERING LOCK PIN.CONSEQUENCES OF DEFECT: IF THE LOCKING PIN BREAKS, ALLOWING THE STEERING WHEELTO TILT UNRESTRAINED, STEERING CAN BE AWKWARD. IF THE FAILURE OCCURS WHILE THEVEHICLE IS IN MOTION, THE DRIVER MAY LOSE CONTROL AND AN ACCIDENT COULD RESULT.NOTE: UNTIL THE VEHICLE IS REPAIRED, THE FOLLOWING PRECAUTIONS SHOULD BEOBSERVED: DO NOT EXERT UPWARD OR DOWNWARD PRESSURE ON THE STEERING WHEEL;SHOULD THE FAILURE OCCUR WHILE DRIVING, MOVE THE STEERING WHEEL ALL THE WAY UPOR DOWN AND STEER CAREFULLY TO A SAFE AREA BESIDE THE ROAD.","1983","ISUZU","I MARK"
"JAGUAR ROVER TRIUMPH INC.","90V123000",0,0,0,"PE90060","02/07/1990","FUEL SYSTEM, GASOLINE:STORAGE:TANK ASSEMBLY","EXCESSIVE FUEL VAPOR PRESSURE CAN OCCUR THAT, AFTER PROLONGED CYCLING, COULD WEAKEN THE FUEL TANK STRUCTURE.","THIS CAN CAUSE FUEL TANK LEAKS WHICH, IN THE PRESENCE OFAN IGNITION SOURCE, COULD RESULT IN A VEHICLE FIRE.","INSTALL A REVISED FUEL PURGE SYSTEM WHICH ELIMINATES EXCESSIVE VAPOR PRESSURE BUILD-UP.","SYSTEM: FUEL TANK - FUEL PURGE SYSTEM.VEHICLE DESCRIPTION: PASSENGER CARS; 2 DOOR COUPE, CABRIOLET, CONVERTIBLE.","1983","JAGUAR","XJS"
"JAGUAR ROVER TRIUMPH INC.","90V035000",0,0,0,,"20/02/1990","VEHICLE SPEED CONTROL","ELECTRONICALLY CONTROLLED VALVES IN THE CRUISE CONTROL ACTUATOR MAY NOT FUNCTION PROPERLY DUE TO DIRT ENTERING THE VALVES.","CRUISE CONTROL WOULD NOT DISENGAGE UNDER NORMAL OPERATINGCONDITIONS WHICH COULD RESULT IN LOSS OF CONTROL AND AN ACCIDENT.","REPLACE CRUISE CONTROL ACTUATOR AND INSTALL ADDITIONAL VACUUM DUMP VALVE.","SYSTEM: CRUISE CONTROL.  VEHICLE DESCRIPTION: PASSENGER CARS.","1983","JAGUAR","XJS"
"JAGUAR CARS","83V135000",0,0,0,,"20/12/1983","FUEL SYSTEM, GASOLINE:FUEL INJECTION SYSTEM:FUEL RAIL","FUEL LEAKAGE MAY DEVELOP AT THE TWO MAIN FUEL RAIL CONNECTIONS. DETERIORATION AT THESE TWO CONNECTIONS HAS BEEN TRACED TO A COMBINATION OF MISALIGNMENT OF THE TWO RAIL HALVES AND THE EFFECT OF TEMPERATURE CHANGES.",,"DEALER WILL REPLACE THE CURRENT TWO PIECE FUEL RAIL WITH A NEW PART KIT OF SINGLE PIECE DESIGN.","VEHICLE DESCRIPTION: PASSENGER VEHICLES.SYSTEM: FUEL; FUEL INJECTION DISTRIBUTION PLUMBING.CONSEQUENCES OF DEFECT: LEAKING FUEL COULD LEAD TO A VEHICLE FIRE AND PERSONALINJURY.NOTE: OWNERS ARE ADVISED TO PROMPTLY CHECK THE ENGINE COMPARTMENT FOR EVIDENCEOF FUEL LEAKAGE. IF ANY FUEL IS FOUND ON OR AROUND THE TOP OF THE ENGINE WHILETHE ENGINE IS COLD AND THE IGNITION SWITCH IS ON, THE VEHICLE SHOULD NOT BEOPERATED.","1983","JAGUAR","XJS"
"JAGUAR CARS","85V087000",0,0,0,,"03/07/1985","FUEL SYSTEM, GASOLINE:FUEL INJECTION SYSTEM:FUEL RAIL","POSSIBLE FUEL LEAKAGE FROM THE ENGINE FUEL INJECTION      SYSTEM, PARTICULARLY IN THE AREA OF THE HOSE/CLIP FITTINGS.                                                                                                       CONSEQUENCE OF DEFECT: THE PRESENCE OF AN IGNITION SOURCE, WITH FUEL LEAKAGE,    COULD RESULT IN AN ENGINE COMPARTMENT FIRE OR THE DESTRUCTION OF IGNITION        DISTRIBUTOR CAP.",,"A NEW FUEL DELIVERY SYSTEM DESIGNED TO ELIMINATE FUEL HOSE    CLIPS WILL BE INSTALLED.","VEHICLE DESCRIPTION: PASSENGER CARS.    SYSTEM: FUEL INJECTOR.","1983","JAGUAR","XJS"
