Manufacturer,NHTSACampaignNumber,parkIt,parkOutSide,overTheAirUpdate,NHTSAActionNumber,ReportReceivedDate,Component,Summary,Consequence,Remedy,Notes,ModelYear,Make,Model
"GENERAL MOTORS CORP.","71V235000",0,0,0,,"29/12/1971","ENGINE AND ENGINE COOLING:ENGINE","THERE IS A POSSIBILITY THAT A SEPARATED MOTOR MOUNT MAY ALLOW THE ENGINE TO LIFT, WHICH MAY AFFECT THE THROTTLE LINKAGE, MOMENTARILY INCREASING THROTTLE, POSSIBLY TO FULL THROTTLE.","UNEXPECTED LOSS OF THROTTLE CONTROL MAY CAUSE LOSS OFVEHICLE CONTROL AND AN ACCIDENT.","INSPECT ENGINE MOUNTS AND INSTALL RESTRAINTS WHICH WILL LIMIT ENGINE LIFT AND ELIMINATE POSSIBLE SECONDARY EFFECTS TO THE THROTTLE LINKAGE DUE TO ENGINE MOUNT SEPARATION.","SYSTEM: ENGINE.VEHICLE DESCRIPTION: PASSENGER VEHICLES, LIGHT TRUCKS AND VANS.","1968","CHEVROLET","C SERIES"
"GENERAL MOTORS CORP.","71V235000",0,0,0,,"29/12/1971","ENGINE AND ENGINE COOLING:ENGINE","THERE IS A POSSIBILITY THAT A SEPARATED MOTOR MOUNT MAY ALLOW THE ENGINE TO LIFT, WHICH MAY AFFECT THE THROTTLE LINKAGE, MOMENTARILY INCREASING THROTTLE, POSSIBLY TO FULL THROTTLE.","UNEXPECTED LOSS OF THROTTLE CONTROL MAY CAUSE LOSS OFVEHICLE CONTROL AND AN ACCIDENT.","INSPECT ENGINE MOUNTS AND INSTALL RESTRAINTS WHICH WILL LIMIT ENGINE LIFT AND ELIMINATE POSSIBLE SECONDARY EFFECTS TO THE THROTTLE LINKAGE DUE TO ENGINE MOUNT SEPARATION.","SYSTEM: ENGINE.VEHICLE DESCRIPTION: PASSENGER VEHICLES, LIGHT TRUCKS AND VANS.","1968","CHEVROLET","CAMARO"
"GENERAL MOTORS CORP.","68V085000",0,0,0,,"17/09/1968","VEHICLE SPEED CONTROL",,,,"POSSIBILITY THAT CARBURETOR THROTTLE LEVER MAY INTERFERE WITH THROTTLE RETAINING CLIP.  IF THIS OCCURS, CAN CAUSE THROTTLE LEVER TO BE HELD PARTIALLY OPEN,  PREVENTING ITS RETURN TO IDLE POSITION. POSSIBLE THIS WILL MAKE VEHICLE DIFFICULT TO STOP.  (CORRECT WHERE NECESSARY WITH IMPROVED TYPE THROTTLE RODCLIP.)","1968","CHEVROLET","CAMARO"
"CHRYSLER CORPORATION","68V025000",0,0,0,,"25/03/1968","SUSPENSION:FRONT:CONTROL ARM:UPPER BALL JOINT",,,,"POSSIBILITY FRONT SUSPENSION UPPER BALL JOINTS MAY NOT MEET SPECIFICATIONS.  SEVERE IMPACT ON SUS- PENSION SYSTEM COULD CAUSE UPPER BALL JOINT TO FAIL AND CAUSE ERRATIC STEERING CONTROL.  (CORRECT BY RE- PLACEMENT WHEN NECESSARY).","1968","DODGE","DART"
"CHRYSLER CORPORATION","68V037000",0,0,0,,"19/04/1968","ENGINE AND ENGINE COOLING:EXHAUST SYSTEM:MANIFOLD/HEADER/MUFFLER/TAIL PIPE",,,,"POSSIBILITY VEHICLES ASSEMBLED WITH INCORRECT LEFT SIDE ENGINE EXHAUST MANIFOLD MAY NOT PROVIDE SUFFICIENT CLEARANCE FOR STEERING COLUMN SHAFT COUPLING.  CONDITION MAY CAUSE STEERING SHAFT COUPLING TO CATCH ON MANIFOLD AND RESULT IN STEERING INTERFERENCE.  (CORRECT BY REPLACING WHEN NECESSARY.)","1968","DODGE","DART"
"CHRYSLER CORPORATION","70V075000",0,0,0,,"07/07/1970","TIRES",,,,"POSSIBILITY THAT GOODYEAR TIRES, SIZE 700 X 13, COULD FAIL TO COMPLY WITHNATIONAL HIGHWAY SAFETY BUREAU'S STRENGTH PLUNGER ENERGY TEST.  (CORRECT BYREPLACING TIRES WHERE NECESSARY BY GOODYEAR DEALERS IN ACCORDANCE WITH THEIRREGULAR ADJUSTMENT POLICY.)","1968","DODGE","DART"
"CHRYSLER CORPORATION","67V072000",0,0,0,,"12/09/1967","POWER TRAIN:AUTOMATIC TRANSMISSION",,,,"POSSIBLE INTERFERENCE BETWEEN THE FLOOR PAN AND THE TRANSMISSION KICKDOWN ROD.  THIS CONDITION COULD RESULT IN FAILURE OF THE THROTTLE TO RETURN TO IDLE.  (INSPECT AND REWORK TRANSMISSION LEVER.)","1968","DODGE","DART"
"FORD MOTOR COMPANY","68V075000",0,0,0,,"13/08/1968","STRUCTURE:BODY",,,,"POSSIBILITY THAT INCORRECT NUTS USED IN ATTACHING PICKUP BOX TO FRAME.  THESE NUTS MAY LOOSEN AND CAUSE BOX TO SEPARATE FROM FRAME.  (REPLACE WITH CORRECT TYPE OF NUTS.)","1968","FORD","F250"
"FORD MOTOR COMPANY","68V018000",0,0,0,,"07/03/1968","STEERING:LINKAGES:ARM:IDLER AND ATTACHMENT",,,,"POSSIBILITY THAT IMPROPER HEAT-TREATED CENTER LINK PIN TO STEERING IDLER ARM MAY FAIL DUE TO TENSION STRESS AFTER TIGHTENING THE RETAINING NUT.  FAILURE OF THIS PIN COULD CAUSE LOSS OF STEERING CONTROL.  (CORRECT BY REPLACING WITH PROPER HEAT-TREATED PIN.)","1968","FORD","FALCON"
"FORD MOTOR COMPANY","69V115000",0,0,0,,"04/09/1969","SERVICE BRAKES, AIR:SLACK ADJUSTERS",,,,"POSSIBILITY THAT FRONT BRAKE ADJUSTER MECHANISM MAY FAIL IN VEHICLE OPERATIONWHEN REVERSE BRAKING IS REQUIRED.  FAILURE OF THIS MECHANISM COULD RESULT INEXCESSIVE CLEARANCES BETWEEN BRAKE SHOES AND DRUMS AND EVENTUALLY PERMITHYDRAULIC PISTON TO BE PUSHED OUT OF FRONT WHEEL CYLINDER.  (CORRECT BY IN-STALLING REDESIGNED ADJUSTER MECH- ANISM.)","1968","FORD","FORD TRUCK"
"FORD MOTOR COMPANY","70V135000",0,0,0,,"10/11/1970","SERVICE BRAKES, HYDRAULIC:FOUNDATION COMPONENTS:MASTER CYLINDER",,,,"POSSIBILITY THAT COVER ON DUAL HY- DRAULIC BRAKE MASTER CYLINDER RES- ERVOIRMAY BECOME DISTORTED DUE TO EXCESSIVE TIGHTENING OF ATTACH- MENT BOLT.  COULDCAUSE BRAKE FLUID TO LEAK FROM UNDER COVER, RESULTING IN REDUCED BRAKEEFFICIENCY.  (COR- RECT BY REPLACING WITH NEW IM- PROVED TYPE COVER.)","1968","FORD","FORD TRUCK"
"Drake Automotive Group LLC","19E011000",0,0,0,,"09/02/2019","STEERING:LINKAGES:KNUCKLE:SPINDLE:ARM","Drake Automotive Group, LLC (Drake) is recalling certain Scott Drake left and right wheel spindles, part numbers C5ZZ-3106-L, C5ZZ-3105-R, C70Z-3106-L, C70Z-3105-R sold for use on 1965-1966 Ford Mustang V8s and 1967-1969 Ford Mustangs (all vehicles with drums).  The spindle may fail resulting in the wheel and tire detaching from the vehicle's steering system.","Spindle failure can cause a loss of steering control, increasing the risk of a crash.","Drake Automotive Group, LLC will notify owners and will replace all of the recalled units, free of charge.  The recall began March 17, 2019.  Owners may contact Drake automotive at 1-800-999-0289.","Owners may also contact the National Highway Traffic Safety Administration Vehicle Safety Hotline at 1-888-327-4236 (TTY 1-800-424-9153), or go to www.safercar.gov.","1968","FORD","MUSTANG"
"FORD MOTOR COMPANY","77V043000",0,0,0,,"28/03/1977","SEATS:FRONT ASSEMBLY:RECLINER","THE SEAT BACK PIVOT PIN BRACKET ON THE INVOLVED VEHICLES MAY FAIL. CONSEQUENTLY, THE SEAT BACK WILL ROTATE REARWARD.",,"THE DEALER WILL REPLACE THE DRIVER""S SEAT PIVOT PIN BRACKET ON ALL AFFECTED VEHICLES, FREE OF CHARGE.","VEHICLE DESCRIPTION: PASSENGER VEHICLES EQUIPPED WITH FRONT BUCKET SEATS.SYSTEM: INTERIOR; SEAT BACK.CONSEQUENCES OF DEFECT: SHOULD THE PIN BREAK DURING VEHICLE OPERATION, LOSS OFVEHICLE CONTROL AND AN ACCIDENT COULD RESULT.","1968","FORD","MUSTANG"
"GENERAL MOTORS CORP.","68V009000",0,0,0,,"13/02/1968","SERVICE BRAKES, HYDRAULIC:FOUNDATION COMPONENTS:DISC",,,,"POSSIBILITY REINFORCED BRAKE PEDAL SUPPORT BRACKET WHICH ALSO ASSISTS IN SUPPORTING THE POWER BRAKE UNIT ON THESE VEHICLES WAS NOT INCLUDED IN A DEALER'S PARTS KIT FOR CONVERTING MANUAL DISC BRAKES TO POWER DISC BRAKES.  THE BRACKETS USED WITH MANUAL DISC BRAKES COULD CRACK OR BREAK IF A POWER ASSIST UNIT IS ATTACHED IN THE FIELD.  A BROKEN OR CRACKED BRACKET COULD CAUSE LEAKS IN HYDRAULIC BRAKE ATTACHING LINES AND POSSIBLY RESULT IN A LOSS OF BRAKING ACTION.  (COR-ECT BY INSTALLING NEW REINFORCE- MENT BRAKE SUPPORT BRACKETS.)","1968","PONTIAC","GTO"
"TOYOTA MOTOR CO., LTD.","69V141000",0,0,0,,"07/10/1969","SERVICE BRAKES, HYDRAULIC:FOUNDATION COMPONENTS:HOSES, LINES/PIPING, AND FITTINGS",,,,"POSSIBILITY THAT FRONT BRAKE HOSES MAY RUB AGAINST FRONT SPRING BUMPER CAUSINGHOSE TO CHAFE.  REPEATED RUBBING COULD CAUSE HOSE TO LEAK BRAKE FLUID,RESULTING IN MALFUNCTION OF FRONT BRAKES.  (CORRECT BY INSPECTING AND REPLACEWHEN NECESSARY.)","1968","TOYOTA","CROWN"