id,Manufacturer,NHTSACampaignNumber,parkIt,parkOutSide,overTheAirUpdate,NHTSAActionNumber,ReportReceivedDate,Component,Summary,Consequence,Remedy,Notes,ModelYear,Make,Model
2007,"FORD MOTOR COMPANY","85V068000",0,0,0,,"21/05/1985","SERVICE BRAKES, HYDRAULIC:POWER ASSIST:VACUUM","BRAKE BOOSTER REAR SHELLS MAY HAVE REDUCED WALL           THICKNESSES WHICH COULD CAUSE THE SHELL TO BREAK.                                                                                                                 CONSEQUENCE OF DEFECT: REPEATED BRAKE USE COULD CAUSE THE SHELL TO CRACK AND     THE BOOSTER ASSEMBLY TO COME APART. SERVICE BRAKES CAPABILITY WOULD BE TOTALLY   LOST WITHOUT WARNING AND COULD RESULT IN AN ACCIDENT.",,"INSPECT AND IF NECESSARY REPLACE THE POWER BRAKE BOOSTER      ASSEMBLY.","VEHICLE DESCRIPTION: PASSENGER CARS EQUIPPED WITH 3.8 OR 5.0 LITER ENGINES AND  TANDEM POWER BRAKE BOOSTERS.  VEHICLES EQUIPPED WITH POLICE OR TAXI PACKAGE     OPTION ARE NOT AFFECTED.                                                                                                                                        SYSTEM: POWER BRAKE BOOSTERS.","1985","MERCURY","MARQUIS"
2008,"FEDERAL-MOGUL CORPORATION","07E064000",0,0,0,,"27/08/2007","FUEL SYSTEM, GASOLINE:DELIVERY:FUEL PUMP","CERTAIN FEDERAL-MOGUL AFTERMARKET FUEL PUMPS SOLD UNDER THE BRAND NAMES OF CARTER, ACCUFLOW, NAPA, TRUFLOW, PARTS DEPO, AND PARTS MASTER, SHIPPED BETWEEN AUGUST 2006 AND JULY 2007 FOR USE ON THE VEHICLES LISTED ABOVE.  THE FUEL PUMP DIAPHRAGM IN CERTAIN PRODUCTION RUNS MAY HAVE BEEN IMPROPERLY INSTALLED OR INADEQUATELY TESTED WHICH MAY CAUSE THE FUEL PUMP TO LEAK.","A LEAKING FUEL PUMP COULD CREATE A VEHICLE FIRE HAZARD.","FEDERAL-MOGUL WILL NOTIFY OWNERS AND REPLACE THE DEFECTIVE FUEL PUMPS FREE OF CHARGE.  THE RECALL BEGAN ON OCTOBER 15, 2007.  OWNERS CAN CONTACT FEDERAL-MOGUL AT 248-354-7700.","THIS RECALL ONLY PERTAINS TO AFTERMARKET CARTER, NAPA, ACCUFLOW, TRU FLOW, PARTS MASTER, AND PARTS DEPOT BRAND FUEL PUMPS AND HAS NO RELATION TO ANY ORIGINAL EQUIPMENT INSTALLED ON THE LISTED MOTOR VEHICLES.  CUSTOMERS MAY CONTACT THE NATIONAL HIGHWAY TRAFFIC SAFETY ADMINISTRATION'S VEHICLE SAFETY HOTLINE AT 1-888-327-4236 (TTY: 1-800-424-9153); OR GO TO HTTP://WWW.SAFERCAR.GOV.","1985","MERCURY","TOPAZ"
2009,"FORD MOTOR COMPANY","85V145000",0,0,0,,"05/11/1985","SUSPENSION:REAR","REAR SUPENSION CONTROL ARM-TO-SPINDLE ATTACHMENT BOLTS    MAY BE SUBJECT TO FRACTURE CAUSING THE REAR SPINDLE TO SEPARATE DURING USE OF    CAR.                                                                                                                                                              CONSEQUENCE OF DEFECT: IF BOLTS FRACTURE AND REAR SPINDLE DISENGAGES FROM        CONTROL ARM, LOSS OF CONTROL WILL BE EXPERIENCE WHICH MAY RESULT IN AN           ACCIDENT.",,"REPLACE REAR SUSPENSION BOLTS AS NECESSARY.","SYSTEM: REAR SUSPENSION BOLTS.     VEHICLE DESCRIPTION: PASSENGER CARS. THIS IS AN ADDENDUM THE NHTSA RECALL       NUMBER 85V086000.","1985","MERCURY","TOPAZ"
2010,"FORD MOTOR COMPANY","85V134000",0,0,0,,"22/10/1985","ELECTRICAL SYSTEM:IGNITION:MODULE","THE UNEXPECTED OPEN THROTTLE CAUSES AN INCREASE IN        ENGINE SPEED WHICH COULD RESULT IN LOSS OF CONTROL OF THE CAR AND A POTENTIAL    CRASH.                                                                                                                                                            CONSEQUENCE OF DEFECT: THE ELECTRONIC ENGINE CONTROL PROCESSOR MAY EXPERIENCE    AN INTERMITTENT TIMING PROBLEM. THIS PROBLEM CAUSES IMPROPER EXECUTION ENGINE    PERFORMANCE WHICH MAY MAINTAIN OR CAUSE A PARTIALLY OPEN THROTTLE.",,"REPLACE ELECTRONIC ENGINE CONTROL PROCESSOR, IF NECESSARY.","SYSTEM: ELECTRONIC ENGINE CONTROL PROCESSOR.  VEHICLE DESCRIPTION: PASSENGER CARS WITH 2.3 LITER ENGINES WITH 49-STATES       CALIBRATIONS AND AUTOMATIC TRANSMISSIONS.","1985","MERCURY","TOPAZ"
2011,"FORD MOTOR COMPANY","85V086000",0,0,0,,"03/07/1985","SUSPENSION:REAR","REAR SUSPENSION CONTROL ARM-TO-SPINDLE ATTACHMENT BOLTS   MAY BE SUBJECT TO FRACTURE DURING USE OF CAR.                                                                                                                     CONSEQUENCE OF DEFECT: IF BOLTS FRACTURE, REAR SPINDLE COULD DISENGAGE FROM      CONTROL ARM AND POSSIBLY RESULT IN LOSS OF CONTROL.",,"REPLACE REAR SUSPENSION BOLTS AS NECESSARY.","VEHICLE DESCRIPTION: PASSENGER CARS. SYSTEM: REAR SUSPENSION BOLTS.","1985","MERCURY","TOPAZ"
2020,"MOBILE TRAVELER, INC.","85V006000",0,0,0,,"07/01/1985","FUEL SYSTEM, OTHER:DELIVERY:HOSES, LINES/PIPING, AND FITTINGS","THE LP GAS DISTRIBUTION SYSTEM WHERE THE LP LINE PASSES   OVER THE REAR SUSPENSION LEAF SPRING DOES NOT HAVE ENOUGH CLEARANCE AND COULD    ALLOW CONTACT BETWEEN THE LP LINE AND THE LEAF SPRING. THIS COULD LEAD TO        FAILURE OF THE COPPER TUBING. OWNERS ARE ADVISED TO CLOSE OFF THE VALVE TO THE   LP GAS AND NOT USE THE SYSTEM.                                                                                                                                    CONSEQUENCE OF DEFECT: THERE MAY BE LEAKAGE OF LP GAS WHICH CAN RESULT IN        SERIOUS PERSONAL INJURY OR DEATH FROM ASPHYXIATION OR EXPLOSION.",,"REROUTE THE LP GAS PIPE UNDER THE LEAF SPRING.","VEHICLE DESCRIPTION: MOTORHOMES (CLASS C) BUILT ON CHEVROLET, GMC AND FORD      CHASSIS WITH LPG SYSTEM.  SYSTEM: LP GAS.","1985","MOBILE TRAVELER","MOBILE TRAVELER"
2022,"NISSAN NORTH AMERICA, INC.","95I006000",0,0,0,"RQ99021","01/11/1995","FUEL SYSTEM, GASOLINE:FUEL INJECTION SYSTEM","THIS IS NOT A SAFETY RECALL CAMPAIGN IN ACCORDANCE WITH FEDERAL REGULATION 573.  HOWEVER, IT IS DEEMED A SAFETY IMPROVEMENT CAMPAIGN BY THE AGENCY.  THE CAMPAIGN WILL REPLACE THE FUEL INJECTORS AND RELATED HOSES OF AFFECTED VEHICLES WHICH COULD LEAK.","FUEL LEAKS IN THE ENGINE COULD RESULT IN A FIRE.","NISSAN DEALERS WILL REPLACE THE FUEL INJECTORS AND RELATED HOSES ON THE AFFECTED VEHICLES.","NOTE: NISSAN HAS DECIDED TO CONDUCT A SAFETY IMPROVEMENT CAMPAIGN TO REPLACE THE FUEL INJECTORS AND RELATED HOSES WITHOUT CHARGE. OWNERS CAN CONTACT NISSAN AT 1-800-647-7261.","1985","NISSAN","300ZX"
2023,"NISSAN NORTH AMERICA, INC.","87V098000",0,0,0,"EA85029","06/07/1987","POWER TRAIN:AUTOMATIC TRANSMISSION:LEVER AND LINKAGE:FLOOR SHIFT","UNINTENDED ACCELERATION MAY OCCUR, FOR EXAMPLE, WHEN SHIFTING FROM THE PARK POSITION.","THIS COULD RESULT IN A VEHICLE ACCIDENT.","INSTALL A SHIFT INTERLOCK SYSTEM WHICH PREVENTS THE TRANSMISSION SHIFT LEVER FROM BEING MOVED FROM THE PARK POSITION UNLESS THE BRAKE PEDAL IS DEPRESSED.","SYSTEM: ACCELERATOR/TRANSMISSION.VEHICLE DESCRIPTION: PASSENGER CARS EQUIPPED WITH AUTOMATIC TRANSMISSION.","1985","NISSAN","300ZX"
2021,"NISSAN NORTH AMERICA, INC.","90V072000",0,0,0,,"17/04/1990","EQUIPMENT:OTHER:LABELS","INCORRECT TIRE INFLATION PRESSURES WERE PRINTED ON CERTIFICATION LABELS.","INCORRECT TIRE INFLATION COULD RESULT IN LOSS OF VEHICLE CONTROL AND AN ACCIDENT.","INSTALL CORRECTED TIRE INFORMATION LABEL ON DOORPOST CERTIFICATION LABEL.","SYSTEM: TIRE INFORMATION LABEL; FMVSS 120.  VEHICLE DESCRIPTION: LIGHT TRUCKS, MULTIPURPOSE PASSENGER VEHICLE, AND PASSENGER CARS.","1985","NISSAN","720"
2024,"NISSAN NORTH AMERICA, INC.","95I006000",0,0,0,"RQ99021","01/11/1995","FUEL SYSTEM, GASOLINE:FUEL INJECTION SYSTEM","THIS IS NOT A SAFETY RECALL CAMPAIGN IN ACCORDANCE WITH FEDERAL REGULATION 573.  HOWEVER, IT IS DEEMED A SAFETY IMPROVEMENT CAMPAIGN BY THE AGENCY.  THE CAMPAIGN WILL REPLACE THE FUEL INJECTORS AND RELATED HOSES OF AFFECTED VEHICLES WHICH COULD LEAK.","FUEL LEAKS IN THE ENGINE COULD RESULT IN A FIRE.","NISSAN DEALERS WILL REPLACE THE FUEL INJECTORS AND RELATED HOSES ON THE AFFECTED VEHICLES.","NOTE: NISSAN HAS DECIDED TO CONDUCT A SAFETY IMPROVEMENT CAMPAIGN TO REPLACE THE FUEL INJECTORS AND RELATED HOSES WITHOUT CHARGE. OWNERS CAN CONTACT NISSAN AT 1-800-647-7261.","1985","NISSAN","MAXIMA"
2025,"NISSAN NORTH AMERICA, INC.","86V096000",0,0,0,,"16/07/1986","VISIBILITY:WINDSHIELD","THERE MAY BE INSUFFICIENT THICKNESS OF ADHESIVE IN THE    CONTACT AREA BETWEEN THE BOTTOM OF THE FRONT WINDSHIELD GLASS AND THE BODY.                                                                                       CONSEQUENCE OF DEFECT: THIS LACK OF ADHESIVE MAY CAUSE THE WINDSHIELD TO         DISMOUNT IN AN ACCIDENT, THUS FAILING TO COMPLY WITH FMVSS 212, WINDSHIELD       MOUNTING AND WHICH MAY ALLOW THE OCCUPANTS TO BE EJECTED OUT OF THE CAR,         CAUSING MORE SERIOUS INJURIES OR DEATH.",,"ADD MORE ADHESIVE TO BOTTOM OF FRONT WINDSHIELD GLASS.","SYSTEM: WINDSHIELD/FMVSS 212.                                                                                                                                   VEHICLE DESCRIPTION: WAGONS AND SEDANS.","1985","NISSAN","MAXIMA"
2026,"LEISURE ODYSSEY, INC.","91V062000",0,0,0,,"12/04/1991","POWER TRAIN:AXLE ASSEMBLY","REAR AXLE BEARINGS MAY FAIL DUE TO A BENDING MOMENT CREATED BY THE AFTERMARKET DUAL REAR WHEELS FROM A VARIETY OF FACTORS AND ESPECIALLY WHEN OVERLOADED. FAILURE OF THE BEARINGS CREATE STRESSES ON THE THE REAR AXLE, RESULTING IN BREAKAGE OF THE AXLE.","A BROKEN AXLE WILL CAUSE SEPARATION OF THE DUAL REARWHEEL ASSEMBLY FROM THE MOTORHOME, CAUSING LOSS OF CONTROL WHICH COULD RESULT INAN ACCIDENT.","REPLACE REAR AXLE ASSEMBLIES WITH FULL-FLOATING REAR AXLE ASSEMBLIES.","SYSTEM: REAR AXLE; SINGLE AXLE WITH DUAL REAR WHEELS.VEHICLE DESCRIPTION: MICRO-MINI MOTORHOMES BUILT ON TOYOTA CAMPER CAB-CHASSISEQUIPPED WITH AFTERMARKET DUAL REAR WHEELS ON A REAR AXLE DESIGNED FOR SINGLEWHEELS.NOTE: ODYSSEY MICRO-MINI MOTORHOMES MADE BY GENERAL R.V. ARE NOT INCLUDED INTHIS RECALL CAMPAIGN.","1985","ODYSSEY","ODYSSEY"
2027,"GENERAL MOTORS CORP.","89V102000",0,0,0,,"16/06/1989","VEHICLE SPEED CONTROL","A SMALL NYLON BUSHING IN THE CRUISE CONTROL SERVO BAIL MAY SLIP OUT OF PLACE, CAUSING INTERMITTENT AND UNEXPECTED INCREASES IN ENGINE SPEED OR DIESELING (ENGINE RUN ON WITH IGNITION OFF).","SERVO ROD ASSEMBLY COULD CATCH ON ENGINE COMPONENTS ANDRESULT IN A STUCK THROTTLE WITH POTENTIAL FOR A VEHICLE CRASH.","INSTALL A NEW BUSHING IN CRUISE CONTROL SERVO BAIL.","SYSTEM:  CRUISE CONTROL.VEHICLE DESCRIPTION:  PASSENGER VEHICLES EQUIPPED WITH CRUISE CONTROL ANDCERTAIN GASOLINE AND DIESEL ENGINES.","1985","OLDSMOBILE","88"
2028,"GENERAL MOTORS CORP.","85V028000",0,0,0,,"19/03/1985","EQUIPMENT:OTHER:LABELS","THE TIRE PLACARD LABEL ON THE LEFT FRONT DOOR MAY HAVE    BEEN PRINTED WITH AN ERROR WHICH SPECIFIES A HIGHER MAXIMUM LOADING THAN IS      ALLOWED.                                                                                                                                                          CONSEQUENCE OF DEFECT: EXCESSIVE VEHICLE LOADING COULD CAUSE A TIRE BLOWOUT AND  RESULT IN AN ACCIDENT.",,"NEW TIRE PLACARD LABELS WITH CORRECT INFORMATION WILL BE      INSTALLED.","VEHICLE DESCRIPTION: PASSENGER CARS.SYSTEM: TIRE INFORMATION LABELS/FMVSS110.","1985","OLDSMOBILE","88"
2029,"GENERAL MOTORS CORP.","84V063000",0,0,0,,"21/05/1984","EQUIPMENT:OTHER:LABELS","OMISSION OF THE CERTIFICATION LABELS AS REQUIRED BY FEDERAL MOTOR VEHICLE SAFETY STANDARD NUMBER 110 ""TIRE SELECTION AND RIMS"".",,"DEALER WILL INSTALL REQUIRED CERTIFICATION LABELS.","VEHICLE DESCRIPTION: PASSENGER VEHICLES.SYSTEM: CERTIFICATION; INFORMATION LABELS.CONSEQUENCES OF DEFECT: ABSENCE OF INFORMATION COULD RESULT IN IMPROPER TIREPRESSURE RESULTING IN SHORTENED LIFE OF TIRE. INCORRECT REPLACEMENT TIRES COULDALSO BE SELECTED, CAUSING A POSSIBLE SAFETY HAZARD ON THE ROAD.","1985","OLDSMOBILE","98"
2030,"HONEYWELL INTERNATIONAL, INC.","06E043000",0,0,0,,"19/05/2006","FUEL SYSTEM, GASOLINE","CERTAIN REPLACEMENT FUEL FILTERS, FRAM BRAND NAME P/N G3727, WITH DATE CODES X52911 THROUGH X60801 SEQUENTIALLY OR X600141 AND A MEXICO COUNTRY OR ORIGIN MARKING ON THE FUEL FILTER HOUSING MANUFACTURED FROM OCTOBER 18, 2005, THROUGH MARCH 21, 2006, SOLD FOR USE ON THE VEHICLES LISTED ABOVE AND ON CERTAIN SCHOOL BUSES.  (TO SEE THE SCHOOL BUS ENGINE SIZES, CLICK ON ""DOCUMENT SEARCH"" AND THEN ""BUS APPLICATIONS"").  THE CONNECTOR ON THE FUEL FILTER WAS NOT MANUFACTURED TO HONEYWELL'S SPECIFICATION.  AS A RESULT, THE O-RING MAY NOT SEAT CORRECTLY ON THE FUEL LINE.","THIS CONDITION MAY CAUSE AN INADEQUATE SEAL AT THE CONNECTION, POTENTIALLY LEADING TO A FUEL LEAK. IN THE PRESENCE OF AN IGNITION SOURCE, A FIRE COULD OCCUR.","HONEYWELL WILL NOTIFY OWNERS AND REPLACE THE FUEL FILTERS FREE OF CHARGE.  THE RECALL BEGAN ON OCTOBER 18, 2006.  OWNERS MAY CONTACT FRAM CUSTOMER SERVICE AT 1-800-890-2075 (OPTION 1).","THIS RECALL ONLY PERTAINS TO AFTERMARKET FRAM FUEL FILTERS AND HAS NO RELATION TO ANY ORIGINAL EQUIPMENT INSTALLED ON THE VEHICLES LISTED.  CUSTOMERS MAY CONTACT THE NATIONAL HIGHWAY TRAFFIC SAFETY ADMINISTRATION'S VEHICLE SAFETY HOTLINE AT 1-888-327-4236 (TTY: 1-800-424-9153); OR GO TO HTTP://WWW.SAFERCAR.GOV.","1985","OLDSMOBILE","CALAIS"
2031,"GENERAL MOTORS CORP.","86V030000",0,0,0,,"21/02/1986","VEHICLE SPEED CONTROL:SPRINGS","THE THROTTLE RETURN SPRING ASSEMBLY MAY FAIL PREVENTING   THE THROTTLE FROM RETURNING TO THE CLOSED (IDLE) POSITION WHEN THE ACCELERATOR   PEDAL IS RELEASED.                                                                                                                                                CONSEQUENCE OF DEFECT: ENGINE SPEED MAY NOT DECREASE AND LOSS OF ACCELERATOR     CONTROL COULD RESULT IN AN ACCIDENT WITHOUT PRIOR WARNING.",,"REPLACE THROTTLE RETURN SPRING.","SYSTEM: THROTTLE RETURN SPRING.                                                                                                                                 VEHICLE DESCRIPTION: PASSENGER CARS EQUIPPED WITH 2.5 LITER 4 CYLINDER ENGINES.","1985","OLDSMOBILE","CALAIS"
2032,"GENERAL MOTORS CORP.","86V121000",0,0,0,,"28/08/1986","LATCHES/LOCKS/LINKAGES:HOOD:LATCH","THE SECONDARY HOOD LATCH MAY BE INCORRECTLY ALIGNED, OR   MAY EXHIBIT A BINDING CONDITION OF THE LATCH PIVOT.                                                                                                               CONSEQUENCE OF DEFECT: THIS CONDITION COULD RESULT IN THE PRIMARY HOOD LATCH     NOT BEING COMPLETELY ENGAGED TO THE HOOD, THE HOOD COULD UNEXPECTEDLY OPEN       WHILE VEHICLE IS IN MOTION.  SHOULD THIS OCCUR, THE HOOD MAY CONTACT THE         WINDSHIELD REDUCING THE FORWARD VISION AREA OF THE DRIVER AND A VEHICLE CRASH    WITHOUT PRIOR WARNING COULD OCCUR.",,"THE SECONDARY HOOD LATCH WILL BE REPLACED AND INSPECT THE     PRIMARY HOOD LATCH POP-UP LEVER.","SYSTEM: HOODLATCH/SECONDARY.                                                                                                                                    VEHICLE DESCRIPTION: PASSENGER CARS.","1985","OLDSMOBILE","CALAIS"
2033,"GENERAL MOTORS CORP.","87V124000",0,0,0,,"10/08/1987","STRUCTURE","SMALL CRACKS MAY DEVELOP IN THE BODY PILLAR AROUND THE DOOR STRIKER BOLT HOLE.","CRACKS WOULD INCREASE LEADING TO DIFFICULTY IN CLOSINGTHE DOOR AND MIGHT ALLOW DOOR TO COME OPEN DURING A CRASH, INCREASINGLIKELIHOOD OF INJURY TO OCCUPANTS.","INSTALL INNER AND OUTER REINFORCEMENT PLATE ON BOTH LEFT AND RIGHT BODY PILLARS.","SYSTEM: BODY PILLARVEHICLE DESCRIPTION: TWO DOOR PASSENGER CARS.","1985","OLDSMOBILE","CALAIS"
2034,"GENERAL MOTORS CORP.","85V047000",0,0,0,,"26/04/1985","VISIBILITY:WINDSHIELD","A LOSS OF BONDING ADHESION BETWEEN THE PAINT AND THE      WINDSHIELD OPENING AREA COULD ALLOW THE WINDSHIELD TO SEPARATE DURING A 30 MILE  PER HOUR FRONTAL BARRIER TEST REQUIRED BY FMVSS 212, WINDSHIELD RETENTION.                                                                                        CONSEQUENCE OF DEFECT: WINDSHIELD SEPARATION DURING AN ACCIDENT COULD RESULT IN  AN UNBELTED OCCUPANT BEING EJECTED FROM THE CAR AND SEVERLY INJURED.",,"REMOVE AND REINSTALL WINDSHIELD IF A LACK OF PAINT BONDING    IS EVIDENT.","VEHICLE DESCRIPTION: PASSENGER CARS. SYSTEM: WINDSHIELD/FMVSS 212.","1985","OLDSMOBILE","CALAIS"
2035,"GENERAL MOTORS CORP.","89V102000",0,0,0,,"16/06/1989","VEHICLE SPEED CONTROL","A SMALL NYLON BUSHING IN THE CRUISE CONTROL SERVO BAIL MAY SLIP OUT OF PLACE, CAUSING INTERMITTENT AND UNEXPECTED INCREASES IN ENGINE SPEED OR DIESELING (ENGINE RUN ON WITH IGNITION OFF).","SERVO ROD ASSEMBLY COULD CATCH ON ENGINE COMPONENTS ANDRESULT IN A STUCK THROTTLE WITH POTENTIAL FOR A VEHICLE CRASH.","INSTALL A NEW BUSHING IN CRUISE CONTROL SERVO BAIL.","SYSTEM:  CRUISE CONTROL.VEHICLE DESCRIPTION:  PASSENGER VEHICLES EQUIPPED WITH CRUISE CONTROL ANDCERTAIN GASOLINE AND DIESEL ENGINES.","1985","OLDSMOBILE","CUTLASS"
2036,"GENERAL MOTORS CORP.","84V124000",0,0,0,,"10/10/1984","STEERING:LINKAGES:TIE ROD ASSEMBLY","THE TIE RODS ARE PART OF THE STEERING LINKAGE AND TRANSMIT TURNING MOVEMENTS TO THE WHEELS. THE BOLTS THAT FASTEN THE TIE RODS TO THEIR ADJUSTERS MAY NOT BE TIGHT ENOUGH. THIS COULD ALLOW THE TIE ROD TO LOOSEN AND DETACH ITSELF FROM THE ADJUSTER.",,"THE TIE ROD END BOLTS WILL BE TIGHTENED WITHOUT COST TO THE OWNER.","VEHICLE DESCRIPTION: PASSENGER VEHICLES.SYSTEM: STEERING LINKAGES; TIE RODS.CONSEQUENCES OF DEFECT: A LOSS OF STEERING CONTROL AND A POSSIBLE VEHICLE CRASHCOULD RESULT.","1985","OLDSMOBILE","CUTLASS"
2037,"GENERAL MOTORS CORP.","84V154000",0,0,0,,"27/11/1984","SEAT BELTS:FRONT:RETRACTOR","THE VEHICLES WERE ASSEMBLED WITH FRONT SEAT BELT RETRACTORS WHICH MAY NOT PERFORM ADEQUATELY DURING A COLLISION.",,"THE DEALER WILL REPLACE THE LEFT AND RIGHT FRONT SEAT BELT RETRACTORS FREE OF CHARGE.","VEHICLE DESCRIPTION: PASSENGER VEHICLES.SYSTEM: INTERIOR SYSTEMS; FRONT SEAT BELT RETRACTOR.CONSEQUENCES OF DEFECT: IN THE EVENT OF A VEHICLE CRASH, FAILURE OF A FRONTSEAT BELT RETRACTOR WOULD INCREASE CHANCES OF OCCUPANT INJURY.","1985","OLDSMOBILE","CUTLASS"
2038,"HONEYWELL INTERNATIONAL, INC.","06E043000",0,0,0,,"19/05/2006","FUEL SYSTEM, GASOLINE","CERTAIN REPLACEMENT FUEL FILTERS, FRAM BRAND NAME P/N G3727, WITH DATE CODES X52911 THROUGH X60801 SEQUENTIALLY OR X600141 AND A MEXICO COUNTRY OR ORIGIN MARKING ON THE FUEL FILTER HOUSING MANUFACTURED FROM OCTOBER 18, 2005, THROUGH MARCH 21, 2006, SOLD FOR USE ON THE VEHICLES LISTED ABOVE AND ON CERTAIN SCHOOL BUSES.  (TO SEE THE SCHOOL BUS ENGINE SIZES, CLICK ON ""DOCUMENT SEARCH"" AND THEN ""BUS APPLICATIONS"").  THE CONNECTOR ON THE FUEL FILTER WAS NOT MANUFACTURED TO HONEYWELL'S SPECIFICATION.  AS A RESULT, THE O-RING MAY NOT SEAT CORRECTLY ON THE FUEL LINE.","THIS CONDITION MAY CAUSE AN INADEQUATE SEAL AT THE CONNECTION, POTENTIALLY LEADING TO A FUEL LEAK. IN THE PRESENCE OF AN IGNITION SOURCE, A FIRE COULD OCCUR.","HONEYWELL WILL NOTIFY OWNERS AND REPLACE THE FUEL FILTERS FREE OF CHARGE.  THE RECALL BEGAN ON OCTOBER 18, 2006.  OWNERS MAY CONTACT FRAM CUSTOMER SERVICE AT 1-800-890-2075 (OPTION 1).","THIS RECALL ONLY PERTAINS TO AFTERMARKET FRAM FUEL FILTERS AND HAS NO RELATION TO ANY ORIGINAL EQUIPMENT INSTALLED ON THE VEHICLES LISTED.  CUSTOMERS MAY CONTACT THE NATIONAL HIGHWAY TRAFFIC SAFETY ADMINISTRATION'S VEHICLE SAFETY HOTLINE AT 1-888-327-4236 (TTY: 1-800-424-9153); OR GO TO HTTP://WWW.SAFERCAR.GOV.","1985","OLDSMOBILE","FIRENZA"
2039,"GENERAL MOTORS CORP.","86V073000",0,0,0,"PE86031","28/05/1986","ENGINE AND ENGINE COOLING:ENGINE","THE ENGINE AIR CLEANER PLASTIC TRIM COVER COULD FALL OFF  THE AIR CLEANER ASSEMBLY AND LAND ON THE EXHAUST MANIFOLD CREATING A FIRE        HAZARD.                                                                                                                                                           CONSEQUENCE OF DEFECT: IF THE CAR IS BEING OPERATED AT THE TIME THAT THE         PLASTIC TRIM COVER FALLS OFF, AN ENGINE COMPARTMENT FIRE COULD OCCUR WITHOUT     WARNING.",,"REMOVE THE TRIM COVER AND DISCARD.","SYSTEM: ENGINE AIR CLEANER COVER.                                                                                                                               VEHICLE DESCRIPTION: PASSENGER CARS EQUIPPED WITH RPO LQ5 2.0 ENGINES.","1985","OLDSMOBILE","FIRENZA"
2040,"GENERAL MOTORS CORP.","89V102000",0,0,0,,"16/06/1989","VEHICLE SPEED CONTROL","A SMALL NYLON BUSHING IN THE CRUISE CONTROL SERVO BAIL MAY SLIP OUT OF PLACE, CAUSING INTERMITTENT AND UNEXPECTED INCREASES IN ENGINE SPEED OR DIESELING (ENGINE RUN ON WITH IGNITION OFF).","SERVO ROD ASSEMBLY COULD CATCH ON ENGINE COMPONENTS ANDRESULT IN A STUCK THROTTLE WITH POTENTIAL FOR A VEHICLE CRASH.","INSTALL A NEW BUSHING IN CRUISE CONTROL SERVO BAIL.","SYSTEM:  CRUISE CONTROL.VEHICLE DESCRIPTION:  PASSENGER VEHICLES EQUIPPED WITH CRUISE CONTROL ANDCERTAIN GASOLINE AND DIESEL ENGINES.","1985","OLDSMOBILE","TORONADO"
2041,"PACCAR, INCORPORATED","89V228000",0,0,0,,"05/12/1989","SUSPENSION:REAR:SPRINGS:LEAF SPRING ASSEMBLY:HANGER/BRACKET","A REQUIRED WELD JOINING A WALKING BEAM BUSHING SPACER TO THE AXLE HANGER BRACKET MAY HAVE BEEN OMITTED.","REAR AXLE COULD SEPARATE FROM THE REAR SUSPENSION,CAUSING LOSS OF VEHICLE CONTROL WHICH COULD RESULT IN AN ACCIDENT.","MAKE NECESSARY WELDING CORRECTIONS.","SYSTEM: SUSPENSION.VEHICLE DESCRIPTION: HEAVY-DUTY TRUCKS WITH HENDRICKSON REAR SUSPENSION.","1985","PETERBILT","PETERBILT"
2042,"PACCAR, INCORPORATED","86V126000",0,0,0,,"10/09/1986","SUSPENSION:REAR:SPRINGS:LEAF SPRING ASSEMBLY:HANGER/BRACKET","A REQUIRED WELD JOINING A WALKING BEAM BUSHING SPACER TO  THE AXLE HANGER BRACKET MAY HAVE BEEN OMITTED.                                                                                                                    CONSEQUENCE OF DEFECT: REAR AXLE COULD SEPARATE FROM THE REAR SUSPENSION,        CAUSING LOSS OF VEHICLE CONTROL WHICH COULD RESULT IN AN ACCIDENT.",,"MAKE NECESSARY WELDING CORRECTIONS.","SYSTEM: SUSPENSION.                                                                                                                                             VEHICLE DESCRIPTION: HEAVY DUTY TRUCKS WITH HENDRICKSON REAR SUSPENSION.","1985","PETERBILT","PETERBILT"
2043,"PEUGEOT, INC.","84V151000",0,0,0,,"26/11/1984","FUEL SYSTEM, GASOLINE:STORAGE:TANK ASSEMBLY:FILLER PIPE AND CAP","THE FUEL CAPS ON THE INVOLVED VEHICLES DO NOT SEAL PROPERLY AND ARE NOT IN COMPLIANCE WITH FEDERAL MOTOR VEHICLE SAFETY STANDARD NO. 301, ""FUEL SYSTEM INTEGRITY."" CONTACT WITH FUEL CAUSES THE FUEL CAP GASKET TO SWELL, PREVENTING ADEQUATE SEALING BETWEEN CAP AND FILLER OPENING.",,"A REPLACEMENT CAP WILL BE SENT TO EACH OWNER OF AN AFFECTED VEHICLE, FREE OF CHARGE.","VEHICLE DESCRIPTION: PASSENGER VEHICLES.SYSTEM: FUEL SYSTEM; FUEL FILLER CAP.CONSEQUENCES OF DEFECT: THE LACK OF A SEAL CAN CAUSE FUEL LEAKAGE WHEN THE TANKIS FULL. IN ADDITION, CONTACT WITH FUEL MAY ALSO CAUSE THE INNER PORTION OF THECAPS TO DISSOLVE CAUSING THE CAP TO CRACK OR BREAK. A FIRE COULD OCCUR INEITHER CASE AND COULD RESULT IN INJURY TO OCCUPANTS.","1985","PEUGEOT","505"
2044,"FEDERAL-MOGUL CHASSIS PRODUCTS","08E033000",0,0,0,,"14/04/2008","SUSPENSION","FEDERAL MOGUL IS RECALLING 6,903 AFTERMARKET BALL JOINT ASSEMBLIES SHIPPED BETWEEN NOVEMBER 9, 2007 AND MARCH 26, 2008, WHICH MAY HAVE BEEN PACKAGED WITH INCORRECT NUTS.  THE PART NUMBERS PACKAGED WITH INCORRECT NUTS ARE: K7147, K7329, K8683, AND 104353.  THESE PARTS WERE MADE FOR USE ON THE VARIOUS VEHICLES LISTED ABOVE.","THE NUTS INCLUDED IN THE PACKAGING FOR THESE BALL JOINT ASSEMBLIES ARE MISSING THE INTENDED PREVAILING TORQUE (SELF-LOCKING) FEATURE.  IF THE INCORRECT NUT WAS TO BECOME LOOSE, THE JOINING MEMBERS MAY LOOSEN LEADING TO A SEPARATION OF THE BALL JOINT.  THIS MAY RESULT IN LOSS OF VEHICLE CONTROL, POSSIBLY RESULTING IN A VEHICLE CRASH.","FEDERAL MOGUL WILL NOTIFY OWNERS AND REPLACE THE PARTS FREE OF CHARGE.   THE RECALL BEGAN ON MAY 22, 2008.  OWNERS CAN CONTACT FEDERAL MOGUL AT 877-489-6659.","THIS RECALL ONLY PERTAINS TO AFTERMARKET BALL JOINT ASSEMBLIES AND HAS NO RELATION TO ANY ORIGINAL EQUIPMENT INSTALLED ON VEHICLES MANUFACTURED BY THE VEHICLE MANUFACTURERS.  CUSTOMERS MAY CONTACT THE NATIONAL HIGHWAY TRAFFIC SAFETY ADMINISTRATION'S VEHICLE SAFETY HOTLINE AT 1-888-327-4236 (TTY: 1-800-424-9153); OR GO TO HTTP://WWW.SAFERCAR.GOV.","1985","PLYMOUTH","CARAVELLE"
2045,"CHRYSLER CORPORATION","85V010000",0,0,0,,"01/01/1985","FUEL SYSTEM, GASOLINE:DELIVERY:HOSES, LINES/PIPING, AND FITTINGS","AN ENGINE COMPARTMENT FUEL HOSE ROUTED TO THE FUEL        SYSTEM PRESSURE REGULATOR MAY HAVE AN INADEQUATELY TIGHTENED HOSE CLAMP.                                                                                          CONSEQUENCE OF DEFECT: THE FUEL HOSE COULD LEAK AND RESULT IN AN ENGINE          COMPARTMENT FIRE.",,"REPOSITION AND TIGHTEN TO THE PROPER TORQUE LEVEL OF THE      FUEL HOSE CLAMP.","VEHICLE DESCRIPTION: PASSENGER CARS EQUIPPED WITH 2.2 LITER TURBO ENGINE.   SYSTEM: FUEL HOSE.","1985","PLYMOUTH","CARAVELLE"
2046,"CHRYSLER CORPORATION","88V105000",0,0,0,,"01/07/1988","FUEL SYSTEM, GASOLINE","FUEL LEAKAGE MAY OCCUR IN LOW AMBIENT TEMPERATURE OPERATION AT CONNECTIONS OF AN ENGINE COMPARTMENT FUEL SUPPLY HOSE TO THE PRESSURE REGULATOR AND TO THE FUEL RAIL.","IN THE PRESENCE OF AN IGNITION SOURCE, FUEL LEAKAGE COULDRESULT IN A FIRE.","RELOCATE PRESSURE REGULATOR; REPLACE FUEL SUPPLY WITH FORMED HOSE WITH REVISED ROUTING CONFIGURATION TO ENSURE SEALING INTEGRITY.","SYSTEM: FUEL.VEHICLE DESCRIPTION: VEHICLES EQUIPPED WITH 2.2L TURBO CHARGED ENGINE.","1985","PLYMOUTH","CARAVELLE"
